jobTitles,Company,jobLocations,requiredExperiance,Salary,JobDescription,SkillsSenior Drupal Developer,A Thingz Solutions Private Limited,Bengaluru/Bangalore|Hyderabad/Secunderabad,5-8years,Not Specified,Senior Drupal Developer,Azure|Cloud|AWS|Php|Drupal|Mysql|Javascript|jQuery|AJAX|HTML|CSS|Codeigniter|Wordpress|
Frontend Developer (Angular/React.js),Smatik Software Private Limited,Belgaum|Hubli,3-6years,400000 - 800000 INR,We are looking for talented Front End Developers with atleast 3+ years of experience in building highly scalable UI on Web and Mobile. You will be responsible for implementation of complete front-end web applications with focus on app performance.,UIDeveloper|FrontEndWebDeveloper|FrontEndDeveloper|Angular|react.js|FrontEndProgramming|Javascript|AJAX|Jquery|HTML|CSS|Jscript|Xml|
Mobile Apps Developer,Xecom Information Technologies Private Limited,Pune,1-6years,140000 - 650000 INR,"Looking for opportunities and take more responsibilities to work on Business, Social Media Mobile Apps",HTML/HTML5|CSS/CSS3|Cordova|AndroidStudio|WebApi|Javascript|jQuery|Json|AJAX|WebServices|Oops|MsSqlServer|MySQL|Xamarin|
Dotnet Fresher,Ishttaa Techcraft Private Limited,Bengaluru/Bangalore,Fresher,Not Specified,Job Opening for Dotnet Fresher,Dotnet|C#|Javascript|CSS|HTML|Jquery|
Job Opening for Angular / Nodejs Developer,Ktrian Solutions Private Limited,Faridabad,3-5years,229999 - 590000 INR,"In Depth knowledge of Node.js. |   Hands on experience with HTML,CSS and Ajax. |   Development experience designing object oriented Javascript. |   Knowledge of web libraries and frameworks such as NodeJS. |",Mysql|Mssql|Javascript|HTML|CSS|Angular|Node.js|AJAX|
Php developer,Orissa Doot Private Limited,Bhubaneswar,2-3years,Not Specified,Hiring For Php Developer in Bhubaneswar Location,Phpdeveloper|MySQL|XHTML|CSS|Javascript|Codeigniter|CakePHP|
Java Technical Lead/ Developer,MIT Jobs,Bengaluru/Bangalore|Chennai,3-10years,Not Specified,"If you are an experienced Java developer with a background in trading or finance, this role will be made for you!",HTML/CSS|TDDandBDD|Java8|Spring|Javascript|Angularjs|
Senior Software Engineer JavaScript,Best infosystems Ltd,OtherIndia,3-8years,Not Specified,"As a Javascript Engineer, you will be required to work on various Javascript libraries that are served on our customers’ websites thereby impacting millions of users. These libraries are the core of all the features of VWO. |",VanillaJavascript|Rollup.js|Cypress|ESLint|Javascript|Typescript|HTML|CSS|UiDevelopment|
User Interface Developers and Leads – Salesforce Commerce Cloud,Sampark,Pune,4-9years,Not Specified,"Plan, design, build, manage, and review content that complies with the website standards. |",SalesforceCommerceCloud(SFCC)|Controller|Pipelines|StorefrontReferenceArchitecture(SFRA)|InterfaceSpecificationMetaLanguage(ISML)|BusinessManager|Javascript|HTML|CSS|Bootstrap|Angular|React|
Full Stack Magento Developer,C P Careers Private Limited,Jaipur,3-8years,800000 - 1100000 INR,- We are looking to hire a skilled Magento Developer to build and maintain our ecommerce websites.,FullStackDeveloper|wikis|osCommerce|MagentoDeveloper|Phpdeveloper|SEO|PerformanceTuning|BrowserCompatibility|VersionControl|Joomla|Drupal|HTML|CSS|AJAX|Javascript|Java|C#|Phyton|Angularjs|react.js|Node.js|MSSQL|MangoDb|Apache|UiUxDesigner|
MANAGER – ANGULAR,Axxonet System Technologies Private Limited,Bengaluru/Bangalore|Hyderabad/Secunderabad,8-12years,1100000 - 1650000 INR,"Job Description |    |   Experience of CSS & JavaScript and Angular or ReactJS or Vue.js |    |    Knowledge of Java, Spring Boot framework, UI Design & design patterns. |    |    Must be able to work closely with business users. |    |    Knowledge of Unix / Linux operatin",Oracle/Sybase|Unix/shellscripting|OWASP10|CSS&JavaScriptandAngularorReactJSorVue.jsKnowledgeofJava|Angular|Javascript|Css3|Html5|Java|AdvancedJava|SpringBoot|Framework|Docker|Kubernates|JUnit|Svn|Git|SpringBoot|
Php developer,Mpfi Project Consultancy Private Limited,Bengaluru/Bangalore,1-2years,Not Specified,"For writing server-side web application logic.PHP developers usually develop back-end components, connect the application with the other(often third-party)web services, and support the front-end developers by integrating their work with Applications",PHPixie|Slim|FluePHP.|Php|CodeIgniter|Html5|Css3|jQuery|AJAX|Javascript|MySql|Drupal|Laravel|Symfony|Zend|Phalcon|CakePHP|Yii|
Software Designer,Hi Tides Consulting,Pune,0-3years,120000 - 200000 INR,"Multiple Openings for Web designing using HTML, React, CSS",Html5|CSS|Javascript|UI|Ux|react.js|WebDesigner|Web|ReactNative|
ANGULAR DEVELOPER (PRODUCT BASED COMPANY)- BANGALORE,Epicomm Technologies Ltd,Bengaluru/Bangalore,4-9years,1500000 - 1800000 INR,"Skilled in Angular, Angular2, TypeScript, CSS, JavaScript, NodeJS, Git, Experience working and integrating front end applications with RESTful Middle-Tier Applications, Grunt  Bachelors degree in Computer Science, Software Engineering, Information T",Angular|Js|HTML|CSS|Grunt|Git|RestfulApi|Nodejs|Grunt|
Php developer,Star Tech,Pune,1-3years,Not Specified,"Candidate will be required to do programming independently in Core PHP & PHP frameworks, Ajax, Javascript, Jquery, javascript frameworks and Mysql, html , css, web-services. Must have minimum 1 year of real hands experience in all above skills.",web-services|CakePHP|Zend|Yii|Laravel|CodeIgniter|Symfony|Mvc|CorePhp|PhpFrameworks|Ajax|Javascript|Jquery|JavascriptFrameworks|Mysql|html|css|
GRAPHIC DESIGNER PAID INTERN,Vamtrick Business Solutions Private Limited,Gurgaon/Gurugram|Noida,0-2years,320000 - 550000 INR,"Role Fresher |  Industry Type Advertising, PR, MR, Event Management |  Functional Area Marketing, Advertising, MR, PR, Media Planning |  Role Category Other",GraphicDesigner|Flash|HTML|Xml|Dreamweaver|Javascript|Js|WebDesigner|CSS|
Software Developer,Aspire Nxt Private Limited,Hubli,1-4years,Not Specified,Immediate Job openings for software developer,Design|PhpProgrammer|Javascript|Sql|AJAX|HTML|CSS|MysqlDatabase|Lamp|Xamp|Laravel|CodeigniterFramework|AgileMethodology|RequirementGathering|Coding|Testing|
Dot Net Developer,Maxo Tech Solutions LLC,Pune,4-5years,300000 - 400000 INR,"Full stack software developer. Min. 4-6 years’ experience in .Net programming . Good knowledge and experience in Asp.net, C# /VB.NET , MVC, SQL Server, MySQL, Ajax, Web Services, Java Script, HTML5, CSS, jquery, Angular / Angular JS, Bootstrap etc. I",C#/VB.NET|Angular/AngularJS|Asp.net|Mvc|SQLServer|MySQL|Ajax|WebServices|JavaScript|Html5|CSS|jquery|
Frontend Developer,ExterNetworks Inc,Bengaluru/Bangalore,5-7years,Not Specified,"4+ years of experience with programming languages like Java, J2ee, Spring hibernate frameworks, Microservice architecture.",AngularJs|Reactjs|Expressjs|RestfulWebservices|HTML|CSS|Javascript|Typescript|
Full Stack Developer,Aosta Overseas Careers,Bengaluru/Bangalore|Hyderabad/Secunderabad,5-8years,Not Specified,URGENT REQUIREMENT FOR FULL STACK DEVELOPER FOR ONE OF MNC CLIENT,HTML|CSS|Sass|Javascript|Frameworks|Angular|ajax|Restapi|Node|Docker|Git|MongoDB|Express|
Senior UI Developer,Paktolus Solutions,Hyderabad/Secunderabad,12-22years,Not Specified,"We are having  openings for Senior UI Developer -Hitech City - Madhapur – Hyderabad. |   |  •	Profile			: 	Senior UI Developer |  •	Location		: 	Hitech City, Madhapur Hyderabad.  |  •	Start Date		: 	Immediate or ASAP  |  •	Shift timings		: 	1:00PM -10:00PM","""Angular8""|""UIdeveloper""|HTML|CSS|ResponsiveDesign|Javascript|JQuery|Reactjs|Angular|"
UX Designer/graphic Designer required for Canada/ Australia/ Hong Kong/ Germany,Sampoorna Consultants Private Limited,Canada|Germany,2-6years,Not Specified,UX Designer/Graphic Designer required for Canada/ Australia/ Hong Kong/ Germany,GraphicDesigner|illustrations|MacromediaFlash|AdobeInDesign|ArticulateStoryline|HTML/CSS|e-learning|audacity|UX/UIDesign|UxDesigning|graphicdesigning|AdobePhotoshop|AdobeIllustrator|DreamWeaver|AdobeCaptivate|
React.Js Developer,ExterNetworks Inc,Mumbai|Pune,2-5years,Not Specified,We are looking for a great JavaScript developer who is proficient with React.js. Your primary focus will be on developing user interface components and implementing them following well-known React.js workflows (such as Flux or Redux). You will ensure,ReactJs|Redux|Javascript|HTML|CSS|Bootstrap|
Open text MBPM + .Net || .Net & Java Dev || Min. 5 Years of Exp,Career Carnival LLP,Chennai|OtherIndia,5-7years,800000 - 1600000 INR,Exp: Min. 5 Years of Exp |  Location : PAN India |  Budget : Upto 18 LPA,Java/J2EE|HTML/CSS|OpenTextMBPMWork|JQWidgets|.NETFramework|WindowsWCF(SOAP)|EntityFramework(ORM)|Javascript|JQuery|MsSqlServer|
Creative Developer,Sampoorna Consultants Private Limited,Chennai,3-5years,Not Specified,"Excellent Career Opportunity Creative Developer (Job Code : J43044) Exp: 3-5 Years Location: Chennai Key Skills: HTML,CSS,JAVASCRIPT",HTML|CSS|Javascript|
CodeIgniter PHP Developer,Kalp Corporate,Ahmedabad,1-5years,200000 - 600000 INR,Looking for Dynamic PHP Developer,vuejsJSON|Phpdeveloper|Codeigniter|CorePhp|AJAX|Mysql|Javascript|Java|HTML|CSS|Jquery|Js|
Sr.Backend Developer (node.js),Mobile Programming LLC,Pune,8-13years,Not Specified,"NodeJS, Koa, Postgres, EmberJS, Cardstack, Git, AWS (EC2, RDS, Lambda, S3, Cloudfront), TravisCI, Docker, Chai, and other modern technologies to support application development.",Node.js|NodeJS|Javascript|Html5|css|Nodejs|
Trainee Software Developer (Dotnet),Xecom Information Technologies Private Limited,Pune,0-1years,140000 - 250000 INR,"Looking for trainee Software developers well trained in Microsoft.Net - ASP.net, C#, MS SQL",Asp.NetC#|MSSQL|Javascript|Json|AJAX|Xml|WebApi|jQuery|HTML|CSS|
Web Developer,Ak Technologies,Bengaluru/Bangalore,0-1years,Not Specified,"We are looking for a website developer with at least 6 months of experience in end to end website developing. |  Skills required: HTML,CSS, PHP, JAVA, Javascript, Bootstrap and Angular.",HTML|CSS|Javascript|Angular|AngularJs|Bootstrap|Java|Php|PHPprogrammer|
Senior Software Engineers/ Senior Software Developers/ Senior .Net Developers,Infinity HR Solutions,Bengaluru/Bangalore,4-6years,Not Specified,Adhering to Agile Project management methodologies and meet product release schedules and client deliverables.,DotNetCore|C#|Mvc|ASP.Net|Dotnet|.NET|ASP.net|WebApi|AJAX|jQuery|Html5|CSS|Bootstrap|WebForms|TelerikReporting|TelerikControls|
Software Developer (.net),Xecom Information Technologies Private Limited,Pune,1-4years,150000 - 550000 INR,"Looking for opportunities and take more responsibilities to work on large, complex applications Api development, ASP.NET, AJAX, Working with third party controls(Telerik), .NET framework 3.5, 4.8",Asp.NetC#|MSSQL|Javascript|Json|AJAX|Xml|WebApi|jQuery|HTML|CSS|
"PHP Developer - @Nagercoil, kaniyakumari",Jobsnta,Nagercoil,2-6years,Not Specified,We are hiring candidates with minimum 2 years of Experience as PHP Developer who are based out of Nagercoil Location,Phpdeveloper|PhpMysql|jQuery|Javascript|CSS|Jscript|
Web Developers,Infinix Immigration Service Private Limited,Germany|HongKong,1-5years,2000000 - 3000000 INR,"call Abhishek at 9205537089 for details. Web developers design and build websites. They are typically responsible for the appearance, of the site and technical aspects, such as site speed and how much traffic the site can handle.",WebDeveloper|WebDevelopment|WebDesign|WebsiteDevelopment|Programming|WebDesigner|Javascript|CSS|
Urgent opening for Wordpress Developer,Kaavi Recruitment Consultancy Private Limited,Mumbai,2-5years,100000 - 300000 INR,Candidate should be having 2-6 yrs of experience in wordpress developer,Htl/Php/Mysql|WordpressDeveloper|HTML|CSS|
Java Developer,Newzen Infotech,Hyderabad/Secunderabad,0-1years,110000 - 229999 INR,"Job Opportunity for Java Freshers, who are technically good and strong knowledge  |     on core Java, Advanced Java, Spring,Hibernate and Good in Analytical skills. |",J2EEScripts|CSS.|HibernateEe|JAVAJ2EEScripts|Java|CoreJava|Servlets|
Website Designer HTML5 CSS3 Developer Responsive Website Designers Mobile Friendly web site CSS HTML,DRPU Software Pvt. Ltd.,Noida|Ghaziabad,0-2years,200000 - 580000 INR,We are looking for Creative Website Designers having Good knowledge of Designing of Responsive Layout Web sites based on HTML5 CSS3. Website Designers and Mobile Friendly web site Developers with Good hand on CSS CSS3 HTML 5.,HTMLDeveloper|Website|mobilefriendly|ResponsiveLayoutWebsites|Html5|CSS|Javascript|AJAX|Css3|Html5Development|WebsiteDesigner|WebsiteDevelopment|WebDesigner|HTML|Java|Javascript|Php|MYSQL|PHPdeveloper|PHPprogrammer|
Sr Java Spring Full Stack Developer/Analyst/Lead,Yiron Technologies Private Limited,Chandigarh,2-12years,Not Specified,Sr Java Spring Full Stack Developer/Analyst/Lead,CoreJAVAScripts|CSS.|JSPScripts|J2EEScripts|Javadeveloper|Java|SpringBoot|Hibernate|
Senior Software Developer (Dotnet),Xecom Information Technologies Private Limited,Pune,2-6years,210000 - 650000 INR,"Looking for opportunities and take more responsibilities to work on large, complex applications Api development, ASP.NET, AJAX, Working with third party controls(Telerik), .NET framework 3.5, 4.8",Asp.NetC#|MSSQL|Javascript|Json|AJAX|Xml|WebApi|jQuery|HTML|CSS|
Dot Net Developer,Oxcytech System,Pune,2-4years,Not Specified,"Operates in a Fast-Paced Agile Development Environment. |   |  Will Work Closely with other Developers, Qa Engineers, and Product Management to Collaborate in the Delivery of On Time, High Value, Quality Software Solutions. |",EntityFramework|Mvc|C#|Asp.Net|HTML|Javascript|jQuery|CSS|
react js developer Front End Developer  ui developer Web Developer,E Edge Technology,Bengaluru/Bangalore,0-1years,Not Specified,we have openings for React JS developer position for bangalore location.looking for candidates who has 6months to 1 year in same field.,ReactJs|HTML|CSS|Javascript|
.Net Core ( Asp.net Core) Developer / Programmer,Angel And Genie,Ahmedabad,2-7years,200000 - 900000 INR,.Net ( Asp.net) Developer / Programmer,.NetDeveloper|.NETFramework|ASP.NET|C#.net|Mvc|Linq|SQLServer|Javascript|jQuery|AJAX|HTML|CSS|ResponsiveDesign|Wpf|Wcf|
Frontend Developer-1.5years of React JS and 1yr NodeJS exp. mandatory-Work From Home(Fully RemoteJob,Innointel LLC,Noida|Mohali,2-5years,Not Specified,Frontend Developer-1.5years of React JS and 1yr NodeJS exp. mandatory-Work From Home(Fully Remote Job)Salary upto 13 LPA–2 to 5 yrs of relevant exp.,FrontendDeveloper|ReactJs|Nodejs|Angularjs|HTML|CSS|Javascript|jQuery|AWS|
Senior Software Developer,ValueLabs LLP,Chennai,5-10years,Not Specified,"Min Experience:5yrs |  Required Skills: Angular JS,HTML5,CSS,AWS Cloud, AWS RDS |  Location: Chennai",AngularJs|Html5|CSS|AwsCloud|AwsRds|
"Hiring ""Java Fullstack Developer"" @ Hyderabad",Career Foresight Hr Solutions Llp,Hyderabad/Secunderabad,6-9years,Not Specified,Looking for Java Fullstack Developer with 6-8 Years Experience,Angular/react|Java|J2EE|Hibernate|Spring|SpringBoot|Microservices|JDBC|html|css|
UI/ UX Designer,Maxo Tech Solutions LLC,Cochin/Kochi/Ernakulam,3-6years,400000 - 500000 INR,"2years UI/UX design experience |  Development of new Webpages based on the design |  Enhancement of existing User Interfaces according to the new requirements. |  Knowledge in HTML5, CSS3, and JavaScript skills are a plus",Photoshop|HTML|CSS|Flash|Dreamweaver|
Full Stack Developer,Quess IT Staffing (Formerly known as Magna Infotech),Bengaluru/Bangalore|Hyderabad/Secunderabad,5-7years,Not Specified,Urgent Requirement for FULL STACK DEVELOPER for One of our MNC Client,XHR|Cae|HTML|CSS|Sass|Js|Angular|AJAX|RestApi|Node|Docker|Git|MongoDB|Express|
UI Developer,C P Careers Private Limited,Bengaluru/Bangalore|Gurgaon/Gurugram,4-7years,Not Specified,Urgent Opening_UI Developer_Ahmedabad/Bangalore/Gurgaon_Immediate to 15 Days,UIDeveloper|UserInterfaceDevelopment|WebDeveloper|Javascript|HTML|CSS|UiDevelopment|UserInterface|
PHP DEVELOPER - IT - NAGERCOIL -CALL 8286161793,Jobsnta,Nagercoil,2-4years,Not Specified,responsible for managing back-end services,Phpdeveloper|PhpMysql|PHPprogrammer|jQuery|CSS|Mvc|
Full Stack Web Developer,Splunk Hr Consulting,Bengaluru/Bangalore,8-12years,Not Specified,"8+ years of coding and development experience in front end UI web development ,Back-end programming languages.Database design and management and Server management and deployment for the relevant environment.",FullStackDeveloper|Designing|CodingandtestingforfrontendUI.|HTML|CSS|JavaScript|
Virtual walk in Drive for UI developer on Saturday 28th Feb @ Chennai,V2Soft Private Limited,Chennai,5-10years,Not Specified,Translation of the UI/UX design wireframes to actual code that will produce visual elements of the application.,UIdeveloper|UiDesign|UxDesign|HTML|CSS|Javascript|Js|AJAX|Angularjs|Bootstrap|jQuery|
React.Js Developer,SrinSoft Technologies Pvt Ltd,Bengaluru/Bangalore|Chennai,2-8years,Not Specified,"•	Strong in jQuery, JavaScript development |    •	Should be strong in React JS |    •	Extensive Agile experience |    •	Strong in UI design using HTML, CSS, Bootstrap |    •	Experience in Git Hub, Azure Devops",react.js|CSS|Javascript|AJAX|Jquery|Reactjs|ReactJs|
Graphic Designer NOIDA/GURGAON,Star Tech,Gurgaon/Gurugram|Noida,0-3years,540000 - 819999 INR,GNM WELCOMING CANDIDATES HAVING GOOD SKILLS FOR THE POST OF GRAPHIC DESIGNER.,GraphicDesigner|Illustration|WebDesigner|CSS|Js|Javascript|Flash|Dreamweaver|Xml|HTML|
Java Developer,Advanced Technology Consulting Service Private Limited,Mumbai,1-6years,Not Specified,Experience range from 1 to 6 yrs.,anyMVCarchitecture|Javascript|jQuery|Typescript|Html|CSS|CoreJava|J2ee|JDBC|
Software Developer (Dotnet),Xecom Information Technologies Private Limited,Pune,1-6years,140000 - 650000 INR,"Looking for opportunities and take more responsibilities to work on large, complex applications Api development, ASP.NET, AJAX, Working with third party controls(Telerik), .NET framework 3.5, 4.8",Asp.NetC#|RDLReports|MSSQL|Javascript|Json|AJAX|Xml|WebApi|jQuery|HTML|CSS|
Web Designer (UI/UX),Antra Inc,Hyderabad/Secunderabad,5-8years,Not Specified,"Experience designing graphics for web, print, social media, and other mediums |",Adobedesignsoftware|Indesign|Illustrator|WebDesigner|WebDesigning|HTML|CSS|Bootstrap|Javascript|
Web Developer,Encora Innovation Labs India Private Limited,Bengaluru/Bangalore,1-4years,Not Specified,Hiring Web developers with 1-2 yrs and 2-3 yrs for Bangalore,HTML|CSS|Javascript|Bootstrap|
Web Developer - 5 to 7Yrs Exp,ExterNetworks Inc,Hyderabad/Secunderabad,4-8years,Not Specified,Looking for Web Developer with 5 to 7Yrs Exp,Photoshop|WebDeveloper|HTML|CSS|Javascript|Jquery|Html5|Bootstrap|Cms|Wordpress|WebDevelopment|
Senior Software Developer,Skan Tech Consultancy,Delhi|Gurgaon/Gurugram,5-9years,Not Specified,"Develop and maintain applications, Front end- Bootstrap, HTML, CSS3, Javascript; Backend- My SQL, Python; Writing codes,Debugging, ORM libraries, Technical documentation, Unit testing, Designing and implementation",ObjectRelationship|Python|HTML|Bootstrap|Javascript|CSS|Mysql|DJANGO|WebService|Api|REST|Soap|ScriptingBash|Docker|Xml|Json|Xslt|Linux|OrmHibernate|Debugging|
Web Developer – 3+yrs Exp – Bangalore – 14L,Angel And Genie,Bengaluru/Bangalore,3-9years,Not Specified,Web Developer – 3+yrs Exp – Bangalore – 14L,WebDeveloper|Spa|WebSockets|WebDevelopment|Javascript|HTML|CSS|REST|Reactjs|AngularJs|
Full Stack Web Developer,Quality Thought Infosystems (India) Private Limited,Hyderabad/Secunderabad,0-1years,Not Specified,Looking for FronEnd/Fullstack/Angular/UI Developer Freshers,MeanStackDeveloper|HTML|CSS|Javascript|Js|Angularjs|FrontEndDevelopment|Node.js|Python|Php|
Tech Lead (PHP) in Bangalore,Sourcetal Hiretech,Bengaluru/Bangalore,7-10years,2400000 - 2500000 INR,"Dear Job Seeker, |   |  Currently, We are looking for the Tech Lead (PHP) in Bangalore. |   |  Designation / Position: Tech Lead (PHP) |",CI/CDPipeline|Php|Wordpress|Laravel|Codeigniter|HTML|CSS|MariaDb|Javascript|Ajax|Apache|Nginx|Maven|Sonar|Jenkins|Redis|Elk|RestApis|Docker|Kubernetes|Mysql|Postgres|
PHP Developer,Universal Management Consultancy Services,Mohali,2-3years,240000 - 300000 INR,"We need a PHP Developer who should have experience of 2-3 years in Wordpress, and should knowledge of any framework or CMS (CakePHP, CodeIgniter, Laravel).",AjaxJquery|Phpdeveloper|PhpMysql|HTML|CSS|Javascript|Json|CorePhp|CodeIgniter|Wordpress|Magento|Shopify|Bigcommerce|
"ASP.NET DEVELOPER /  .NET DEVELOPER  (SQL, JS, AJAX, CSS, JQuery, Json, SAP, C#)",XS Infosol Private Limited,Mumbai|MumbaiCity|NaviMumbai|Thane,2-7years,300000 - 570000 INR,"Multiple openings for ASP.NET DEVELOPERS / .NET DEVELOPERS  (SQL, JS, AJAX, CSS, JQuery, Json, SAP, C#) with 2 years of experience.",ASP.NETDeveloper|.NetDeveloper|Sql|Js|AJAX|CSS|JQuery|Json|SAP|C#|Asp.Net|
Technical Support Engineer,Career Net Solutions,Remote,2-6years,Not Specified,"A Technical Support Engineer serves as an expert for our product, VWO, and associated web technologies. The Support Engineer is the technical interface between our customers and VWO’s Development/QA and Product management teams.",HTML|CSS|Javascript|JQuery|
Web Developer,Job World,Delhi,1-6years,Not Specified,"Tailoring user experience |   Bringing a designers concept to life with HTML, CSS, and JavaScript/JQuery |   Production, modification, and maintenance of websites and web application user interfaces |   Experience with responsive and adaptive design.",WebDeveloper|HTMLDeveloper|Html5|CSS|Javascript|Xml|AJAX|
Front End Developer,Selectivite Consultants,Noida,3-8years,Not Specified,Hiring for TOP MNC for 'Front End / Back End Developer) |   |  Job Location: Noida |  Education Qualification: Any Graduate |  Experience: Minimum 3 Years |  Salary: Upto 12lpa |  Work from Office |,HTML|CSS|Javascript|Html5|jQuery|Bootstrap|Js|Node.js|Sql|Nosql|
Urgent Job Vacancies for Senior Software Engineer - Java in Pune,Pioneercodes Technologies Solutions LLP,Pune,4-8years,Not Specified,Senior Software Engineer - Java |   On payroll Permanent job.,J2EEScripts|CoreJAVAScripts|CSS.|JSPScripts|JAVAJ2EEScripts|Javadeveloper|iReportEditor|Java|J2EE|CoreJava|JavaJ2ee|Java8|SpringMvcFramework|SpringBoot|JUnit|Jpa|Hibernate|JavaScript|JQuery|HTML|Json|Xml|JasperReports|Jasper|Sql|
PHP Developer ( Experienced ),V2Soft Private Limited,Cochin/Kochi/Ernakulam,2-7years,Not Specified,"We are looking for PHP Developers with good coding skills, logical ability to develop and enhance websites/web applications in PHP or CMS platforms.",Phpdeveloper|PhpMysqlAjax|jQuery|CSS|Json|
Virtual walk in Drive for UI developer on Saturday 28th Feb @ Bangalore & Mysore,Arccaa Analytics And IT Solutions LLP,Bengaluru/Bangalore|Mysore,5-10years,Not Specified,Translation of the UI/UX design wireframes to actual code that will produce visual elements of the application.,UIdeveloper|UiDesign|UxDesign|HTML|CSS|Javascript|Js|AJAX|Angularjs|Bootstrap|jQuery|
Java Full stack Developer,Angel And Genie,Hyderabad/Secunderabad,4-6years,Not Specified,"	Should have Expertise in front-end technologies, including JavaScript, CSS3 and HTML5 and third-party libraries such as React Js, Angular, jQuery  – E3 Level |  	Should be Experienced in server-side Java programming language– E3 Level |",Javascript|CSS|HTML|Git|Angular|jQuery|
Web Developer – Bangalore – 3+yrs – 14L,Xecom Information Technologies Private Limited,Bengaluru/Bangalore,3-9years,Not Specified,The Web Developer will be a part of Global Information Technology Team and will primarily have |  responsibilities over the creation and maintenance of company-owned web applications.,WebDeveloper|mobx|WebSockets|WebDevelopment|Javascript|HTML|CSS|Reactjs|Redux|Flux|REST|
Senior Dotnet Developer,Xecom Information Technologies Private Limited,Pune,2-6years,200000 - 650000 INR,"Looking for opportunities and take more responsibilities to work on large, complex applications  |  ASP.net, C#, MS SQL, JavaScript, jQuery, WebAPI, AJAX, Web services, OOPS, Reporting services, RDL reports",Asp.NetC#|MSSQL|Javascript|Json|AJAX|Xml|WebApi|jQuery|HTML|CSS|
Frontend UI Senior Dev,Syth Infotech Private Limited,Gurgaon/Gurugram,3-8years,Not Specified,Must Have Skills  |  • Working experience as hardcore JavaScript i.e. both ES5 and ES6... but most of the work is on ES6 and some in ES5.  |  • Should have worked on any MVC framework React JS  |  • Good knowledge on Redux  |  • At least 3-4 years of experience,Javascript|CSS|HTML|ReactJs|
React Native Developer,Knila It Solutions India Private Limited,Pune,3-4years,720000 - 1780000 INR,B.Tech. or higher in computer science.  |       3-4 years of strong work experience with React Native and Kotlin. |       Expert in React Native and related libraries like Reduce and React Navigation,Es5|react.js|ReactNative|Kotlin|HTML|CSS|Javascript|Api|
Java Developer,BeamStacks Software,Coimbatore,2-5years,Not Specified,"We are looking for a Java Developer with experience in building high-performing, scalable, enterprise-grade applications. Should be able to handle projects independently with minimal guidance. Should be a self starter and be able to adapt changes.",CoreJava|SpringFramework|HTML|CSS|Javascript|J2EE|
Senior Software Engineer PHP MySQL,SQR Infotech Private Limited,Noida,4-8years,Not Specified,Senior Software Engineer PHP  MySQL with 4 to 8 years of Experience in building Web Applications using PHP,Cake|jQueryAJAX|Php|MVCFramework|CakeFramework|Mysql|Javascript|Json|CSS|PhpMysql|PhpEngineer|
