jobTitles,Company,jobLocations,requiredExperiance,Salary,JobDescription,Skills
HTML CSS,SwissTech Unicorn Corp LLP,Vadodara,1-6years,180000 - 470000 INR,We are looking for an experienced HTML / CSS Developer to join our team at SwissTech Unicorn.,Html5|CSS|
OPENING FOR FRESHERS PYTHON DEVELOPER,Career Mantra Management Services,Mumbai|Pune,0-1years,120000 - 229999 INR,"Post : Python developers |      Salary : 1.8 L.P.A To 2.4 L.P.A. |      Job Location : Pune, Mumbai |      Interested Candidate Apply Here |      For More Details Call Us 7249679203 HR Megha",PythonDevelopers|Java|HTML|CSS|Javascript|MSSQL|
"Mandatory Skill: Angular 2+, HTML, CSS, Typescript, Javascript ,Es6,Bootstap",Best infosystems Ltd,Bengaluru/Bangalore|Chennai,4-9years,Not Specified,"Mandatory Skill: Angular 2+, HTML, CSS, Typescript, Javascript ,Es6,Bootstap. |  Strong expertise with HTML, CSS, Typescript, Javascript ,Es6 |  Proficient understanding of web mark-up,  HTML5, CSS3 |  Experience with RESTful services |  Good understanding. |   |",Angular|Html5|CSS|Javascript|
SFCC Developers,D4 insight,Remote,6-12years,Not Specified,Looking for SFCC Developers,SFCC(Demandware)|HTML|CSS|Javascript|
AEM Developer,Prime Online Pvt. Ltd,Kolkata,2-5years,Not Specified,"Web Application Developer will be a member of a global Development team, supporting Legacy systems and web sites as well as developing new features and new Web applications. |  CMM5 Level Product Development  MNC Company |  Now –WFH/ Later WFO – Kolkata",Javascript|CSS|HTML|Java|Aem|Database|
Angular Developer (2/4/5/6),Comfyi Solution,Chennai,1-4years,200000 - 500000 INR,Responsible to develop web application using Angular 2 or above. |    To Create functional requirements and design documents for new features in web application.,AngularDeveloper|Angular2|Javascript|JQuery|HTML|Html5|CSS|Bootstrap|UI|
PHP Developers,Elite Corporate Solutions Private Limited,Chennai,1-5years,Not Specified,Responsible to work with PHP open source & to code & test the applications.Walkin Immediately with 2 hard copies of resumes to the following address.,Php|PHPdeveloper|HTML|CSS|Database|Javascript|jQuery|AJAX|Json|Mysql|
Angular developer,SliceMyPage,Gurgaon/Gurugram|Noida,3-5years,330000 - 500000 INR,Opportunity for Angular developer (Immediate candidates),Angulardeveloper|Angular2+|Javascript|HTML|CSS|
SOFTWARE ENGINEER PHP Web Developer,Best infosystems Ltd,Chennai|Hyderabad/Secunderabad,3-8years,520000 - 1250000 INR,Urgent Requirement,Cake|CSS|PhpFrameworks|Sql|WordPress|Javascript|HTML|Php|JQuery|Laravel|Ajax|
Front End Developer,Sourcebase Technologies Private Limited,Delhi|Noida,4-9years,Not Specified,"Drupal 8,RDBMS: MySql or PostgreSQL,  Laravel, CMS, HTML/HTML5, CSS/CSS3",RDBMS:MySqlorPostgreSQL|HTML/HTML5|CSS/CSS3|Drupal8|Laravel|Cms|
Front End Developer,Hi Tides Consulting,Lucknow,0-3years,120000 - 300000 INR,"We are looking  for the position of Front End Developer who is  responsible for ensuring the alignment of web design and user experience requirements, optimizing web pages for maximum efficiency, and maintaining brand consistency across all web pages",Photoshop|HTML|CSS|Javascript|Bootstrap|WebDesigner|
looking for a UI Developer,Millennium Ims Private Limited,Bengaluru/Bangalore|Hyderabad/Secunderabad,3-6years,Not Specified,"• Hands-on experience in optimizing the UI of an application. |  • Good understanding of asynchronous request handling, partial page updates, and AJAX. |  Proficient understanding of web mark-up, including HTML5, CSS3. |  • Basic understanding of CSS pre-pro |",UIDeveloper|HTML|CSS|AJAX|
Senior Frontend Developer,Talent Basket,Delhi|Gurgaon/Gurugram,3-6years,Not Specified,3 years of experience in frontend application development,Angular|Typescript|Javascript|Html5|CSS|Css3|
Sr. NodeJS Developer/NodeJS Developer/Full stack Developer,Winx Consulting Services,Patan-Gujarat,2-7years,210000 - 810000 INR,Immediate opening for Sr.NodeJS Developer/NodeJS Developer,Html5|Javascript|CSS|NodeJS|MangoDb|Json|
Dot Net – Technical Consultant,Redefined Corp,Bengaluru/Bangalore|OtherIndia,8-18years,Not Specified,Must have Skills |    •	Dot Net |    •	MVC |    •	Java Script |    •	Web API integration  |    •	API call |    •	Ajax |,.NET|C#|Asp.Net|Mvc|HTML|Javascript|CSS|
Senior UI Developer - Angular2+,Deputize Consultancy Private limited,Thiruvananthapuram/Trivandrum,4-10years,Not Specified,We are hiring Senior UI Angular 2+for Leading MNC@Trivandrum Technopark Location,UIDeveloper|Angular|CSS|Javascript|HTML|
Java Developer Core Java,Bodhami Private Limited,Hyderabad/Secunderabad,2-6years,500000 - 900000 INR,"2+ years experience in java/j2ee |     Experience into spring boot, microservices,Hibernet, Agile methodlogy, |     Any one of the cloud comphenent |      |     Structs(Good to have)",Javascript|HTML|AJAX|Xml|Jscript|CSS|
Front End Developer,Global Technologies,Chennai,2-4years,Not Specified,"Front End Developer  |  Solid knowledge of HTML, CSS, SASS. |  Familiar with UI layouts, SASS, bootstrap, and the CSS GRID system |  Excellent knowledge of Javascript and Jquery |  MVC architecture and OOP programming style.",SASS.JavascriptandJquery|HTML|CSS|
Angular  Developer,Comfyi Solution,Mumbai,5-8years,Not Specified,"Please share copy of your updated resume if you are available and interested to learn more about this opportunity;   |   |   |  Angular Developer |  Mumbai |   |  Required Technical Skills |  • HTML5, CSS* |  • JavaScript |  • TypeScript |  • Angular 6+ |  • Understanding of version",Angular|HTML|CSS|
"UI Developer (Angular , Javascript)",Nscript Web Studios Private Limited,Bengaluru/Bangalore|Goa,1-4years,250000 - 350000 INR,"Bodhami is a National Award Winner of 2020 and featured on National Startup Showcase. We are looking for a UI Developer with hands on experience in Angular, Java to join our award winning team. |",Angular|Bootstrap|Html5|CssJavaScript|
UI Developer,Best infosystems Ltd,Bengaluru/Bangalore,2-6years,Not Specified,"2+ years of demonstrable experience in HTML5, CSS3 and JavaScript based web applications. |  Proficient in UI frameworks such as Angular or frontend libraries such as React. |  Proficient in jQuery. |  Have working knowledge of CSS extension language such as",UI|Angular|Frontend|Html5|CSS|Javascript|
Software Project Trainee - (2020 Pass Out Only),Shell Info Technologies Private Limited,Chennai,Fresher,Not Specified,Software Trainee Engineers to work in  real Time software application development & designing. 2016 passing out students from reputed Institutions will be preferred.,Trainee|realTime|Designing|softwareprojects|C|C++|CSS|Sql|SoftwareEngineer|ApplicationDevelopment|
Immediate Opening For Core PHP Developer,Nscript Web Studios Private Limited,Chennai,2-4years,200000 - 400000 INR,Looking for an experienced and smart Core PHP developer,CorePhp|PHPDeveloper|Javascript|AJAX|Jquery|HTML|CSS|Framework|
UI Developer,Computer Generated Solutions India PVt. Ltd.,Hyderabad/Secunderabad,4-8years,400000 - 800000 INR,UI Developer with Angular,Angular|HTML|CSS|Bootstrap|
Hexaware Is Hiring Frontend Developers !! Mumbai/Pune/Chennai,Hexaware Technologies Limited,Chennai|Mumbai,5-10years,Not Specified,"6+ years of Experience in developing single page applications in the latest |  versions of the Angular 2+ framework. |  Highly experienced in writing standards-compliant HTML, CSS and JavaScript (ES6+) |  compatible with our supported browsers/devices |",UIDeveloper|Angular|UiDevelopment|HTML|CSS|
"Immediate C2H Opening for Angular 6,HTML5 CSS,RESTFUL EXPERTISE at Bangalore. EXPERIENCE : 6+ YEARS",BR Raysoft Global Private Limited,Bengaluru/Bangalore,5-15years,Not Specified,"Immediate C2H Opening for Angular 6,HTML5 CSS,RESTFUL EXPERTISE at Bangalore. |  EXPERIENCE : 6+ YEARS",Html5|css|Angular6|
Sr. UI Developer,Akken Technologies Private Limited,Hyderabad/Secunderabad,5-10years,Not Specified,We are looking for creative and enthusiastic Sr. UI Developer to join our product development team. He / She should be able to take ownership of all aspects of user interface development to meet business requirements across platforms.,UIDeveloper|WebDeveloper|Photoshop|CSS|Javascript|HTML|AJAX|Dreamweaver|
"Axion Technical Services Pvt Ltd, Chennai is hiring PHPWeb Developers",Axion Technical services Private Limited,Chennai|Trichy,2-5years,Not Specified,"# Axion Technical Services Pvt Ltd, Chennai is hiring Web Developers having 2-5 Years of |  experience |   |  # As a PHP Web Developer, the Web Developer relies on experience in web application |  development to design and PHP-based web applications |",Phpdeveloper|PhpMysql|Javascript|Jquery|CSS|Joomla|Codeigniter|Bootstrap|
Associate Software Engineer,Manheer Singh (Proprietor Of BigBoss Decor),Pune,0-3years,170000 - 250000 INR,Immediate opening For Associate Software Engineer/Developer For 2020 Passed Out Only.,Fresher|Java|CSS|Javascript|Bootstrap|HTML|SoftwareEngineering|
Job Opening for Java AWS Professionals,Team Ace HR LLP,Chennai,5-12years,Not Specified,Hiring for Java AWS Professionals,"""oracle10g""|Coldfusion|Java|jQuery|Javascript|html|css|"
Senior UI Developer,MVK Staffing Services Private Limited,Bengaluru/Bangalore|Hyderabad/Secunderabad,5-8years,Not Specified,We are hiring Sr UI Developer - Permanent work from home,Salesforce|html|css|Javascript|Lightning|
Dotnet Developer,Millennium Ims Private Limited,Bengaluru/Bangalore,5-8years,Not Specified,Position #1 |   |  Dot Net – Technical Consultant |   |  Relevant experience: 8+ years |   |  Joining date: ASAP |   |    |   |    |   |  Must have Skills |   |  Dot Net |  MVC |  Java Script |  Web API integration |  API call |  Ajax |,Asp.Net|C#|Mvc|Javascript|jQuery|Sql|Wcf|Json|HTML|CSS|
FullStack Developer-Cognizant Softvision-Bangalore,Cognizant Technology Solutions India Pvt Ltd,Bengaluru/Bangalore,3-8years,Not Specified,We are looking for talented Full Stack developers with the following skillsets |,react.js|Node.js|HTML|CSS|JavaScript|
Java Developer,Diraa HR Services,Chennai|Coimbatore,2-5years,Not Specified,"A Java Developer is responsible for the programming and development of applications and software using the popular programming language, Java.",Javascript|Jscript|Php|Xml|Jquery|AJAX|HTML|CSS|
Job Opening for Java AWS Professionals,Team Ace HR LLP,Chennai|Mumbai|MumbaiCity,5-12years,Not Specified,Hiring for Java AWS Professionals,"""oracle10g""|Coldfusion|Java|jQuery|Javascript|html|css|"
AEM Full Stack Developer,Deputize Consultancy Private limited,Bengaluru/Bangalore|Mysore,4-7years,1000000 - 1500000 INR,Hiring for AEM Full Stack Developer |     |    |   Package: 12to 15 lac (PA) |    |   Quick Joining: 15 days  (Depends on Knowledge) |    |   Experience: 4-7 YEARS |,AEM(version6.4plus)|HTML|CSS|Javascript|AngularJs|react.js|
react developer,Keen Bright Solutions Llp,Hyderabad/Secunderabad,4-10years,Not Specified,react developer,React|Redux|HtmlCss|Javascript|
Senior Angular JS Developer,Innointel LLC,Bengaluru/Bangalore,5-10years,Not Specified,"Delivering a complete front end application, Ensuring high performance on mobile and desktop, Writing tested, idiomatic, and documented JavaScript, HTML and CSS, Coordinating the workflow between the graphic designer, the HTML code, and yourself,",AngularJs|Javascript|Html5|CSS|
Node JS professionals with 3-12 years experience,Kenan Management Consultants Private Limited,Bengaluru/Bangalore|Chennai,2-12years,Not Specified,"A global product development and consulting company offering cognitive solutions and |  custom software development services for start-ups, small to mid-sized businesses, and large |  enterprises is seeking Node JS professionals with 3- 12 years experience",ReactJs|Flux|Redux|NodeJS|Javascript|CSS|HTML|
Full Stack Developer,Complete HR Services,MumbaiCity|NaviMumbai,3-5years,Not Specified,"ROLE and RESPONSIBILITIES OF APP AND WEB DEVELOPER:-) |  ⚫ Know HTML, CSS, JavaScript, PHP, and other relevant web design coding languages |  ⚫ Create and test applications for websites |  ⚫ Collaborate |  ⚫ Present design specs |  ⚫ Work with graphics and other de",Language-Python|WebDevelopment|HTML|CSS|Javascript|Php|Java|
Front-end Developer (Shopify),Samarthya tech pvt ltd,Ahmedabad,4-7years,600000 - 850000 INR,We are looking for a Full-Time Front-end (Shopify) developer to work with our European clients.,ShopifyAPI|Liquid|HTML|CSS|Javascript|jQuery|Js|AJAX|
Angular developer,HTC Global Services (India) Private Limited,Bengaluru/Bangalore,4-9years,Not Specified,"Opening for Angular developer for Manipal(WFH) |  Exp-4-8yrs |  Relevant in Angular should be 2 or 3yrs |  Must have Skill-Angular, Javascript, HTML,CSS, UI Frame wok |  Notice - Immediate to 15days |  pls share your profile to [HIDDEN TEXT]  |",uiframework|Angular|Javascript|html|css|
Dot Net Developer,Simple Logic IT Private Limited,Mumbai|NaviMumbai,2-4years,Not Specified,"We are an IT managed services company based in Mumbai. We are currently looking for Dot Net Developer with 2+ (or more) years of relevant experience. Candidates with expert knowledge in Asp .Net, MVC will be given preference. |   |  Location : Mumbai",DotNet|DotNetDevelopment|Asp.Net|Mvc|HTML|CSS|Javascript|Xml|
Software Engineer,Digiquint Solutions Private Limited,Bengaluru/Bangalore,1-3years,900000 - 1200000 INR,"SOROCO |   |  India, Karnataka, Bangalore |   |  Software Engineer (Front End) |   |  INR 900000 - 1200000 |   |  1 - 3 years |   |  Immediate Joiner (0-15 Days) |   |  Serving Notice within 30 days. |   |  Key Requirements and Qualifications: |   |  Should have worked on Java Script Frame Work (A",Angular|Html5|CSS|Javascript|react.js|
WordPress / Drupal Developer,TEKYANTRA,Hyderabad/Secunderabad,3-6years,480000 - 1200000 INR,Looking for consultants who can join Immediately,WordpressCms|Drupal|Php|PHPprogrammer|Cms|Javascript|CSS|
Node JS professionals with 3-12 years experience,Kenan Management Consultants Private Limited,Cochin/Kochi/Ernakulam|Thiruvananthapuram/Trivandrum,2-12years,Not Specified,"A global product development and consulting company offering cognitive solutions and |   custom software development services for start-ups, small to mid-sized businesses, and large |   enterprises is seeking Node JS professionals with 3- 12 years experience",ReactJs|Flux|Redux|NodeJS|Javascript|CSS|HTML|
Senior software engineer,Verchi Business Solutions Private Limited,Hyderabad/Secunderabad,10-12years,Not Specified,|                                  |                              |                                  |,
AEM Developer,Kaarya Consulting Services Private Limited,Bengaluru/Bangalore,4-9years,Not Specified,"AEM + Java with j2ee |   oops - sound knowledge |   DS, algo - good |   basic of html, css, js",AEM+Javawithj2ee|DataStructures|Algorithms|Ds|OopsConcept|CSS|Js|
Backend Developer,Cynosure Corporate Solutions,Delhi|Gurgaon/Gurugram,5-10years,Not Specified,"LAMP (Linux, Apache, Mysql, PHP) environment, Drupal, Laravel, CMS, HTML/HTML5, CSS/CSS3, and JavaScript/jQuery/angular JS,  |  •	Laravel technology stack |  •	Custom API development |  •	CMS/MVC framework: Drupal & Laravel  |",Drupalspecialist|DrupalDeveloper|larLaravel|Drupal|ApiDevelopment|LampLinux|Javascript|Jquery|Php|CSS|AJAX|HTML|Jscript|Xml|
"Immediate opportunity for MVC, C# .Net, HTML, Javascript, CSS.",Teejay Global Infotech Services LLP,Bengaluru/Bangalore,3-7years,Not Specified,"Immediate opportunity for MVC,c#,Net,HTML,Javascript,CSS, |           |         Experience-5-10years |          |         Location:Bangalore",Dotnet|Webapi|Mvc|Angular2|
Full Stack Developer,Alok N Thuse (Proprietor of S759 Labs),Hyderabad/Secunderabad,5-8years,Not Specified,Responsibilities: |   |  •	Developing front end website architecture. |   |  •	Designing user interactions on web pages. |   |  •	Developing back-end website applications. |   |  •	Creating servers and databases for functionality. |   |,Javascript|Mysql|Php|Java|css|html|
Full Stack Developer,Azine Technologies,Bengaluru/Bangalore|Gurgaon/Gurugram,4-8years,Not Specified,Position: Full Stack Developer |  Duration:6 Months |  Location :Remote |,HTML|CSS|Javascript|Xml|Node.js|WebServices|Soap|ASP.NET|Jms|RESTful|
FrontEnd Developer,Digiquint Solutions Private Limited,Mumbai,2-5years,Not Specified,"We are looking for a qualified Front-end developer to join our IT team. We expect you to be a tech-savvy professional, who is curious about new digital technologies and aspires to combine usability with visual design.",Java|Javascript|CSS|HTML|react.js|Mvc|
Immediate opening For PHP Developer @Ahmedabad,Pinnacle HRM,Ahmedabad,3-8years,300000 - 450000 INR,We are looking for a PHP Developer who is responsible for managing back-end services and the interchange of data between the server and the users. |,Phpdeveloper|CSS|Html5|Laravel|Mvc|Codeigniter|
.NET FULL STACK DEVELOPER,Global Solutions,Hyderabad/Secunderabad,4-9years,Not Specified,".Net Full Stack Developer with 5+ years of experience strong hands on knowledge on .Net Core ASP.Net Web API, REST Framework, MVC, MVVM architecture.",.NetCore|WebApi|Javascript|Html5|CSS|Asp.Net|Azure|
Graphic Designer,Digitalveli Technologies,Bengaluru/Bangalore,2-4years,500000 - 800000 INR,"Graphic Designer (2-3yrs)- strong in videos/social media calendar development,",GraphicDesigner|Illustrator|Photoshop|Aftereffects|HTML|CSS|
Full Stack Developer,Emastech Consultancy services (OPC) Private Limited,Kolkata,4-5years,300000 - 450000 INR,Multiple Openings for Full Stack Developer with Our Client located at Kolkata.,FullStackDeveloper|CSS|Xml|Javascript|AJAX|
Front End Developer,Brightsword IT Services Private Limited,Bengaluru/Bangalore|Chennai,5-10years,Not Specified,Frontend/UI Developer  - immediate joinee,frontenddeveloper|UIDeveloper|CSS|Javascript|
React.Js,Disha Recruitment Services,Pune,0-2years,Not Specified,Looking for React Developer for Pune,react.js|CSS|Html5|Bootstrap|JavaScript|
PHP Wordpress Developer / PHP Developer / PHP Programmer / Wordpress Developer,Inspirigence Talent Solutions,Bengaluru/Bangalore,2-5years,Not Specified,We are urgently looking for a PHP/WordPress Developer with Creative web design to join our dynamic web development team.,Wordpress|Php|RestApi|Mysql|jQuery|Javascript|HTML|CSS|Xml|Woocommerce|JQUERY|Xml|CSS|HTML|Wordpress|Php|Javascript|
ReactJS Full Stack Developer | 4-6 LPA | 3+ Years,Hi Tides Consulting,Bengaluru/Bangalore|Chennai,3-7years,400000 - 600000 INR,"Key Skills 3+ Years : ReactJS, PHP / CSS, MySQL, MangoDB, SQL Server,Java/ React.js / PHP / CSS / .Net, MySQL, MongoDB, SQL Server |    Server-side Programming : Java/ React.js / PHP / CSS / .Net |    DBMS Technology : MySQL, MongoDB, SQL Server",Reactjs|Php|CSS|MySQL|Mangodb|SQLServer|Java|react.js|Php|CSS|.NET|MySQL|MongoDB|SqlServerProgramming|
"""Sharepoint Developer""",DRPU Software Pvt. Ltd.,OtherIndia,4-7years,1000000 - 2400000 INR,"Powerapp,'power automate'SPFx,HTML,CSS",CSS.|CoreJAVAScripts|Java|Powerapps|Dhtml|
JAVA FULL STACK DEVELOPER ( ANGULAR OR REACTJS) -MUST MICROSERVICES - BGL LOC,E-Hireo Global Solutions Private Limited,Bengaluru/Bangalore,2-8years,600000 - 1800000 INR,"Experience developing SPA and Microservices mobile and web apps , deployed on Cloud Environment with CI/CD (AWS) |    |  Strong in  front-end languages and libraries (e.g. HTML/ CSS, JavaScript, XML, jQuery) |    |  Experience using HTML, CSS, JavaScript, Angula",ANGULAR/REACTJS|Spa|CI/CD|JASMINEORPROTRACTOR|Java|HTML|CSS|Microservices|AWS|CLOUD|
Website Designer HTML5 CSS3 Developer Responsive Website Designers Mobile Friendly web site CSS HTML,Emastech Consultancy services (OPC) Private Limited,Noida|Ghaziabad,0-2years,200000 - 580000 INR,We are looking for Creative Website Designers having Good knowledge of Designing of Responsive Layout Web sites based on HTML5 CSS3. Website Designers and Mobile Friendly web site Developers with Good hand on CSS CSS3 HTML 5.,WebsiteDesigner|Html5|Css3|Java|Php|MySQL|AJAX|Javascript|CSS|HTML|
Front end developer,Computer Generated Solutions India PVt. Ltd.,Bengaluru/Bangalore,1-3years,160000 - 630000 INR,"we are hiring for frontend developer,",EnzymeRedux|frontenddeveloper|Webpack|Javascript|HTML|CSS|Jquery|react.js|
UI Development,HR Factor,Pune,3-5years,500000 - 1000000 INR,"Must have good experience in UI development, React and Angular JS",BootstrapCSSframework|UiDevelopment|Angularjs|CSS|Html5|Javascript|
UI Architect,Java R&d Private Limited,Hyderabad/Secunderabad,7-12years,700000 - 1200000 INR,Front End development with Angular,UIDeveloper|Angular|Bootstrap|HTML|CSS|FrontEnd|
UI Developer,Deputize Consultancy Private limited,Bengaluru/Bangalore,6-9years,500000 - 1000000 INR,"	Minimum 5 years as a Front-end developer using HTML, CSS, JavaScript |  	Experience in Salesforce and Lightning is highly preferred |  	Notice Period of 30 Days or Less Only",Salesforce|SFDC|Lightning|FrontEndDevelopment|HTML|CSS|
Software Developer,Future Focus Infotech Private Limited,Bhopal|Indore,0-3years,110000 - 710000 INR,"Java R&D Pvt. Ltd. is an IT Development & Consulting Company with a well-established parent company Java Labs headquartered at VA, USA holding a strong experience of servicing top fortune 500 and small and medium sized clients for over 15 yrs. |",Java|HTML|CSS|Python|react.js|Phpdeveloper|AngularJs|Javascript|Golang|Node.js|
Software Developer - .NET Framework,Talentsol Consulting,Hyderabad/Secunderabad,3-5years,Not Specified,"Greetings from TalentSol Consulting ! |   |  If you are actively looking for JOB opportunity then this Post is for you, One of our clients in Hyderabad are hiring for ((Software Developer - .NET Framework)). Kindly find the JD below.",Angular8/10|CSS&SQLServer|TypeScript|JavaScript|ASP.NET|C#|HTML|
Great Opportunity for UI/ReactJS developers,UniqueForce Technology Solutions Private Limited,Chennai,7-8years,Not Specified,"Good experience and working as a React.js Developer. |  In-depth knowledge of JavaScript, CSS, HTML, and front-end languages. |  Knowledge of REACT tools including React.js, Webpack, Enzyme, Redux, and Flux.",FrontendDeveloper|UIdeveloper|react.js|Javascript|CSS|HTML|AJAX|Jquery|Xml|Jscript|Php|
Remote Software Developer,ACET INFOTECH PRIVATE LIMITED,Chennai|Coimbatore,3-13years,Not Specified,In this role you will focus on delivering products and solutions that directly impact internal and external USA clients. You must be able to balance the desire system elegance against the new for rapid delivery.,C#|Asp.netMvc|HtmlCss|Javascript|jQuery|
Senior PHP Developer,Cyphware Infotech Private Limited,Mumbai,3-4years,Not Specified,"The ideal candidate should have an In-depth understanding of the entire web development process (design, development, and deployment) alongwith specific skills as mentioned below. Candidates must display strong interpersonal skills, ability to ideate",-MustknowHTML|BootstrapandMysqldatabase|CSS|
Node JS Developer / Sr. Node JS Developer,Hi Tides Consulting,Ahmedabad,2-7years,240000 - 1080000 INR,Looking for candidate with experience in NodeJS and Web Development,restlet|Javascript|CSS|HTML|Jscript|WebDevelopment|MongoDB|RESTful|WebServices|
Web Developer,Brahmani Business Management Private Limited,Faridabad,3-5years,330000 - 550000 INR,"Writing well designed, testable, efficient code by using best software development |  practices |   Creating static and dynamic website layout/ user interfaces by using standard HTML/ |  CSS practices |   Integrating data from various back-end services and dat",HTML/CSSskills.|Analyticalskills.|Analytical|Javascript|CSS|
Hiring For Creative Graphic Designer in Canada and Australia,Cloud Visa Immigration LLP,Australia|Canada,3-8years,4500000 - 5500000 INR,"call & what's app to Pooja-9311529770 |   |  Graphic designers use computers or hand tools to create posters, websites, logos, brochures, magazines and many other materials to communicate ideas and information visually.  |",GraphicDesigner|CSS|WebDesigner|Js|Javascript|Flash|Dreamweaver|HTML|Xml|
Graphic Designer in Canada and Australia,Cloud Visa Immigration LLP,Australia|Canada,3-8years,4500000 - 5500000 INR,"|  Graphic designers use computers or hand tools to create posters, websites, logos, brochures, magazines and many other materials to communicate ideas and information visually.  |",GraphicDesigner|CSS|WebDesigner|Js|Javascript|Flash|Dreamweaver|HTML|Xml|
Software Engineer – Front End,Global Technologies,Hyderabad/Secunderabad,4-10years,Not Specified,"4+ years of hands-on experience in large-scale (distributed) system architecture, complex software design, high scalability and availability, optimization, etc. |  Extensive experience with UI technologies, defining visions/solutions and collaborating",UI|Ux|HTML|CSS|Javascript|jQuery|Bootstrap|Reactjs|
Opening for JAVA + Node JS Developer - Mumbai,Freelancer Deepika D Bidri,NaviMumbai,2-10years,Not Specified,we are currently hiring developers with good exp in Java + Node Js for Mumbai Location,Node.js|NodeJS|Nodejs|Java|HtmlCss|
Node JS Developer,Global Solutions,Kolkata,1-3years,200000 - 300000 INR,"We are looking for a Node.js Developer responsible for managing the interchange of data between the server and the users. Your primary focus will be the development of all server-side logic, definition and maintenance of the central database.",Rnc|Node.js|JavaScript|CSS|HTML|Jsp|
