jobTitles,Company,jobLocations,requiredExperiance,Salary,JobDescription,Skillssoftware developer / Software Engineer / Software Engineer / Freshers,Fujitsu Consulting,Chennai,0-2years,240000 - 470000 INR,Opportunity for Freshers |    2011 - 2018 Fresher |    Immediate joining |    Salary : 10000 - 18000,Developer|IT|Hardware|Javadeveloper|CSS.|CoreJAVAScripts|JSPScripts|TestE|SoftwareEngineer|Softwaredeveloper|SeniorSoftwareEngineer|Softwareprogrammer|Programmer|Java|C++|C#|ASP.NET|Testing|ManualTesting|SoftwareTesting|AutomationTesting|
"Sitecore eCommerce, Sitecore CMS",Maxo Tech Solutions LLC,Bengaluru/Bangalore|Coimbatore,3-10years,Not Specified,"3+ years experience in design & development of Sitecore based web application with Sitecore |   CMS (Sitecore 9.0+).Experience in design & coding of Sitecore CMS modules i.e. Sitecore API, data/command |   templates, layouts, components & workflows.",SitecoreCMS|SitecoreEcommerce|SQLServer|MongoDB|Asp.net|CSS|Jquery|Js|Bootstrap|Linq|HTML|Framework|
Associate Application Developer,InfoPro Solutions Pvt Ltd,Pune,3-4years,Not Specified,"Work on a demand to assess the feasibility, effort, and cost of the demand and create a business case for approval of the demand. |",SharePointDeveloper|Sharepoint|Javascript|.NET|C#|PowerShell|Scripting|CSS|Csom|Jsom|Api|
Graphics Designer / Web Designer,Sourcetal Hiretech,Hyderabad/Secunderabad,Fresher,Not Specified,"Job description |   |  Roles and Responsibilities |   |  Accountable for overall responsibility of Graphic Design and Development(full life cycle) using open source desktop publishing tools such as GIMP 2.10.20, Inkscape, Scribus 1.4.8, LibreOffice 7/6, etc. Exp",GraphicDesigner|WebDesigner|CSS|Javascript|Flash|Dreamweaver|Xml|HTML|Js|
Full Stack Developer,Hi Tides Consulting,Bengaluru/Bangalore|Hyderabad/Secunderabad,5-8years,Not Specified,Urgent requirement for Full Stack Developer for on of our MNC Client at Hyderabad and Bangalore,JSFrameworks(various)|AJAX/XHR/RESTAPIexperience|Cae|CiscoCloud|HTML|CSS|Sass|Js|Angular|Node|Docker|Git|MongoDB|Express|
Full Stack Developer,Anupama (Proprietor of Making IT Simplest),Mangalore|Udupi,3-10years,Not Specified,Develop user interfaces for modern rich internet applications with the latest front end technologies.  |   |  Perform development tasks of increasingly complex nature which may require extensive research and analysis |   |  Building of web projects from scratch |,react.js|Node.js|JavaScript|HTML|CSS|
PHP Developer (Junior & Senior) in Bangalore,Applied Materials,Bengaluru/Bangalore,2-5years,800000 - 1500000 INR,"Dear Job Seeker, |   |  Currently, We are looking for the PHP Developer (Junior & Senior) in Bangalore. |   |  Designation / Position: PHP Developers (Junior & Senior) |",Php|Wordpress|Codeigniter|Laravel|HTML|CSS|Javascript|Ajax|Mysql|MariaDb|Postgres|RestApis|Apache|Nginx|
REACT.JS & PHP DEVELOPER (URGENT - BANGALORE  LOC),SQR Infotech Private Limited,Bengaluru/Bangalore,3-7years,1000000 - 1300000 INR," Must have exp in JavaScript Framework ReactJs, with popular React.js workflows (such as Flux or Redux) |   Minimum 4 yrs of professional development experience with object-orientated PHP, MySQL, AJAX JSON. Yii or any similar MVC framework |",YIIORANYOTHERMVCFRAMEWORK|Reactjs|Php|MYSQL|Json|AJAX|HTML|CSS|RestApi|
"Opening For Fashion Designer,Web Designer,Graphic Designer,Interior Designer Job Fresher",Geminid Systems Private Limited,Mumbai|MumbaiCity|NaviMumbai|Thane,0-1years,Not Specified,"Opening For Fashion Designer,Web Designer,Graphic Designer,Interior Designer Job Fresher  |  Mumbai Location Candidate Can Apply |  Fresher Only  |  Internship also Apply |  One Time Interview Mulund",FashionDesigner|Fashion|Apparels|Textiles|Model|Clothing|Fabric|InteriorDesigner|InteriorDecorator|SpacePlanning|FurnitureDesigning|Architect|InteriorDesignerAndTextileDesigner|Photoshop|Graphic|WebDesigner|Javascript|CSS|Flash|Dreamweaver|
Trainee Software Developer,Axxonet System Technologies Private Limited,Bengaluru/Bangalore|Delhi,0-1years,150000 - 300000 INR,"1. Design, Develop, Test, Deploy & Maintain Java Programs |  2. Work with Cloud Platforms AWS, Salesforce, GCP |  Note : Please take two mandatory online assessment listed for selection, candidates are short listed with minimum of 60% scores in each test.",Salesforce|Sdlc|Java|Git|AWS|Javascript|HTML|CSS|
Full Stack Developer,Vibrantzz Management Services,Bengaluru/Bangalore,1-4years,Not Specified,A full stack developer must have a range of technical and soft skills to qualify for the job role. They must have knowledge of front-end technologies like:,BootstrapandotherCSSframeworks|andBower|jQueryorBackbone.js|SassorLESS|and.Net|HTML|Javascript|AndCss|Foundation|AJAX|Grunt|Gulp|Angularjs|React|Ember|Python|Php|Ruby|Java|Javascript|MySQL|PostgreSQL|Oracle|MongoDB|
Senior Software Engineer JavaScript,V2Soft Private Limited,OtherIndia,3-8years,Not Specified,"As a Javascript Engineer, you will be required to work on various Javascript libraries that are served on our customers’ websites thereby impacting millions of users. These libraries are the core of all the features of VWO.",VanillaJavascript|Rollup.js|Cypress|ESLint|UIDevelopmentShareJobLinkonSocialMedia|Javascript|Typescript|HTML|CSS|
hiring for full stack developer in native application,Aibel Advertising and Media Solutions Private Limited,Mumbai|MumbaiCity|NaviMumbai|Thane,5-10years,Not Specified,"good numbers of hiring must be required with the experience on mean stack, mern stack, mongodb, AWS, angular, nodejs, react.",FullStackDeveloper|Express.Js|MongoDB|node.js|JavaScript|CSS|AWS|React|Angular|MeanStack|
AEM developer,Tracy Ann Benson (Proprietor of HR Geek Consulting ),Bengaluru/Bangalore,5-10years,Not Specified,Looking for AEM developer.,webcontentmanagementsystem|Aem|AdobeAem|Html5|Css3|Javascript|AJAX|RESTful|WebServices|
ASP.NET Developer  (Web),Hucon Solutions India Private Limited,Cochin/Kochi/Ernakulam,1-6years,300000 - 350000 INR,Candidate should have minimum 1 or 2 years of experience in ASP.Net   |,Asp.Net|HTML|Html5|Dhtml|CSS|Javascript|jQuery|Mvc|C#|
Angular Developer (Senior Software Engineer),Encora Innovation Labs India Private Limited,Cochin/Kochi/Ernakulam,4-7years,440000 - 990000 INR,"Looking for senior software developer with hands on experience in Angular 6,8,9,10. |  We will provide you a good work Environment in Infopark, Cochin.",DotNetDeveloper|Angular|Javascript|jQuery|AngularJs|CSS|Html5|Bootstrap|Json|AJAX|Git|
UI Developer,Gautam Consultancy,Bengaluru/Bangalore,3-10years,810000 - 3050000 INR,"Should be able to create and review designs/documents   |  Must be able to clearly articulate situations, problems and communicate ideas and solutions  |","""UIDeveloper""|""UIDevelopment""|""Javascript""|""Angular""|""HTML""|""CSS""|""Elasticsearch""|""Mysql""|""Oracle""|"
Ruby on Rails Developer,Fenopix Technologies Private Limited,Bengaluru/Bangalore,5-10years,Not Specified,"Experience with Ruby on Rails, along RSpec and Resque",RorDeveloper|RubyOnRails|Ruby|jQuery|html|css|rdbms|PostgreSQL|Nosql|VueJs|
Apply Directly for Top MNC'S !!!!!! ~ Fresher ~ BPO ~ Banking Process ~ Voice @ Vadodara/Baroda,Angel And Genie,Vadodara,0-2years,50000 - 150000 INR,"* Willing to work in rotational shifts |  * Graduation in any specialization |  *  Want Proficiency in English  |                 |                 |   Regards, |   Nitu Choudhary |  Call: 7350853129 |  Email Your CV on: nitu.gautamconsultancy @gmail.com(no space)",ITES/BPO|CustomerSupport|Bpo|CommunicationSkills|Freshers|Graduate|VoiceProcess|PostGraduate|FluentEnglish|Nightshift|OnlineDataEntry|CustomerCare|International|Telecalling|Domestic|Cse|Csa|csr|English|Voice|Inbound|Call|Receptionist|Kpo|css|
Software Developer,Sevenstar Websolution,Bengaluru/Bangalore,0-2years,300000 - 400000 INR,"As a developer, you'll be working mainly on the design & development of CanvasJS",C|C++|HTML|Php|CSS|Javascript|jQuery|Asp.Net|Java|MySQL|SoftwareDevelopment|SoftwareArchitecture|
"Sr.CakePHP Developer, Experience – 3+ Years – Koramangala, Bangalore – Budget Max 10 LPA CTC",Skan Tech Consultancy,Bengaluru/Bangalore,3-9years,Not Specified,"Sr.CakePHP Developer, Experience – 3+ Years – Koramangala, Bangalore – Budget Max 10 LPA CTC",CAKEPHP|Oops|OraclePL/SQL|WebServices|Xml|Soap|Ide|Json|Javascript|MySQL|HTML|AngularJs|CSS|JqueryUi|JQuery|
PHP CI Developer,Sunquest Information Systems (India) Private Limited,Noida,1-4years,110000 - 330000 INR,"We are looking for an experienced and self-driven PHP CI developer to join our team! If you are passionate about learning and gaining new skills in this field, don't miss this opportunity! The candidate must be comfortable working autonomously. |    |",MSSQLDeveloper|SQLDesigner|PHPDeveloper|CodeigniterFramework|Codeigniter|Cakephp|MVCFramework|Symphony|Laravel|CorePhp|Joomla|Javascript|MYSQL|DatabaseDeveloper|SQLServerDeveloper|MongoDb|ApiDevelopment|ApiIntegration|HtmlCss|
Application Developer,Xecom Information Technologies Private Limited,Hyderabad/Secunderabad,2-6years,Not Specified,Work on new software applications |  Design prototypes |  Troubleshoot software applications,FullStackDeveloper|FullStackWebDeveloper|UIDeveloper|AngularJs|PostgreSQL|Angularjs|AngularJavascript|Angular.js|FrontEnd|Frontend|UiDevelopment|HTML|CSS|Templates|Flutter|react.js|ReactNative|DataAnalytics|Algorithm|MobileDevelopment|
Software Engineer,Miracle Software Systems India Private Limited,Bengaluru/Bangalore|Kolkata,2-5years,Not Specified,"2 - 5 years of experience in development. As the member of a dynamic Product Development Team, Software Engineer / Senior Software Engineer is responsible to deliver high quality solutions in a fast-paced growth environment. Work with the Development","""react""|""angular""|""css""|Mvc|"
Analyst Programmer (Dotnet)- ERP,Freelancer K V Anila,Pune,2-6years,140000 - 550000 INR,"Looking for opportunities & take more responsibilities to work on business applications Should have experience of doing DOTNET development in at least one of the following AP,AR, FA, GL, MRP, Service Management, Engineering, BoM, Inventory, Reports",Asp.NetC#|MSSQL|Javascript|Json|AJAX|Xml|WebApi|jQuery|HTML|CSS|
UI/UX Developer:,Peoplefy Infosolutions Private Limited,Visakhapatnam,5-9years,Not Specified,Experience: 5 years |  Location:Visakhaptnam,"UserInterfaceDevelopment|""UI/UX""|UIDeveloper|UiDevelopment|HTML|Bootstrap|CSS|SpringMvc|jQuery|JqueryUi|"
Angular Developer,Megadev Software Co,Chennai,2-10years,600000 - 1000000 INR,Position- Angular Developer |   |  Location – Chennai |   |  Salary – 6 LPA and Above |   |  Experience: 2 -10 years,AngularJs|Angularjs|Typescript|Node.js|Nodejs|NodeJS|HTML|Xml|Json|CSS|Javascript|AJAX|Git|Bootstrap|RestApi|
Urgent requirement For Sharepoint office 365 Analyst,Best infosystems Ltd,Pune,4-9years,Not Specified,We have great opportunity for Sharepoint office 365 Analyst for Pune location |   |,ReactJSFramework|SupportingO365|SharepointApplications|HTML|CSS|Javascript|Typescript|Powerapps|Powerbi|Itil|
Backend Developer,Danalitic India Private Limited,Ahmedabad,4-10years,Not Specified,Looking for Backend Developer with excellent programming skills and a passion for developing applications or improving existing ones.,Design|Deployment|CMSFramework|BackendDeveloper|WebDevelopment|Java|Ruby|Php|Python|HTML|Javascript|CSS|
FULL STACK ENG APPLICATIONS,Web Design Magics,Hyderabad/Secunderabad,4-8years,Not Specified,4 8 Years of experience Full stack Net Azure Angular SQL Skill set ASP Net ASP NET MVC strong in C OOPS Concepts WCF ASP NET Web API Ajax HTML HTML 5 CSS jQuery JavaScript SQL Server,Configuredcode|UnitTestCode|Angular|ApplicationDeployment|UnitTesting|Wcf|ASPNET|WebApi|Ajax|HTML|Html5|CSS|jQuery|Javascript|SQLServer|
"Full Stack Developer (Java Spring, Microservices)",Uplers Solutions Private Limited,Pune,3-6years,440000 - 1290000 INR,"The Full Stack Developer would need to have at least 3+ years of experience into Java, Spring & Microservices frameworks with demonstrable history of development and production exposure.",JAVAJ2EEScripts|Java|Spring|SpringFramework|Microservices|CssJavaScript|
Full Stack Developer,Team Hunt Hr Solutions,Mumbai,2-5years,300000 - 500000 INR,We are looking for a strong mobile app developer who welcomes both engineering and maintenance tasks. The primary focus will be to implement new user interfaces and features together with automated unit and integration tests.,MVVMfront-enddeveloper|Back-enddeveloperHTML5|DevTools|Bulme|VelocityJS|Mvp|Css3|Js|Javascript|CSS|HTML|Jscript|Phpdeveloper|ReactNative|Python|Java|Git|ReactJs|Bootstrap|Angular|MobileApplicationsDevelopment|Retrofit|Mvc|
UI Developer with Angular,IT-Scient Consulting Private Limited,Bengaluru/Bangalore|Chennai,4-9years,Not Specified,Must Have Skills  |  1. Angular 6 |  2. Type Scripts |  3. css |  Detailed Job Description: |  Need UI Developer having knowledge of Angular 6 and above and good knowledge in type scripts.Ability to turn a UI wireframe into webpage.,Angular6|CSS|Html5|
Freelance Full Stack Developer,Techbeeshub Private Limited,Bengaluru/Bangalore|Hyderabad/Secunderabad,3-6years,Not Specified,"3+ years of experience in development and design of applications for data processing |   |  Frontend: VueJS, NuxtJS, CSS, HTML, Java Script, Bootstrap, Axios, nodeJS |   |  Backend: Python (Flask, Flask Restplus, numpy, pandas) or django, PostgreSQL |   |",PythonDjango|react.js|NodeJS|ExpressJs|MeanStack|Flask|Javascript|CSS|Jscript|AJAX|
Software Trainee,Miracle Software Systems India Private Limited,Visakhapatnam,0-1years,Not Specified,The candidate may possess skills in any programming language/scripting language/DevOps/any database |         Hands-on experience in any application development is preferable |         Good communication skills and logical thinking capabilities.,mechinelearning|Adobe|Sketch|CoreJava|AdvancedJava|Sql|HTML|Angular|Node.js|CSS|Mysql|Nosql|Html5|Python|Qa|Selenium|Javascript|DeepLearning|Db|SpringBoot|Jpa|Iot|Ionic|Streaming|Datascience|UnixShellScripting|Devops|
Software Developer / Software Engineer / PHP Developer / PHP Programmer,ONS Tech,Mohali|Chandigarh,0-1years,80000 - 150000 INR,We are looking for SERIOUS CANDIDATES who are looking to excel there skills in the field of web development. |           |          Candidate should have a basic understanding of- |          1. PHP |          2. MySql |          3. Javascript |          4. HTML/CSS |          5. Bootstrap |       |,SoftwareDeveloper|SoftwareEngineer|PHPDeveloper|PHPProgrammer|Php|Mysql|Bootstrap|HTML|CSS|Javascript|
MNC Company Hiring Java Developer in Pune,Selectivite Consultants,Pune,4-12years,Not Specified,An Austrian base company hiring Java Developer in Pune,J2EEScripts|CoreJAVAScripts|CSS.|JSPScripts|HibernateEe|testingJavaEE|Object-OrientedDesign|Java|J2EE|Jpa|Spring|SpringBoot|SpringMVC|SpringBatch|SpringIoc|JavaFrameworks|SpringBoot|Hibernate|SpringBatch|SpringSecurity|
Full Stack WordPress Developer,Uplers Solutions Private Limited,Bengaluru/Bangalore,3-13years,1800000 - 2400000 INR,"Hiring for Full stack WordPress Developer with 3-13 Yrs of experience located at Bengaluru (Permanently Remote, India) with Attractive Salary $1800-$3150 per month / INR 1,50,000 - 2,00,000 Monthly",Javascript|Phpdeveloper|PHPprogrammer|Wordpress|WordpressDeveloper|Php|Json|Jquery|Xml|Drupal|Html5|CSS|Git|Woocommerce|
Python Full-Stack Developer (Back End + Front End),Arthur Grand Technologies Inc,Bengaluru/Bangalore,5-15years,Not Specified,"Position: Python Full-Stack Developer (Back End + Front End) |  Location: Bangalore , IN |  Duration: Full Time / Permanent |  Salary: 10 Lakhs -15 Lakhs / Annum",Anuglar|Backend|Python|Javascript|CSS|HTML|Xml|Jscript|Node.js|
Product Lead (Java/ j2ee),Radial HR Solutions,Bengaluru/Bangalore,8-11years,1800000 - 2200000 INR,"Looking for the position of Product Lead (Java j2ee): Require Candidates with 8+yrs of experience in Java, J2EE, Spring IOC, Spring Annotations, Spring JDBC, Jquery, Java script, HTML 5, CSS.Exp as team leader",ProductLead(Java/j2ee)|SpringAnnotations|TeamLead|Java|J2EE|SpringIoc|Spring|JDBC|Jquery|JavaScript|Html5|CSS|teamleader|
Hiring for Full stack Developer for Bangalore Location (FTE),Anri Solutions HR Services Private Limited,Bengaluru/Bangalore,4-7years,Not Specified,The Candidate is responsible for DB and Backend server side programming for Mobile and Web application. |  He/she should be able to execute projects based on requirements and with limited supervision independently.,DevExtreme|Express.js|AJAXandBootstrap|Angular6|HTML|CSS|Javascript|JQuery|
Apply for Customer Service Executive role in Leading MNC !!!!!! BPO ~ Voice Support @ Vadodara,Gautam Consultancy,Vadodara,0-2years,50000 - 150000 INR,"* Willing to work in rotational shifts |    * Graduation in any specialization |    *  Want Proficiency in English  |                |                |     Regards, |     Nitu Choudhary |     Call: 7350853129 |     Email Your CV on: nitu.gautamconsultancy @gmail.com(no spac",Bpo|CallCenter|VoiceProcess|InternationalCallCenter|Querysolving|CommunicationSkills|Inbound|OutboundCalling|TeleCalling|Fresher|FluentEnglish|CustomerCare|NIghtShift|Csr|Cse|Csa|Graduate|CustomerCareExecutive|B.Com|USShift|Kpo|Css|
Java Web Full Stack Developer,Space Consultancy,Bengaluru/Bangalore,4-6years,550000 - 850000 INR,"A java full stack web developer is a developer with extensive knowledge and expertise in full stack tools and frameworks that works with java. The java suite of technologies include working with servlets, core java, REST API and more tools that make",Java|HTML|CSS|Javascript|
We Have A Opening for BPO ~ Call Center ~ Banking Process !!!!!  Freshers apply soon!!!! @ vadodara,Gautam Consultancy,Vadodara,0-2years,50000 - 150000 INR,"* Willing to work in rotational shifts |    * Graduation in any specialization |    *  Want Proficiency in English  |            |            |     Regards, |     Nitu Choudhary |     Call: 7350853129 |     Email Your CV on: nitu.gautamconsultancy @gmail.com(no space)",Bpo|Ites|NightShift|Querysolving|Fresher|Graduate|Voicesupport|Telecalling|Csa|csr|cse|Rotationalshift|CustomerHandling|fulltime|B.Com|CommunicationSkills|CustomerCareExecutive|English|DomesticProcess|BankingProcess|USShift|Kpo|css|
Software Developer,GREEN CATALYSATOR IT INDIA PRIVATE LIMITED,Bengaluru/Bangalore|Coimbatore,2-5years,Not Specified,Java & PHP software developer with 2 - 4 years of experience,Java|Javascript|Php|Jscript|Jquery|CSS|HTML|AJAX|Mysql|Apache|
Web Developer ( Java/.net /PHP Candidates Can Apply) - Delhi,Klaus It Solutions Private Limited,Delhi|Gurgaon/Gurugram,1-3years,250000 - 320000 INR,"If you are a Java/PHP/.net developer & have good understanding of web techonologies, and want to switch to Ruby on Rails or iOS or Android development, you may apply to this positoin.",WebDeveloper|Online|Design|WebDevelopment|WebsiteDevelopment|WebDesign|UiDevelopment|Programming|CSS|Javascript|AJAX|Extjs|Jquery|Js|Phpdeveloper|PhpMysql|Ios|Linux|UNIX|
Java Script Devoloper,Klaus It Solutions Private Limited,Bengaluru/Bangalore|Chennai,5-13years,Not Specified,"Development experience 5+ years in |  o Experience in writing and debugging JavaScript code |  o Experience in writing browser extensions (chromium preferred) |  o Experience responding to security issues in target-rich environments, looking at security alert",HTMLoExperiencewithRESTfulAPIs|JavaScript|javascriptlibrary|CSS|Json|Debugging|MalwareAnalysis|
Java Script Devoloper,TEKsystem,Bengaluru/Bangalore|Hyderabad/Secunderabad,5-9years,Not Specified,"Development experience 5+ years in |  o Experience in writing and debugging JavaScript code |  o Experience in writing browser extensions (chromium preferred) |  o Experience responding to security issues in target-rich environments, looking at security alert",writinganddebuggingJavaScriptcode|Demonstratedexpertiseworkingwithmalwareanalysis|javascriptlibrary|CSS|HTML|
Java Full Stack Developer,Topsource Infotech Solutions Private Limited,Bengaluru/Bangalore|Noida,4-7years,Not Specified,"4+ Years of development experience in Front End frameworks and technologies like React.js, Vue.js, |  Anjular.js, HTML5, CSS.",JavaFullStackDeveloper|Vue.js|Anjular.js|OpenIDConnect|react.js|Html5|CSS|REST|Json|Soap|Xml|Oauth|Saml|Cassandra|MongoDB|
ServiceNow Developer,Quess IT Staffing (Formerly known as Magna Infotech),Chennai,4-14years,800000 - 3000000 INR,We have urgent opening for ServiceNow Developer in TopSource . Any Science/Computer Graduate who is having 4 years of work experience in ServiceNow Developers can apply.,ServiceNowDeveloper|ServiceNowdevelopment|JSON/XML|Analytical|Servicenow|Javascript|Glide|Html5|Soap|REST|Ajax|CSS|AgileDevelopment|TestingMethodology|
UI Developer,Hi Tides Consulting,Bengaluru/Bangalore|Hyderabad/Secunderabad,3-5years,Not Specified,UI Developer_3 to 6 Years_Immediate to 15 Days_PAN India,UIDeveloper|UserInterfaceDeveloper|Javascript|CSS|HTML|UserInterface|
FRONTEND DEVELOPER (IT SERVICE BASED CO.)- BANGALORE,Gautam Consultancy,Bengaluru/Bangalore,4-9years,900000 - 1200000 INR,"Strong  vanilla skills - HTML, CSS, JS *outside of Angular/React/Vue!* |  • Experience creating of mobile-first, responsive designs. |  • Experience with cross-browser testing and Experience with gulp or grunt, and npm |",HTML|CSS|Angular|Reactjs|Vue|Rwd|CrossBrowserTesting|Grunt|Gulp|Npm|
Bumper Offer in BPO Sector For Fresher Candidate ~ Banking Process @ Vadodara/Baroda,Deep Technologies,Vadodara,0-2years,50000 - 150000 INR,"* Willing to work in rotational shifts |   * Graduation in any specialization |   *  Want Proficiency in English  |           |           |   Regards, |   Nitu Choudhary |   Call: 7350853129 |   Email Your CV on: nitu.gautamconsultancy @gmail.com(no space)",Bpo|CustomerServices|CustomerCare|CustomerSupport|Voicesupport|QuerySolving|DomesticBPO|International|CallCenter|ARCalling|TeleCalling|CustomerCareExecutive|Fresher|Graduate|BPOFreshers|USShift|UKShift|DayShift|Ccr|CSE|Csa|CSR|Kpo|CSS|
PHP Developer/PHP web Developer,Shorewise Consulting India Private Limited,Surat,1-4years,120000 - 330000 INR,We are currently looking for a candidate Minimum of 2 years of experience in the PHP field for Surat Location and who has a minimum computer graduation qualification.,WebDeveloper|Phpdeveloper|PHPprogrammer|PhpMysql|PhpMysqlAjax|jQuery|Javascript|HTML|CSS|AJAX|Php|
Lightning Salesforce Developer,Cyphware Infotech Private Limited,Chennai|Delhi,3-10years,Not Specified,"ASAP hiring, please only send resumes where candidates can join within 1 month.",salesforceandlightningandCSS|
PHP / Laravel developer,Sterling Emerson HR Services,Pune,2-8years,Not Specified,We have an urgent opening for PHP Developer for a leading organization who are having min. 2 to 8 yrs of experience.,PHPandLaravel|SQLschemadesign|RestApi|html|css|Javascript|Git|Github|
Full Stack java Developer,Rapid Global Business Solutions India (P) Ltd,Bengaluru/Bangalore,4-12years,Not Specified,Hiring Full Stack Java Developers for US based MNC,JAVAJ2EEScripts|Java|Hibernate|SpringBoot|Microservices|UI|HTML|CSS|Angular|Oops|
Excellent opportunity to work with BPO ~  Voice Process !!!!!! @ Vadodara/Baroda,Gautam Consultancy,Vadodara,0-2years,50000 - 150000 INR,"* Willing to work in rotational shifts |   * Graduation in any specialization |   *  Want Proficiency in English  |                |                |   Regards, |   Nitu Choudhary |   Call: 7350853129 |   Email Your CV on: nitu.gautamconsultancy @gmail.com(no space)",Bpo|Ites|Voice|CallCentre|CSR|CSE|CustomerSupport|CustomerCareExecutive|CustomerCare|Dayshift|Fresher|Inbound|DayJob|Graduate|USShift|UKShift|Ccr|UsProcess|e-commerce|DataEntryOperator|Aviation|Kpo|CSS|Receptionist|
Amazing role for Freshers!!! ~ BPO ~ Voice Support~ Banking Process ~  @ Vadodara/Baroda,Gautam Consultancy,Vadodara,0-2years,50000 - 150000 INR,"* Willing to work in rotational shifts |  * Graduation in any specialization |  *  Want Proficiency in English  |                |                |  Regards, |  Nitu Choudhary |  Call: 7350853129 |  Email Your CV on: nitu.gautamconsultancy @gmail.com(no space)",Bpo|CallCenter|VoiceProcess|InternationalCallCenter|Csr|Cse|Csa|cbsc|Cbse|Fresher|CommunicationSkills|Graduate|Ug|Pg|Domestic|Ites|CustomerCareExecutive|Inbound|Outbound|Telecalling|CustomerCare|Aviation|uscalling|Nightshift|Kpo|Css|
Salesforce - Technical Architect / Associate Technical Architect,C P Careers Private Limited,Bengaluru/Bangalore,8-16years,Not Specified,"Job Description  |   |  Experience: 8 + years  |  Work Location: Bangalore  |  Mandatory Skills:  |  Lightning, Apex coding, Triggers, Visual pages  |  Salesforce PD1 is mandatory  |",HTML|CSS|Javascript|Xml|Json|
Angular Developer,IT-Scient Consulting Private Limited,Kolkata|Pune,4-9years,Not Specified,"Strong in Angular 8, Angular Material, typescript, rxjs, NgRx, & of css (including responsive & scss).    |   |  Backend is running AWS with DynamoDB & Spring Boot as the RESTful service.  |   |  Ability to comprehend a piece of work, code it in Angular and test",Angular8|NgRx|css(includingresponsive&scss)|AngularMaterial|Typescript|Rxjs|
.NET Full Stack Developer,S P A Enterprise Info Services India Private Limited,Hyderabad/Secunderabad,7-10years,Not Specified,"Responsible for leading the development/testing of applications, which may include end-to-end ownership of software stack. Your demonstrated ability to consistently achieve this while building and leading effective teams.",MSVisualStudio2017|.NETCore|.NETFramework|AzureDevOps|AngularJs|ASP.NET|Mvc|Javascript|CSS|Wcf|WebApi|WebServices|C#|Tsql|MsSqlServer|Ssrs|Tableau|PowerBi|Git|Jira|Teamcity|SSIS|
