jobTitles,Company,jobLocations,requiredExperiance,Salary,JobDescription,SkillsFront End Developer,Quess IT Staffing (Formerly known as Magna Infotech),Mumbai,1-3years,Not Specified,Indus OS is looking to hire Web Developer to join our team. You will be working on cutting edge technology of Indus OS.,html5ShareJobLinkonSocialMedia|react.js|angular.js|Javascript|html|Css3|
Frontend Developer-1.5years of React JS and 1yr NodeJS exp. mandatory-Work From Home(Fully RemoteJob,Azosis Technologies Private Limited,Noida|Mohali,2-5years,Not Specified,Frontend Developer-1.5years of React JS and 1yr NodeJS exp. mandatory-Work From Home(Fully Remote Job)Salary upto 13 LPA–2 to 5 yrs of relevant exp.,FrontendDeveloper|ReactJs|Nodejs|Angularjs|HTML|CSS|Javascript|jQuery|AWS|
Senior Software Developer,Skan Tech Consultancy,Delhi|Gurgaon/Gurugram,5-9years,Not Specified,"Develop and maintain applications, Front end- Bootstrap, HTML, CSS3, Javascript; Backend- My SQL, Python; Writing codes,Debugging, ORM libraries, Technical documentation, Unit testing, Designing and implementation",ObjectRelationship|Python|HTML|Bootstrap|Javascript|CSS|Mysql|DJANGO|WebService|Api|REST|Soap|ScriptingBash|Docker|Xml|Json|Xslt|Linux|OrmHibernate|Debugging|
Web Developer – 3+yrs Exp – Bangalore – 14L,Angel And Genie,Bengaluru/Bangalore,3-9years,Not Specified,Web Developer – 3+yrs Exp – Bangalore – 14L,WebDeveloper|Spa|WebSockets|WebDevelopment|Javascript|HTML|CSS|REST|Reactjs|AngularJs|
React JS Developer/ Sr. Developer/ Lead Developer,C P Careers Private Limited,Bengaluru/Bangalore|Hyderabad/Secunderabad,5-12years,1010000 - 2370000 INR,"JavaScript, Typescript, ReactJS, StencilJS, CSS, Bootstrap, CSS, Nginx, Node.JS. Hands on in ReactJS is a must. 5-12 yr.immediate joiner.Good to have Gradle/Maven, Git, Log4J, Mockito . Knowledge of AWS platform is a plus.Agile Development",StencilJS|Node.JSJScript|Javascript|Typescript|react.js|CSS|Bootstrap|Nginx|
Java Developer,Advanced Technology Consulting Service Private Limited,Mumbai,1-6years,Not Specified,Experience range from 1 to 6 yrs.,anyMVCarchitecture|Javascript|jQuery|Typescript|Html|CSS|CoreJava|J2ee|JDBC|
Software Developer (Dotnet),Xecom Information Technologies Private Limited,Pune,1-6years,140000 - 650000 INR,"Looking for opportunities and take more responsibilities to work on large, complex applications Api development, ASP.NET, AJAX, Working with third party controls(Telerik), .NET framework 3.5, 4.8",Asp.NetC#|RDLReports|MSSQL|Javascript|Json|AJAX|Xml|WebApi|jQuery|HTML|CSS|
Java Developer For MNC Company,Infomedia Solutions And Consultant,Pune,2-4years,300000 - 600000 INR,Requirement for post of Java developer,Javadeveloper|AngularJavascript|
Graphic Designer NOIDA/GURGAON,Star Tech,Gurgaon/Gurugram|Noida,0-3years,540000 - 819999 INR,GNM WELCOMING CANDIDATES HAVING GOOD SKILLS FOR THE POST OF GRAPHIC DESIGNER.,GraphicDesigner|Illustration|WebDesigner|CSS|Js|Javascript|Flash|Dreamweaver|Xml|HTML|
Web Developer,Encora Innovation Labs India Private Limited,Bengaluru/Bangalore,1-4years,Not Specified,Hiring Web developers with 1-2 yrs and 2-3 yrs for Bangalore,HTML|CSS|Javascript|Bootstrap|
Web Developer - 5 to 7Yrs Exp,ExterNetworks Inc,Hyderabad/Secunderabad,4-8years,Not Specified,Looking for Web Developer with 5 to 7Yrs Exp,Photoshop|WebDeveloper|HTML|CSS|Javascript|Jquery|Html5|Bootstrap|Cms|Wordpress|WebDevelopment|
Java Full Stack Developer,Brainworks Business Solutions Private Limited,Bengaluru/Bangalore,4-8years,1700000 - 1800000 INR,"Role         	: Consultant/ Lead Consultant (Java Full Stack Developer) |    Location       	: Bangalore  |    Experience    	: 4 – 8 Years |    Notice Period	: Immediate, Serving Notice Period, 30 Days |",andSQL/NoSQL|ReactJS/Redux|Javaprogramminglanguage.Knowledgeofrelational|columnarandNoSQLdatabases|CoreJava|Javascript|SoftwareArchitecture|SoftwareDesign|DesignPatterns|
Opportunity For  Senior UI Developers,Crestron Software Development India Private Limited,Bengaluru/Bangalore,4-10years,Not Specified,Crestron’s India team Senior UI Developers responsible developing Common User Interface components which will be used across multiple webpages and devices,UIDeveloper|Anuguar2+|FrontEndDevelopment|UiDevelopment|Html5|Javascript|
Virtual walk in Drive for UI developer on Saturday 28th Feb @ Chennai,V2Soft Private Limited,Chennai,5-10years,Not Specified,Translation of the UI/UX design wireframes to actual code that will produce visual elements of the application.,UIdeveloper|UiDesign|UxDesign|HTML|CSS|Javascript|Js|AJAX|Angularjs|Bootstrap|jQuery|
Front End Developer,Job World,Noida,3-8years,Not Specified,Hiring for TOP MNC for 'Front End / Back End Developer) |   |  Job Location: Noida |  Education Qualification: Any Graduate |  Experience: Minimum 3 Years |  Salary: Upto 12lpa |  Work from Office |,HTML|CSS|Javascript|Html5|jQuery|Bootstrap|Js|Node.js|Sql|Nosql|
Web Designer (UI/UX),Antra Inc,Hyderabad/Secunderabad,5-8years,Not Specified,"Experience designing graphics for web, print, social media, and other mediums |",Adobedesignsoftware|Indesign|Illustrator|WebDesigner|WebDesigning|HTML|CSS|Bootstrap|Javascript|
React.Js Developer,SrinSoft Technologies Pvt Ltd,Bengaluru/Bangalore|Chennai,2-8years,Not Specified,"•	Strong in jQuery, JavaScript development |    •	Should be strong in React JS |    •	Extensive Agile experience |    •	Strong in UI design using HTML, CSS, Bootstrap |    •	Experience in Git Hub, Azure Devops",react.js|CSS|Javascript|AJAX|Jquery|Reactjs|ReactJs|
Full Stack Web Developer,Quality Thought Infosystems (India) Private Limited,Hyderabad/Secunderabad,0-1years,Not Specified,Looking for FronEnd/Fullstack/Angular/UI Developer Freshers,MeanStackDeveloper|HTML|CSS|Javascript|Js|Angularjs|FrontEndDevelopment|Node.js|Python|Php|
Tech Lead (PHP) in Bangalore,Sourcetal Hiretech,Bengaluru/Bangalore,7-10years,2400000 - 2500000 INR,"Dear Job Seeker, |   |  Currently, We are looking for the Tech Lead (PHP) in Bangalore. |   |  Designation / Position: Tech Lead (PHP) |",CI/CDPipeline|Php|Wordpress|Laravel|Codeigniter|HTML|CSS|MariaDb|Javascript|Ajax|Apache|Nginx|Maven|Sonar|Jenkins|Redis|Elk|RestApis|Docker|Kubernetes|Mysql|Postgres|
PHP Developer,Universal Management Consultancy Services,Mohali,2-3years,240000 - 300000 INR,"We need a PHP Developer who should have experience of 2-3 years in Wordpress, and should knowledge of any framework or CMS (CakePHP, CodeIgniter, Laravel).",AjaxJquery|Phpdeveloper|PhpMysql|HTML|CSS|Javascript|Json|CorePhp|CodeIgniter|Wordpress|Magento|Shopify|Bigcommerce|
Full Stack Developer,Decoding Youth Talent,Noida,2-7years,Not Specified,"We are looking for a Full Mean Stack Developer with experience of building highly technical products using Java/Node.JS, PHP and front end in HTML, CSS3 and JavaScript. Hands on experience in MongoDB and MySQL",Javascript|Phpdeveloper|Mysql|MongoDB|AngularJs|Node.js|AWS|Html5|ApiIntegration|
Web Developer,Career Net Solutions,Delhi,1-6years,Not Specified,"Tailoring user experience |   Bringing a designers concept to life with HTML, CSS, and JavaScript/JQuery |   Production, modification, and maintenance of websites and web application user interfaces |   Experience with responsive and adaptive design.",WebDeveloper|HTMLDeveloper|Html5|CSS|Javascript|Xml|AJAX|
Virtual walk in Drive for UI developer on Saturday 28th Feb @ Bangalore & Mysore,V2Soft Private Limited,Bengaluru/Bangalore|Mysore,5-10years,Not Specified,Translation of the UI/UX design wireframes to actual code that will produce visual elements of the application.,UIdeveloper|UiDesign|UxDesign|HTML|CSS|Javascript|Js|AJAX|Angularjs|Bootstrap|jQuery|
Frontend Developer+ React JS : -Immediate Opening with our Top MNC Client- Bangalore/Chennai  Locati,Future Focus Infotech Private Limited,Bengaluru/Bangalore|Chennai,5-13years,Not Specified,Frontend Developer+ React JS : -Immediate Opening with our Top MNC Client- Bangalore/Chennai  Location .  |,Tools&Frameworks(NodeJS|ReactJS)|Html5|Javascript|CSS|React|JavascriptLibraries|Sass|
Angular Developer,Talent Basket,Thiruvananthapuram/Trivandrum,4-8years,Not Specified,Looking for an Angular developer to develop frontend micro apps |  and integrate micro services. Primary focus will be the development |  of a feature for the application which will mostly be frontend and its |  integration.,angular8|Ionic4|angularUI|Angular|IonicFramework|Typescript|Javascript|UiDevelopment|RESTful|
UI Developer,Cherub Business Solutions,Pune,4-10years,Not Specified,The Application Developer is a collaborative team player who has willingness to learn and improve Reporting application and contributes to team’s success.,UIDeveloper|CI/CD|react.js|React|NodeJS|Devops|HTML|Bootstrap|Javascript|Redux|Maven|
Software Engineer,Spadeworx Software Services Private Limited,Bengaluru/Bangalore,0-1years,Not Specified,"We are looking for Javascript Developers to join our fun, energetic team who are running at full speed to ignite a digital disruption in the movie industry",Javascript|Coding|Java|python|AngularJs|DesignPatterns|AWS|Cloud|DataStructure|Algorithms|Oop|
Shop Plugin Developer,Syth Infotech Private Limited,Pune,5-10years,Not Specified,Need a candidate with Experience with complete eCommerce lifecycle development and Storefront API. (SFCC mandatory) |   Good to have : (Magento/Hybris/Shopify Plus). |      |    5-8 Years of experience. |     |    Note : looking for immediate Joiner,Ecommerce|SalesforceSFDC|JavaScriptFramework|SFCC|Api|Magento|Hybris|Shopify|Sass|Grid|
Technical Support Engineer,HR Grid Solutions,Remote,2-6years,Not Specified,"A Technical Support Engineer serves as an expert for our product, VWO, and associated web technologies. The Support Engineer is the technical interface between our customers and VWO’s Development/QA and Product management teams.",HTML|CSS|Javascript|JQuery|
JAVA - Project Leader,Arccaa Analytics And IT Solutions LLP,Hyderabad/Secunderabad,10-13years,Not Specified,We are seeking to fill the position of Project Leader to assist the nodal departments in achieving objectives of the programme.,experienceinCoreJava/J2EE/Servlets/JSP/JavaScript|StrutsFrameworkiscompulsory|Oops|
Senior UI Developer /UI Developer /Front end Developer,Nitya Software India Private Limited,Pune,3-6years,Not Specified,|  We are looking for Senior UI Developer with a keen eye for design for the position of Front-end Developer.  |  Senior UI Developer is responsible for ensuring the alignment of web design and user experience requirements.,Redux.js|Html5|Bootstrap|react.js|MongoDb|Css3|Javascript|Node.js|Git|
Frontend UI Senior Dev,Cittabase Solutions Private Limited,Gurgaon/Gurugram,3-8years,Not Specified,Must Have Skills  |  • Working experience as hardcore JavaScript i.e. both ES5 and ES6... but most of the work is on ES6 and some in ES5.  |  • Should have worked on any MVC framework React JS  |  • Good knowledge on Redux  |  • At least 3-4 years of experience,Javascript|CSS|HTML|ReactJs|
Senior UI Developer,Career Foresight Hr Solutions Llp,Hyderabad/Secunderabad,6-10years,1610000 - 1810000 INR,"Hi Aspirants, |    |  Greetings from HR GRID Solutions! |    |  The ideal developer should be able to understand the intricacies of cross-browser/device development and translate product and customer needs into functional and appealing interactive applications.",Angular9.x(andolderversions)|Html5|Css3|Javascript|JQuery|Less|Typescript|
Java Full stack Developer,SnapHunt Pte Ltd,Hyderabad/Secunderabad,4-6years,Not Specified,"	Should have Expertise in front-end technologies, including JavaScript, CSS3 and HTML5 and third-party libraries such as React Js, Angular, jQuery  – E3 Level |  	Should be Experienced in server-side Java programming language– E3 Level |",Javascript|CSS|HTML|Git|Angular|jQuery|
Backend Engineer,Encora Innovation Labs India Private Limited,Hyderabad/Secunderabad,1-5years,330000 - 650000 INR,"Backend Software Engineer experience with Java, Nodejs, Python, and PostgresSQL",Node.js|Java|Javascript|PostgreSQL|MachineLearning|ArtificialIntelligence|MongoDB|Docker|JIRA|Confluence|
Sharepoint Developer,Aureustech Systems Private Limited,Chennai,4-8years,650000 - 950000 INR,Minimum 4 years of professional development experience using SharePoint,Sharepoint|.NETFramework|MS-SQLServer|MS-SQLServer|InfopathForms|SoftwareDevelopment|Javascript|
Sr.Full Stack Developer,Learning Candid India Private Limited,Coimbatore,6-10years,1500000 - 2000000 INR,"6+ years of experience in C#, .NET, MS SQL, MVC, Net Core, Git, Web API, EF / EF core, Azure |  Extensive experience in building complex web UI components using technologies like JavaScript / jQuery, HTML and CSS. |",Asp.Net|C#|Mvc|Javascript|AngularJs|react.js|
Software Development Engineer,Career Foresight Hr Solutions Llp,Bengaluru/Bangalore,1-3years,Not Specified,"We are looking for Angular Developers to join our fun, energetic team who are running at full speed to ignite a digital disruption in the movie industry",Javascript|AngularJs|DataStructure|Algorithms|Oops|ObjectOrientedProgramming|aws|cloud|Angularjs|
Frontend Developer,Angel And Genie,Bengaluru/Bangalore,2-12years,800000 - 1500000 INR,Delivering new user-facing features optimised for maximum speed and scalability. Engineering and upgrading security measures to build resilience and track possible failure points. |,CreativeSolutions|Caching|TroubleShooting|Html5|Javascript|jQuery|AJAX|Dom|FrontEnd|FrontEndDevelopment|WebTechnologies|Ux|Programming|Css3|react.js|AgileMethodology|
SR. DEVELOPER / TECH LEAD – .NET,MVK Staffing Services Private Limited,Chennai,6-11years,Not Specified,"Encora is looking for Tech Lead - .Net with 4-10 years’ experience in ASP.Net, .Net Core, C#, MVC, Angular JS,Web API, Web Services, Java Script/ jQuery, Multi-tier Architecture, Entity Framework, SQL, Design Patterns and Agile |   |",.NetCore|Multi-tierArchitecture|ASP.Net|C#|Mvc|WebApi|AngularJs|WebServices|Entityframework|MicroServices|JQuery|Javascript|Ajax|DesignPatterns|Sql|Sdlc|
Java Full Stack,Knila It Solutions India Private Limited,Hyderabad/Secunderabad,6-13years,Not Specified,9+ years of full Software Development Life Cycle experience,angular2/4/6/8ReactJS|RESTand/orSOAPwebservices|MicroservicesXML|Springboot.|Angularjs|Javascript|Jboss|Html5|Css3|Bootstrap|Hibernate|
Full Stack Developer,BeamStacks Software,Bengaluru/Bangalore,7-12years,Not Specified,"Experience with React Js, React Native, JavaScript including DOM Manipulation and that JavaScript object model. |   •         Thorough understanding of React Native and its core Principles. |   •         Hands on experience on React Native Framework at least",ReactNative|mongodb|Sql|Javascript|
Fullstack Developer,Jobs Expert Private Limited,Bengaluru/Bangalore,4-7years,800000 - 1200000 INR,"Excellent in frontend technologies( Javascript, Angular ) and Java/J2EE, Spring, Hibernate and Spring Boot |  Experience in Maven, Rest Service, Log 4J |  Knowledge of Data streaming, Spark, Message Broker",Javascript|Java|Hibernate|Spring|
Web Developer – Bangalore – 3+yrs – 14L,Disha Recruitment Services,Bengaluru/Bangalore,3-9years,Not Specified,The Web Developer will be a part of Global Information Technology Team and will primarily have |  responsibilities over the creation and maintenance of company-owned web applications.,WebDeveloper|mobx|WebSockets|WebDevelopment|Javascript|HTML|CSS|Reactjs|Redux|Flux|REST|
Senior Front end Developer,Phases India,Hyderabad/Secunderabad,6-14years,Not Specified,We are looking for Sr/ Lead Front End Developer at Hyderabad Location,UIDeveloper|Angular|jQuery|Javascript|RestApi|
Laravel Developer,Satish Sahab (Proprietor of SoS Solution),Delhi,1-5years,220000 - 540000 INR,We have an urgent opening for PHP Laravel Developer for a leading organization who are having min. 1 to 5 yrs of experience in PHP Framework |  Designation / Position: PHP Laravel Developer |  Company : Softonic Solution,Php|PHPdeveloper|MYSQL|Laravel|Codeigniter|PhpFramework|HTML|Javascript|Jquery|
Software Engineer (.NET Developer),Novateur IT Technologies India Private Limited,Chennai,4-10years,Not Specified,"Four plus years of .NET development, Microsoft SQL server/tools, writing/debugging SQL scripts and experience developing applications using C# and/or VB.NET, ASP.NET MVC, jQuery, JavaScript, Angular, ASP.NET Web API 2.0, SQL Server, Azure SQL, XAML.",.NetDeveloper|.NETcore|MicrosoftSQLserverortools|Writing|debuggingSQLscripts|C#and/orVB.NET|ASP.NETWebAPI2.0|Asp.netMvc|jQuery|Javascript|Angular|SQLServer|AzureSql|Xaml|
iOS developer,Proteus Technologies Private Limited,Mumbai|MumbaiCity|Thane,1-3years,Not Specified,"Opportunity for Jr IOS Developer/ IOS Developer with below skill set |   Xcode |   iOS, |   Swift |   Objective C",iosdeveloper|coredova|Xcode|Ios|ObjectiveC|Xml|Java|html|Javascript|Mvc|Storyboard|
Senior Dotnet Developer,Xecom Information Technologies Private Limited,Pune,2-6years,200000 - 650000 INR,"Looking for opportunities and take more responsibilities to work on large, complex applications  |  ASP.net, C#, MS SQL, JavaScript, jQuery, WebAPI, AJAX, Web services, OOPS, Reporting services, RDL reports",Asp.NetC#|MSSQL|Javascript|Json|AJAX|Xml|WebApi|jQuery|HTML|CSS|
React Native Developer,Vinirma Consulting Private Limited,Pune,3-4years,720000 - 1780000 INR,B.Tech. or higher in computer science.  |       3-4 years of strong work experience with React Native and Kotlin. |       Expert in React Native and related libraries like Reduce and React Navigation,Es5|react.js|ReactNative|Kotlin|HTML|CSS|Javascript|Api|
Dot Net Developers for Qatar,InfoPro Solutions Pvt Ltd,Qatar,4-9years,Not Specified,Urgent hiring for Dot Net Developers for Qatar,DotNetDeveloper|UX/UIDesign|.NET|C#|Asp.net|Mvc|Html5|Css3|Javascript|jQuery|
UI/ Front end developer,Glenser Interior Studio,Bengaluru/Bangalore,2-6years,Not Specified,Strong in Angular 1.or React or Vue   |    |  Some experience (6+ months) in Spring Boot and RESTFul services,HTML|CSS|Javascript|Angularjs|react.js|RESTful|
"Full Stack Developer, Software Engineer, Software Developer",SQR Infotech Private Limited,Bengaluru/Bangalore,2-4years,250000 - 360000 INR,We are looking for a full stack developer with minimum of 4 years of experience  |     Must be able to write codes |     Candidate must have designed E commerce websites,WebDeveloper|FullStackDeveloper|HTML|CSS|Phpdeveloper|Php|MYSQL|AJAX|Bootstrap|Javascript|Python|
Web Designer,I Growth Services,Bengaluru/Bangalore|Hyderabad/Secunderabad,1-3years,310000 - 450000 INR,We are Hiring Urgently,Photoshop|Sem|InternetMarketing|OnlineMarketing|SearchEngine|HTML|Javascript|CSS|SEO|SearchEngineOptimization|LinkBuilder|Smo|Html5|Dreamweaver|Xml|UI|Ux|
Php developer,DXC Technology India,Pune,2-7years,350000 - 720000 INR,"SQR Infotech have an urgent requirement for PHP Developer (Drupal 7), Pune. |",CSSandAJAX|Drupal7|MYSQL|Php|Javascript|HTML|
Great opportunity for Sr Laravel and Ui Ux Developer at Vashi location,Grace System Technology Labs (India) Pvt.Ltd,NaviMumbai|Thane,2-12years,Not Specified,"Sr. Laravel Developer, Expert JS, NodeJS, AngularJS, MySQL, HTML5, CSS, JavaScript, Backend Coding PHP, Laravel Framework, 'Laravel Developer',Javascript + JSON + Jquery, XML, CSS 3, Bootstrap 3 or 4, ECMAscript, React JS, HTML5","""UiUxDeveloper|Sr.LaravelDeveloper|ExpertJS|BackendCodingPHP|LaravelDeveloper|ECMAscript|Nodejs|Angularjs|MySQL|Html5|CSS|Javascript|LaravelFramework|Javascript|Json|Jquery|Xml|CSS|Bootstrap|ReactJs|Html5|"
Mid Level Cloud Developer,Proteus Technologies Private Limited,Bengaluru/Bangalore|Chennai,5-8years,Not Specified,"An Overall Development Experience of 5+ years, with 3+ years as Full Stack Developer, cloud application development which include",CloudDeveloper|CoreJava|Angular7|CoreJava|Jquery|Javascript|ReactJs|
Sr.Python Automation Engineer,Hi Tides Consulting,Bengaluru/Bangalore,4-8years,Not Specified,Immediate Opening with our client-SONY-Bangalore,python|SeleniumAutomation|Testing|Appium|Javascript|ManualTesting|
Junior Ios Developer,Saransh Software Solutions Private Limited,Mumbai|MumbaiCity|Thane,1-3years,Not Specified,"Essential Technical Skills: |   |  Xcode |  iOS, |  Swift |  Objective C",iosdeveloper|Xcode|Ios|Swift|ObjectiveC|Cordova|Storyboard|Mvc|Javascript|Html|Json|Xml|
Lead PHP Developer /Programmer,Sales Moguls Private Limited,Bengaluru/Bangalore,4-5years,Not Specified,"PHP (including Core PHP), MySQL, HTML, JavaScript, Node.js, AngularJS, PHP Frameworks, Python and etc., |    •	Construct, develop, code, debug, and maintain applications. |    •	Conform to define software design methodology for the development and implementat",Maintain|CorePhp|Mvc|Javascript|jquery|Bootstrap|Html5|Css3|WebServer|Coding|Debugging|
Cloud Architect,Ennoble Technologies India Private Limited,Chennai|Pune,8-10years,Not Specified,We have an Immediate requirement for Cloud Architect(GCP/ Amazon Web Services/ Azure/ Openshift) |  Location: Pune/Chennai |  Experience: 8+ Years |  Notice: Immediate to 20 days |,CloudServices|OracleDatabase|SQLServer|Javascript|
UI/UX Developer,Web Design Magics,Delhi,2-3years,240000 - 340000 INR,"Requirement of UI/UX Developer for Technology team for a permanent position, a person who has about 2-3 years of experience in UI/UX Development for web and software development. |",Photoshop|WebDeveloper|UserInterfaceDevelopment|Html5|Css3|Javascript|Bootstrap|jQuery|UiDevelopment|UserInterface|graphicaluserinterface|UXDeveloper|Programming|UiDesign|UX/UIDesign|
UI Developer,Angel And Genie,Hyderabad/Secunderabad,3-6years,Not Specified,"1.Experience with HTML 4/5, CSS, Bootstrap, Typescript, JUNIT and Java Script |  2.Experience Angular 7/8/9 and developing Single Page Application(SPA) |  3.Good to have experience working in a Agile based model, AWS/Azure, GIT, CI/CD",Spa|UI|HTML|CSS|JUNIT|Javascript|Angular|AWS|
MAGENTO DEVELOPER,Search Engine Ranking System Consultants Private Limited,Hyderabad/Secunderabad,2-9years,Not Specified,Magento and minimum 2+ years of development experience especially in Magento 2.,Knockout.js.|MagentoDeveloper|Php|ObjectOrientedProgramming|Mvc|Html5|Css3|Javascript|jQuery|
FULL STACK DEVELOPER - React J.s & Node J.s 2 TO 5 YEARS EXPERIENCE,Transgnx HR Solutions Private Limited,Bengaluru/Bangalore,2-5years,Not Specified,"We are looking for talented individuals who are not just looking for a job, but for a fun career in a young startup that has a lot of potential and room to grow.",FullStackDeveloper|Javascript|ReactJs|Node.js|Oops|Mvc|DbDesign|Git|WebServices|MySQL|MongoDB|
Drupal Developer – 3-6yrs Exp – 7.2 to 8.4L CTC – Vadodara,Angel And Genie,Vadodara,3-6years,Not Specified,Drupal Developer – 3-6yrs Exp – 7.2 to 8.4L CTC – Vadodara,DrupalDeveloper|ReactJQuery|Drupal|Javascript|Angularjs|Html5|CSS|REST|Json|MySql|Postgressql|Mariadb|
Sr. Software Engineer,DXC Technology India,Bengaluru/Bangalore|Kolkata,4-7years,700000 - 900000 INR,"- Proven software development experience in PHP, Wordpress. Demonstrable knowledge of web technologies including Javascript, CSS etc.  |   |  - Good knowledge of MySQL and other relational databases, version control tools and of developing web services. |",Php|Wordpress|Javascript|CSS|Mysql|
Software Engineer-Digital Team,Aroha Technologies,Bengaluru/Bangalore,1-1years,80000 - 150000 INR,This is regarding Software Engineer position in Bangalore.,"""HTML""|""JAVASCRIPT""|""Angular""|""Reactjs""|""Python""|""PHP""|""JAVA""|"
"Senior Software Engineer-Java , Groovy",HTC Global Services (India) Private Limited,Bengaluru/Bangalore|Chennai,4-14years,Not Specified,"Java, JavaScript, Angular, Groovy with Spring Framework.  Experience with SQL.  Experience with REST API.",Java|Groovy|Javascript|AngularJs|REST|Sql|
UI Fullstack Developer,Encora Innovation Labs India Private Limited,Bengaluru/Bangalore,3-12years,700000 - 3000000 INR,3+ years of software development experience. Full stack experience is a plus.,UIFullstackDeveloper|Html5|Css3|Javascript|RestfulWebServices|Node.JS|
"Immediate requirement for Fresher (Java,SQL)",POSIDEX TECHNOLOGIES PVT LTD,Hyderabad/Secunderabad,0-2years,Not Specified,Hurry!! we are hiring grab the opportunity in pandemic.,CoreJAVAScripts|Javadeveloper|JAVAJ2EEScripts|Java|CoreJava|JavaJ2ee|Angular|AngularJavascript|
UI UX Designer,Matrix Corporate Management Services Private Limited,Bengaluru/Bangalore|Hyderabad/Secunderabad,4-6years,400000 - 710000 INR,Urgent requirement.,UserExperienceDesigner|ProductDesigner|UXDevelopment|Photoshop|UX/UIDesign|Ux|Html5|UI|Javascript|UI|WebDesigner|CSS|Js|Flash|Dreamweaver|Xml|HTML|
Dot Net Developer,Congruent Info-Tech Private Limited,Pune,3-5years,Not Specified,"Junior level Dot Net Developers with the skill sets of .Net, MVC, jQuery, Javascript, Web API",.NET|C#|WebApi|Mvc|jQuery|Javascript|
Python Developer,Corevance Systems Private Limited,Chennai,5-10years,Not Specified,We are looking for Python Developer.,.NetDeveloper|TFSHTML5|Azure|C#|Mvc5|Webapi|SQLServer|Javascript|CSS|
.Net Developer,URS Systems Private Limited,Hyderabad/Secunderabad,1-8years,200000 - 1000000 INR,"We are looking to hire 6 experienced Net Developers with experience between 1 year to 8 years to help us keep growing. If you're hard-working and dedicated, Corevance systems is an ideal place to work. Apply today! |",DotNet|.NET|Javascript|jQuery|Json|Mssql|DotNetTechnologies|
Automation Engineer,Web Design Magics,Gurgaon/Gurugram|Noida,3-8years,Not Specified,Looking For Automation Engineer,Java|Groovy|Javascript|Extjs|Multithreading|JIRA|UNIX|Linux|Sql|
