jobTitles,Company,jobLocations,requiredExperiance,Salary,JobDescription,SkillsSenior Backend Engineer,Xecom Information Technologies Private Limited,Remote,2-12years,Not Specified,"Developing, releasing, maintaining and optimising Progressive Web App and corresponding microservice backend. Defining and maintaining the central database as well as developing all server-side logic. |",SoftwareEngineering|Javascript|Java|CSS|Dom|Algorithm|MongoDB|Nosql|WebTechnologies|Sql|AWS|Nosql|Postgres|
UI / UX Designer / Web Developer,Disha Recruitment Services,Pune,1-4years,150000 - 550000 INR,"Looking for opportunities and take more responsibilities to design UI for enterprise level web, tablet & mobile applications, web sites on various platforms",Graphic&WebDesigner|Javascript|Json|AJAX|Xml|jQuery|HTML|CSS|UiUxDesigner|WebDesigner|
"WordPress Developer / Web Developer | 1-3 Years Exp | 2-3 LPA | HTML,CSS,Java Script",IT Resonance Private Limited,Bengaluru/Bangalore,1-3years,240000 - 300000 INR,"- Excellent in Wordpress, all aspects |  - Proficient in HTML, Css and JavaScript |  - Experience in Staging Environment & Production Environment",WebDeveloper|WebProgrammer|FrontEndDeveloper|Wordpress|WordpressDeveloper|HTML|CSS|Javascript|WebDesigner|
Design and Creative Officer,XS Infosol Private Limited,Chennai,4-9years,Not Specified,5 years and more of relevant experience in a word processing center and web technology platform.,Photoshop|WebDesigner|Javascript|HTML|CSS|
ASP.NET Developer,SnapHunt Pte Ltd,NaviMumbai,2-5years,200000 - 450000 INR,"Knowledge of ASP.Net, C#, VB.Net, VBA, SQL SERVER, J query, Web API, integration with business applications.",.NET|VB.Net|C#|Sql|Javascript|Webapi|
Senior 2D Animator (Flash),UKB IT Solutions Private Limited,Mohali,3-9years,300000 - 500000 INR,"Creating storyboards, user flows, process flows and site maps to effectively communicate interaction and design ideas. |  Designing gameplay and game features with a view to deliver a strong player experience.",Illustrator|FlashAnimation|CorelDraw|2DAnimation|CharacterAnimator|HTML|CSS|Dreamweaver|Javascript|AdobePhotoshop|
Front End Developer,ACS Consultants,Hyderabad/Secunderabad,5-8years,Not Specified,We require a Front End Developer to work on a contractual role with an experience of 5-8 years for Hyderabad location. |  The duration of the project would be 6 months extendable.,AngularFramework|RxJSandjQuery|DevOpsCI/CDpipelines|understandingofUIandUXdesigns|WebApplications|Angular6|Javascript|Html5|Css3|
Senior QA Engineer - TestComplete,Rohini IT Consulting LLP,Hyderabad/Secunderabad,6-12years,1000000 - 1600000 INR,"Minimum 6 years’ experience on automation scripting in Selenium with Java/ JavaScript · Having knowledge in TestComplete, Mobile Automation testing with Cucumber BDD will be preferred",SeniorQAEngineer-TestCompleteselenium|JavascriptShareJobLinkonSocialMedia|Java|Cucumber|Uft|Testcomplete|
"Lead Application Developer - UI, Angular, Javascript, Springboot/Java - Bangalore",Dit Interactive Pvt. Ltd,Bengaluru/Bangalore,9-14years,Not Specified,"We are currently seeking a Senior Application Developer with significant experience with Angular, JavaScript, and Spring boot, and a creative mind to contribute in building applications that will amaze our customers.",Java|SpringBoot|Javascript|HTML|Angular|React|Vue|CSS|Xml|Less|Sass|ApplicationDevelopment|
Php developer,SnapHunt Pte Ltd,Ahmedabad,2-5years,240000 - 910000 INR,"Develop web applications using Laravel, CakePHP, MySQL, HTML, CSS, Javascript, AJAX, PHPUnit and Git/GitHub. |",Ecommerce|AJEAJAX|Phpdeveloper|PhpMysql|CorePhp|CakePhp|Joomla|Api|Shopify|Bigcommerce|wordpress|jQuery|Javascript|
Full Stack Developer,HeadHunters HR Private Limited,Remote,3-5years,360000 - 540000 INR,Supporting continuous improvement by investigating alternatives and new technologies and presenting these for architectural review. Leading a team of engineers to deliver winning products. |,ContinuousImprovement|FullStackDeveloper|CSS|Javascript|HTML|Html5|Ux|SoftwareEngineering|Debugging|TechnicalDocumentation|
Opening for Front End Developer-Bangalore/Pune,C P Careers Private Limited,Bengaluru/Bangalore|Pune,4-7years,Not Specified,"Minimum 4 years of experience in Front End,  |  React JS , Javascript, HTML and CSS Exp is mendatory. |  Only imm joiners.",react.js|Javascript|HTML|CSS|
Angular Developer,Game Changer IT Services,Bengaluru/Bangalore|Chennai,4-8years,1500000 - 2000000 INR,"Job Description |   |  Title: Angular Developer |   |  Location: Begumpet, Hyderabad |   |  Position: Full Time |   |  Job Summary: |   |  We at Solugenix are seeking to hire Angular Developer to create well-written front |   |  end applications based on best practices, standards and a",angulardevelopment|Analytics|effectivedesign|Development|validationandsupport|architecturerequirement|angularmodules|custommodules|proficiency|NodeJS|ProductOwner|Angular|UI|Oops|Html5|Css3|Javascript|Jqurey|RESTful|Api|
Hydris Developer,Satish Sahab (Proprietor of SoS Solution),Bengaluru/Bangalore|Pune,6-10years,Not Specified,Looking for 6+ years of experience in Hydris Developer.,Hydris|J2EEScripts|CoreJAVAScripts|WebServices(RESTful|SOAP)|AngularJS.|Java|SpringFramework|Javascript|
Developers Back-End (Android and IOS),Brainworks Business Solutions Private Limited,Delhi,1-5years,220000 - 540000 INR,We are looking forward to hire the android and IOS developers for back end team. We expect the candidates applying |  for the same will be potential enough to meet our needs. |   |  Perform related duties as assigned by team leader |  Maintain compliance |,Spa|HTML|CSS|Javascript|Python|
Back End Developer,Macropace Technologies,Pune|Indore,3-6years,Not Specified,Urgent Hiring |Back End Developer | Exp -3 to 7 Years | Location - Pune/Indore/Hyderabad,Javascript|HTML|CSS|NodeJS|Mysql|
Immediate Opening For ReactJS developer_4+Years_Bangalore,Innointel LLC,Bengaluru/Bangalore,4-9years,Not Specified,"Reactjs,redux,angularjs,javascript,html,css3",Reactjs|Redux|Angularjs|Javascript|html|Css3|
Salesforce Developer,Star Tech,Bengaluru/Bangalore,3-8years,2000000 - 2200000 INR,"Job Title : Salesforce Developer |   Location : WFH, Post Pandemic Bangalore |   Notice Period Immediate / 30 days  |   Mandatory Skills : LWC,Triggers,Apex Classes,Lightning Pages, IDE,Ajax,Javascript,HTTP,CSS Bootstrap,VisualStudio Code, Github",LWC|LightningPages|CSSBootstrap|VisualStudioCode|Triggers|ApexClasses|Ide|Ajax|Javascript|Http|Github|
NEED UI UX DEVELOPERS FRESHERS,C P Careers Private Limited,Gurgaon/Gurugram|Noida,0-2years,640000 - 880000 INR,INTERGLOBE OFFERING POST OF UI UX DEVELOPER,UIDeveloper|UIUXDEVELOPERJS|UXDeveloper|Javascript|WebDesigner|CSS|Dreamweaver|Xml|HTML|Flash|
Deveops Release engineer Requirement,SnapHunt Pte Ltd,Bengaluru/Bangalore|Chennai,4-9years,1500000 - 2100000 INR,"DevOps Engineer |   |  • Has experience in deploying applications and updates to applications |  • Has knowledge of tools in Devops universe (Ex. Jenkins, code deploy, sonarQube, |  Github, |  Bitbucket etc...) |  • Has experience in Automation of code deployments and",codedeploy|Automationofcodedeployments|cd|Go|C/C++|testingcode|container|kubernetes.Ansible|EL|Jenkins|Sonarqube|Github|Bitbucket|Ci|agile|Java|Javascript|selenium|Microservices|Deployments|Orchestration|Docker|Puppet|Nagios|Grafana|Prometheus|
Full Stack Developer,SnapHunt Pte Ltd,Mumbai,0-4years,Not Specified,"You will be driving the day-to-day execution of assigned client projects, ensuring solutions built on proprietary applications meet clients requirements.",FullStackDeveloper|react.js|HTML|CSS|Python|Javascript|WebDevelopment|FrontEndDevelopment|jQuery|Programming|
Coding Python Java Script Java Professional,Encora Innovation Labs India Private Limited,Remote,2-12years,Not Specified,We're recruiting experienced & passionate Coding Tutors for one of India's leading & fastest growing education & training organizations.,Java|Javascript|Python|Coding|
Full Stack Developer,Deputize Consultancy Private limited,Delhi,6-12years,Not Specified,"You will be highly involved in architecting, building and launching a new and cutting-edge platform. You will be working with data platforms, API architectures, AI & ML models as well as UX.",Dynamo|FullStackDeveloper|SpringBoot|Java|Javascript|Html5|Css3|Nosql|MongoDB|REST|AWS|UiDevelopment|
Web Developers,Aurumdata Solutions India Private Limited,Bengaluru/Bangalore,0-2years,Not Specified,Hiring web developers with 6 months to 2 years experience,HTML|CSS|Javascript|Bootstrap|
React.Js/Native Developer,Aequor Information Technologies Priivate Limited,Mumbai,1-6years,Not Specified,"Looking for React Developers with strong proficiency in React.js/React Native, Redux, Javascript, HTML5. CSS3.",react.js|ReactNative|Redux|Javascript|Html5|Css3|
UI Developer / Web Developer with Angular8,Klaus It Solutions Private Limited,Bengaluru/Bangalore|Gurgaon/Gurugram,6-14years,Not Specified,"5+ years’ experience in User Interface Design and Development |  Expert in Front End Web Development including Javascript, Bootstrap, JQuery, HTML5, CSS3. |  Knowledge of modern JavaScript technologies, libraries, and frameworks such as React.JS",UIdeveloper|Vue.js|UI|Ux|Angular|HTML|CSS|Javascript|JQuery|React|FrontEndWebDevelopment|
Mean Stack Developer,Epicomm Technologies Ltd,Hyderabad/Secunderabad|Mumbai,3-6years,310000 - 730000 INR,Urgent Requirement,MeanStackDeveloper|MeanStack|Xml|Xsl|AJAX|Soap|Javascript|Xsd|WebServices|Dhtml|
Full Stack Developer,Corient Business Solutions Private Limited,OtherIndia,5-10years,Not Specified,Required skills :  |  Core JAVA(Strong) |  Threads(Strong) |  Jenkins(Strong) |  SQL(Strong) |  REST |  Git |  Spring Framework |  JUnit |  Mockito |  Oracle Database |  angular4+ |  Typescript |  HTML5 |  Javascript |  Jquery |  CSS |  Bootstrap |  Jasmine or any,CoreJava|Rest|Git|SpringFramework|Junit|Mockito|OracleDatabase|Angular|Typescript|Html5|Javascript|Jquery|CSS|Bootstrap|Jasmine|
Accessibility Testing (All Platforms),SnapHunt Pte Ltd,Hyderabad/Secunderabad,3-8years,300000 - 800000 INR,We are looking for Accessibility Testing (All Platforms) |   |  With Minimum of 3.5+ Years of Experience |  Who can join Immediately / 30 -40 Days |  Position - Permanent with one of the reputed MNC Company |  Location - Hyderabad,VPAT|WCAG2.0|VPATDOJO|AccessibilityTesting|Win32|Ios|Android|Web|Mac|HTML|CSS|DOJO|Javascript|
C# Developer - .Net,Corient Business Solutions Private Limited,Mumbai,3-5years,300000 - 600000 INR,Versatile & talented professionals with open source approach for company's requirements of programing & other challenging field of IT software.,WindowOS|.Netcore|C#|HTML|Oop|MySQL|C#.net|Javascript|Agile|Asp.Net|Scrum|C#Developer|
Java Software Engineer,Accrualify India Private Limited,Nagpur,0-4years,100000 - 600000 INR,"Develop all application specifications and associate code, Analyse functional requirements,  flexible to learn new programs and script languages",Java|SoftwareEngineer|Javascript|HTML|AngularJs|jQuery|SpringCore|Mvc|MySQL|Postgres|Rest|Soap|ApacheCamel|Api|
Full Stack Developer (Python + React.js/React Native),Tekit Solution,Indore,2-7years,Not Specified,Job Location: Remote/Indore |  Job Type: Full Time |  Job Timing: 10:00 - 07:00 PM |  Skills required: React.js / Angular.js + backend Python |,Javascriptframework|React.js.|MEANDeveloper|MERNDeveloperSoftwaredeveloper|Developer|IT|Hardware|PythonDeveloper|Programmer|SoftwareEngineer|Angular.js|SeniorSoftwareEngineer|Softwareprogrammer|
Full Stack Developer (UI/UX Developer) .net MVC,E-Friend Solutions India,Indore,3-8years,360000 - 720000 INR,"UI Developer,Web designer,UX/UI Design,.NET,MVC,UI Designer,User Interface,Front End Development,full stack Developer",FullStackDeveloper|UI/UXDeveloper|.netMVC|Photoshop|Illustrator|HTML|CSS|Javascript|ASP.NET|jQuery|Vuejs|
Angular Developer,Giant Leap Systems Private Limited,Pune,6-11years,1000000 - 2000000 INR,"5+ years of experience working as a full-stack developer and/or server-side |   Prior experience working on a scalable web based application. |   Must have 2+ years of hands-on experience with Angular, NodeJS, TypeScript and JavaScript |",Javascript|Typescript|Nodejs|Angular|
Hybrid Mobile Application Developer / Application Developer / App Developer / App Development,Sumedha Management Consultancy,Faridabad,1-3years,Not Specified,Hybrid Mobile Application Developer,HybridMobileApplications|Flutter|Bootstrap|Android|Angularjs|Cordova|Html5|Css3|Javascript|jQuery|AJAX|Xml|Json|Sqlite|MySQL|
UI Architect,Redefined Corp,Hyderabad/Secunderabad,8-15years,Not Specified,"We are currently seeking applicants for UI Architect Position. Who is an expert in HTML 4/5, CSS3, JavaScript, Typescript, JUNIT, BootStrap, and JQuery. Experience Angular 7/8/9 and developing Single Page Application(SPA).",Angular8|Angular9|MobileUI|HTML|CSS|Javascript|Bootstrap|JQuery|JUNIT|Angular7|WebUi|
Sr. Node.js Developer Openings in Bangalore,Verchi Business Solutions Private Limited,Bengaluru/Bangalore,6-15years,Not Specified,"4+ years in Node.js, HTML,CSS, Javascript,Typescript",Nodejs|Javascript|HTML|CSS|Typescript|
Sr. Java Developer and Mid-level java Developer,Germinate Technologies Private Limited,Chennai|Hyderabad/Secunderabad,2-12years,Not Specified,"As a senior software engineer, you’ll work on websites and digital software platforms used to build and host multiple hotel websites.  You’ll commence working on a complex website supporting 1,000 hotels across the United States. That site is under d",:HTML5|Gatsby|PHPandDrupalknowledge|CSS|Javascript|React|Redux|
QA Automation Engineer (8-14 years).,Trapsoft Solutions India Private Limited,Hyderabad/Secunderabad,8-13years,Not Specified,"Should have Automation background with experience in tools like Cypress, Cucumber, Selenium,GIT |  Should have proficient experience Agile QA skills, e2e testing capability, support to UAT testers |  Should have expertise in Java script |",Cypress|UATtesters|AWSdevicefarms|JIRA|Cucumber|Selenium|Git|Javascript|ApiTesting|Cicd|Jenkins|
Java Developer,SnapHunt Pte Ltd,Noida,3-7years,500000 - 1000000 INR,Provide deep technical expertise in all aspects of solution design and application development for specific business environments. Focus on setting technical direction on groups of applications and similar technologies.,Javadeveloper|J2EEScripts|JSPScripts|CoreJAVAScripts|Javascript|Java|SqlDatabase|SqlDba|
UI Designer,Etranbiz Global Technologies Private Limited,Lucknow,1-2years,90000 - 180000 INR,"Working closely with multiple stakeholders to define and implement innovative solutions for the product direction, visuals and experience.",CareerDevelopment|CSS|HTML|Javascript|WebDevelopment|Html5|UserInterfaceDesign|UserExperienceDesign|Prototype|SEO|
Software Trainee Intern,AutoRabit Software Private Limited,Bengaluru/Bangalore,0-1years,Not Specified,"OraTalents is Grooming and offering internship opportunity for a period of 3 months they would be groomed on various technologies on latest oracle Technologies, Java, Web Development, Oracle Applications.",SkillswithC++|HTML-CSS|Javascript|PL/SQL|Linux|
UI Architect / Frontend Architect,Turbot HQ India Private Limited,Hyderabad/Secunderabad,8-17years,Not Specified,Hiring for UI Developer / User Interface Developer / Senior UI Developer with 5-15 yrs Exp for Hyderabad Location for more details please contact us,UIDeveloper|UiDevelopment|Angular|html|css|Saas|Less|Javascript|Typescript|Ooa|Ood|react.js|UserInterface|
Turbot - Software Engineer/Senior Software Engineer - Cloud Computing,New Vision Softcom And Consultancy Private Limited,Kolkata,4-7years,509999 - 1310000 INR,"A Turbot Software Engineer is a Cloud, DevOps, DevSecOps and Turbot subject matter expert delivering highly scalable and reliable software in the cloud. The ideal candidate will have a solid understanding of cloud computing and technology systems, as",CodingDeveloper|Javascript|CSS|HTML|Jscript|AWS|Gcp|Azure|CloudComputing|
Graphic Designer,Learning Candid India Private Limited,Delhi|Gurgaon/Gurugram,3-5years,600000 - 900000 INR,"Illustrates concept by designing rough layout of art and copy |  regarding arrangement, size, type size and style, and related |  aesthetic conceptsLead/Support/Input in production and post-production |",Photoshop|HTML|Javascript|CSS|Dreamweaver|
Lead Dot Net Developer,Vinirma Consulting Private Limited,Bengaluru/Bangalore,3-6years,Not Specified,".Net, C#, WCF, ASP.Net, HTML5, CSS3, Javascript and Jquery",.NET|C#|Wcf|ASP.Net|Html5|Css3|JavascriptAndJquery|
Salesforce UI/UX Technical Consultant for UAE,Societe Maison De Cuir,UnitedArabEmirates,6-11years,Not Specified,"Urgent hiring for Salesforce UI/UX Technical Consultant for UAE. 6+ years of experience and Highly skilled at front-end engineering using Object-Oriented JavaScript (ES5,ES6), various JavaScript libraries and frameworks (LWC), HTML.",spas|Visualforce.|Ux|UI|Javascript|HTML|CSS|WebDesign|Apex|
Developer,C P Careers Private Limited,Kolkata,1-4years,Not Specified,"•	Maintain the company's core digital property, built on Shopify Plus. |   •	Follow provided designs with accuracy and improvise when needed. |   •	Contribute to best practices, workflows and company knowledge sharing. |   •	Rigorously educate yourself on the la",websitemanagementandHTMLcoding.ShopifyandCMSdevelopmentandapps.AdobeCreativeSuite|Photoshop|Xml|Javascript|CSS|
PRINCIPAL ENGINEER,Novateur IT Technologies India Private Limited,Bengaluru/Bangalore|Hyderabad/Secunderabad,11-15years,8000000 - 9000000 INR,"Job Description: |   |  As a Principal Engineer, you will lead the full-stack development of one of Soroco’s major products by working cross-functionally with the product and design organizations. Within the product engineering team, this role reports dire",Scaling|availability&|drivingcodereviews|designreviewsarchitecturediscussions|futuristicsystems|robustness|/Framework|NLPregression|architectureanddesign|Performance|FrameworkDesign|Java|C#|Python|Javascript|AWS|Azure|Gcp|Nosql|Ocr|
Full Stack Java Developer,SnapHunt Pte Ltd,Hyderabad/Secunderabad,3-8years,Not Specified,"Looking for full stack java developer, who hold experience in core java, microservices. And have experience in UI development and database. Irrelevant resumes not expectable. 4+ years of candidates can apply.",FullStackDeveloper|frontendandbackend|UiDevelopment|Javascript|React|CoreJava|Microservice|RESTful|Soap|WebServices|
Senior Frontend Developer,SnapHunt Pte Ltd,Hyderabad/Secunderabad,6-16years,800000 - 1500000 INR,You will be working with the Design team to understand the design & UI/UX requirements and collaborating with graphic designers & backend developers to improve usability.,Javascript|HTML|CSS|jQuery|FrontEndDevelopment|WebDevelopment|Angular|WebTechnologies|SoftwareDevelopment|SEO|react.js|
Senior Frontend Developer (Remote),Angel And Genie,Remote,5-15years,Not Specified,"Designing and building scalable, aesthetic and responsive front end applications. Leading a team of developers to conceptualize, build and test products. |",Javascript|WebServices|Soap|Bootstrap|Java|FrontEnd|WebTechnologies|Programming|Scrum|Agile|react.js|RESTful|
"PHP, Cake PHP, Developer-Minimum 4 years of relevant Experience, Salary-4 to 5 LPA",MVK Staffing Services Private Limited,Bengaluru/Bangalore,4-9years,Not Specified,"PHP, Cake PHP, Developer-Minimum 4 years of relevant Experience, Salary-4 to 5 LPA ,Job Location Bangalore. Cake PHP experience is mandatory to have.",PHPCake|ObjectOrientedDesignConcepts|Php|Javascript|MySQL|HTML|Oops|Oracle|Pl|Sql|WebServices|Xml|Soap|
Senior Frontend Developer,SnapHunt Pte Ltd,Hyderabad/Secunderabad,6-16years,800000 - 1500000 INR,You will be working with the Design team to understand the design & UI/UX requirements and collaborating with graphic designers & backend developers to improve usability.,Javascript|HTML|CSS|jQuery|FrontEndDevelopment|WebDevelopment|Angular|WebTechnologies|SoftwareDevelopment|SEO|react.js|
QA Engineer,MVK Staffing Services Private Limited,Bengaluru/Bangalore|Hyderabad/Secunderabad,2-7years,Not Specified,We are looking for QA Engineers - 100% Remote - US Shift - Need Immediate joiners,QaEngineer|Selenium|Appium|MobileTesting|Javascript|
Excellent Opportunity for Drupal Developer - HYD & Pune,Stryde Consulting Services,Hyderabad/Secunderabad|Pune,5-12years,Not Specified,"Strong Experience Drupal theming. |  Strong in HTML, CSS, jQuery & JavaScript |  Extra points for passing the Acquia Certified Front End Developer exam or D7 or D8 |  Ability to create custom template files for D7 and Twig files for D8",Drupaltheming|D7|D8|HTML|CSS|jQuery|Javascript|Php|
Software Engineer Developer,POSIDEX TECHNOLOGIES PVT LTD,Hyderabad/Secunderabad,2-4years,Not Specified,Looking for candidates with good programming knowledge with 2+ years exp in Spring Boot and Angular,SoftwareEngineer|Softwaredeveloper|CoreJava|SpringMVC|Nodejs|HTML|CSS|Javascript|DesignPatterns|JQuery|ResponsiveDesign|Bootstrap|Angular|
ZENSAR IS HIRING FOR SITECORE DEVELOPER FOR PUNE/BANGALORE/HYDERABAD,Zensar Technologies Limited,Bengaluru/Bangalore|Pune,3-7years,Not Specified,SITECORE DEVELOPER,SitecoreCMS|SitecoreEcommerce|sitecore|Javascript|
Full Stack Developer Campaign development,Angel And Genie,Bengaluru/Bangalore,3-10years,Not Specified,Overall  3+ years of experience in Software development.,FullStackDeveloper|Html5|CSS|Javascript|Mvc|
Team Lead / Azure Devops Architect (Work from Home),TJC India Private Limited,Pune,5-15years,Not Specified,We are looking for the manager for our MS Azure DevOps corporate solution.,CI/CD|Shiftleft|Zapscanning|SecurityScan|whitesource|OPA5|Azure|AWS|DevopsEngineer|Devops|Jenkins|Kubernetes|Docker|Selenium|Owasp|Javascript|
SENIOR SOFTWARE ENGINEER (FRONT-END),C P Careers Private Limited,Bengaluru/Bangalore|Hyderabad/Secunderabad,4-8years,1500000 - 2300000 INR,"Responsibilities include (but are not limited to): |   |  Designing and building high quality, responsive, scalable, and performant applications using HTML5, CSS, Javascript, Angular and other front-end frameworks. |   |  Working on projects end-to-end, includin",Designingandbuilding|solutioninganddesigningarchitecture|Developing|deploying|maintainingsystems|Reviewing|FrontEndsystemDesignandarchitecture|FrontEndEngineers|Jav|responsive|Html5|CSS|Javascript|Angular|Testing|Html5|Css3|
Software Programmer/Senior Software Programmer,C P Careers Private Limited,Mumbai|Pune,2-8years,Not Specified,"Software Programmer-2to 4yrs |  Sr. Software Programmer-4 to 8yrs |  Skills:-Java,J2EE,JSP/Servlet,JMS,Struts, Spring ,Angular 2+, jQuery,JavaScript, HTML/CSS,SQL, Job Scheduling, Maven, web services–RESTful and SOAP |  Domain Like-Payment Gateway/BFSI Domain",Java|CoreJava|JavaJ2ee|Struts|Jsp|Servlets|J2EE|Hibernate|HTML|CSS|Javascript|Jquery|Angular|SpringFramework|SpringBatch|
Full Stack Developer,Arccaa Analytics And IT Solutions LLP,Hyderabad/Secunderabad,4-6years,Not Specified,"Role: Developer – Full stack developer |    |   Location: Hyderabad |    |   Experience: 4 years to 6 years |    |   Should have Expertise in front-end technologies, including JavaScript, CSS3 and HTML5",HanaDB|Javascript|Html5|react.js|AngularJs|jQuery|ServerSideProgramming|Dbms|Git|ApacheServer|
AM FRONT END,C P Careers Private Limited,Bengaluru/Bangalore|Chennai,5-7years,800000 - 1200000 INR,"KEY ACTIVITIES |   |  Front end developer |   |  We are looking for a highly motivated front end Developer to join our team developing our Learning Experience Platform.  You will also have some Java experience, as your front-end development will sit on a Java",MVFRAMEWORKS|VUE.JS|ANGULAR.JSD|LATESTECMASCRIPT|LESS/SASS|SEMANTIC-UI|XAPI|STORYPOINTS|SPRINTS|HTML|Javascript|Framework|JQUERY|AJAX|Json|CSS|React|ember.js|NODE.JS|Bootstrap|Scorm|JIRA|
MNC Company Hiring MS PowerApps Developer in Pune,Selectivite Consultants,Pune,4-11years,Not Specified,An Austrian Base Company Hiring MS PowerApps Developer,Powerautomate|#C|Azuredevops|AzureDevOPS|MSPowerApps|Sharepoint|Powerapps|SharepointOnline|.NET|Javascript|Sql|C#|Scripting|Sql|
Software Development Engineer II - Android Platform,AasaanJobs Private Limited,MumbaiCity,3-7years,Not Specified,"Leading our Mobile First strategy in everything from usability to optimization |  Experienced writing UI tests, Rx-java & Data binding and proficiency in building android apps using Kotlin & DS fundamentals |  Familiarity with continuous integration",androiddeveloper|UITestcases|Kotlin|Javascript|DataStructures|
Oracle Adf Developer,Redefined Corp,Bengaluru/Bangalore,5-15years,Not Specified,"4+ years experience in Oracle ADF, SDLC, Javascript..",OracleAdf|Javascript|Sdlc|DataMigration|
Software Engineer,Learning Candid India Private Limited,Bengaluru/Bangalore,3-6years,Not Specified,"•	As a member of our Product Development team you will be responsible for ensuring successful delivery using .net languages such as C# and ASP .NET.  |  •	You need to create applications from scratch, configure existing systems and provide user support.",.NETFramework.|Asp.Net|Asp.netMvc|EntityFramework|Linq|Ado.net|HTML|Javascript|Bootstrap|CSS|C#|
Engineering Manager,Snaphunt Pte Ltd,Bengaluru/Bangalore,10-12years,4000000 - 7000000 INR,"Executing the Product road map to handle delivery commitments. Continuously improving processes, technology & applications you own |   |",Scala|Spark|Java|Mysql|PostgreSQL|FrontEnd|WebServices|Javascript|
