jobTitles,Company,jobLocations,requiredExperiance,Salary,JobDescription,Skills
Production Engineer,Sapna Manish Sharma (Proprietor Of JBM India),Pune,1-6years,250000 - 450000 INR,Requirement for Production Engineer.,Fabrication|Manufacturing|MechanicalEngineering|ProductionEngineer|
Production Engineer,JDC Recruitment Services,Kolkata|Mumbai,2-5years,400000 - 600000 INR,Develop and lead the improvement plans in the shop floor. |  Controlling of all parameters related to main process of plating. |  Controlling of Rework & Rejection.,ProductionManager|ManufacturingEngineer|Manufacturing|ProductionEngineer|ProductionSupervisor|ProductionExecutive|ProductionOfficer|ProductionIncharge|
Production Engineer,Shakun Sharma (Proprietor Of FM Industry),Kolkata,0-1years,240000 - 459999 INR,Urgent Hiring For Production Engineer  |   Freshers Can Also Apply,ProductionManager|ManufacturingEngineer|Manufacturing|ProductionEngineer|ProductionSupervisor|ProductionExecutive|ProductionOfficer|ProductionIncharge|
Production Engineer,JDC Recruitment Services,Bengaluru/Bangalore|Hyderabad/Secunderabad,5-9years,540000 - 750000 INR,"Should have experience as Production Engineer |  Should be responsible for manpower managing, production planning. |  Also should be quality oriented, productivity oriented. |",ProductionManager|ProductionHead|FactoryManager|ProductionExecutive|ProductionEngineer|ProductionInCharge|ProductionOfficer|ProductionSupervisor|
Production Engineer,Diraa HR Services,Coimbatore,0-4years,Not Specified,"To be successful as a Production Engineer, you should be an independent thinker and keen problem-solver.",ProductionManager|ProductionHead|FactoryManager|ProcessTrainer|ProductionSupervisor|ProductionInCharge|ProductionExecutive|ProductionOfficer|ProductionEngineer|
Production & Quality Engineer,Sapna Manish Sharma (Proprietor Of JBM India),Bengaluru/Bangalore,1-6years,250000 - 450000 INR,Requirement for Production & Quality Engineer.,Production|ProductionManagement|ProductionPlanning|QualityControl|Quality|QualityAssurance|
r. Production Engineer,SRB International Private Limited,Noida,7-15years,400000 - 700000 INR,"Dear Candidate, |   |  We have an urgent opening for Sr. Production Engineer:",QualityControl|VendorDevelopment|QualityChecks|
Production Engineer / Sr. Engineer,Hire Zone Solution,Faridabad,1-3years,200000 - 350000 INR,"Developing manufacturing and operational strategic plans and generally overseeing their implementation to ensure maximum capacity utilization of the manufacturing units towards achieving the groups strategy, growth and profit objectives.",ProductionEngineer/Sr.Engineer|
Production Support Engineer -  LNT Infotech,Larsen & Toubro Infotech Limited,Pune,5-10years,Not Specified,We are looking a candidate with immediate joiner or max 1 month N.P.,ProductionSupport|InfrastructureSupportEngineer|Troubleshooting|Configuration|UnixSupport|LinuxSupport|
Production Engineer-Pune,Shalitin Immigrations LLP,Pune,1-2years,Not Specified,"|   |  Part of Production and Assembly & Testing Team responsible for the assembly of electronic analytical instruments as per the set assembly processes and procedures. Test and calibrate assembled instruments as per customer applications, record and rel",Production|Calibration|assembly|Process|QAShareJobLinkonSocialMedia|Testing|
Production Engineer Reqd. in Canada & Australia,Shalitin Immigrations LLP,Australia|Canada,4-10years,6500000 - 9900000 INR,"Production Engineering defines,works out how the product will be manufactured & assembled on the production line including design of packaging, ensuring the right quantity of products are delivered,aligned to support the speed of production line.",ManufacturingEngineer|CadDesign|LineBalancing|QualityControl|CycleTimeReduction|IndustrialEngineering|Commandonmathematics/designingsoftware'ssuchasAutoCad|Solid-works|ProductionEngineer|ProductionSupervisor|
Production Engineer required in Canada & Gulf.,Pear Visa Immigration Services Private Limited,Canada|Gulf,4-8years,3000000 - 4800000 INR,Production Engineers are responsible for validating industry leading broadcast and AV solutions at a modular and system level.  Candidates should be ready to be challenged in an ever-changing industry.,ProductHead|ManufacturingEngineer|ProductManager|ProductionEngineer|ProductionIncharge|ProductionExecutive|
Industrial | Production Engineer For CANADA & AUSTRALIA,Shalitin Immigrations LLP,Australia|Canada,3-8years,3000000 - 5050000 INR,"Mechanical , Industrial & Production Engineers in shortage in AUSTRALIA & CANADA, Immigration in 7-8 months on different schemes.We can help you avail the golden opportunity to Migrate CANADA on point based scheme.",ProjectPlanning|MechanicalEngineering|ProductEngineering|PlanningEngineer|QualityControl|ElectricalEngineer|engineer|ProjectManagement|qualityassurance|seniorengineer|
Production Engineer Reqd. In Canada & Gulf,3 Minds ESolutions Private Limited,Canada|Gulf,2-4years,4260000 - 5880000 INR,"Develop and conduct production, inventory and quality assurance programs in manufacturing or in other industries",ProductionManager|FactoryManager|ProductionPlanning|ProductionControl|ProductionExecutive|ProductionOfficer|
Production Support Engineer /Software Engineer - Control - M,Freelancer Ganesh Popat Sontakke,Bengaluru/Bangalore|Mumbai,5-15years,Not Specified,URGENT HIRING FOR PRODUCTION SUPPORT ENGINEER FOR MUMBAI/CHENNAI/PUNE/BANGALORE FOR PERMANENT POSITION,ProductionSupportEngineer|Control-M|oracleSQLserver|Sql|ShellScripting|Shellscript|Perl|Python|powershell|
"Production Engineer,Quality Engineer hiring in adani thermal power pune    7419025878",Freelancer Ganesh Popat Sontakke,Gondia|Aurangabad,0-5years,270000 - 990000 INR,"Diploma, Degree, B.E, B.TECH, Mechanical Engineer, Diploma Mechanical Engineer, Electrical Engineer, Electronics Engineer , Civil Engineer , Graduation, Production Engineer,Quality Engineer",Diploma|Degree|B.E|B.TECH|MechanicalEngineer|DiplomaMechanicalEngineer.ElectricalEngineer|ElectronicsEngineerCivilEngineer|Graduation|ProductionEngineer|QualityEngineer|
"Production Engineer,Quality Engineer hiring in adani thermal power pune    7419025878",Diraa HR Services,Gondia|Aurangabad,0-5years,270000 - 990000 INR,"Diploma, Degree, B.E, B.TECH, Mechanical Engineer, Diploma Mechanical Engineer, Electrical Engineer, Electronics Engineer , Civil Engineer , Graduation, Production Engineer,Quality Engineer",Diploma|Degree|B.E|B.TECH|MechanicalEngineer|DiplomaMechanicalEngineer.ElectricalEngineer|ElectronicsEngineerCivilEngineer|Graduation|ProductionEngineer|QualityEngineer|
Production Engineer,Sharp Facility,Coimbatore,0-5years,110000 - 540000 INR,immediate openings for production engineer,ProductionEngineer|ProductionSupervisor|
Production Engineer,Diraa HR Services,Pune,0-5years,220000 - 330000 INR,We Have a urgent Job Opening For B.E / Diploma / Mechanical |   Production / Quality / Maintenance Engineer |   Gender - Male / Female |   Experience : 0 to 5 |   Salary Depend on the interview |   for more details please call & visit our office |   8624006464,ProductionManager|ManufacturingEngineer|ProductionEngineer|ProductionSupervisor|
Production Engineer,A V Immigration And Careers Consultancy Private Limited,Coimbatore,0-5years,Not Specified,Immediate openings for production engineer,ProductionEngineer|ProductionSupervisor|
Production Engineer - Canada/Australia,Sharp Facility,Australia|Canada,3-8years,1600000 - 2800000 INR,"Production Engineers are responsible for supervising and improving production at plants and factories. They support engineering teams, draw up safety protocols, report issues to the Manager, and develop strategies to improve efficiency and profit.",manufacturing|ProductionSupport|ProductionEngineer|qualityassurance|
Urgent Requirements For Production & Quality Engineer,Yashodhara Management And Company,Pune,0-5years,220000 - 330000 INR,We Have a urgent Job Opening For B.E / Diploma / Mechanical |  Production / Quality / Maintenance Engineer |  Gender - Male / Female. |  Experience : 0 to 5 |  Salary Depend on the interview |  for more details please call  |  8624006464,QualityControl|ProductionEngineer|QualityAssurance|MaintenanceEngineer|ServiceEngineer|
REQUIRED MECHANICAL PRODUCTION ENGINEER.,Riju Karan (Proprietor Of Toyota Climax India),Mumbai|MumbaiCity|NaviMumbai|Thane,3-8years,220000 - 430000 INR,QUALIFICATION-DIPLOMA/BE MECHANICAL/ELECTRONICS  |    IMMEDIATE JOINER |    SALARY- 25-35K |     |    CONTACT-7021684442/9167875089 |     |,MechanicalEngineer|ElectronicsEngineer|ProductionManager|ManufacturingEngineer|Manufacturing|ProductionSupervisor|ProductionEngineer|ProductionExecutive|ProductionIncharge|
Production Engineer,Pleco Migration Private Limited,Canada|HongKong,5-7years,3000000 - 4500000 INR,Production Engineer  |     |   Call Shreya : 9311576814,ProductionManager|ProductionPlanning|ProductionManagement|ProductionControl|ProductionEngineer|ProductionOfficer|ProductionIncharge|
Production Engineer,Startech Placement Services,Pune,3-4years,240000 - 300000 INR,Urgent Vacancy for Production Engineer,Manufacturing|ManufacturingEngineer|Fabrication|Machining|Welding|SheetMetalerection|ProductionEngineer|ProductionSupervisor|
Production Engineer,M.I. Enterprises,Qatar,5-10years,Not Specified,"Preparing Production Plan, Work Scheduling, Costing,maximum retail price (MRP), Bill of Materials (BOM) Bill Of Quantity (BOQ), Enterprise resource planning (ERP) Or master production schedule (MPS) |   Manage Production line, Daily execution work flow",FurnitureContractors|InteriorDecoration|commercialtower|InteriorDesigner|InteriorDesigner|furnituredesigning|InteriorDecorator|SpacePlanning|Architect|ProductionEngineer|
Production Engineer,Diraa HR Services,Coimbatore,0-5years,Not Specified,"Production Engineers are responsible for supervising and improving production at plants and factories. They support engineering teams, draw up safety protocols, report issues to the Manager, and develop strategies to improve efficiency and profit.",ProductionManager|ManufacturingEngineer|ProductionEngineer|ProductionSupervisor|ProductionExecutive|
Production Engineer,Subrata Mondal (Proprietor Of Cafe Industry),Mumbai,0-5years,180000 - 400000 INR,Hiring for Production Engineer |   Freshers can also apply,ProductionManager|FactoryManager|ProductionHead|ProductionOfficer|ProductionSupervisor|ProductionExecutive|ProductionEngineer|ProductionInCharge|
Production Engineer required in Canada,Cloud Visa Immigration LLP,Canada,2-7years,4000000 - 4500000 INR,Call & what's app to Pooja -9311529770 |   |  Production Engineers have an extensive knowledge and expertise about the manufacturing and production process.,ProductionManager|ProductionHead|FactoryManager|ProductionExecutive|ProductionEngineer|ProductionInCharge|ProductionSupervisor|ProductionOfficer|
Production Engineer hiring in jcb india pune salary  18k -85k 7206143903,Freelancer Ganesh Popat Sontakke,Pune|Gondia,0-2years,Not Specified,"Diploma,Degree,B.E,B.TECH,Mechanical Engineer,Diploma Mechanical Engineer.Electrical Engineer,Electronics Engineer Civil Engineer ,Graduation, Production Engineer,Quality Engineer",Diploma|Degree|B.E|B.TECH|MechanicalEngineer|DiplomaMechanicalEngineer.ElectricalEngineer|ElectronicsEngineerCivilEngineer|Graduation|ProductionEngineer|QualityEngineer|
Production Engineer hiring in jcb india pune salary  18k -85k 7206143903,Freelancer Ganesh Popat Sontakke,Pune|Gondia,0-2years,Not Specified,"Diploma,Degree,B.E,B.TECH,Mechanical Engineer,Diploma Mechanical Engineer.Electrical Engineer,Electronics Engineer Civil Engineer ,Graduation, Production Engineer,Quality Engineer",Diploma|Degree|B.E|B.TECH|MechanicalEngineer|DiplomaMechanicalEngineer.ElectricalEngineer|ElectronicsEngineerCivilEngineer|Graduation|ProductionEngineer|QualityEngineer|
Mechanical Production Engineer,Yashodhara Management And Company,Mumbai|MumbaiCity|NaviMumbai|Thane,0-4years,250000 - 450000 INR,"Vacancy for Production Engineer required,0 to 4 years exp candidate can apply |  Diploma/BE Candidate |  Job Location- Ambernath/navi Mumbai/Dombivali/Mumbai |  Industry type- Fabrication/Furniture Fabrication/valve/Machine Manufacturing |  Contact person-sarika",MechanicalProductionEngineer|
Immediate opening for Production engineer,Diraa HR Services,Coimbatore,0-2years,Not Specified,Production Engineers are responsible for supervising and improving production at plants and factories.,ProductionManager|ProductionHead|FactoryManager|ProductionExecutive|ProductionEngineer|ProductionInCharge|ProductionSupervisor|ProductionOfficer|
ARGENT HIRING FOR PRODUCTION QUALITY Maintenance Engineer,Riju Karan (Proprietor Of Toyota Climax India),Pune,0-1years,150000 - 229999 INR,"Dear Candidate, |   We have urgent opening for production ,quality maintenance trainee engineer fresher.  |   B-tech/mechanical/automobile/E&TC/electrical engineer. |   Interested candidate visit to my office and send the resume. |   CONTACT ME FAST 8002551517",MechanicalEngineer|ElectricalEngineer|Electrical|DiplomaMechanical|Mechanicaldesignengineer|MaintenanceEngineer|
Mechanical Production Engineer,Icon Facilities,Tirunelveli,0-2years,130000 - 360000 INR,looking for mechanical production engineer |   freshers can also apply,ProductionManager|ManufacturingEngineer|Manufacturing|ProductionEngineer|ProductionSupervisor|ProductionExecutive|ProductionOfficer|ProductionIncharge|
Jr Production  Engineer,MS Staffing,Pune,1-3years,Not Specified,"Post : Jr Production Engg  |  Salary : 15000 to 25000 |  Skill : varnier caliper, production incharg , Industrial Engineer |            Manufacturing Engineer",ProductionManager|Manufacturing|ManufacturingEngineer|ProductionEngineer|ProductionExecutive|ProductionOfficer|ProductionIncharge|
Production & Quality Engineer,I2canz Outsourcing Private Limited,Pune,0-5years,220000 - 330000 INR,"We Have an urgent Job Opening For B.E / Diploma / Mechanical |   Gender - Male / Female. |   Experience : 0 to 5 |   location - Bhosari, Chakan |   Salary Depend on the interview |   for more details please call & visit our office |   CALL - 7248903232",QualityControl|ProductionEngineer|ProductionSupervisor|QualityAssurance|MaintenanceEngineer|
Industrial and manufacturing Engineers for Canada & Australia,Sharp Facility,Australia|Canada,2-12years,4050000 - 6050000 INR,"Industrial and manufacturing engineers conduct studies, and develop and supervise programs to achieve the best use of equipment, human resources, technology, materials and procedures to enhance efficiency and productivity.",ManufacturingEngineering|Manufacturing|Industrial|IndustrialConstruction|ManufacturingIndustry|
Mechanical Engineers - Production & Quality Engineer,Volks Mobel India,Pune,0-5years,220000 - 330000 INR,We Have a urgent Job Opening For B.E / Diploma / Mechanical |   Production / Quality / Maintenance Engineer |   Gender - Male / Female. |   Experience : 0 to 5 |   Salary Depend on the interview |   for more details please call & visit our office |  8624006464,QualityControl|ProductionEngineer|ProductionSupervisor|QualityAssurance|MaintenanceEngineer|
Junior Production Engineer,Riju Karan (Proprietor Of Toyota Climax India),Hyderabad/Secunderabad,2-5years,10000 - 20000 INR,ANB Interiors is a Modular kitchens/wardrobes/furniture manufacturing firm located in Bollaram and is currently looking to hire a Junior Production Engineer.,ProductionEngineering|ProductionEngineerTrainee|InteriorProjects|ModularFurniture|ProductionEngineer|
Production & Quality Engineer,M.I. Enterprises,Imphal,0-3years,200000 - 350000 INR,Requirement of Production & Quality Engineer.,Production&QualityEngineer|ProductionEngineer|QualityEngineer|
Furniture Production Engineer,Precision Tech Enterprises,Qatar,3-9years,Not Specified,Minimum of 3 years Gulf Experience in Joinery Field.,FurnitureProductionEngineer|FurnitureProduction|
Production Control Engineer,The NaukriWala,Mehsana,1-3years,220000 - 330000 INR,"Production Management & Control,Production, Plastic, Injection Molding, Chemical, Plating, Process, Control, Electroplating",Production|Plastic|InjectionMolding|Chemical|Plating|Process|Control|Electroplating|
Production Engineer for good MNC Company,Yashodhara Management And Company,Pune,0-3years,180000 - 210000 INR,Requirement for the position of Production Engineer.,MechanicalEngineer|ProductionEngineer|ProductionExecutive|
Mechanical Production Engineer,AIS Technolabs Private Limited,Mumbai|MumbaiCity|NaviMumbai|Thane,2-10years,350000 - 550000 INR,"Urgent Job Vacancy For Mechanical Production Engineer, Required Diploma/BE Mechanical Candidate, exp 4 to 10 year candidate can apply. |  salary start from 32k to 45k |  interested candidate can call on 8411955806 |  send ur resume on [HIDDEN TEXT] |",ManufacturingEngineer|Manufacturing|ProductionEngineer|ProductionSupervisor|ProductionExecutive|ProductionOfficer|ProductionIncharge|
Production Supervisor,Q Visas Immigration,Bengaluru/Bangalore,2-7years,250000 - 400000 INR,"Production process, production supervisor |",ProductionSupervisor|ProductionOfficer|ProductionExecutive|ProductionIncharge|
Industrial | Production Engineer For CANADA & AUSTRALIA,SnapHunt Pte Ltd,Australia|Canada,2-7years,Not Specified,"Production Engineering defines and works out how the product will be manufactured and/or assembled on the production line including design of packaging, ensuring the right quantity of components/products are delivered and aligned to support the speed",QualityControl|Iso|ProductionPlanning|ProductionControl|ProductionManagement|QualityAssurance|QualityAnalyst|QualityManager|
Openings for Production Engineer,Freelancer Iranna K Patil,Bengaluru/Bangalore,Fresher,220000 - 330000 INR,We have currently openings for Mechanical production Engineering filed. Interested candidates can apply for this,Production|Maintenance|Manufacturing|Quality|
A210174-Senior Manager Production,Expertia Ai Technologies Private Limited,OtherIndia,8-12years,Not Specified,"Person will responsible to carry out the works pertains to Production department and drive the smoothly, also responsible to meet the production targets, continuous improvement in reduction of rejection.",Metallurgy|Mechanical|Production|QualityStandard|
REQUIRED MECHANICAL PRODUCTION ENGINEER.,Freelancer Prem Kumar S,Mumbai|MumbaiCity|NaviMumbai|Thane,3-8years,220000 - 430000 INR,QUALIFICATION-DIPLOMA/BE MECHANICAL/ELECTRONICS  |   IMMEDIATE JOINER |   SALARY- 25-35K |    |   CONTACT-7021684442/9167875089 |    |,MechanicalEngineer|ElectronicsEngineer|ProductionManager|ManufacturingEngineer|Manufacturing|ProductionSupervisor|ProductionEngineer|ProductionExecutive|ProductionIncharge|
Mechanical Engineer Production/Maintenance,MS Staffing,Chennai,0-5years,320000 - 740000 INR,"Dear Aspirants, |  We are urgently requirement wanted for FRESHER/EXPERIENCE. Mechanical Engineer with Research and development ,quality assurance. Skilled in Production and Maintenance. Free food and accommodation provided.  |  Contact JANANI 7200939476.",MechanicalMaintenance|MaintenanceSupervisorMaintenanceExecutive|ProductionEngineer|ProductionSupervisor|
Production & Quality Engineer Job In Pune,Adal Immigrations LLP,Pune,0-5years,220000 - 330000 INR,"We Have an urgent Job Opening For B.E / Diploma / Mechanical |    Gender - Male / Female. |    Experience : 0 to 5 |    location - Bhosari, Chakan |    Salary Depend on the interview |    for more details please call & visit our office |    CALL - 7248903232",QualityControl|ProductionSupervisor|ProductionEngineer|QualityAssurance|MaintenanceEngineer|
Warehouse Manager Required in Canada|Australia,Freelancer Ganesh Popat Sontakke,Australia|Canada,2-7years,2000000 - 5000000 INR,"Safety Management,Developing Standards,Maintaining Processes,Inventory Control,Equipment Management,Judgement.",WarehouseManager|InventoryControl|DispatchLogistic|CostReduction|WarehouseManagement|Store|Wms|Logistics|Inventory|ShoreOperations|CustomsDocumentation&clearance|Wm|
"Production Engineer,Quality Engineer hiring in adani thermal power pune    7419025878",Diraa HR Services,Gondia|Aurangabad,0-5years,270000 - 990000 INR,"Diploma, Degree, B.E, B.TECH, Mechanical Engineer, Diploma Mechanical Engineer, Electrical Engineer, Electronics Engineer , Civil Engineer , Graduation, Production Engineer,Quality Engineer",Diploma|Degree|B.E|B.TECH|MechanicalEngineer|DiplomaMechanicalEngineer.ElectricalEngineer|ElectronicsEngineerCivilEngineer|Graduation|ProductionEngineer|QualityEngineer|
REQUIRED MECHANICAL PRODUCTION ENGINEER.,Startech Placement Services,Mumbai|MumbaiCity|NaviMumbai|Thane,3-8years,220000 - 430000 INR,QUALIFICATION-DIPLOMA/BE MECHANICAL/ELECTRONICS  |  IMMEDIATE JOINER |  SALARY- 25-35K |   |  CONTACT-7021684442/9167875089 |   |,MechanicalEngineer|ElectronicsEngineer|ProductionManager|ManufacturingEngineer|Manufacturing|ProductionSupervisor|ProductionEngineer|ProductionExecutive|ProductionIncharge|
Production Engineer / Quality Engineer /maintenance Engineer,A V Immigration And Careers Consultancy Private Limited,Pune,0-1years,160000 - 240000 INR,Requirement for the position of Quality Engineer / Production Engineer / maintenance Engineer .,QualityControl|Inspection|Qc|QualityAssurance|Testing|ProductionEngineer|
Production Engineer,A V Immigration And Careers Consultancy Private Limited,Coimbatore,0-4years,Not Specified,immediate openings for production engineer,ProductionEngineer|ProductionSupervisor|
Production Engineer,Diraa HR Services,Pune,Fresher,Not Specified,"Urgently Required Post- Quality, production, maintainence, accounting, purchase and design",Manufacturing|ManufacturingEngineer|MechanicalMaintenance|MaintenanceSupervisor|AccountingFinance|PurchaseEngineer|ProductionEngineer|ProductionSupervisor|ProductionExecutive|MaintenanceEngineer|ServiceEngineer|PurchaseExecutive|
Production Engineer - Canada/Australia,Infomedia Solutions And Consultant,Australia|Canada,3-8years,1600000 - 2800000 INR,"Production Engineers are responsible for supervising and improving production at plants and factories. They support engineering teams, draw up safety protocols, report issues to the Manager, and develop strategies to improve efficiency and profit.",manufacturing|ProductionSupport|ProductionEngineer|qualityassurance|
Production Engineer - Canada/Australia,Freelancer Ganesh Popat Sontakke,Australia|Canada,9-14years,1600000 - 2800000 INR,"Production Engineers are responsible for supervising and improving production at plants and factories. They support engineering teams, draw up safety protocols, report issues to the Manager, and develop strategies to improve efficiency and profit.",manufacturing|ProductionSupport|ProductionEngineer|qualityassurance|
Production Engineer,Freelancer Ganesh Popat Sontakke,Coimbatore,0-2years,Not Specified,"To be successful as a Production Engineer, you should be an independent thinker and keen problem-solver. Outstanding Production Engineers are able to diagnose problems, train staff, and provide effective recommendations.",Manufacturing|ProductionManager|ProductionSupervisor|ProductionOfficer|ProductionExecutive|ProductionIncharge|ProductionEngineer|
Designation - Engineer – Production (SMC/DMC) Nerul,Freelancer Ganesh Popat Sontakke,Mumbai|MumbaiCity|NaviMumbai|Thane,1-6years,Not Specified,"Designation - Engineer – Production (SMC/DMC)Requirement - 3 (Nerul)Required Experience : 2-3 Years |  Qualifications : DME,   EMAIL [HIDDEN TEXT]                                                                                       |",Dme|Mechanical|Mech|
Opening For Mechanical Engineers in Sheet metal Fabrication industry,Freelancer Ganesh Popat Sontakke,Pune|Nashik,0-4years,180000 - 280000 INR,"We have urgent requirement for Mechaical  engineers. |      Job type :- on roll,full time |      Required experience :- 0 to 3 year |      About Company :- Sheet metal Fabrication industry",QualityControl|SheetMetalFabrication|PressShop|ProductionEngineer|QualityAssurance|MaintenanceEngineer|
Production Engineer hiring in jcb india pune salary  18k -85k 9647964286,Freelancer Ganesh Popat Sontakke,Pune|Gondia,0-2years,Not Specified,"Diploma,Degree,B.E,B.TECH,Mechanical Engineer,Diploma Mechanical Engineer.Electrical Engineer,Electronics Engineer Civil Engineer ,Graduation, Production Engineer,Quality Engineer",Diploma|Degree|B.E|B.TECH|MechanicalEngineer|DiplomaMechanicalEngineer.ElectricalEngineer|ElectronicsEngineerCivilEngineer|Graduation|ProductionEngineer|QualityEngineer|
Production Engineer hiring in jcb india pune salary  18k -85k 9647964286,Freelancer Ganesh Popat Sontakke,Pune|Gondia,0-2years,Not Specified,"Diploma,Degree,B.E,B.TECH,Mechanical Engineer,Diploma Mechanical Engineer.Electrical Engineer,Electronics Engineer Civil Engineer ,Graduation, Production Engineer,Quality Engineer",Diploma|Degree|B.E|B.TECH|MechanicalEngineer|DiplomaMechanicalEngineer.ElectricalEngineer|ElectronicsEngineerCivilEngineer|Graduation|ProductionEngineer|QualityEngineer|
Production Engineer hiring in jcb india pune salary  18k -85k 9647964286,SR Group,Pune|Gondia,0-2years,Not Specified,"Diploma,Degree,B.E,B.TECH,Mechanical Engineer,Diploma Mechanical Engineer.Electrical Engineer,Electronics Engineer Civil Engineer ,Graduation, Production Engineer,Quality Engineer",Diploma|Degree|B.E|B.TECH|MechanicalEngineer|DiplomaMechanicalEngineer.ElectricalEngineer|ElectronicsEngineerCivilEngineer|Graduation|ProductionEngineer|QualityEngineer|
