jobTitles,Company,jobLocations,requiredExperiance,Salary,JobDescription,SkillsMechanical Engineer  hiring in tata motors west bangal 8607033210,Freelancer Ganesh Popat Sontakke,Kolkata|Haldia,0-4years,270000 - 990000 INR,"Diploma, Degree, B.E, B.TECH, Mechanical Engineer, Diploma Mechanical Engineer, Electrical Engineer, Electronics Engineer , Civil Engineer , Graduation, Production Engineer,Quality Engineer",Diploma|Degree|B.E|B.TECH|MechanicalEngineer|DiplomaMechanicalEngineer.ElectricalEngineer|ElectronicsEngineerCivilEngineer|Graduation|ProductionEngineer|QualityEngineer|
Electrical Engineer hiring in jcb  plants  rajesthan  7082476165,Freelancer Ganesh Popat Sontakke,Kota|Bhilwara,0-2years,270000 - 990000 INR,"Diploma,Degree,B.E,B.TECH,Mechanical Engineer,Diploma Mechanical Engineer.Electrical Engineer,Electronics Engineer Civil Engineer ,Graduation, Production Engineer,Quality Engineer",Diploma|Degree|B.E|B.TECH|MechanicalEngineer|DiplomaMechanicalEngineer.ElectricalEngineer|ElectronicsEngineerCivilEngineer|Graduation|ProductionEngineer|QualityEngineer|
Mechanical Engineer hiring in Adani thermal power ranchi   9817953509,Freelancer Ganesh Popat Sontakke,Jamnagar|Ranchi,0-4years,270000 - 869999 INR,"Diploma,Degree,B.E,B.TECH,Mechanical Engineer,Diploma Mechanical Engineer.Electrical Engineer,Electronics Engineer Civil Engineer ,Graduation, Production Engineer,Quality Engineer",Diploma|Degree|B.E|B.TECH|MechanicalEngineer|DiplomaMechanicalEngineer.ElectricalEngineer|ElectronicsEngineerCivilEngineer|Graduation|ProductionEngineer|QualityEngineer|
"7497007381                 TATA Motors jamsedpur plants  hiring Diploma,degree,B.tech,iti,graduation",Freelancer Ganesh Popat Sontakke,Jamshedpur|Ranchi,0-4years,270000 - 990000 INR,"Diploma,Degree,B.E,B.TECH,Mechanical Engineer,Diploma Mechanical Engineer.Electrical Engineer,Electronics Engineer Civil Engineer ,Graduation, Production Engineer,Quality Engineer",Diploma|Degree|B.E|B.TECH|MechanicalEngineer|DiplomaMechanicalEngineer.ElectricalEngineer|ElectronicsEngineerCivilEngineer|Graduation|ProductionEngineer|QualityEngineer|
Urgent opening For Production Engineer,Freelancer Ganesh Popat Sontakke,Chennai|Mumbai,2-4years,380000 - 560000 INR,urgent hiring................,electronicindustrial|productsElectronics|EngineeringProduction|EngineeringProduction|PlanningElectronics|ElectronicsProduction|
Mechanical Engineer  Hiring in jindal power angul  7206081769,Convate Consultancy Services Private Limited,Rourkela|Sambalpur,0-4years,270000 - 990000 INR,"Diploma,Degree,B.E,B.TECH,Mechanical Engineer,Diploma Mechanical Engineer.Electrical Engineer,Electronics Engineer Civil Engineer ,Graduation, Production Engineer,Quality Engineer",Diploma|Degree|B.E|B.TECH|MechanicalEngineer|DiplomaMechanicalEngineer.ElectricalEngineer|ElectronicsEngineerCivilEngineer|Graduation|ProductionEngineer|QualityEngineer|
Exciting job opportunity of Mechanical Maintenance Engineer for SHREDDER,Freelancer Ganesh Popat Sontakke,SouthKorea,7-12years,Not Specified,"Dear Candidate, |   |  Greetings!! |   |  Convate is a maven international recruitment consultancy, has experience of placing Professionals across India and Middle East, since 2004.",Maintenance|MechanicalMaintenance|BreakdownMaintenance|PreventiveMaintenance|shredder|shredding|shredderunit|shreddermachine|shreddingunit|metalshredder|shreddingmachine|industrialshredder|
"DIPLOMA, DEGREE, B.tech   hiring in tata motors west bangal 8607033210",Freelancer Ganesh Popat Sontakke,Kolkata|Haldia,0-5years,270000 - 990000 INR,"Diploma, Degree, B.E, B.TECH, Mechanical Engineer, Diploma Mechanical Engineer, Electrical Engineer, Electronics Engineer , Civil Engineer , Graduation, Production Engineer,Quality Engineer",Diploma|Degree|B.E|B.TECH|MechanicalEngineer|DiplomaMechanicalEngineer.ElectricalEngineer|ElectronicsEngineerCivilEngineer|Graduation|ProductionEngineer|QualityEngineer|
Mechanical Engineering hiring in tata motors west bangal 8607033210,Freelancer Ganesh Popat Sontakke,Kolkata|Kharagpur,0-2years,270000 - 890000 INR,"Diploma,Degree,B.E,B.TECH,Mechanical Engineer,Diploma Mechanical Engineer.Electrical Engineer,Electronics Engineer Civil Engineer ,Graduation, Production Engineer,Quality Engineer",Diploma|Degree|B.E|B.TECH|MechanicalEngineer|DiplomaMechanicalEngineer.ElectricalEngineer|ElectronicsEngineerCivilEngineer|Graduation|ProductionEngineer|QualityEngineer|
Mechanical Engineer  hiring in L&T west bangal salary 25k-75k  8930761653,Freelancer Ganesh Popat Sontakke,Asansol|Durgapur,0-5years,270000 - 990000 INR,"Diploma, Degree, B.E, B.TECH, Mechanical Engineer, Diploma Mechanical Engineer, Electrical Engineer, Electronics Engineer , Civil Engineer , Graduation, Production Engineer,Quality Engineer",Diploma|Degree|B.E|B.TECH|MechanicalEngineer|DiplomaMechanicalEngineer.ElectricalEngineer|ElectronicsEngineerCivilEngineer|Graduation|ProductionEngineer|QualityEngineer|
Electrical Engineer  hiring Adani therml power kota  9653556145,Freelancer Ganesh Popat Sontakke,Kota|Bikaner,0-2years,270000 - 1090000 INR,"Diploma,Degree,B.E,B.TECH,Mechanical Engineer,Diploma Mechanical Engineer.Electrical Engineer,Electronics Engineer Civil Engineer ,Graduation, Production Engineer,Quality Engineer",Diploma|Degree|B.E|B.TECH|MechanicalEngineer|DiplomaMechanicalEngineer.ElectricalEngineer|ElectronicsEngineerCivilEngineer|Graduation|ProductionEngineer|QualityEngineer|
Mechanical Engineer  hiring in Adani thermal power ranchi   9817953509,Freelancer Ganesh Popat Sontakke,Gaya|Muzaffarpur,0-4years,270000 - 869999 INR,"Diploma,Degree,B.E,B.TECH,Mechanical Engineer,Diploma Mechanical Engineer.Electrical Engineer,Electronics Engineer Civil Engineer ,Graduation, Production Engineer,Quality Engineer",Diploma|Degree|B.E|B.TECH|MechanicalEngineer|DiplomaMechanicalEngineer.ElectricalEngineer|ElectronicsEngineerCivilEngineer|Graduation|ProductionEngineer|QualityEngineer|
Mechanical Engineer hiring in ashok leyland india in rajesthan  7056623257,Freelancer Ganesh Popat Sontakke,Jaipur|Jaisalmer,0-2years,270000 - 1090000 INR,"Diploma,Degree,B.E,B.TECH,Mechanical Engineer,Diploma Mechanical Engineer.Electrical Engineer,Electronics Engineer Civil Engineer ,Graduation, Production Engineer,Quality Engineer",Diploma|Degree|B.E|B.TECH|MechanicalEngineer|DiplomaMechanicalEngineer.ElectricalEngineer|ElectronicsEngineerCivilEngineer|Graduation|ProductionEngineer|QualityEngineer|
Mechanical Engineering hiring in jcb  plants  rajesthan  7082476165,Freelancer Ganesh Popat Sontakke,Jaipur|Jaisalmer,0-2years,270000 - 990000 INR,"Diploma,Degree,B.E,B.TECH,Mechanical Engineer,Diploma Mechanical Engineer.Electrical Engineer,Electronics Engineer Civil Engineer ,Graduation, Production Engineer,Quality Engineer",Diploma|Degree|B.E|B.TECH|MechanicalEngineer|DiplomaMechanicalEngineer.ElectricalEngineer|ElectronicsEngineerCivilEngineer|Graduation|ProductionEngineer|QualityEngineer|
Mechanical Engineer hiring in ashok leyland india in rajesthan  7056623257,Freelancer Ganesh Popat Sontakke,Jaipur|Jaisalmer,0-2years,270000 - 1090000 INR,"Diploma,Degree,B.E,B.TECH,Mechanical Engineer,Diploma Mechanical Engineer.Electrical Engineer,Electronics Engineer Civil Engineer ,Graduation, Production Engineer,Quality Engineer",Diploma|Degree|B.E|B.TECH|MechanicalEngineer|DiplomaMechanicalEngineer.ElectricalEngineer|ElectronicsEngineerCivilEngineer|Graduation|ProductionEngineer|QualityEngineer|
Mechanical Engineer  hiring in jcb india pune 7206143903,Freelancer Ganesh Popat Sontakke,Pune|Gondia,0-5years,270000 - 990000 INR,"Diploma, Degree, B.E, B.TECH, Mechanical Engineer, Diploma Mechanical Engineer. Electrical Engineer, Electronics Engineer , Civil Engineer , Graduation ,  Production Engineer, Quality Engineer",Diploma|Degree|B.E|B.TECH|MechanicalEngineer|DiplomaMechanicalEngineer.ElectricalEngineer|ElectronicsEngineer|CivilEngineer|Graduation|ProductionEngineer|QualityEngineer|
Mechanical Engineer hiring in tata motors west bangal 8607033210,Freelancer Ganesh Popat Sontakke,Durgapur|Bankura,0-5years,270000 - 890000 INR,"Diploma,Degree,B.E,B.TECH,Mechanical Engineer,Diploma Mechanical Engineer.Electrical Engineer,Electronics Engineer Civil Engineer ,Graduation, Production Engineer,Quality Engineer",Diploma|Degree|B.E|B.TECH|MechanicalEngineer|DiplomaMechanicalEngineer.ElectricalEngineer|ElectronicsEngineerCivilEngineer|Graduation|ProductionEngineer|QualityEngineer|
Electrical Engineer  hiring in ashok leyland india in rajesthan 7056623257,Freelancer Ganesh Popat Sontakke,Jaipur|Jaisalmer,0-4years,270000 - 1090000 INR,"Diploma,Degree,B.E,B.TECH,Mechanical Engineer,Diploma Mechanical Engineer.Electrical Engineer,Electronics Engineer Civil Engineer ,Graduation, Production Engineer,Quality Engineer",Diploma|Degree|B.E|B.TECH|MechanicalEngineer|DiplomaMechanicalEngineer.ElectricalEngineer|ElectronicsEngineerCivilEngineer|Graduation|ProductionEngineer|QualityEngineer|
"TATA Motors jamsedpur plants  hiring Diploma,degree,B.tech,iti,graduation 7497007381",Freelancer Ganesh Popat Sontakke,Jamshedpur|Ranchi,0-5years,270000 - 990000 INR,"Diploma,Degree,B.E,B.TECH,Mechanical Engineer,Diploma Mechanical Engineer.Electrical Engineer,Electronics Engineer Civil Engineer ,Graduation, Production Engineer,Quality Engineer",Diploma|Degree|B.E|B.TECH|MechanicalEngineer|DiplomaMechanicalEngineer.ElectricalEngineer|ElectronicsEngineerCivilEngineer|Graduation|ProductionEngineer|QualityEngineer|
"diploma,degree,b.tech,B.E,hiring in jcb all india plants   7082476165",Freelancer Ganesh Popat Sontakke,Jodhpur|Vijayawada,0-2years,270000 - 990000 INR,"Diploma,Degree,B.E,B.TECH,Mechanical Engineer,Diploma Mechanical Engineer.Electrical Engineer,Electronics Engineer Civil Engineer ,Graduation, Production Engineer,Quality Engineer",Diploma|Degree|B.E|B.TECH|MechanicalEngineer|DiplomaMechanicalEngineer.ElectricalEngineer|ElectronicsEngineerCivilEngineer|Graduation|ProductionEngineer|QualityEngineer|
Production Supervisor  in Press shop company,Whitehr Consultancy Services,Pune|Aurangabad,4-6years,280000 - 360000 INR,Requirement for the post of Production Supervisor |   Industry- Press shop Industry |   Location - Pune,PressShop|SheetMetalFabrication|ProductionSupervisor|
Mechanical Engineer hiring TATA Motors jamsedpur plants  7497007381,Freelancer Ganesh Popat Sontakke,Jamshedpur|BokaroSteelCity,0-5years,270000 - 990000 INR,"Diploma,Degree,B.E,B.TECH,Mechanical Engineer,Diploma Mechanical Engineer.Electrical Engineer,Electronics Engineer Civil Engineer ,Graduation, Production Engineer,Quality Engineer",Diploma|Degree|B.E|B.TECH|MechanicalEngineer|DiplomaMechanicalEngineer.ElectricalEngineer|ElectronicsEngineerCivilEngineer|Graduation|ProductionEngineer|QualityEngineer|
Mechanical Engineer hiring in Adani thermal power ranchi   9817953509,Freelancer Ganesh Popat Sontakke,Dhanbad|Ranchi,0-2years,270000 - 869999 INR,"Diploma,Degree,B.E,B.TECH,Mechanical Engineer,Diploma Mechanical Engineer.Electrical Engineer,Electronics Engineer Civil Engineer ,Graduation, Production Engineer,Quality Engineer",Diploma|Degree|B.E|B.TECH|MechanicalEngineer|DiplomaMechanicalEngineer.ElectricalEngineer|ElectronicsEngineerCivilEngineer|Graduation|ProductionEngineer|QualityEngineer|
"TATA Motors in kaling nagar hiring diploma,degree,B.tech,iti,  9996798584",Freelancer Ganesh Popat Sontakke,Sambalpur|Bhubaneswar,0-4years,270000 - 890000 INR,"Diploma,Degree,B.E,B.TECH,Mechanical Engineer,Diploma Mechanical Engineer.Electrical Engineer,Electronics Engineer Civil Engineer ,Graduation, Production Engineer,Quality Engineer",Diploma|Degree|B.E|B.TECH|MechanicalEngineer|DiplomaMechanicalEngineer.ElectricalEngineer|ElectronicsEngineerCivilEngineer|Graduation|ProductionEngineer|QualityEngineer|
Mechanical Engineer hiring in jcb all india plants  7082476165,Freelancer Ganesh Popat Sontakke,Dhanbad|Akola,0-2years,270000 - 990000 INR,"Diploma,Degree,B.E,B.TECH,Mechanical Engineer,Diploma Mechanical Engineer.Electrical Engineer,Electronics Engineer Civil Engineer ,Graduation, Production Engineer,Quality Engineer",Diploma|Degree|B.E|B.TECH|MechanicalEngineer|DiplomaMechanicalEngineer.ElectricalEngineer|ElectronicsEngineerCivilEngineer|Graduation|ProductionEngineer|QualityEngineer|
Electrical Engineer hiring in jcb india pune 7206143903,Freelancer Ganesh Popat Sontakke,Pune|Gondia,0-5years,270000 - 990000 INR,"Diploma, Degree, B.E, B.TECH, Mechanical Engineer, Diploma Mechanical Engineer. Electrical Engineer, Electronics Engineer , Civil Engineer , Graduation ,  Production Engineer, Quality Engineer",Diploma|Degree|B.E|B.TECH|MechanicalEngineer|DiplomaMechanicalEngineer.ElectricalEngineer|ElectronicsEngineer|CivilEngineer|Graduation|ProductionEngineer|QualityEngineer|
"TATA Motors jamsedpur plants  hiring Diploma,degree,B.tech,iti,graduation 7497007381",Freelancer Ganesh Popat Sontakke,Jamshedpur|Ranchi,0-5years,270000 - 990000 INR,"Diploma,Degree,B.E,B.TECH,Mechanical Engineer,Diploma Mechanical Engineer.Electrical Engineer,Electronics Engineer Civil Engineer ,Graduation, Production Engineer,Quality Engineer",Diploma|Degree|B.E|B.TECH|MechanicalEngineer|DiplomaMechanicalEngineer.ElectricalEngineer|ElectronicsEngineerCivilEngineer|Graduation|ProductionEngineer|QualityEngineer|
Diploma Mechanical Engineer  hiring in Adani thermal power ranchi   9817953509,Freelancer Ganesh Popat Sontakke,Patna|Giridih,0-2years,270000 - 869999 INR,"Diploma,Degree,B.E,B.TECH,Mechanical Engineer,Diploma Mechanical Engineer.Electrical Engineer,Electronics Engineer Civil Engineer ,Graduation, Production Engineer,Quality Engineer",Diploma|Degree|B.E|B.TECH|MechanicalEngineer|DiplomaMechanicalEngineer.ElectricalEngineer|ElectronicsEngineerCivilEngineer|Graduation|ProductionEngineer|QualityEngineer|
"TATA motoes kharagpur WEST BANGAL Hiring diploma,degree,B.tech,iti,  8607033210",Freelancer Ganesh Popat Sontakke,Durgapur|Bankura,0-5years,270000 - 890000 INR,"Diploma,Degree,B.E,B.TECH,Mechanical Engineer,Diploma Mechanical Engineer.Electrical Engineer,Electronics Engineer Civil Engineer ,Graduation, Production Engineer,Quality Engineer",Diploma|Degree|B.E|B.TECH|MechanicalEngineer|DiplomaMechanicalEngineer.ElectricalEngineer|ElectronicsEngineerCivilEngineer|Graduation|ProductionEngineer|QualityEngineer|
"B.tech,B.e hiring in Adani thermal power ranchi   9817953509",Freelancer Ganesh Popat Sontakke,Patna|Giridih,0-2years,270000 - 869999 INR,dear candidates we are hiring engineers,Diploma|Degree|B.E|B.TECH|MechanicalEngineer|DiplomaMechanicalEngineer.ElectricalEngineer|ElectronicsEngineerCivilEngineer|Graduation|ProductionEngineer|QualityEngineer|
Mechanical Engineer  hiring in adani thermal power pune salary 7419025878,Freelancer Ganesh Popat Sontakke,Pune|Chandrapur,0-5years,270000 - 990000 INR,"Diploma, Degree, B.E, B.TECH, Mechanical Engineer, Diploma Mechanical Engineer, Electrical Engineer, Electronics Engineer , Civil Engineer , Graduation, Production Engineer,Quality Engineer",Diploma|Degree|B.E|B.TECH|MechanicalEngineer|DiplomaMechanicalEngineer.ElectricalEngineer|ElectronicsEngineerCivilEngineer|Graduation|ProductionEngineer|QualityEngineer|
Mechanical Maintenance hiring in adani thermal power pune salary 7419025878,Freelancer Ganesh Popat Sontakke,Kolhapur|Solapur,0-5years,270000 - 990000 INR,"Diploma, Degree, B.E, B.TECH, Mechanical Engineer, Diploma Mechanical Engineer, Electrical Engineer, Electronics Engineer , Civil Engineer , Graduation, Production Engineer,Quality Engineer",Diploma|Degree|B.E|B.TECH|MechanicalEngineer|DiplomaMechanicalEngineer.ElectricalEngineer|ElectronicsEngineerCivilEngineer|Graduation|ProductionEngineer|QualityEngineer|
Production Manager - Australia/Canada,A V Immigration And Careers Consultancy Private Limited,Australia|Canada,9-14years,1600000 - 3000000 INR,"PRODUCTION MANAGERS plan, organise, direct, control and coordinate the production activities of forestry, manufacturing and mining organisations including physical and human resources.",ProductionManager|productionstrategies|ProductionPlanning|ProductionControl|ProductionManagement|
Mechanical Engineering  hiring in Jindal Thermal power angul odisha 7206081769,Freelancer Ganesh Popat Sontakke,Puri|Bhubaneswar,0-4years,90000 - 990000 INR,"Diploma,Degree,B.E,B.TECH,Mechanical Engineer,Diploma Mechanical Engineer.Electrical Engineer,Electronics Engineer Civil Engineer ,Graduation, Production Engineer,Quality Engineer",Diploma|Degree|B.E|B.TECH|MechanicalEngineer|DiplomaMechanicalEngineer.ElectricalEngineer|ElectronicsEngineerCivilEngineer|Graduation|ProductionEngineer|QualityEngineer|
Mechanical Engineering HIRING IN TATA THERMAL POWER Kaling nagar 7056716625,Freelancer Ganesh Popat Sontakke,Allahabad/Prayagraj|Puri,0-4years,270000 - 890000 INR,"Diploma,Degree,B.E,B.TECH,Mechanical Engineer,Diploma Mechanical Engineer.Electrical Engineer,Electronics Engineer Civil Engineer ,Graduation, Production Engineer,Quality Engineer",Diploma|Degree|B.E|B.TECH|MechanicalEngineer|DiplomaMechanicalEngineer.ElectricalEngineer|ElectronicsEngineerCivilEngineer|Graduation|ProductionEngineer|QualityEngineer|
Electrical Engineer hiring in ashok leyland india in rajesthan  7056623257,Freelancer Ganesh Popat Sontakke,Kota|Bikaner,0-4years,270000 - 1090000 INR,"Diploma,Degree,B.E,B.TECH,Mechanical Engineer,Diploma Mechanical Engineer.Electrical Engineer,Electronics Engineer Civil Engineer ,Graduation, Production Engineer,Quality Engineer",Diploma|Degree|B.E|B.TECH|MechanicalEngineer|DiplomaMechanicalEngineer.ElectricalEngineer|ElectronicsEngineerCivilEngineer|Graduation|ProductionEngineer|QualityEngineer|
Manufacturing Executive  call or watsup hr tanya  8866783398,Smart Solution,Ajmer|Lucknow,0-5years,Not Specified,manufacturing exceutive pan india job opening for more details call or @ watsup hr tanya  8866783398,Labour|Packaging|Packers|Packages|jobsalloverindia|JournalEntry|DataProcessing|DataEntry|DataConversion|DataManipilation|Typing|Voice|BackOffice|DataManagement|
Electrical Maintenance Engineer HIRING IN TATA THERMAL POWER Kaling nagar 7056716625,Freelancer Ganesh Popat Sontakke,Sambalpur|Bhubaneswar,0-4years,270000 - 890000 INR,"Diploma,Degree,B.E,B.TECH,Mechanical Engineer,Diploma Mechanical Engineer.Electrical Engineer,Electronics Engineer Civil Engineer ,Graduation, Production Engineer,Quality Engineer",Diploma|Degree|B.E|B.TECH|MechanicalEngineer|DiplomaMechanicalEngineer.ElectricalEngineer|ElectronicsEngineerCivilEngineer|Graduation|ProductionEngineer|QualityEngineer|
Mechanical Engineer hiring  jcb india pune 7206143903,Freelancer Ganesh Popat Sontakke,Akola|Chandrapur,0-2years,270000 - 990000 INR,dear candidates we are hiring engineers,Diploma|Degree|B.E|B.TECH|MechanicalEngineer|DiplomaMechanicalEngineer.ElectricalEngineer|ElectronicsEngineer|CivilEngineer|Graduation|ProductionEngineer|QualityEngineer|
Production Supervisor,Startech Placement Services,Pune,0-1years,180000 - 180000 INR,production Supervisor,ProductionManager|ProductionSupervisor|ProductionEngineer|ProductionExecutive|ProductionIncharge|ProductionOfficer|
Mechanical Engineer  hiring in tata motors west bangal 8607033210,Freelancer Ganesh Popat Sontakke,Kolkata|Haldia,0-5years,270000 - 990000 INR,"Diploma, Degree, B.E, B.TECH, Mechanical Engineer, Diploma Mechanical Engineer, Electrical Engineer, Electronics Engineer , Civil Engineer , Graduation, Production Engineer,Quality Engineer",Diploma|Degree|B.E|B.TECH|MechanicalEngineer|DiplomaMechanicalEngineer.ElectricalEngineer|ElectronicsEngineerCivilEngineer|Graduation|ProductionEngineer|QualityEngineer|
Mechanical Engineer hiring in ashok leyland india in rajesthan 7056623257,Freelancer Ganesh Popat Sontakke,Kota|Bikaner,0-2years,270000 - 1090000 INR,"Diploma,Degree,B.E,B.TECH,Mechanical Engineer,Diploma Mechanical Engineer.Electrical Engineer,Electronics Engineer Civil Engineer ,Graduation, Production Engineer,Quality Engineer",Diploma|Degree|B.E|B.TECH|MechanicalEngineer|DiplomaMechanicalEngineer.ElectricalEngineer|ElectronicsEngineerCivilEngineer|Graduation|ProductionEngineer|QualityEngineer|
"diploma,degree,B.TECH,ITI, hiring  in Adani thermal power RAJESTHAN  9653556145",Freelancer Ganesh Popat Sontakke,Bhilwara|Chittaurgarh,0-4years,270000 - 890000 INR,"Diploma,Degree,B.E,B.TECH,Mechanical Engineer,Diploma Mechanical Engineer.Electrical Engineer,Electronics Engineer Civil Engineer ,Graduation, Production Engineer,Quality Engineer",Diploma|Degree|B.E|B.TECH|MechanicalEngineer|DiplomaMechanicalEngineer.ElectricalEngineer|ElectronicsEngineerCivilEngineer|Graduation|ProductionEngineer|QualityEngineer|
"TATA motoes kharagpur WEST BANGAL Hiring diploma,degree,B.tech,iti,  8607033210",Freelancer Ganesh Popat Sontakke,Kolkata|Kharagpur,0-5years,270000 - 890000 INR,"Diploma,Degree,B.E,B.TECH,Mechanical Engineer,Diploma Mechanical Engineer.Electrical Engineer,Electronics Engineer Civil Engineer ,Graduation, Production Engineer,Quality Engineer",Diploma|Degree|B.E|B.TECH|MechanicalEngineer|DiplomaMechanicalEngineer.ElectricalEngineer|ElectronicsEngineerCivilEngineer|Graduation|ProductionEngineer|QualityEngineer|
Electrical Maintenance Engineer HIRING IN TATA THERMAL POWER Kaling nagar 7056716625,Freelancer Ganesh Popat Sontakke,Sambalpur|Bhubaneswar,0-4years,270000 - 890000 INR,"Diploma,Degree,B.E,B.TECH,Mechanical Engineer,Diploma Mechanical Engineer.Electrical Engineer,Electronics Engineer Civil Engineer ,Graduation, Production Engineer,Quality Engineer",Diploma|Degree|B.E|B.TECH|MechanicalEngineer|DiplomaMechanicalEngineer.ElectricalEngineer|ElectronicsEngineerCivilEngineer|Graduation|ProductionEngineer|QualityEngineer|
"TATA power west bangal hiring diploma,degree,B.tech,iti, 9647964286",Freelancer Ganesh Popat Sontakke,Kolkata|Kharagpur,0-4years,270000 - 990000 INR,dear candidates we are hiring engineers,Diploma|Degree|B.E|B.TECH|MechanicalEngineer|DiplomaMechanicalEngineer.ElectricalEngineer|ElectronicsEngineerCivilEngineer|Graduation|ProductionEngineer|QualityEngineer|
"B.tech, hiring in ashok leyland india in rajesthan  7056623257",Freelancer Ganesh Popat Sontakke,Kota|Bikaner,0-2years,270000 - 1090000 INR,"Diploma,Degree,B.E,B.TECH,Mechanical Engineer,Diploma Mechanical Engineer.Electrical Engineer,Electronics Engineer Civil Engineer ,Graduation, Production Engineer,Quality Engineer",Diploma|Degree|B.E|B.TECH|MechanicalEngineer|DiplomaMechanicalEngineer.ElectricalEngineer|ElectronicsEngineerCivilEngineer|Graduation|ProductionEngineer|QualityEngineer|
"B.tech,B.E  hiring in adani thermal power pune salary 7419025878",Freelancer Ganesh Popat Sontakke,Pune|Chandrapur,0-5years,270000 - 990000 INR,"Diploma, Degree, B.E, B.TECH, Mechanical Engineer, Diploma Mechanical Engineer, Electrical Engineer, Electronics Engineer , Civil Engineer , Graduation, Production Engineer,Quality Engineer",Diploma|Degree|B.E|B.TECH|MechanicalEngineer|DiplomaMechanicalEngineer.ElectricalEngineer|ElectronicsEngineerCivilEngineer|Graduation|ProductionEngineer|QualityEngineer|
Mechanical Engineering  hiring in ashok leyland india in rajesthan 7056623257,Freelancer Ganesh Popat Sontakke,Jaipur|Jaisalmer,0-4years,270000 - 1090000 INR,"Diploma,Degree,B.E,B.TECH,Mechanical Engineer,Diploma Mechanical Engineer.Electrical Engineer,Electronics Engineer Civil Engineer ,Graduation, Production Engineer,Quality Engineer",Diploma|Degree|B.E|B.TECH|MechanicalEngineer|DiplomaMechanicalEngineer.ElectricalEngineer|ElectronicsEngineerCivilEngineer|Graduation|ProductionEngineer|QualityEngineer|
Electrical Engineer hiring in jcb  plants  rajesthan  7082476165,Freelancer Ganesh Popat Sontakke,Kota|Bhilwara,0-2years,270000 - 990000 INR,"Diploma,Degree,B.E,B.TECH,Mechanical Engineer,Diploma Mechanical Engineer.Electrical Engineer,Electronics Engineer Civil Engineer ,Graduation, Production Engineer,Quality Engineer",Diploma|Degree|B.E|B.TECH|MechanicalEngineer|DiplomaMechanicalEngineer.ElectricalEngineer|ElectronicsEngineerCivilEngineer|Graduation|ProductionEngineer|QualityEngineer|
"TATA motoes kharagpur WEST BANGAL Hiring diploma,degree,B.tech,iti,  8607033210",Freelancer Ganesh Popat Sontakke,Kolkata|Kharagpur,0-5years,270000 - 890000 INR,"Diploma,Degree,B.E,B.TECH,Mechanical Engineer,Diploma Mechanical Engineer.Electrical Engineer,Electronics Engineer Civil Engineer ,Graduation, Production Engineer,Quality Engineer",Diploma|Degree|B.E|B.TECH|MechanicalEngineer|DiplomaMechanicalEngineer.ElectricalEngineer|ElectronicsEngineerCivilEngineer|Graduation|ProductionEngineer|QualityEngineer|
Mechanical Engineering  hiring in ashok leyland india in rajesthan 7056623257,Freelancer Ganesh Popat Sontakke,Jaipur|Jaisalmer,0-4years,270000 - 1090000 INR,"Diploma,Degree,B.E,B.TECH,Mechanical Engineer,Diploma Mechanical Engineer.Electrical Engineer,Electronics Engineer Civil Engineer ,Graduation, Production Engineer,Quality Engineer",Diploma|Degree|B.E|B.TECH|MechanicalEngineer|DiplomaMechanicalEngineer.ElectricalEngineer|ElectronicsEngineerCivilEngineer|Graduation|ProductionEngineer|QualityEngineer|
Electrical Engineer hiring in ashok leyland india in rajesthan  7056623257,Freelancer Ganesh Popat Sontakke,Kota|Bikaner,0-2years,270000 - 1090000 INR,"Diploma,Degree,B.E,B.TECH,Mechanical Engineer,Diploma Mechanical Engineer.Electrical Engineer,Electronics Engineer Civil Engineer ,Graduation, Production Engineer,Quality Engineer",Diploma|Degree|B.E|B.TECH|MechanicalEngineer|DiplomaMechanicalEngineer.ElectricalEngineer|ElectronicsEngineerCivilEngineer|Graduation|ProductionEngineer|QualityEngineer|
