jobTitles,Company,jobLocations,requiredExperiance,Salary,JobDescription,SkillsHiring for the Diploma Quality & Production Enggineers,Freelancer Ganesh Popat Sontakke,Mumbai|Pune,2-3years,220000 - 340000 INR,"Administer daily production plans, recommend and authorize adjustments to shift planning when required. Manage production personnel by ensuring that the task in their areas are executed as planned in an efficient way and with the right quality.",AutomobileEngineer|shiftplanning|Q.C|RawMaterial|Diploma|ProductQuality|
"Civil Engineer,Site engineer,Civil engg,Diploma Civil,Site supervisor,7497007381",Ameuro Migration Private Limited,Allahabad/Prayagraj|Lucknow,0-2years,270000 - 990000 INR,"Diploma,Degree,B.E,B.TECH,Mechanical Engineer,Diploma Mechanical Engineer.Electrical Engineer,Electronics Engineer Civil Engineer ,Graduation, Production Engineer,Quality Engineer",Diploma|Degree|B.E|B.TECH|MechanicalEngineer|DiplomaMechanicalEngineer.ElectricalEngineer|ElectronicsEngineerCivilEngineer|Graduation|ProductionEngineer|QualityEngineer|
Requirement of Instrumentation Engineer in Germany,Diraa HR Services,Germany,2-7years,4860000 - 5640000 INR,Contact Ritika 9340964735 |       IELTS not mandatory |       Job Role will be mid-level & entry-level Engineer |       Less time taking and economical process |       Free Medical Facilities |       Can get government allowance |       The spouse can legally work the,InstrumentationEngineer|InstructionalDesign|Production|Manufacturing|QualityControl|
Manual Testing Automation Testing Engineers,Jailaxmi Enterprises,Chennai|Coimbatore,0-5years,Not Specified,Manual Testing Automation Testing Engineers,TestingEngineer|QAAnalyst|QaEngineer|QualityEngineer|SoftwareTesting|Tester|SoftwareTestingEngineer|TestLead|
Hire Electrical /Electronic Engineers,Newzen Infotech,Pune,0-3years,Not Specified,"We have urgent requirement for Electrical / Electronic Engineers. |  Job type :- on roll,full time  |  Required experience :- 0 to 3 year  |  About company :- core sector  |  Required knowledge :- good technical skill",ProductionEngineer|QualityEngineer|MaintenanceEngineer|
Business Analyst - IT,Axs Solutions And Consulting Private Limited,Mumbai,2-5years,Not Specified,Managing the entire product line life cycle from strategic planning to tactical activities. |  Specifying market requirements for current and future products by conducting market research supported by on-going visits to customers and non-customers. |,BusinessAnalyst/ProjectMonitoring/DeliveryManagement/stakeholdermanagement/ProductManagement/BusinessAnalysis/BusinessAnalystManager/QualityAnalyst/QualityAssurance/QualityAnalystengineer|
Hire Mechanical  Engineers Freshers,Jailaxmi Enterprises,Pune,0-1years,Not Specified,"We have urgent requirement for mechanical freshers. |  Job type :- on roll,full time  |  Required Experience ;- 0 to 1year  |  About company :- core automobile sector  |  Required Knowledge :- good communication skill  |",DesignEngineer|ProductionEngineer|QualityEngineer|MaintenanceEngineer|
Requirement of Instrumentation Engineer in Germany,Ameuro Migration Private Limited,Germany,2-7years,4860000 - 5640000 INR,Contact Ritika 9340964735 |      IELTS not mandatory |      Job Role will be mid-level & entry-level Engineer |      Less time taking and economical process |      Free Medical Facilities |      Can get government allowance |      The spouse can legally work there |,InstrumentationEngineer|InstructionalDesign|Production|Manufacturing|QualityControl|
Mechanical Engineer   Hiring in jindal power angul  7206081769,Freelancer Ganesh Popat Sontakke,Rourkela|Sambalpur,0-4years,270000 - 990000 INR,"Diploma,Degree,B.E,B.TECH,Mechanical Engineer,Diploma Mechanical Engineer.Electrical Engineer,Electronics Engineer Civil Engineer ,Graduation, Production Engineer,Quality Engineer",Diploma|Degree|B.E|B.TECH|MechanicalEngineer|DiplomaMechanicalEngineer.ElectricalEngineer|ElectronicsEngineerCivilEngineer|Graduation|ProductionEngineer|QualityEngineer|
Requirement of Instrumentation Engineer in Germany,Ameuro Migration Private Limited,Germany,2-7years,4860000 - 5640000 INR,Contact Ritika 9340964735 |     IELTS not mandatory |     Job Role will be mid-level & entry-level Engineer |     Less time taking and economical process |     Free Medical Facilities |     Can get government allowance |     The spouse can legally work there |,InstrumentationEngineer|InstructionalDesign|Production|Manufacturing|QualityControl|
"Electrical Engineer  hiring diploma ,degree,B.tech,iti,   9653556145",Freelancer Ganesh Popat Sontakke,Patna|Samastipur,0-4years,90000 - 990000 INR,"Diploma,Degree,B.E,B.TECH,Mechanical Engineer,Diploma Mechanical Engineer.Electrical Engineer,Electronics Engineer Civil Engineer ,Graduation, Production Engineer,Quality Engineer",Diploma|Degree|B.E|B.TECH|MechanicalEngineer|DiplomaMechanicalEngineer.ElectricalEngineer|ElectronicsEngineerCivilEngineer|Graduation|ProductionEngineer|QualityEngineer|
Electrical Engineer hiring in L&T india utterpardesh  8059616531,Freelancer Ganesh Popat Sontakke,Kanpur|Varanasi,0-4years,270000 - 1290000 INR,"Diploma,Degree,B.E,B.TECH,Mechanical Engineer,Diploma Mechanical Engineer. Electrical Engineer, Electronics Engineer, Civil Engineer,Graduation ,Production Engineer,Quality Engineer",Diploma|Degree|B.E|B.TECH|MechanicalEngineer|DiplomaMechanicalEngineer.ElectricalEngineer|ElectronicsEngineer|CivilEngineer|Graduation|ProductionEngineer|QualityEngineer|
Diploma Civil Engineer  hiring in L&T all india  salary 25k-75k    8930761653,Freelancer Ganesh Popat Sontakke,Asansol|Durgapur,0-4years,270000 - 1290000 INR,"Diploma,Degree,B.E,B.TECH,Mechanical Engineer,Diploma Mechanical Engineer. Electrical Engineer, Electronics Engineer, Civil Engineer,Graduation ,Production Engineer,Quality Engineer",Diploma|Degree|B.E|B.TECH|MechanicalEngineer|DiplomaMechanicalEngineer.ElectricalEngineer|ElectronicsEngineer|CivilEngineer|Graduation|ProductionEngineer|QualityEngineer|
"DIPLOMA,DEGREE,b.TECH,ITI  hiring in jcb india pune 7206143903",Freelancer Ganesh Popat Sontakke,Gorakhpur|Lucknow,0-5years,270000 - 1290000 INR,"Diploma,Degree,B.E,B.TECH,Mechanical Engineer,Diploma Mechanical Engineer. Electrical Engineer, Electronics Engineer, Civil Engineer,Graduation ,Production Engineer,Quality Engineer",Diploma|Degree|B.E|B.TECH|MechanicalEngineer|DiplomaMechanicalEngineer.ElectricalEngineer|ElectronicsEngineer|CivilEngineer|Graduation|ProductionEngineer|QualityEngineer|
Diploma Fresher hiring in tata motors west bangal 8607033210,Freelancer Ganesh Popat Sontakke,Kolkata|Haldia,0-5years,270000 - 990000 INR,"Diploma, Degree, B.E, B.TECH, Mechanical Engineer, Diploma Mechanical Engineer, Electrical Engineer, Electronics Engineer , Civil Engineer , Graduation, Production Engineer,Quality Engineer",Diploma|Degree|B.E|B.TECH|MechanicalEngineer|DiplomaMechanicalEngineer.ElectricalEngineer|ElectronicsEngineerCivilEngineer|Graduation|ProductionEngineer|QualityEngineer|
Electrical Engineer hiring in ashok leyland india in rajesthan  7056623257,Freelancer Ganesh Popat Sontakke,Jaipur|Bhilwara,0-2years,270000 - 1090000 INR,"Diploma,Degree,B.E,B.TECH,Mechanical Engineer,Diploma Mechanical Engineer.Electrical Engineer,Electronics Engineer Civil Engineer ,Graduation, Production Engineer,Quality Engineer",Diploma|Degree|B.E|B.TECH|MechanicalEngineer|DiplomaMechanicalEngineer.ElectricalEngineer|ElectronicsEngineerCivilEngineer|Graduation|ProductionEngineer|QualityEngineer|
"Diploma ,degree B.tech hiring in jcb  plants  rajesthan  7082476165",Freelancer Ganesh Popat Sontakke,Kota|Bhilwara,0-2years,270000 - 990000 INR,"Diploma,Degree,B.E,B.TECH,Mechanical Engineer,Diploma Mechanical Engineer.Electrical Engineer,Electronics Engineer Civil Engineer ,Graduation, Production Engineer,Quality Engineer",Diploma|Degree|B.E|B.TECH|MechanicalEngineer|DiplomaMechanicalEngineer.ElectricalEngineer|ElectronicsEngineerCivilEngineer|Graduation|ProductionEngineer|QualityEngineer|
Software Development And Engineer in Test,Growing Careers,Chennai,0-1years,Not Specified,Required fresh candidates for Software Development And Engineer in Test,Developer|Q.A.|SoftwareEngineer|Softwaredeveloper|SeniorSoftwareEngineer|SoftwareTester|QualityAssurance|SoftwareTesting|Testing|
"TATA power west bangal 9647964286 hiring diploma degree b.tech,iti, 9647964286",Freelancer Ganesh Popat Sontakke,Kolkata|Haldia,0-5years,80000 - 990000 INR,"Diploma,Degree,B.E,B.TECH,Mechanical Engineer,Diploma Mechanical Engineer.Electrical Engineer,Electronics Engineer Civil Engineer ,Graduation, Production Engineer,Quality Engineer",Diploma|Degree|B.E|B.TECH|MechanicalEngineer|DiplomaMechanicalEngineer.ElectricalEngineer|ElectronicsEngineerCivilEngineer|Graduation|ProductionEngineer|QualityEngineer|
Mechanical Engineer hiring in TATA Motors  plants 7206144199,Freelancer Ganesh Popat Sontakke,Patna|Darbhanga,0-4years,270000 - 1290000 INR,"Diploma,Degree,B.E,B.TECH,Mechanical Engineer,Diploma Mechanical Engineer. Electrical Engineer, Electronics Engineer, Civil Engineer,Graduation ,Production Engineer,Quality Engineer",Diploma|Degree|B.E|B.TECH|MechanicalEngineer|DiplomaMechanicalEngineer.ElectricalEngineer|ElectronicsEngineer|CivilEngineer|Graduation|ProductionEngineer|QualityEngineer|
Mechanical Engineer hiring in adani thermal power pune    7419025878,Freelancer Ganesh Popat Sontakke,Gondia|Aurangabad,0-5years,270000 - 990000 INR,"Diploma, Degree, B.E, B.TECH, Mechanical Engineer, Diploma Mechanical Engineer, Electrical Engineer, Electronics Engineer , Civil Engineer , Graduation, Production Engineer,Quality Engineer",Diploma|Degree|B.E|B.TECH|MechanicalEngineer|DiplomaMechanicalEngineer.ElectricalEngineer|ElectronicsEngineerCivilEngineer|Graduation|ProductionEngineer|QualityEngineer|
Production Engineer hiring in jcb india pune salary  18k -85k 7206143903,Freelancer Ganesh Popat Sontakke,Pune|Gondia,0-2years,Not Specified,"Diploma,Degree,B.E,B.TECH,Mechanical Engineer,Diploma Mechanical Engineer.Electrical Engineer,Electronics Engineer Civil Engineer ,Graduation, Production Engineer,Quality Engineer",Diploma|Degree|B.E|B.TECH|MechanicalEngineer|DiplomaMechanicalEngineer.ElectricalEngineer|ElectronicsEngineerCivilEngineer|Graduation|ProductionEngineer|QualityEngineer|
Top MNC Urgent Required Software Testing Engineer,Career Mantra Management Services,Mumbai|Pune,0-3years,240000 - 600000 INR,Post : Software testing |   Salary : Upto 6 L.P.A |   Job Location : Pune |   Interested Candidate Apply Here |   Call 9075293451 HR Neha,TestingEngineer|QAAnalyst|SoftwareTestEngineer|SoftwareEngineer|SoftwareTestingEngineer|QaEngineer|QualityEngineer|TestLead|SoftwareTesting|Tester|SoftwareTesting|ManualTesting|Automationtesting|TestEngineer|SoftwareQualityAssurance|
Mechanical Engineer  Hiring in jindal power angul  7206081769,Freelancer Ganesh Popat Sontakke,Rourkela|Sambalpur,0-4years,270000 - 990000 INR,"Diploma,Degree,B.E,B.TECH,Mechanical Engineer,Diploma Mechanical Engineer.Electrical Engineer,Electronics Engineer Civil Engineer ,Graduation, Production Engineer,Quality Engineer",Diploma|Degree|B.E|B.TECH|MechanicalEngineer|DiplomaMechanicalEngineer.ElectricalEngineer|ElectronicsEngineerCivilEngineer|Graduation|ProductionEngineer|QualityEngineer|
Mechanical Maintenance hiring in TATA power west bangal 9647964286,Freelancer Ganesh Popat Sontakke,Kolkata|Kharagpur,0-5years,80000 - 990000 INR,"Diploma,Degree,B.E,B.TECH,Mechanical Engineer,Diploma Mechanical Engineer.Electrical Engineer,Electronics Engineer Civil Engineer ,Graduation, Production Engineer,Quality Engineer",Diploma|Degree|B.E|B.TECH|MechanicalEngineer|DiplomaMechanicalEngineer.ElectricalEngineer|ElectronicsEngineerCivilEngineer|Graduation|ProductionEngineer|QualityEngineer|
Mechanical Engineer hiring in TATA Motors pune plants 7206144199,Freelancer Ganesh Popat Sontakke,Patna|Darbhanga,0-4years,270000 - 1290000 INR,"Diploma,Degree,B.E,B.TECH,Mechanical Engineer,Diploma Mechanical Engineer. Electrical Engineer, Electronics Engineer, Civil Engineer,Graduation ,Production Engineer,Quality Engineer",Diploma|Degree|B.E|B.TECH|MechanicalEngineer|DiplomaMechanicalEngineer.ElectricalEngineer|ElectronicsEngineer|CivilEngineer|Graduation|ProductionEngineer|QualityEngineer|
"L&T india utterpardesh hiring diploma ,degree,B.tech,iti,  8059616531",Freelancer Ganesh Popat Sontakke,Kanpur|Lucknow,0-5years,270000 - 1290000 INR,"Diploma,Degree,B.E,B.TECH,Mechanical Engineer,Diploma Mechanical Engineer. Electrical Engineer, Electronics Engineer, Civil Engineer,Graduation ,Production Engineer,Quality Engineer",Diploma|Degree|B.E|B.TECH|MechanicalEngineer|DiplomaMechanicalEngineer.ElectricalEngineer|ElectronicsEngineer|CivilEngineer|Graduation|ProductionEngineer|QualityEngineer|
Mechanical Engineer hiring in ashok leyland india in rajesthan  7056623257,Freelancer Ganesh Popat Sontakke,Bikaner|Chittaurgarh,0-2years,270000 - 1090000 INR,"Diploma,Degree,B.E,B.TECH,Mechanical Engineer,Diploma Mechanical Engineer.Electrical Engineer,Electronics Engineer Civil Engineer ,Graduation, Production Engineer,Quality Engineer",Diploma|Degree|B.E|B.TECH|MechanicalEngineer|DiplomaMechanicalEngineer.ElectricalEngineer|ElectronicsEngineerCivilEngineer|Graduation|ProductionEngineer|QualityEngineer|
"B.tech,diploma,degree,iti,  hiring in jcb  plants  rajesthan  7082476165",Freelancer Ganesh Popat Sontakke,Kota|Bhilwara,0-2years,270000 - 990000 INR,"Diploma,Degree,B.E,B.TECH,Mechanical Engineer,Diploma Mechanical Engineer.Electrical Engineer,Electronics Engineer Civil Engineer ,Graduation, Production Engineer,Quality Engineer",Diploma|Degree|B.E|B.TECH|MechanicalEngineer|DiplomaMechanicalEngineer.ElectricalEngineer|ElectronicsEngineerCivilEngineer|Graduation|ProductionEngineer|QualityEngineer|
"B.tech,diploma,degree,iti,  hiring in jcb  plants  rajesthan  7082476165",Freelancer Ganesh Popat Sontakke,Kota|Bhilwara,0-2years,270000 - 990000 INR,"Diploma,Degree,B.E,B.TECH,Mechanical Engineer,Diploma Mechanical Engineer.Electrical Engineer,Electronics Engineer Civil Engineer ,Graduation, Production Engineer,Quality Engineer",Diploma|Degree|B.E|B.TECH|MechanicalEngineer|DiplomaMechanicalEngineer.ElectricalEngineer|ElectronicsEngineerCivilEngineer|Graduation|ProductionEngineer|QualityEngineer|
TATA Motors pune plants hiring diploma degree b.tech  7206144199,Freelancer Ganesh Popat Sontakke,Nasik|Gondia,0-4years,270000 - 1290000 INR,"Diploma,Degree,B.E,B.TECH,Mechanical Engineer,Diploma Mechanical Engineer. Electrical Engineer, Electronics Engineer, Civil Engineer,Graduation ,Production Engineer,Quality Engineer",Diploma|Degree|B.E|B.TECH|MechanicalEngineer|DiplomaMechanicalEngineer.ElectricalEngineer|ElectronicsEngineer|CivilEngineer|Graduation|ProductionEngineer|QualityEngineer|
"TATA power west bangal 9647964286 hiring diploma degree b.tech,iti, 9647964286",Freelancer Ganesh Popat Sontakke,Hooghly|Howrah,0-5years,80000 - 990000 INR,"Diploma,Degree,B.E,B.TECH,Mechanical Engineer,Diploma Mechanical Engineer.Electrical Engineer,Electronics Engineer Civil Engineer ,Graduation, Production Engineer,Quality Engineer",Diploma|Degree|B.E|B.TECH|MechanicalEngineer|DiplomaMechanicalEngineer.ElectricalEngineer|ElectronicsEngineerCivilEngineer|Graduation|ProductionEngineer|QualityEngineer|
Electrical Engineer / Electronics Engineer,The NaukriWala,Pune|Nagpur,0-2years,180000 - 200000 INR,Requirement for the position of Production / Quality Engineer.,ElectricalEngineer|ElectronicsEngineer|ProductionEngineer|QualityEngineer|
"L&T india utterpardesh hiring diploma ,degree,B.tech,iti,  8059616531",Freelancer Ganesh Popat Sontakke,Allahabad/Prayagraj|Gorakhpur,0-5years,270000 - 1290000 INR,"Diploma,Degree,B.E,B.TECH,Mechanical Engineer,Diploma Mechanical Engineer. Electrical Engineer, Electronics Engineer, Civil Engineer,Graduation ,Production Engineer,Quality Engineer",Diploma|Degree|B.E|B.TECH|MechanicalEngineer|DiplomaMechanicalEngineer.ElectricalEngineer|ElectronicsEngineer|CivilEngineer|Graduation|ProductionEngineer|QualityEngineer|
Civil Engineer   hiring in L&T west bangal     8930761653,Freelancer Ganesh Popat Sontakke,Haldia|Kharagpur,0-2years,270000 - 1290000 INR,"Diploma,Degree,B.E,B.TECH,Mechanical Engineer,Diploma Mechanical Engineer. Electrical Engineer, Electronics Engineer, Civil Engineer,Graduation ,Production Engineer,Quality Engineer",Diploma|Degree|B.E|B.TECH|MechanicalEngineer|DiplomaMechanicalEngineer.ElectricalEngineer|ElectronicsEngineer|CivilEngineer|Graduation|ProductionEngineer|QualityEngineer|
Mechanical Engineer  hiring in L&T india utterpardesh  8059616531,Freelancer Ganesh Popat Sontakke,Kanpur|Varanasi,0-4years,270000 - 1290000 INR,"Diploma,Degree,B.E,B.TECH,Mechanical Engineer,Diploma Mechanical Engineer. Electrical Engineer, Electronics Engineer, Civil Engineer,Graduation ,Production Engineer,Quality Engineer",Diploma|Degree|B.E|B.TECH|MechanicalEngineer|DiplomaMechanicalEngineer.ElectricalEngineer|ElectronicsEngineer|CivilEngineer|Graduation|ProductionEngineer|QualityEngineer|
Mechanical Engineer  Hiring in jindal power angul  7206081769,Freelancer Ganesh Popat Sontakke,Rourkela|Sambalpur,0-4years,270000 - 990000 INR,"Diploma,Degree,B.E,B.TECH,Mechanical Engineer,Diploma Mechanical Engineer.Electrical Engineer,Electronics Engineer Civil Engineer ,Graduation, Production Engineer,Quality Engineer",Diploma|Degree|B.E|B.TECH|MechanicalEngineer|DiplomaMechanicalEngineer.ElectricalEngineer|ElectronicsEngineerCivilEngineer|Graduation|ProductionEngineer|QualityEngineer|
"Adani thermal power ranchi hiring diploma,degree,B.tech,iti,  9817953509",Freelancer Ganesh Popat Sontakke,Dhanbad|Ranchi,0-2years,270000 - 869999 INR,"Diploma,Degree,B.E,B.TECH,Mechanical Engineer,Diploma Mechanical Engineer.Electrical Engineer,Electronics Engineer Civil Engineer ,Graduation, Production Engineer,Quality Engineer",Diploma|Degree|B.E|B.TECH|MechanicalEngineer|DiplomaMechanicalEngineer.ElectricalEngineer|ElectronicsEngineerCivilEngineer|Graduation|ProductionEngineer|QualityEngineer|
TATA Motors pune plants hiring diploma degree b.tech  7206144199,Freelancer Ganesh Popat Sontakke,Patna|Darbhanga,0-4years,270000 - 1290000 INR,"Diploma,Degree,B.E,B.TECH,Mechanical Engineer,Diploma Mechanical Engineer. Electrical Engineer, Electronics Engineer, Civil Engineer,Graduation ,Production Engineer,Quality Engineer",Diploma|Degree|B.E|B.TECH|MechanicalEngineer|DiplomaMechanicalEngineer.ElectricalEngineer|ElectronicsEngineer|CivilEngineer|Graduation|ProductionEngineer|QualityEngineer|
Electrical Engineer  Hiring in jindal power angul  7206081769,Freelancer Ganesh Popat Sontakke,Rourkela|Sambalpur,0-4years,270000 - 990000 INR,"Diploma,Degree,B.E,B.TECH,Mechanical Engineer,Diploma Mechanical Engineer.Electrical Engineer,Electronics Engineer Civil Engineer ,Graduation, Production Engineer,Quality Engineer",Diploma|Degree|B.E|B.TECH|MechanicalEngineer|DiplomaMechanicalEngineer.ElectricalEngineer|ElectronicsEngineerCivilEngineer|Graduation|ProductionEngineer|QualityEngineer|
Mechanical Engineer hiring in ashok leyland india in rajesthan  7056623257,Freelancer Ganesh Popat Sontakke,Jaipur|Jaisalmer,0-2years,270000 - 1090000 INR,"Diploma,Degree,B.E,B.TECH,Mechanical Engineer,Diploma Mechanical Engineer.Electrical Engineer,Electronics Engineer Civil Engineer ,Graduation, Production Engineer,Quality Engineer",Diploma|Degree|B.E|B.TECH|MechanicalEngineer|DiplomaMechanicalEngineer.ElectricalEngineer|ElectronicsEngineerCivilEngineer|Graduation|ProductionEngineer|QualityEngineer|
Mechanical Engineer hiring in Adani thermal power   9653556145,Freelancer Ganesh Popat Sontakke,Bengaluru/Bangalore|Belgaum,0-4years,90000 - 990000 INR,"Diploma,Degree,B.E,B.TECH,Mechanical Engineer,Diploma Mechanical Engineer.Electrical Engineer,Electronics Engineer Civil Engineer ,Graduation, Production Engineer,Quality Engineer",Diploma|Degree|B.E|B.TECH|MechanicalEngineer|DiplomaMechanicalEngineer.ElectricalEngineer|ElectronicsEngineerCivilEngineer|Graduation|ProductionEngineer|QualityEngineer|
"ashok leyland india in rajesthan  hiring diploma,degree,b.tech,iti, 7056623257",Freelancer Ganesh Popat Sontakke,Bikaner|Chittaurgarh,0-2years,270000 - 1090000 INR,"Diploma,Degree,B.E,B.TECH,Mechanical Engineer,Diploma Mechanical Engineer.Electrical Engineer,Electronics Engineer Civil Engineer ,Graduation, Production Engineer,Quality Engineer",Diploma|Degree|B.E|B.TECH|MechanicalEngineer|DiplomaMechanicalEngineer.ElectricalEngineer|ElectronicsEngineerCivilEngineer|Graduation|ProductionEngineer|QualityEngineer|
"adani thermal power madhey pardesh hiring diploma,degree,B.tech,iti,    7419025878",Freelancer Ganesh Popat Sontakke,Gondia|Aurangabad,0-5years,270000 - 990000 INR,"Diploma, Degree, B.E, B.TECH, Mechanical Engineer, Diploma Mechanical Engineer, Electrical Engineer, Electronics Engineer , Civil Engineer , Graduation, Production Engineer,Quality Engineer",Diploma|Degree|B.E|B.TECH|MechanicalEngineer|DiplomaMechanicalEngineer.ElectricalEngineer|ElectronicsEngineerCivilEngineer|Graduation|ProductionEngineer|QualityEngineer|
Mechanical Engineering HIRING IN TATA THERMAL POWER Kaling nagar 7056716625,Freelancer Ganesh Popat Sontakke,Allahabad/Prayagraj|Puri,0-4years,270000 - 890000 INR,"Diploma,Degree,B.E,B.TECH,Mechanical Engineer,Diploma Mechanical Engineer.Electrical Engineer,Electronics Engineer Civil Engineer ,Graduation, Production Engineer,Quality Engineer",Diploma|Degree|B.E|B.TECH|MechanicalEngineer|DiplomaMechanicalEngineer.ElectricalEngineer|ElectronicsEngineerCivilEngineer|Graduation|ProductionEngineer|QualityEngineer|
Mechanical Maintenance hiring in TATA power west bangal 9647964286,Freelancer Ganesh Popat Sontakke,Kolkata|Kharagpur,0-5years,80000 - 990000 INR,"Diploma,Degree,B.E,B.TECH,Mechanical Engineer,Diploma Mechanical Engineer.Electrical Engineer,Electronics Engineer Civil Engineer ,Graduation, Production Engineer,Quality Engineer",Diploma|Degree|B.E|B.TECH|MechanicalEngineer|DiplomaMechanicalEngineer.ElectricalEngineer|ElectronicsEngineerCivilEngineer|Graduation|ProductionEngineer|QualityEngineer|
"Diploma,Degree,B.E,B.TECH, Hiring in jindal power angul  7206081769",Freelancer Ganesh Popat Sontakke,Rourkela|Sambalpur,0-4years,270000 - 990000 INR,"Diploma,Degree,B.E,B.TECH,Mechanical Engineer,Diploma Mechanical Engineer.Electrical Engineer,Electronics Engineer Civil Engineer ,Graduation, Production Engineer,Quality Engineer",Diploma|Degree|B.E|B.TECH|MechanicalEngineer|DiplomaMechanicalEngineer.ElectricalEngineer|ElectronicsEngineerCivilEngineer|Graduation|ProductionEngineer|QualityEngineer|
B.Tech hiring in Adani thermal power ranchi   9817953509,Freelancer Ganesh Popat Sontakke,Dhanbad|Ranchi,0-2years,270000 - 869999 INR,"Diploma,Degree,B.E,B.TECH,Mechanical Engineer,Diploma Mechanical Engineer.Electrical Engineer,Electronics Engineer Civil Engineer ,Graduation, Production Engineer,Quality Engineer",Diploma|Degree|B.E|B.TECH|MechanicalEngineer|DiplomaMechanicalEngineer.ElectricalEngineer|ElectronicsEngineerCivilEngineer|Graduation|ProductionEngineer|QualityEngineer|
Electrical Engineer  Hiring in jindal power angul  7206081769,Freelancer Ganesh Popat Sontakke,Rourkela|Sambalpur,0-4years,270000 - 990000 INR,"Diploma,Degree,B.E,B.TECH,Mechanical Engineer,Diploma Mechanical Engineer.Electrical Engineer,Electronics Engineer Civil Engineer ,Graduation, Production Engineer,Quality Engineer",Diploma|Degree|B.E|B.TECH|MechanicalEngineer|DiplomaMechanicalEngineer.ElectricalEngineer|ElectronicsEngineerCivilEngineer|Graduation|ProductionEngineer|QualityEngineer|
Electrical Engineer  Hiring in jindal power angul  7206081769,Freelancer Ganesh Popat Sontakke,Rourkela|Sambalpur,0-4years,270000 - 990000 INR,"Diploma,Degree,B.E,B.TECH,Mechanical Engineer,Diploma Mechanical Engineer.Electrical Engineer,Electronics Engineer Civil Engineer ,Graduation, Production Engineer,Quality Engineer",Diploma|Degree|B.E|B.TECH|MechanicalEngineer|DiplomaMechanicalEngineer.ElectricalEngineer|ElectronicsEngineerCivilEngineer|Graduation|ProductionEngineer|QualityEngineer|
Mechanical Engineer  Hiring in jindal power angul  7206081769,Freelancer Ganesh Popat Sontakke,Rourkela|Sambalpur,0-4years,270000 - 990000 INR,"Diploma,Degree,B.E,B.TECH,Mechanical Engineer,Diploma Mechanical Engineer.Electrical Engineer,Electronics Engineer Civil Engineer ,Graduation, Production Engineer,Quality Engineer",Diploma|Degree|B.E|B.TECH|MechanicalEngineer|DiplomaMechanicalEngineer.ElectricalEngineer|ElectronicsEngineerCivilEngineer|Graduation|ProductionEngineer|QualityEngineer|
"L&T all india  hiring diploma,degree,B.tech,iti  salary 25k-75k 8930761653",Freelancer Ganesh Popat Sontakke,Asansol|Haldia,0-4years,270000 - 1290000 INR,"Diploma,Degree,B.E,B.TECH,Mechanical Engineer,Diploma Mechanical Engineer. Electrical Engineer, Electronics Engineer, Civil Engineer,Graduation ,Production Engineer,Quality Engineer",Diploma|Degree|B.E|B.TECH|MechanicalEngineer|DiplomaMechanicalEngineer.ElectricalEngineer|ElectronicsEngineer|CivilEngineer|Graduation|ProductionEngineer|QualityEngineer|
Mechanical Engineer hiring in jcb india pune salary  18k -85k 7206143903,Freelancer Ganesh Popat Sontakke,Ahmednagar|Chandrapur,0-2years,Not Specified,"Diploma,Degree,B.E,B.TECH,Mechanical Engineer,Diploma Mechanical Engineer.Electrical Engineer,Electronics Engineer Civil Engineer ,Graduation, Production Engineer,Quality Engineer",Diploma|Degree|B.E|B.TECH|MechanicalEngineer|DiplomaMechanicalEngineer.ElectricalEngineer|ElectronicsEngineerCivilEngineer|Graduation|ProductionEngineer|QualityEngineer|
