jobTitles,Company,jobLocations,requiredExperiance,Salary,JobDescription,Skillsjob opening for Hardware engineer job& networking Engineer fresher job Mumbai 7208456718,The NaukriWala,MumbaiCity|NaviMumbai|Thane,0-2years,Not Specified,job opening for Hardware engineer job& networking Engineer fresher job Mumbai 7208456718,Freshers|HardwareTroubleshooting|HardwareAssembling|HardwareInstallation|NetworkEngineer|
AEM Tester,Diraa HR Services,Bengaluru/Bangalore,4-6years,370000 - 550000 INR,Looking for AEM Tester,AutomationTesting|Qtp|ManualTesting|PerformanceTesting|SoftwareTesting|QTPTesting|
REQUIRED ELECTRONICS ENGINEER,Jailaxmi Enterprises,Mumbai|MumbaiCity|NaviMumbai|Thane,0-5years,210000 - 330000 INR,QUALIFICATION-DIPLOMA /BE ELECTRONICS /TELECOMMUNICATION.  |  EXP- FRESHER TO 5 YEARS EXP. |   |  POST-QUALITY |  PRODUCTION |  SITE /PROJECT |  PCB DESIGN |  SERVICE AND MAINTENANCE  |  SALARY- 15-25K |   |  CALL- 7021684442/9167875089 |,ElectronicsEngineer|BEELECTRONICS/DIPLOMAELECTRONICS|QualityControl|ProductionManager|Manufacturing|TraineeEngineer|ProductionSupervisor|ProductionEngineer|ProductionOfficer|ProductionExecutive|ProductionIncharge|
QA Engineer * in our Manufacturing company,Prosperspective Hr Solutions LLP,Delhi|Pune,5-10years,Not Specified,"We have an urgent opening for * Sr.  QA Engineer * in our Manufacturing company at Askhed, pune |   |  1. Diploma/BE |   |  2. 6 to 7 years of experience. |   |  3. Job location: Askhed, Pune |   |  4.	Salary Range: 35 to 40k  |   |  5.	Joining – Immediate    |   contact 8002551517 |",MechanicalEngineer|ElectricalEngineer|Electrical|DiplomaMechanical|Mechanicaldesignengineer|
Electrical Engineer / Electronics Engineer,Cloud Visa Immigration LLP,Pune|Nagpur,0-2years,180000 - 200000 INR,Requirement for the position of Production / Quality Engineer.,ElectricalEngineer|ElectronicsEngineer|ProductionEngineer|QualityEngineer|
Mechanical Quality Engineer,Shalitin Immigrations LLP,Pune,0-3years,160000 - 310000 INR,Requirement for the position of Quality Engineer.,QualityControl|Inspection|Qc|QualityAssurance|Testing|
QC Inspector,Jailaxmi Enterprises,Coimbatore,2-5years,Not Specified,"Quality control specialists work in a variety of industries, from manufacturing to food production, and are responsible for checking outgoing products to ensure that they are free of defects and produced according to internal specifications and exter",QualityInspector|
Hire Quality Engineers,Jailaxmi Enterprises,Pune,0-4years,Not Specified,"We have urgent requirement for Quality engineers . |  Job type :- on roll,full time  |  Required Experience :- 0 to 4 year  |  About Company :- core automobile sector",QualityControl|QualityAssurance|QualityExecutive|QualityEngineer|
Hardware Tester / PCB Tester,Sourcetal Hiretech,Pune,0-1years,Not Specified,Individuals with Diploma or B Tech in Electronics with hands on experience in Printed circuit board assembly. PCB assembly engineering leader should have zeal to learn assembling of complex and fine pitch components in the PCB.,DiplomaInElectrical|
Quality Manager Required in Abroad,Jailaxmi Enterprises,Canada|NewZealand,4-9years,4500000 - 5500000 INR,"Call & whats app to pooja-9311529770 |   |  The Quality Manager, or Quality Assurance Manager, will inspect the final product to make sure it has been built with compliance to legal standards and meets customer expectations.",QualityControl|Qualityauditor|Qualitycontrol|QualityAnalyst|Qualityassurance|QualityEngineer|
Hire Quality Engineer,Infomedia Solutions And Consultant,Pune,0-4years,190000 - 370000 INR,"We have urgent requirement for Quality Engineer |   job type- On roll,full time. |   experience:-0 to 4 year. |   About company:- core automobile sector |   If any other information contact  us to:-9890065728",QualityControl|InprocessQuality|QualityEngineer|QualityAssurance|QualityInspector|
Opening For Mechanical Engineer/Automobile/Designer Engineer Job (Fresher) 9152092013,Diraa HR Services,Mumbai|MumbaiCity|NaviMumbai|Thane,0-1years,Not Specified,Opening For Mechanical Engineer/Automobile/Designer Engineer Job (Fresher) 9152092013 |  MUMBAI/NAVI MUMBAI/THANE |  FRESHER CAN APPLY |  SSC/HSC BOTH CAN APPLY |  CALL NOW:-HR AISHA 9152092013 |,OpeningForMechanicalEngineer/Automobile/DesignerEngineerJob(Fresher)9152092013|
B.E MECH-QC-2-4  YRS EXPERIENCE,Freelancer Ganesh Popat Sontakke,Coimbatore,2-4years,Not Specified,The candidate must involve in the process through which a business seeks to ensure that product quality is maintained or improved.,QCEngineers|
TRAINEE ENGR -PRODUCTION/QUALITY -FRESHER,Freelancer Ganesh Popat Sontakke,Mumbai|MumbaiCity|NaviMumbai|Thane,0-4years,Not Specified,TRAINEE ENGR -PRODUCTION/QUALITY -FRESHER |       Qualification:ITI/ DIPLOMA IN MECHANICAL ENGINEERING Experience:FRESHER/1 to 5yrs In production/quality  |       knowledge of autocad reqd,Production|MECHANICAL|Quality|
Electrical Engineer hiring in jcb all india plants  7082476165,Freelancer Ganesh Popat Sontakke,Kota|Chittaurgarh,0-5years,270000 - 990000 INR,"Diploma, Degree, B.E, B.TECH, Mechanical Engineer, Diploma Mechanical Engineer, Electrical Engineer, Electronics Engineer , Civil Engineer , Graduation, Production Engineer,Quality Engineer",Diploma|Degree|B.E|B.TECH|MechanicalEngineer|DiplomaMechanicalEngineer.ElectricalEngineer|ElectronicsEngineerCivilEngineer|Graduation|ProductionEngineer|QualityEngineer|
Civil Engineer  hiring in L&T all india  salary 25k-75k    8930761653,Freelancer Ganesh Popat Sontakke,Durgapur|Bhubaneswar,0-4years,270000 - 1290000 INR,"Diploma,Degree,B.E,B.TECH,Mechanical Engineer,Diploma Mechanical Engineer. Electrical Engineer, Electronics Engineer, Civil Engineer,Graduation ,Production Engineer,Quality Engineer",Diploma|Degree|B.E|B.TECH|MechanicalEngineer|DiplomaMechanicalEngineer.ElectricalEngineer|ElectronicsEngineer|CivilEngineer|Graduation|ProductionEngineer|QualityEngineer|
Mechanical Engineer hiring in TATA thermal power west Bangal 9647964286,Freelancer Ganesh Popat Sontakke,Puri|Sambalpur,0-4years,270000 - 1290000 INR,"Diploma,Degree,B.E,B.TECH,Mechanical Engineer,Diploma Mechanical Engineer. Electrical Engineer, Electronics Engineer, Civil Engineer,Graduation ,Production Engineer,Quality Engineer",Diploma|Degree|B.E|B.TECH|MechanicalEngineer|DiplomaMechanicalEngineer.ElectricalEngineer|ElectronicsEngineer|CivilEngineer|Graduation|ProductionEngineer|QualityEngineer|
Diploma Engineering  hiring in Jindal Thermal power angul odisha 7206081769,Jailaxmi Enterprises,Rourkela|Baripada,0-4years,90000 - 990000 INR,"Diploma,Degree,B.E,B.TECH,Mechanical Engineer,Diploma Mechanical Engineer.Electrical Engineer,Electronics Engineer Civil Engineer ,Graduation, Production Engineer,Quality Engineer",Diploma|Degree|B.E|B.TECH|MechanicalEngineer|DiplomaMechanicalEngineer.ElectricalEngineer|ElectronicsEngineerCivilEngineer|Graduation|ProductionEngineer|QualityEngineer|
"adani thermal power madhey pardesh hiring diploma,degree,B.tech,iti,    7419025878",Freelancer Ganesh Popat Sontakke,Gondia|Aurangabad,0-5years,270000 - 990000 INR,"Diploma, Degree, B.E, B.TECH, Mechanical Engineer, Diploma Mechanical Engineer, Electrical Engineer, Electronics Engineer , Civil Engineer , Graduation, Production Engineer,Quality Engineer",Diploma|Degree|B.E|B.TECH|MechanicalEngineer|DiplomaMechanicalEngineer.ElectricalEngineer|ElectronicsEngineerCivilEngineer|Graduation|ProductionEngineer|QualityEngineer|
Opening For Electrical /Electronic Engineers,Freelancer Ganesh Popat Sontakke,Pune,0-4years,Not Specified,"We have urgent Requirement for Electrical / Electronic engineers. |  Job type :- on roll,full time  |  Required Experience :- 0 to 4 year  |  About company :- core  sector  |  Required knowledge :- good technical skill",ProductionEngineer|QualityEngineer|MaintenanceEngineer|
Mechanical Engineer   Hiring in jindal power angul  7206081769,Freelancer Ganesh Popat Sontakke,Kolkata|Durgapur,0-4years,270000 - 990000 INR,"Diploma,Degree,B.E,B.TECH,Mechanical Engineer,Diploma Mechanical Engineer.Electrical Engineer,Electronics Engineer Civil Engineer ,Graduation, Production Engineer,Quality Engineer",Diploma|Degree|B.E|B.TECH|MechanicalEngineer|DiplomaMechanicalEngineer.ElectricalEngineer|ElectronicsEngineerCivilEngineer|Graduation|ProductionEngineer|QualityEngineer|
Mechanical Engineer hiring  TATA motoes kharagpur WEST BANGAL 8607033210,Freelancer Ganesh Popat Sontakke,Kolkata|Kharagpur,0-5years,270000 - 890000 INR,"Diploma,Degree,B.E,B.TECH,Mechanical Engineer,Diploma Mechanical Engineer.Electrical Engineer,Electronics Engineer Civil Engineer ,Graduation, Production Engineer,Quality Engineer",Diploma|Degree|B.E|B.TECH|MechanicalEngineer|DiplomaMechanicalEngineer.ElectricalEngineer|ElectronicsEngineerCivilEngineer|Graduation|ProductionEngineer|QualityEngineer|
Electrical Engineer  hiring in Adani thermal power ranchi   9817953509,Freelancer Ganesh Popat Sontakke,Jamnagar|BokaroSteelCity,0-2years,270000 - 869999 INR,"Diploma,Degree,B.E,B.TECH,Mechanical Engineer,Diploma Mechanical Engineer.Electrical Engineer,Electronics Engineer Civil Engineer ,Graduation, Production Engineer,Quality Engineer",Diploma|Degree|B.E|B.TECH|MechanicalEngineer|DiplomaMechanicalEngineer.ElectricalEngineer|ElectronicsEngineerCivilEngineer|Graduation|ProductionEngineer|QualityEngineer|
Mechanical Engineer  hiring in Adani thermal power ranchi   9817953509,Freelancer Ganesh Popat Sontakke,Ranchi|Deoghar,0-4years,270000 - 1290000 INR,"Diploma,Degree,B.E,B.TECH,Mechanical Engineer,Diploma Mechanical Engineer. Electrical Engineer, Electronics Engineer, Civil Engineer,Graduation ,Production Engineer,Quality Engineer",Diploma|Degree|B.E|B.TECH|MechanicalEngineer|DiplomaMechanicalEngineer.ElectricalEngineer|ElectronicsEngineer|CivilEngineer|Graduation|ProductionEngineer|QualityEngineer|
Electrical Engineer hiring in jcb all india plants  7082476165,Freelancer Ganesh Popat Sontakke,Kota|Chittaurgarh,0-5years,270000 - 990000 INR,"Diploma, Degree, B.E, B.TECH, Mechanical Engineer, Diploma Mechanical Engineer, Electrical Engineer, Electronics Engineer , Civil Engineer , Graduation, Production Engineer,Quality Engineer",Diploma|Degree|B.E|B.TECH|MechanicalEngineer|DiplomaMechanicalEngineer.ElectricalEngineer|ElectronicsEngineerCivilEngineer|Graduation|ProductionEngineer|QualityEngineer|
Mechanical Maintenance hiring in TATA Motors pune plants 7206144199,Freelancer Ganesh Popat Sontakke,Hooghly|Howrah,0-4years,270000 - 1290000 INR,"Diploma,Degree,B.E,B.TECH,Mechanical Engineer,Diploma Mechanical Engineer. Electrical Engineer, Electronics Engineer, Civil Engineer,Graduation ,Production Engineer,Quality Engineer",Diploma|Degree|B.E|B.TECH|MechanicalEngineer|DiplomaMechanicalEngineer.ElectricalEngineer|ElectronicsEngineer|CivilEngineer|Graduation|ProductionEngineer|QualityEngineer|
Mechanical Engineer  hiring in TATA Motors west bangal plants 7206144199,Freelancer Ganesh Popat Sontakke,Darjeeling|Jalpaiguri,0-5years,270000 - 1290000 INR,"Diploma,Degree,B.E,B.TECH,Mechanical Engineer,Diploma Mechanical Engineer. Electrical Engineer, Electronics Engineer, Civil Engineer,Graduation ,Production Engineer,Quality Engineer",Diploma|Degree|B.E|B.TECH|MechanicalEngineer|DiplomaMechanicalEngineer.ElectricalEngineer|ElectronicsEngineer|CivilEngineer|Graduation|ProductionEngineer|QualityEngineer|
Mechanical Engineer hiring in ashok leyland india in rajesthan  7056623257,Freelancer Ganesh Popat Sontakke,Jaipur|Jaisalmer,0-2years,270000 - 1090000 INR,"Diploma,Degree,B.E,B.TECH,Mechanical Engineer,Diploma Mechanical Engineer.Electrical Engineer,Electronics Engineer Civil Engineer ,Graduation, Production Engineer,Quality Engineer",Diploma|Degree|B.E|B.TECH|MechanicalEngineer|DiplomaMechanicalEngineer.ElectricalEngineer|ElectronicsEngineerCivilEngineer|Graduation|ProductionEngineer|QualityEngineer|
Civil Engineer   hiring in L&T west bangal     8930761653,Freelancer Ganesh Popat Sontakke,MumbaiCity|NaviMumbai,0-2years,270000 - 1290000 INR,"Diploma,Degree,B.E,B.TECH,Mechanical Engineer,Diploma Mechanical Engineer. Electrical Engineer, Electronics Engineer, Civil Engineer,Graduation ,Production Engineer,Quality Engineer",Diploma|Degree|B.E|B.TECH|MechanicalEngineer|DiplomaMechanicalEngineer.ElectricalEngineer|ElectronicsEngineer|CivilEngineer|Graduation|ProductionEngineer|QualityEngineer|
Production Engineer hiring in jcb india pune salary  18k -85k 7206143903,Freelancer Ganesh Popat Sontakke,Pune|Gondia,0-2years,Not Specified,"Diploma,Degree,B.E,B.TECH,Mechanical Engineer,Diploma Mechanical Engineer.Electrical Engineer,Electronics Engineer Civil Engineer ,Graduation, Production Engineer,Quality Engineer",Diploma|Degree|B.E|B.TECH|MechanicalEngineer|DiplomaMechanicalEngineer.ElectricalEngineer|ElectronicsEngineerCivilEngineer|Graduation|ProductionEngineer|QualityEngineer|
Mechanical Engineer hiring in L&T all india  salary 25k-75k    8930761653,Freelancer Ganesh Popat Sontakke,Kolkata|Howrah,0-4years,270000 - 1290000 INR,"Diploma,Degree,B.E,B.TECH,Mechanical Engineer,Diploma Mechanical Engineer. Electrical Engineer, Electronics Engineer, Civil Engineer,Graduation ,Production Engineer,Quality Engineer",Diploma|Degree|B.E|B.TECH|MechanicalEngineer|DiplomaMechanicalEngineer.ElectricalEngineer|ElectronicsEngineer|CivilEngineer|Graduation|ProductionEngineer|QualityEngineer|
Civil Engineer  hiring in L&T all india  salary 25k-75k    8930761653,Freelancer Ganesh Popat Sontakke,Durgapur|Bhubaneswar,0-4years,270000 - 1290000 INR,"Diploma,Degree,B.E,B.TECH,Mechanical Engineer,Diploma Mechanical Engineer. Electrical Engineer, Electronics Engineer, Civil Engineer,Graduation ,Production Engineer,Quality Engineer",Diploma|Degree|B.E|B.TECH|MechanicalEngineer|DiplomaMechanicalEngineer.ElectricalEngineer|ElectronicsEngineer|CivilEngineer|Graduation|ProductionEngineer|QualityEngineer|
"DIPLOMA,DEGREE,b.TECH,ITI hiring in L&T india utterpardesh 8059616531",Freelancer Ganesh Popat Sontakke,Kanpur|Varanasi,0-5years,270000 - 1290000 INR,"Diploma,Degree,B.E,B.TECH,Mechanical Engineer,Diploma Mechanical Engineer. Electrical Engineer, Electronics Engineer, Civil Engineer,Graduation ,Production Engineer,Quality Engineer",Diploma|Degree|B.E|B.TECH|MechanicalEngineer|DiplomaMechanicalEngineer.ElectricalEngineer|ElectronicsEngineer|CivilEngineer|Graduation|ProductionEngineer|QualityEngineer|
Diploma Electrical Engineer  hiring in Adani thermal power ranchi   9817953509,Freelancer Ganesh Popat Sontakke,Dhanbad|Ranchi,0-2years,270000 - 869999 INR,"Diploma,Degree,B.E,B.TECH,Mechanical Engineer,Diploma Mechanical Engineer.Electrical Engineer,Electronics Engineer Civil Engineer ,Graduation, Production Engineer,Quality Engineer",Diploma|Degree|B.E|B.TECH|MechanicalEngineer|DiplomaMechanicalEngineer.ElectricalEngineer|ElectronicsEngineerCivilEngineer|Graduation|ProductionEngineer|QualityEngineer|
"Diploma,degree,B.tech ,B.E,diploma  hiring in TATA Motors west bangal plants 7206144199",Freelancer Ganesh Popat Sontakke,Kolkata|Asansol,0-5years,270000 - 1290000 INR,"Diploma,Degree,B.E,B.TECH,Mechanical Engineer,Diploma Mechanical Engineer. Electrical Engineer, Electronics Engineer, Civil Engineer,Graduation ,Production Engineer,Quality Engineer",Diploma|Degree|B.E|B.TECH|MechanicalEngineer|DiplomaMechanicalEngineer.ElectricalEngineer|ElectronicsEngineer|CivilEngineer|Graduation|ProductionEngineer|QualityEngineer|
gradution candidates hiring in jcb india pune 7206143903,Freelancer Ganesh Popat Sontakke,Pune|Gondia,0-5years,270000 - 1290000 INR,"Diploma,Degree,B.E,B.TECH,Mechanical Engineer,Diploma Mechanical Engineer. Electrical Engineer, Electronics Engineer, Civil Engineer,Graduation ,Production Engineer,Quality Engineer",Diploma|Degree|B.E|B.TECH|MechanicalEngineer|DiplomaMechanicalEngineer.ElectricalEngineer|ElectronicsEngineer|CivilEngineer|Graduation|ProductionEngineer|QualityEngineer|
"ashok leyland india in rajesthan  hiring diploma,degree,b.tech,iti, 7056623257",Freelancer Ganesh Popat Sontakke,Jodhpur|Kota,0-2years,270000 - 1090000 INR,"Diploma,Degree,B.E,B.TECH,Mechanical Engineer,Diploma Mechanical Engineer.Electrical Engineer,Electronics Engineer Civil Engineer ,Graduation, Production Engineer,Quality Engineer",Diploma|Degree|B.E|B.TECH|MechanicalEngineer|DiplomaMechanicalEngineer.ElectricalEngineer|ElectronicsEngineerCivilEngineer|Graduation|ProductionEngineer|QualityEngineer|
Production Engineer hiring in jcb india pune salary  18k -85k 7206143903,Freelancer Ganesh Popat Sontakke,Pune|Gondia,0-2years,Not Specified,"Diploma,Degree,B.E,B.TECH,Mechanical Engineer,Diploma Mechanical Engineer.Electrical Engineer,Electronics Engineer Civil Engineer ,Graduation, Production Engineer,Quality Engineer",Diploma|Degree|B.E|B.TECH|MechanicalEngineer|DiplomaMechanicalEngineer.ElectricalEngineer|ElectronicsEngineerCivilEngineer|Graduation|ProductionEngineer|QualityEngineer|
Diploma Engineering  hiring in Jindal Thermal power angul odisha 7206081769,Freelancer Ganesh Popat Sontakke,Rourkela|Baripada,0-4years,90000 - 990000 INR,"Diploma,Degree,B.E,B.TECH,Mechanical Engineer,Diploma Mechanical Engineer.Electrical Engineer,Electronics Engineer Civil Engineer ,Graduation, Production Engineer,Quality Engineer",Diploma|Degree|B.E|B.TECH|MechanicalEngineer|DiplomaMechanicalEngineer.ElectricalEngineer|ElectronicsEngineerCivilEngineer|Graduation|ProductionEngineer|QualityEngineer|
B.tech hiring in tata motors 7497007381,Freelancer Ganesh Popat Sontakke,Jamshedpur|Ranchi,0-2years,270000 - 990000 INR,"Diploma,Degree,B.E,B.TECH,Mechanical Engineer,Diploma Mechanical Engineer.Electrical Engineer,Electronics Engineer Civil Engineer ,Graduation, Production Engineer,Quality Engineer",Diploma|Degree|B.E|B.TECH|MechanicalEngineer|DiplomaMechanicalEngineer.ElectricalEngineer|ElectronicsEngineerCivilEngineer|Graduation|ProductionEngineer|QualityEngineer|
Diploma Fresher hiring in tata motors west bangal 8607033210,Freelancer Ganesh Popat Sontakke,Kolkata|Haldia,0-5years,270000 - 990000 INR,"Diploma, Degree, B.E, B.TECH, Mechanical Engineer, Diploma Mechanical Engineer, Electrical Engineer, Electronics Engineer , Civil Engineer , Graduation, Production Engineer,Quality Engineer",Diploma|Degree|B.E|B.TECH|MechanicalEngineer|DiplomaMechanicalEngineer.ElectricalEngineer|ElectronicsEngineerCivilEngineer|Graduation|ProductionEngineer|QualityEngineer|
Maintenance Engineer,Whitehr Consultancy Services,Pune,0-3years,Not Specified,BE B. Tech Electrical/ Electronics and E & TC freshers and experience candidates. |      |    MNC company on roll  |,Manufacturing|QualityAssurance|ProductionSupervisor|ProductionEngineer|ProductionOfficer|
Mechanical Engineer hiring in L&T all india  salary 25k-75k    8930761653,Freelancer Ganesh Popat Sontakke,Kolkata|Howrah,0-4years,270000 - 1290000 INR,"Diploma,Degree,B.E,B.TECH,Mechanical Engineer,Diploma Mechanical Engineer. Electrical Engineer, Electronics Engineer, Civil Engineer,Graduation ,Production Engineer,Quality Engineer",Diploma|Degree|B.E|B.TECH|MechanicalEngineer|DiplomaMechanicalEngineer.ElectricalEngineer|ElectronicsEngineer|CivilEngineer|Graduation|ProductionEngineer|QualityEngineer|
Civil Engineer  hiring in L&T all india  salary 25k-75k    8930761653,Freelancer Ganesh Popat Sontakke,Durgapur|Bhubaneswar,0-4years,270000 - 1290000 INR,"Diploma,Degree,B.E,B.TECH,Mechanical Engineer,Diploma Mechanical Engineer. Electrical Engineer, Electronics Engineer, Civil Engineer,Graduation ,Production Engineer,Quality Engineer",Diploma|Degree|B.E|B.TECH|MechanicalEngineer|DiplomaMechanicalEngineer.ElectricalEngineer|ElectronicsEngineer|CivilEngineer|Graduation|ProductionEngineer|QualityEngineer|
"DIPLOMA,DEGREE,b.TECH,ITI hiring in L&T india utterpardesh 8059616531",Freelancer Ganesh Popat Sontakke,Kanpur|Varanasi,0-5years,270000 - 1290000 INR,"Diploma,Degree,B.E,B.TECH,Mechanical Engineer,Diploma Mechanical Engineer. Electrical Engineer, Electronics Engineer, Civil Engineer,Graduation ,Production Engineer,Quality Engineer",Diploma|Degree|B.E|B.TECH|MechanicalEngineer|DiplomaMechanicalEngineer.ElectricalEngineer|ElectronicsEngineer|CivilEngineer|Graduation|ProductionEngineer|QualityEngineer|
Civil Engineer hiring in  Jindal Thermal power angul odisha 7206081769,Freelancer Ganesh Popat Sontakke,Rourkela|Korba,0-4years,90000 - 990000 INR,"Diploma,Degree,B.E,B.TECH,Mechanical Engineer,Diploma Mechanical Engineer.Electrical Engineer,Electronics Engineer Civil Engineer ,Graduation, Production Engineer,Quality Engineer",Diploma|Degree|B.E|B.TECH|MechanicalEngineer|DiplomaMechanicalEngineer.ElectricalEngineer|ElectronicsEngineerCivilEngineer|Graduation|ProductionEngineer|QualityEngineer|
Electrical Engineer  hiring in ashok leyland india in rajesthan  7056623257,Freelancer Ganesh Popat Sontakke,Ajmer|Chittaurgarh,0-2years,270000 - 1090000 INR,"Diploma,Degree,B.E,B.TECH,Mechanical Engineer,Diploma Mechanical Engineer.Electrical Engineer,Electronics Engineer Civil Engineer ,Graduation, Production Engineer,Quality Engineer",Diploma|Degree|B.E|B.TECH|MechanicalEngineer|DiplomaMechanicalEngineer.ElectricalEngineer|ElectronicsEngineerCivilEngineer|Graduation|ProductionEngineer|QualityEngineer|
"Adani thermal power hiring diploma ,degree,B.tech,iti,   9653556145",Freelancer Ganesh Popat Sontakke,Mangalore|Darbhanga,0-4years,90000 - 990000 INR,"Diploma,Degree,B.E,B.TECH,Mechanical Engineer,Diploma Mechanical Engineer.Electrical Engineer,Electronics Engineer Civil Engineer ,Graduation, Production Engineer,Quality Engineer",Diploma|Degree|B.E|B.TECH|MechanicalEngineer|DiplomaMechanicalEngineer.ElectricalEngineer|ElectronicsEngineerCivilEngineer|Graduation|ProductionEngineer|QualityEngineer|
"TATA Motors jamsedpur plants  hiring Diploma,degree,B.tech,iti,graduation 7497007381",Freelancer Ganesh Popat Sontakke,Jamshedpur|Ranchi,0-5years,270000 - 990000 INR,"Diploma,Degree,B.E,B.TECH,Mechanical Engineer,Diploma Mechanical Engineer.Electrical Engineer,Electronics Engineer Civil Engineer ,Graduation, Production Engineer,Quality Engineer",Diploma|Degree|B.E|B.TECH|MechanicalEngineer|DiplomaMechanicalEngineer.ElectricalEngineer|ElectronicsEngineerCivilEngineer|Graduation|ProductionEngineer|QualityEngineer|
"TATA Motors in kaling nagar hiring diploma,degree,B.tech,iti,  9996798584",Freelancer Ganesh Popat Sontakke,Sambalpur|Bhubaneswar,0-4years,270000 - 890000 INR,"Diploma,Degree,B.E,B.TECH,Mechanical Engineer,Diploma Mechanical Engineer.Electrical Engineer,Electronics Engineer Civil Engineer ,Graduation, Production Engineer,Quality Engineer",Diploma|Degree|B.E|B.TECH|MechanicalEngineer|DiplomaMechanicalEngineer.ElectricalEngineer|ElectronicsEngineerCivilEngineer|Graduation|ProductionEngineer|QualityEngineer|
"Diploma,degree hiring in Adani thermal power ranchi   9817953509",Freelancer Ganesh Popat Sontakke,Dhanbad|Ranchi,0-2years,270000 - 869999 INR,"Diploma,Degree,B.E,B.TECH,Mechanical Engineer,Diploma Mechanical Engineer.Electrical Engineer,Electronics Engineer Civil Engineer ,Graduation, Production Engineer,Quality Engineer",Diploma|Degree|B.E|B.TECH|MechanicalEngineer|DiplomaMechanicalEngineer.ElectricalEngineer|ElectronicsEngineerCivilEngineer|Graduation|ProductionEngineer|QualityEngineer|
Quality Engineer - Mechanical,Sapna Manish Sharma (Proprietor Of JBM India),Visakhapatnam,0-3years,220000 - 370000 INR,Requirement For Quality Engineer - Mechanical.,ProcessQuality|Diploma|QualityImprovement|ValueEngineering|ProcessCapability|ProductQuality|qualityengineering|B.EMechanical|
Hire Quality Engineers,Jailaxmi Enterprises,Pune,0-4years,Not Specified,"We have urgent requirement for Quality engineers . |  Job type:-on roll,full time  |  Required Experience :- 0 to 4 year  |  About Company :- core automobile sector",QualityControl|QualityAssurance|QualityEngineer|
Fresher mechanical Engineer For MNC Company,Infomedia Solutions And Consultant,Pune|Nashik,0-1years,180000 - 260000 INR,"We have urgent requirement for Mechaical  engineers. |       Job type :- on roll,full time |       Required experience :- 0 to 1 year |       About Company :- MNC company.",QualityControl|ProductionEngineer|QualityAssurance|MaintenanceEngineer|
BE Mechanical,Whitehr Consultancy Services,Pune,0-3years,Not Specified,BE B. Tech Mechanical / Automobile/ Electrical/ Electronics and E & TC freshers and experience candidates. |     |   MNC company on roll  |,Manufacturing|QualityAssurance|ProductionSupervisor|ProductionEngineer|ProductionOfficer|
Mechanical Engineer hiring in jcb all india plants  7082476165,Freelancer Ganesh Popat Sontakke,Dhanbad|Akola,0-2years,270000 - 990000 INR,"Diploma,Degree,B.E,B.TECH,Mechanical Engineer,Diploma Mechanical Engineer.Electrical Engineer,Electronics Engineer Civil Engineer ,Graduation, Production Engineer,Quality Engineer",Diploma|Degree|B.E|B.TECH|MechanicalEngineer|DiplomaMechanicalEngineer.ElectricalEngineer|ElectronicsEngineerCivilEngineer|Graduation|ProductionEngineer|QualityEngineer|
Civil Engineer  hiring in Adani thermal power ranchi   9817953509,Freelancer Ganesh Popat Sontakke,Dhanbad|BokaroSteelCity,0-2years,270000 - 869999 INR,"Diploma,Degree,B.E,B.TECH,Mechanical Engineer,Diploma Mechanical Engineer.Electrical Engineer,Electronics Engineer Civil Engineer ,Graduation, Production Engineer,Quality Engineer",Diploma|Degree|B.E|B.TECH|MechanicalEngineer|DiplomaMechanicalEngineer.ElectricalEngineer|ElectronicsEngineerCivilEngineer|Graduation|ProductionEngineer|QualityEngineer|
