jobTitles,Company,jobLocations,requiredExperiance,Salary,JobDescription,Skills"Adani thermal power hiring diploma ,degree,B.tech,iti,   9653556145",Freelancer Ganesh Popat Sontakke,Mangalore|Darbhanga,0-4years,90000 - 990000 INR,"Diploma,Degree,B.E,B.TECH,Mechanical Engineer,Diploma Mechanical Engineer.Electrical Engineer,Electronics Engineer Civil Engineer ,Graduation, Production Engineer,Quality Engineer",Diploma|Degree|B.E|B.TECH|MechanicalEngineer|DiplomaMechanicalEngineer.ElectricalEngineer|ElectronicsEngineerCivilEngineer|Graduation|ProductionEngineer|QualityEngineer|
Production Engineer hiring in jcb india pune salary  18k -85k 7206143903,Freelancer Ganesh Popat Sontakke,Pune|Gondia,0-2years,Not Specified,"Diploma,Degree,B.E,B.TECH,Mechanical Engineer,Diploma Mechanical Engineer.Electrical Engineer,Electronics Engineer Civil Engineer ,Graduation, Production Engineer,Quality Engineer",Diploma|Degree|B.E|B.TECH|MechanicalEngineer|DiplomaMechanicalEngineer.ElectricalEngineer|ElectronicsEngineerCivilEngineer|Graduation|ProductionEngineer|QualityEngineer|
B.tech hiring in tata motors 7497007381,Freelancer Ganesh Popat Sontakke,Jamshedpur|Ranchi,0-2years,270000 - 990000 INR,"Diploma,Degree,B.E,B.TECH,Mechanical Engineer,Diploma Mechanical Engineer.Electrical Engineer,Electronics Engineer Civil Engineer ,Graduation, Production Engineer,Quality Engineer",Diploma|Degree|B.E|B.TECH|MechanicalEngineer|DiplomaMechanicalEngineer.ElectricalEngineer|ElectronicsEngineerCivilEngineer|Graduation|ProductionEngineer|QualityEngineer|
Requirement of Instrumentation Engineer in Germany,Ameuro Migration Private Limited,Germany,2-7years,4860000 - 5640000 INR,Contact Ritika 9340964735 |      IELTS not mandatory |      Job Role will be mid-level & entry-level Engineer |      Less time taking and economical process |      Free Medical Facilities |      Can get government allowance |      The spouse can legally work,InstrumentationEngineer|InstructionalDesign|Production|Manufacturing|QualityControl|
Requirement of Instrumentation Engineer in Germany,Ameuro Migration Private Limited,Germany,2-7years,4860000 - 5640000 INR,Contact Ritika 9340964735 |     IELTS not mandatory |     Job Role will be mid-level & entry-level Engineer |     Less time taking and economical process |     Free Medical Facilities |     Can get government allowance |     The spouse can legally work,InstrumentationEngineer|InstructionalDesign|Production|Manufacturing|QualityControl|
Requirement of Instrumentation Engineer in Germany,Ameuro Migration Private Limited,Germany,2-10years,4860000 - 5640000 INR,Contact Ritika 9340964735 |    IELTS not mandatory |    Job Role will be mid-level & entry-level Engineer |    Less time taking and economical process |    Free Medical Facilities |    Can get government allowance |    The spouse can legally work,InstrumentationEngineer|InstructionalDesign|Production|Manufacturing|QualityControl|
Electrical Engineer hiring in jcb all india plants  7082476165,Freelancer Ganesh Popat Sontakke,Kota|Chittaurgarh,0-5years,270000 - 990000 INR,"Diploma, Degree, B.E, B.TECH, Mechanical Engineer, Diploma Mechanical Engineer, Electrical Engineer, Electronics Engineer , Civil Engineer , Graduation, Production Engineer,Quality Engineer",Diploma|Degree|B.E|B.TECH|MechanicalEngineer|DiplomaMechanicalEngineer.ElectricalEngineer|ElectronicsEngineerCivilEngineer|Graduation|ProductionEngineer|QualityEngineer|
Electrical Engineer  hiring in jcb india pune 7206143903,Freelancer Ganesh Popat Sontakke,Pune|Gondia,0-4years,270000 - 1290000 INR,"Diploma,Degree,B.E,B.TECH,Mechanical Engineer,Diploma Mechanical Engineer. Electrical Engineer, Electronics Engineer, Civil Engineer,Graduation ,Production Engineer,Quality Engineer",Diploma|Degree|B.E|B.TECH|MechanicalEngineer|DiplomaMechanicalEngineer.ElectricalEngineer|ElectronicsEngineer|CivilEngineer|Graduation|ProductionEngineer|QualityEngineer|
Electrical Engineer  hiring in L&T Madhey pardesh 8481996908,Freelancer Ganesh Popat Sontakke,Ajmer|Chittaurgarh,0-2years,270000 - 1090000 INR,"Diploma,Degree,B.E,B.TECH,Mechanical Engineer,Diploma Mechanical Engineer.Electrical Engineer,Electronics Engineer Civil Engineer ,Graduation, Production Engineer,Quality Engineer",Diploma|Degree|B.E|B.TECH|MechanicalEngineer|DiplomaMechanicalEngineer.ElectricalEngineer|ElectronicsEngineerCivilEngineer|Graduation|ProductionEngineer|QualityEngineer|
Diploma Mechanical Engineer  hiring in TATA Motors pune plants 7206144199,Freelancer Ganesh Popat Sontakke,Hooghly|Howrah,0-4years,270000 - 1290000 INR,"Diploma,Degree,B.E,B.TECH,Mechanical Engineer,Diploma Mechanical Engineer. Electrical Engineer, Electronics Engineer, Civil Engineer,Graduation ,Production Engineer,Quality Engineer",Diploma|Degree|B.E|B.TECH|MechanicalEngineer|DiplomaMechanicalEngineer.ElectricalEngineer|ElectronicsEngineer|CivilEngineer|Graduation|ProductionEngineer|QualityEngineer|
Mechanical Engineer hiring in TATA thermal power west Bangal 9647964286,Freelancer Ganesh Popat Sontakke,Puri|Sambalpur,0-4years,270000 - 1290000 INR,"Diploma,Degree,B.E,B.TECH,Mechanical Engineer,Diploma Mechanical Engineer. Electrical Engineer, Electronics Engineer, Civil Engineer,Graduation ,Production Engineer,Quality Engineer",Diploma|Degree|B.E|B.TECH|MechanicalEngineer|DiplomaMechanicalEngineer.ElectricalEngineer|ElectronicsEngineer|CivilEngineer|Graduation|ProductionEngineer|QualityEngineer|
Electrical Maintenance  hiring in TATA Motors pune plants 7206144199,Freelancer Ganesh Popat Sontakke,Hooghly|Howrah,0-5years,270000 - 1290000 INR,"Diploma,Degree,B.E,B.TECH,Mechanical Engineer,Diploma Mechanical Engineer. Electrical Engineer, Electronics Engineer, Civil Engineer,Graduation ,Production Engineer,Quality Engineer",Diploma|Degree|B.E|B.TECH|MechanicalEngineer|DiplomaMechanicalEngineer.ElectricalEngineer|ElectronicsEngineer|CivilEngineer|Graduation|ProductionEngineer|QualityEngineer|
Electrical Maintenance  hiring in TATA Motors pune plants 7206144199,Freelancer Ganesh Popat Sontakke,Hooghly|Howrah,0-5years,270000 - 1290000 INR,"Diploma,Degree,B.E,B.TECH,Mechanical Engineer,Diploma Mechanical Engineer. Electrical Engineer, Electronics Engineer, Civil Engineer,Graduation ,Production Engineer,Quality Engineer",Diploma|Degree|B.E|B.TECH|MechanicalEngineer|DiplomaMechanicalEngineer.ElectricalEngineer|ElectronicsEngineer|CivilEngineer|Graduation|ProductionEngineer|QualityEngineer|
Civil Engineer hiring in  Jindal Thermal power angul odisha 7206081769,Freelancer Ganesh Popat Sontakke,Raigarh|Raipur,0-4years,90000 - 990000 INR,"Diploma,Degree,B.E,B.TECH,Mechanical Engineer,Diploma Mechanical Engineer.Electrical Engineer,Electronics Engineer Civil Engineer ,Graduation, Production Engineer,Quality Engineer",Diploma|Degree|B.E|B.TECH|MechanicalEngineer|DiplomaMechanicalEngineer.ElectricalEngineer|ElectronicsEngineerCivilEngineer|Graduation|ProductionEngineer|QualityEngineer|
Mechanical Engineer hiring in L&T west bangal     8930761653,Freelancer Ganesh Popat Sontakke,MumbaiCity|NaviMumbai,0-2years,270000 - 1290000 INR,"Diploma,Degree,B.E,B.TECH,Mechanical Engineer,Diploma Mechanical Engineer. Electrical Engineer, Electronics Engineer, Civil Engineer,Graduation ,Production Engineer,Quality Engineer",Diploma|Degree|B.E|B.TECH|MechanicalEngineer|DiplomaMechanicalEngineer.ElectricalEngineer|ElectronicsEngineer|CivilEngineer|Graduation|ProductionEngineer|QualityEngineer|
Civil Engineer  hiring in Adani thermal power ranchi   9817953509,Freelancer Ganesh Popat Sontakke,Dhanbad|BokaroSteelCity,0-2years,270000 - 869999 INR,"Diploma,Degree,B.E,B.TECH,Mechanical Engineer,Diploma Mechanical Engineer.Electrical Engineer,Electronics Engineer Civil Engineer ,Graduation, Production Engineer,Quality Engineer",Diploma|Degree|B.E|B.TECH|MechanicalEngineer|DiplomaMechanicalEngineer.ElectricalEngineer|ElectronicsEngineerCivilEngineer|Graduation|ProductionEngineer|QualityEngineer|
Mechanical Engineer hiring  TATA motoes kharagpur WEST BANGAL 8607033210,Freelancer Ganesh Popat Sontakke,Kolkata|Kharagpur,0-5years,270000 - 890000 INR,"Diploma,Degree,B.E,B.TECH,Mechanical Engineer,Diploma Mechanical Engineer.Electrical Engineer,Electronics Engineer Civil Engineer ,Graduation, Production Engineer,Quality Engineer",Diploma|Degree|B.E|B.TECH|MechanicalEngineer|DiplomaMechanicalEngineer.ElectricalEngineer|ElectronicsEngineerCivilEngineer|Graduation|ProductionEngineer|QualityEngineer|
jindal therma power hiring b.tech fresher candidates   7206081769,Freelancer Ganesh Popat Sontakke,Cuttack|Bhubaneswar,0-4years,270000 - 990000 INR,"Diploma,Degree,B.E,B.TECH,Mechanical Engineer,Diploma Mechanical Engineer.Electrical Engineer,Electronics Engineer Civil Engineer ,Graduation, Production Engineer,Quality Engineer",Diploma|Degree|B.E|B.TECH|MechanicalEngineer|DiplomaMechanicalEngineer.ElectricalEngineer|ElectronicsEngineerCivilEngineer|Graduation|ProductionEngineer|QualityEngineer|
"Degree,  hiring in Jindal Thermal power angul odisha 7206081769",Freelancer Ganesh Popat Sontakke,Cuttack|Bhubaneswar,0-4years,90000 - 990000 INR,"Diploma,Degree,B.E,B.TECH,Mechanical Engineer,Diploma Mechanical Engineer.Electrical Engineer,Electronics Engineer Civil Engineer ,Graduation, Production Engineer,Quality Engineer",Diploma|Degree|B.E|B.TECH|MechanicalEngineer|DiplomaMechanicalEngineer.ElectricalEngineer|ElectronicsEngineerCivilEngineer|Graduation|ProductionEngineer|QualityEngineer|
b.tech hiring in Jindal Thermal power angul odisha 7206081769,Freelancer Ganesh Popat Sontakke,Jharsuguda|Darbhanga,0-4years,90000 - 990000 INR,"Diploma,Degree,B.E,B.TECH,Mechanical Engineer,Diploma Mechanical Engineer.Electrical Engineer,Electronics Engineer Civil Engineer ,Graduation, Production Engineer,Quality Engineer",Diploma|Degree|B.E|B.TECH|MechanicalEngineer|DiplomaMechanicalEngineer.ElectricalEngineer|ElectronicsEngineerCivilEngineer|Graduation|ProductionEngineer|QualityEngineer|
Mechanical Engineering hiring in Adani thermal power ranchi   9817953509,Freelancer Ganesh Popat Sontakke,Dhanbad|BokaroSteelCity,0-2years,270000 - 869999 INR,"Diploma,Degree,B.E,B.TECH,Mechanical Engineer,Diploma Mechanical Engineer.Electrical Engineer,Electronics Engineer Civil Engineer ,Graduation, Production Engineer,Quality Engineer",Diploma|Degree|B.E|B.TECH|MechanicalEngineer|DiplomaMechanicalEngineer.ElectricalEngineer|ElectronicsEngineerCivilEngineer|Graduation|ProductionEngineer|QualityEngineer|
Diploma Mechanical Engineer  hiring in TATA Motors pune plants 7206144199,Freelancer Ganesh Popat Sontakke,Hooghly|Howrah,0-4years,270000 - 1290000 INR,"Diploma,Degree,B.E,B.TECH,Mechanical Engineer,Diploma Mechanical Engineer. Electrical Engineer, Electronics Engineer, Civil Engineer,Graduation ,Production Engineer,Quality Engineer",Diploma|Degree|B.E|B.TECH|MechanicalEngineer|DiplomaMechanicalEngineer.ElectricalEngineer|ElectronicsEngineer|CivilEngineer|Graduation|ProductionEngineer|QualityEngineer|
Mechanical Engineer hiring in TATA thermal power west Bangal 9647964286,Freelancer Ganesh Popat Sontakke,Puri|Sambalpur,0-4years,270000 - 1290000 INR,"Diploma,Degree,B.E,B.TECH,Mechanical Engineer,Diploma Mechanical Engineer. Electrical Engineer, Electronics Engineer, Civil Engineer,Graduation ,Production Engineer,Quality Engineer",Diploma|Degree|B.E|B.TECH|MechanicalEngineer|DiplomaMechanicalEngineer.ElectricalEngineer|ElectronicsEngineer|CivilEngineer|Graduation|ProductionEngineer|QualityEngineer|
"Adani thermal power hiring diploma ,degree,B.tech,iti,   9653556145",Freelancer Ganesh Popat Sontakke,Mangalore|Darbhanga,0-4years,90000 - 990000 INR,"Diploma,Degree,B.E,B.TECH,Mechanical Engineer,Diploma Mechanical Engineer.Electrical Engineer,Electronics Engineer Civil Engineer ,Graduation, Production Engineer,Quality Engineer",Diploma|Degree|B.E|B.TECH|MechanicalEngineer|DiplomaMechanicalEngineer.ElectricalEngineer|ElectronicsEngineerCivilEngineer|Graduation|ProductionEngineer|QualityEngineer|
Mechanical Engineer hiring in jcb all india plants  salary 22k-98k 7082476165,Freelancer Ganesh Popat Sontakke,Aurangabad|Chittaurgarh,0-4years,270000 - 990000 INR,"Diploma,Degree,B.E,B.TECH,Mechanical Engineer,Diploma Mechanical Engineer.Electrical Engineer,Electronics Engineer Civil Engineer ,Graduation, Production Engineer,Quality Engineer",Diploma|Degree|B.E|B.TECH|MechanicalEngineer|DiplomaMechanicalEngineer.ElectricalEngineer|ElectronicsEngineerCivilEngineer|Graduation|ProductionEngineer|QualityEngineer|
Electrical Engineer hiring in L&T india utterpardesh  8059616531,Freelancer Ganesh Popat Sontakke,Kanpur|Varanasi,0-4years,270000 - 1290000 INR,"Diploma,Degree,B.E,B.TECH,Mechanical Engineer,Diploma Mechanical Engineer. Electrical Engineer, Electronics Engineer, Civil Engineer,Graduation ,Production Engineer,Quality Engineer",Diploma|Degree|B.E|B.TECH|MechanicalEngineer|DiplomaMechanicalEngineer.ElectricalEngineer|ElectronicsEngineer|CivilEngineer|Graduation|ProductionEngineer|QualityEngineer|
"Electrical Engineer  hiring diploma ,degree,B.tech,iti,   9653556145",Freelancer Ganesh Popat Sontakke,Mangalore|Darbhanga,0-4years,90000 - 990000 INR,"Diploma,Degree,B.E,B.TECH,Mechanical Engineer,Diploma Mechanical Engineer.Electrical Engineer,Electronics Engineer Civil Engineer ,Graduation, Production Engineer,Quality Engineer",Diploma|Degree|B.E|B.TECH|MechanicalEngineer|DiplomaMechanicalEngineer.ElectricalEngineer|ElectronicsEngineerCivilEngineer|Graduation|ProductionEngineer|QualityEngineer|
Mechanical Engineer hiring in jcb all india plants  7082476165,Freelancer Ganesh Popat Sontakke,Dhanbad|Akola,0-2years,270000 - 990000 INR,"Diploma,Degree,B.E,B.TECH,Mechanical Engineer,Diploma Mechanical Engineer.Electrical Engineer,Electronics Engineer Civil Engineer ,Graduation, Production Engineer,Quality Engineer",Diploma|Degree|B.E|B.TECH|MechanicalEngineer|DiplomaMechanicalEngineer.ElectricalEngineer|ElectronicsEngineerCivilEngineer|Graduation|ProductionEngineer|QualityEngineer|
Electrical Maintenance  hiring in TATA Motors pune plants 7206144199,Freelancer Ganesh Popat Sontakke,Hooghly|Howrah,0-5years,270000 - 1290000 INR,"Diploma,Degree,B.E,B.TECH,Mechanical Engineer,Diploma Mechanical Engineer. Electrical Engineer, Electronics Engineer, Civil Engineer,Graduation ,Production Engineer,Quality Engineer",Diploma|Degree|B.E|B.TECH|MechanicalEngineer|DiplomaMechanicalEngineer.ElectricalEngineer|ElectronicsEngineer|CivilEngineer|Graduation|ProductionEngineer|QualityEngineer|
Mechanical Engineer hiring in jcb all india plants  salary 22k-98k 7082476165,Freelancer Ganesh Popat Sontakke,Aurangabad|Chittaurgarh,0-4years,270000 - 990000 INR,"Diploma,Degree,B.E,B.TECH,Mechanical Engineer,Diploma Mechanical Engineer.Electrical Engineer,Electronics Engineer Civil Engineer ,Graduation, Production Engineer,Quality Engineer",Diploma|Degree|B.E|B.TECH|MechanicalEngineer|DiplomaMechanicalEngineer.ElectricalEngineer|ElectronicsEngineerCivilEngineer|Graduation|ProductionEngineer|QualityEngineer|
"TATA Motors jamsedpur plants  hiring Diploma,degree,B.tech,iti,graduation 7497007381",Freelancer Ganesh Popat Sontakke,Jamshedpur|Ranchi,0-5years,270000 - 990000 INR,"Diploma,Degree,B.E,B.TECH,Mechanical Engineer,Diploma Mechanical Engineer.Electrical Engineer,Electronics Engineer Civil Engineer ,Graduation, Production Engineer,Quality Engineer",Diploma|Degree|B.E|B.TECH|MechanicalEngineer|DiplomaMechanicalEngineer.ElectricalEngineer|ElectronicsEngineerCivilEngineer|Graduation|ProductionEngineer|QualityEngineer|
"TATA motoes kharagpur WEST BANGAL Hiring diploma,degree,B.tech,iti,  8607033210",Freelancer Ganesh Popat Sontakke,Kolkata|Haldia,0-5years,270000 - 890000 INR,"Diploma,Degree,B.E,B.TECH,Mechanical Engineer,Diploma Mechanical Engineer.Electrical Engineer,Electronics Engineer Civil Engineer ,Graduation, Production Engineer,Quality Engineer",Diploma|Degree|B.E|B.TECH|MechanicalEngineer|DiplomaMechanicalEngineer.ElectricalEngineer|ElectronicsEngineerCivilEngineer|Graduation|ProductionEngineer|QualityEngineer|
Electrical Maintenance  hiring in TATA Motors pune plants 7206144199,Freelancer Ganesh Popat Sontakke,Hooghly|Howrah,0-5years,270000 - 1290000 INR,"Diploma,Degree,B.E,B.TECH,Mechanical Engineer,Diploma Mechanical Engineer. Electrical Engineer, Electronics Engineer, Civil Engineer,Graduation ,Production Engineer,Quality Engineer",Diploma|Degree|B.E|B.TECH|MechanicalEngineer|DiplomaMechanicalEngineer.ElectricalEngineer|ElectronicsEngineer|CivilEngineer|Graduation|ProductionEngineer|QualityEngineer|
Civil Engineer hiring in  Jindal Thermal power angul odisha 7206081769,Freelancer Ganesh Popat Sontakke,Rourkela|Korba,0-4years,90000 - 990000 INR,"Diploma,Degree,B.E,B.TECH,Mechanical Engineer,Diploma Mechanical Engineer.Electrical Engineer,Electronics Engineer Civil Engineer ,Graduation, Production Engineer,Quality Engineer",Diploma|Degree|B.E|B.TECH|MechanicalEngineer|DiplomaMechanicalEngineer.ElectricalEngineer|ElectronicsEngineerCivilEngineer|Graduation|ProductionEngineer|QualityEngineer|
Electronics Engineer  hiring in Jindal Thermal power angul odisha 7206081769,Freelancer Ganesh Popat Sontakke,Rourkela|Baripada,0-4years,90000 - 990000 INR,"Diploma,Degree,B.E,B.TECH,Mechanical Engineer,Diploma Mechanical Engineer.Electrical Engineer,Electronics Engineer Civil Engineer ,Graduation, Production Engineer,Quality Engineer",Diploma|Degree|B.E|B.TECH|MechanicalEngineer|DiplomaMechanicalEngineer.ElectricalEngineer|ElectronicsEngineerCivilEngineer|Graduation|ProductionEngineer|QualityEngineer|
Mechanical Engineer hiring in jcb all india plants  7082476165,Freelancer Ganesh Popat Sontakke,Dhanbad|Akola,0-2years,270000 - 990000 INR,"Diploma,Degree,B.E,B.TECH,Mechanical Engineer,Diploma Mechanical Engineer.Electrical Engineer,Electronics Engineer Civil Engineer ,Graduation, Production Engineer,Quality Engineer",Diploma|Degree|B.E|B.TECH|MechanicalEngineer|DiplomaMechanicalEngineer.ElectricalEngineer|ElectronicsEngineerCivilEngineer|Graduation|ProductionEngineer|QualityEngineer|
Mechanical Engineer hiring in jcb all india plants  7082476165,Freelancer Ganesh Popat Sontakke,Dhanbad|Akola,0-2years,270000 - 990000 INR,"Diploma,Degree,B.E,B.TECH,Mechanical Engineer,Diploma Mechanical Engineer.Electrical Engineer,Electronics Engineer Civil Engineer ,Graduation, Production Engineer,Quality Engineer",Diploma|Degree|B.E|B.TECH|MechanicalEngineer|DiplomaMechanicalEngineer.ElectricalEngineer|ElectronicsEngineerCivilEngineer|Graduation|ProductionEngineer|QualityEngineer|
Civil Engineer hiring in  Jindal Thermal power angul odisha 7206081769,Freelancer Ganesh Popat Sontakke,Raigarh|Raipur,0-4years,90000 - 990000 INR,"Diploma,Degree,B.E,B.TECH,Mechanical Engineer,Diploma Mechanical Engineer.Electrical Engineer,Electronics Engineer Civil Engineer ,Graduation, Production Engineer,Quality Engineer",Diploma|Degree|B.E|B.TECH|MechanicalEngineer|DiplomaMechanicalEngineer.ElectricalEngineer|ElectronicsEngineerCivilEngineer|Graduation|ProductionEngineer|QualityEngineer|
"Degree,  hiring in Jindal Thermal power angul odisha 7206081769",Freelancer Ganesh Popat Sontakke,Cuttack|Bhubaneswar,0-4years,90000 - 990000 INR,"Diploma,Degree,B.E,B.TECH,Mechanical Engineer,Diploma Mechanical Engineer.Electrical Engineer,Electronics Engineer Civil Engineer ,Graduation, Production Engineer,Quality Engineer",Diploma|Degree|B.E|B.TECH|MechanicalEngineer|DiplomaMechanicalEngineer.ElectricalEngineer|ElectronicsEngineerCivilEngineer|Graduation|ProductionEngineer|QualityEngineer|
jindal therma power hiring b.tech fresher candidates   7206081769,Freelancer Ganesh Popat Sontakke,Cuttack|Bhubaneswar,0-4years,270000 - 990000 INR,"Diploma,Degree,B.E,B.TECH,Mechanical Engineer,Diploma Mechanical Engineer.Electrical Engineer,Electronics Engineer Civil Engineer ,Graduation, Production Engineer,Quality Engineer",Diploma|Degree|B.E|B.TECH|MechanicalEngineer|DiplomaMechanicalEngineer.ElectricalEngineer|ElectronicsEngineerCivilEngineer|Graduation|ProductionEngineer|QualityEngineer|
Mechanical Construction hiring in Jindal Thermal power angul odisha 7206081769,Freelancer Ganesh Popat Sontakke,Puri|Sambalpur,0-4years,90000 - 990000 INR,"Diploma,Degree,B.E,B.TECH,Mechanical Engineer,Diploma Mechanical Engineer.Electrical Engineer,Electronics Engineer Civil Engineer ,Graduation, Production Engineer,Quality Engineer",Diploma|Degree|B.E|B.TECH|MechanicalEngineer|DiplomaMechanicalEngineer.ElectricalEngineer|ElectronicsEngineerCivilEngineer|Graduation|ProductionEngineer|QualityEngineer|
b.tech hiring in Jindal Thermal power angul odisha 7206081769,Freelancer Ganesh Popat Sontakke,Jharsuguda|Darbhanga,0-4years,90000 - 990000 INR,"Diploma,Degree,B.E,B.TECH,Mechanical Engineer,Diploma Mechanical Engineer.Electrical Engineer,Electronics Engineer Civil Engineer ,Graduation, Production Engineer,Quality Engineer",Diploma|Degree|B.E|B.TECH|MechanicalEngineer|DiplomaMechanicalEngineer.ElectricalEngineer|ElectronicsEngineerCivilEngineer|Graduation|ProductionEngineer|QualityEngineer|
"tata motors hiring diploma,degree,b.tech,iti, 7497007381",Freelancer Ganesh Popat Sontakke,Gorakhpur|Lucknow,0-2years,270000 - 990000 INR,"Diploma,Degree,B.E,B.TECH,Mechanical Engineer,Diploma Mechanical Engineer.Electrical Engineer,Electronics Engineer Civil Engineer ,Graduation, Production Engineer,Quality Engineer",Diploma|Degree|B.E|B.TECH|MechanicalEngineer|DiplomaMechanicalEngineer.ElectricalEngineer|ElectronicsEngineerCivilEngineer|Graduation|ProductionEngineer|QualityEngineer|
Mechanical Engineer hiring in L&T india west bangal 8930761653,Freelancer Ganesh Popat Sontakke,Kolkata|Bankura,0-4years,270000 - 1290000 INR,"Diploma,Degree,B.E,B.TECH,Mechanical Engineer,Diploma Mechanical Engineer. Electrical Engineer, Electronics Engineer, Civil Engineer,Graduation ,Production Engineer,Quality Engineer",Diploma|Degree|B.E|B.TECH|MechanicalEngineer|DiplomaMechanicalEngineer.ElectricalEngineer|ElectronicsEngineer|CivilEngineer|Graduation|ProductionEngineer|QualityEngineer|
"B.tech ,B.E,DIPLOMA   hiring in Jindal Thermal power angul odisha 7206081769",Freelancer Ganesh Popat Sontakke,Rourkela|Baripada,0-4years,90000 - 990000 INR,"Diploma,Degree,B.E,B.TECH,Mechanical Engineer,Diploma Mechanical Engineer.Electrical Engineer,Electronics Engineer Civil Engineer ,Graduation, Production Engineer,Quality Engineer",Diploma|Degree|B.E|B.TECH|MechanicalEngineer|DiplomaMechanicalEngineer.ElectricalEngineer|ElectronicsEngineerCivilEngineer|Graduation|ProductionEngineer|QualityEngineer|
Mechanical Engineer hiring in jcb india pune salary  18k -85k 7206143903,Freelancer Ganesh Popat Sontakke,Pune|Gondia,0-2years,Not Specified,"Diploma,Degree,B.E,B.TECH,Mechanical Engineer,Diploma Mechanical Engineer.Electrical Engineer,Electronics Engineer Civil Engineer ,Graduation, Production Engineer,Quality Engineer",Diploma|Degree|B.E|B.TECH|MechanicalEngineer|DiplomaMechanicalEngineer.ElectricalEngineer|ElectronicsEngineerCivilEngineer|Graduation|ProductionEngineer|QualityEngineer|
Diploma Engineering  hiring in Jindal Thermal power angul odisha 7206081769,Freelancer Ganesh Popat Sontakke,Rourkela|Baripada,0-4years,90000 - 990000 INR,"Diploma,Degree,B.E,B.TECH,Mechanical Engineer,Diploma Mechanical Engineer.Electrical Engineer,Electronics Engineer Civil Engineer ,Graduation, Production Engineer,Quality Engineer",Diploma|Degree|B.E|B.TECH|MechanicalEngineer|DiplomaMechanicalEngineer.ElectricalEngineer|ElectronicsEngineerCivilEngineer|Graduation|ProductionEngineer|QualityEngineer|
Mechanical Engineering hiring in Adani thermal power ranchi   9817953509,Freelancer Ganesh Popat Sontakke,Dhanbad|BokaroSteelCity,0-2years,270000 - 869999 INR,"Diploma,Degree,B.E,B.TECH,Mechanical Engineer,Diploma Mechanical Engineer.Electrical Engineer,Electronics Engineer Civil Engineer ,Graduation, Production Engineer,Quality Engineer",Diploma|Degree|B.E|B.TECH|MechanicalEngineer|DiplomaMechanicalEngineer.ElectricalEngineer|ElectronicsEngineerCivilEngineer|Graduation|ProductionEngineer|QualityEngineer|
Electrical Engineer hiring in L&T india utterpardesh  8059616531,Freelancer Ganesh Popat Sontakke,Kanpur|Varanasi,0-4years,270000 - 1290000 INR,"Diploma,Degree,B.E,B.TECH,Mechanical Engineer,Diploma Mechanical Engineer. Electrical Engineer, Electronics Engineer, Civil Engineer,Graduation ,Production Engineer,Quality Engineer",Diploma|Degree|B.E|B.TECH|MechanicalEngineer|DiplomaMechanicalEngineer.ElectricalEngineer|ElectronicsEngineer|CivilEngineer|Graduation|ProductionEngineer|QualityEngineer|
"Electrical Engineer  hiring diploma ,degree,B.tech,iti,   9653556145",Freelancer Ganesh Popat Sontakke,Mangalore|Darbhanga,0-4years,90000 - 990000 INR,"Diploma,Degree,B.E,B.TECH,Mechanical Engineer,Diploma Mechanical Engineer.Electrical Engineer,Electronics Engineer Civil Engineer ,Graduation, Production Engineer,Quality Engineer",Diploma|Degree|B.E|B.TECH|MechanicalEngineer|DiplomaMechanicalEngineer.ElectricalEngineer|ElectronicsEngineerCivilEngineer|Graduation|ProductionEngineer|QualityEngineer|
Mechanical Engineer hiring in jcb all india plants  7082476165,Freelancer Ganesh Popat Sontakke,Dhanbad|Akola,0-2years,270000 - 990000 INR,"Diploma,Degree,B.E,B.TECH,Mechanical Engineer,Diploma Mechanical Engineer.Electrical Engineer,Electronics Engineer Civil Engineer ,Graduation, Production Engineer,Quality Engineer",Diploma|Degree|B.E|B.TECH|MechanicalEngineer|DiplomaMechanicalEngineer.ElectricalEngineer|ElectronicsEngineerCivilEngineer|Graduation|ProductionEngineer|QualityEngineer|
