jobTitles,Company,jobLocations,requiredExperiance,Salary,JobDescription,SkillsSERVICE DESK US VOICE ANALYST FOR GURGAON,Jobs Expert Private Limited,Chennai|Delhi,1-11years,300000 - 500000 INR,SERVICE DESK US VOICE ANALYST FOR GURGAON,Servicedesk|Helpdesk|Troubleshooting|ApplicationSupport|ITSupport|Technicalsupport|ItHelpdesk|L1Support|SystemAdmin|Systemadministrator|SystemEngineer|ITSupport|
Opportunity For Technical Support Customer Service - Freshers With Knowledge Can Apply,Vibrantzz Management Services,Mumbai|MumbaiCity,0-3years,Not Specified,Good Salary With Incentives  |  Transport Facilities Are Available |  Weekly Two Rotational Offs  |  Interested People With Correct Profile Call For More Details -9819542989(Lohit),Bpo|VoiceProcess|InternationalCallCenter|Inbound|Outbound|Fresher|CustomerService|CustomerCareExecutive|CustomerServiceExecutive|
Business System Analyst - Wireframe/ Prototyping Tools/Hiring for Abroad,Adal Immigrations LLP,Australia|Canada,2-7years,1900000 - 5000000 INR,Directly interface with the stakeholders to understand the end to end system.,Prototypingtools|BusinessAnalyst|FunctionalConsultant|BusinessConsultant|FinancialAnalyst|SystemAnalyst|Seniorbusinessanalyst|ResearchAnalyst|
Desktop Support Engineer For Freshers,Biz Industries,Bengaluru/Bangalore,0-2years,150000 - 250000 INR,Desktop Support Engineer,DesktopSupportEngineer|HardwareEngineer|DesktopEngineer|TechnicalSupportEngineer|CustomerSupportEngineer|
Technical Voice Process / Technical Helpdesk / Windows Server Admin,Jobs Expert Private Limited,Gurgaon/Gurugram|Pune,1-10years,300000 - 580000 INR,Technical Voice Process / Technical Helpdesk / Windows Server Admin |   |  International Technical Voice process experience is mandatory. |  CTC up to 5.8 Lpa + incentives |   |  Sam-9999300435,TechnicalVoiceProcess|Activedirectory|AD|TSE|Tsa|TSR|TechnicalSupportExecutive|TechnicalSupportofficer|TechnicalsupportAnalyst|TechnicalSupportAssociate|TechnicalHelpdesk|Dns|DHCP|ServerSupport|RemoteSupport|Ccna|MCSE|
Financial Voice Jobs In Ocwen BPO,White Horse Manpower Private Limited,Bengaluru/Bangalore,0-5years,150000 - 420000 INR,Candidate should possess excellent oral and written communication skills•         Candidate with good customer service skills would be preferred•         Candidate should have 0-5 year of experience in Customer Support Voice Process.•         Prio,CustomerServiceExecutive|Inbound|Outbound|Bpo|CallCenter|CSR|TSR|customerservice|CustomerSupport|VoiceProcess|Kpo|TechnicalSupport|
Desktop Support Engineer,Team Computers Private Limited,Jaipur,1-3years,100000 - 200000 INR,"Role: Desktop Support Engineer |  Location: Jaipur |  Experience: Min 1 Year |  Salary: 13,000 in hand + PF + ESI + Gratuity |   |  Skills Required: |  Hands on experience in outlook configuration, hardware troubleshooting. |  Knowledge on incident management.",DesktopSupportEngineer|HardwareEngineer|DesktopEngineer|CustomerSupportEngineer|TechnicalSupportEngineer|
Customer Support Representative - Logistics,3 Minds ESolutions Private Limited,Delhi|Mumbai,2-6years,370000 - 750000 INR,HIRING....,CUSTOMSDOCUMENTATION|CustomerSupport|CustomerCare|CustomerSupportExecutive|CustomerCareExecutive|CustomerService|LogisticsExecutive|LogisticsManager|StoresLogistics|LogisticsCoordinator|TechnicalSupport|
ITSM Process Manager/ITSM/ITIL-Chennai/Pune/Mumbai/Noida.,Black And White Business Solutions Private Limited,Chennai|Mumbai,3-12years,Not Specified,we are looking for ITSM process manager for Chennai//Pune/Mumbai/Noida locations. Minimum exp required-4+yrs. |  Fulltime |,ServiceManagement|Remedy|Itsm|Itil|Itsmv6|Datacenter|
Technical Support / Technical - Networking / International Call Center - Bpo,Datalligence-AI Private Limited,Bengaluru/Bangalore,0-5years,150000 - 300000 INR,Hiring for Technical support Engineer/Networking support/ISP Support/,Voice|Telecalling|CustomerCare|calling|Inbound|Outbound|CustomerSupportExecutive|CustomerServiceRepresentative|Customersupportrepresentative|Customercareexecutive|CustomerServiceExecutive|customerservice|
Executive - Customer Success,Job World,Chennai,0-2years,Not Specified,"Help manage our growing customer base and interact with several growing areas of the business including sales onboarding, and client management.",Sales|Marketing|BusinessDevelopment|CustomerSupport|CustomerService|TechnicalSupport|
Hiring For Top MNC For Service Desk Profile Salary upto - 7.5 LPA Call 8826608219,Biz Industries,Pune,1-6years,Not Specified,Skill :Tech Support with International Voice (Voice) |     Experience : Minimum 2 years  |     Location : Pune |     Shift : Fixed US Shift |     Education : Any Graduate,ServiceDesk|Itservicedesk|DesktopSupportEngineer|DesktopEnginee|TechnicalSupport|TechSupport|TechnicalSupportExecutive|TechnicalSupportEngineer|DesktopSupport|ItHelpdesk|Servicedeskanalyst|TechnicalHelpdesk|ItServiceDesk|ItHelpDesk|
Desktop Support Engineer For Freshers,Biz Industries,Hyderabad/Secunderabad,0-2years,150000 - 250000 INR,Desktop Support Engineer,DesktopSupportEngineer|HardwareEngineer|DesktopEngineer|TechnicalSupportEngineer|
Desktop Support Engineer For Freshers,Black And White Business Solutions Private Limited,Delhi,0-2years,150000 - 250000 INR,Desktop Support Engineer,DesktopSupportEngineer|HardwareEngineer|DesktopEngineer|TechnicalSupportEngineer|CustomerSupportEngineer|
Hiring Freshers & Experience for International BPO - Customer support Associate.,M/s Best Placement Service,Bengaluru/Bangalore,0-5years,Not Specified,International Call Center / BPO /Banking /Healthcare/Customer Support / Technical Support,Voice|ChatSupport|Email|SupportCustomerSupport|CustomerService|CustomerSupportExecutive|CustomerCare|CustomerCareExecutive|TechnicalSupport|TechnicalSupport|TechSupport|TechnicalSupportExecutive|
"International and Domestic Call Center US, UK, Australia, Amazon Salary 15k to 50k, No Fees, call 99",Biz Industries,Chandigarh,0-5years,Not Specified,"Call me, after reading the below information if you are satisfied |  Call   7508062612    9988353971  9988350971    |  Jobs in Chandigarh and Mohali cab facility. |  We do not take any Fees, RRRRRRRRRRRequest, Please do not give any fees or any registration c",TechnicalSale|Internationalvoiceprocess|USprocessInboundCalls|InternationalCallCenter|Escalation|Feedback|InternationalBpo|InternationalKPO|Freshers|Experienced|CallCenter|Flipkart|TechSupport|TechnicalSupport|Quality|
Desktop Support Engineer For Freshers,Vibrantzz Management Services,Mumbai,0-2years,150000 - 250000 INR,Desktop Support Engineer,DesktopSupportEngineer|HardwareEngineer|DesktopEngineer|TechnicalSupportEngineer|
US Multinational Banking Voice Process / Salary 35k / Apply now!,Vibrantzz Management Services,Mumbai|Thane,1-8years,270000 - 400000 INR,"its a banking process where you will have to handle calls of customers in regards to day to day banking queries , training will be provided , read further details",CustomerService|CustomerSupport|CustomerServiceExecutive|CustomerCareExecutive|CustomerCare|Voice|Inbound|CallCenter|InternationalBpo|VoiceProcess|InternationalCallCenter|
Global Customer Service Associate Openings for Andheri East Location,Jobs Expert Private Limited,Mumbai|MumbaiCity|Thane,2-6years,270000 - 400000 INR,Hiring for International Stock Broking Firm for Andheri East Location,CustomerService|CustomerSupport|CustomerServiceExecutive|CustomerCareExecutive|CustomerCare|Voice|Inbound|CallCenter|InternationalBpo|VoiceProcess|InternationalCallCenter|
TECHNICAL US VOICE ASSOCIATE FOR DELHI OR PUNE,Jobs Expert Private Limited,Delhi|Pune,1-11years,300000 - 600000 INR,TECHNICAL US VOICE ASSOCIATE FOR DELHI OR PUNE,Activedirectory|ServiceDesk|Troubleshooting|Dns|DHCP|TechnicalSupport|ItServiceDesk|ItHelpdesk|Servicedeskanalyst|SystemEngineer|SystemAdministrator|
"International Technical Voice Process / Enterprise Support - Active Directory, DNS, DHCP",CareerGrade Consulting Services,Gurgaon/Gurugram|Pune,1-8years,300000 - 580000 INR,"International Technical Voice Process / Enterprise Support - Active Directory, DNS, DHCP |   |  Required experience in International Technical Voice process |  CTC up to 5.8 lpa + incentives |   |  Sam- 9999300435",TechnicalVoiceProcess|technicalsolutionengineer|ActiveDirectory|TechnicalSupport|ServerSupport|TechnicalSupportExecutive|TechnicalSupportAssociate|ItHelpdesk|RemoteSupport|Dns|DHCP|
DataDog consultant,Jobs Expert Private Limited,Gurgaon/Gurugram,3-6years,Not Specified,DataDog consultant-WebSphere Commerce Server. Application administrators. L1/L2 support.,Applicationsupportengineer|SupportEngineer|Datadog|ApplicationSupport|L2Support|Technicalsupport|WebsphereCommerceServerAdministration|
Opening's for International Voice Process / Rotational Shifts / Sal from 18K-30K,Black And White Business Solutions Private Limited,Bengaluru/Bangalore,0-5years,Not Specified,International Call Center / BPO /Banking /Healthcare/Customer Support / Technical Support,Voice|ChatSupport|Email|SupportCustomerSupport|CustomerService|CustomerSupportExecutive|CustomerCare|CustomerCareExecutive|TechnicalSupport|TechnicalSupport|TechSupport|TechnicalSupportExecutive|
Senior Support Analyst Hyderabad Location,Orcapod Consulting Services Private Limited,Hyderabad/Secunderabad,4-8years,Not Specified,"Main Duties of the Jobholders:  |   |  The Basic duties of a AWS & Java systems programmer involve understanding the applications from support perspective, handling incidents, troubleshooting the issues/Abends, coding new changes as per specifications and","""AWSInfra""|WeblogicorJBOSS.|ApplicationSupport|Java|Framework|DB2|Websphere|"
One day interview process / International Voice Process / Sal upto 4LPA,Black And White Business Solutions Private Limited,Bengaluru/Bangalore,0-5years,Not Specified,International Call Center / BPO /Banking /Healthcare/Customer Support / Technical Support,Voice|ChatSupport|Email|SupportCustomerSupport|CustomerService|CustomerSupportExecutive|CustomerCare|CustomerCareExecutive|TechnicalSupport|TechnicalSupport|TechSupport|TechnicalSupportExecutive|
Non Voice Bpo,Manheer Singh (Proprietor Of BigBoss Decor),Hyderabad/Secunderabad,0-3years,150000 - 300000 INR,Bulk Hiring Freshers in Non Voice Process.,NonVoiceProcess|freshersBPO|Engineering|CommunicationSkills|Backend|CustomerService|NightShift|NonVoice|DataEntry|InternationalBpo|MsOffice|Technicalsupport|
Network Administrator/PR Visa/Canada/Australia/Hongkong,Adal Immigrations LLP,Australia|Canada,2-7years,2500000 - 5000000 INR,"|  Troubleshoot, diagnose and repair office equipment such as desk phones, printers, scanners and fax machines. |   |  Supporting LANs, WANs, network segments, Internet, and intranet systems. |   |",TroubleShooting|Installation|Maintenance|Repair|Breakdown|NetworkAdministrator|NetworkAdmin|SystemEngineer|SystemAdministrator|Configuration|TechnicalSupport|Debugging|
Openings for Freshers For Top MNC's,Hucon Solutions India Private Limited,Hyderabad/Secunderabad,Fresher,150000 - 200000 INR,Spot offers with Immediate Joining !!!,Bpo|TechnicalSkills|InternationalCallCenter|graduatefresher|B.ComFreshers|Mba|Bba|BA|M.A|Bca|Bhm|Cbse|Convent|Anglo|C.B.S.E|Englishmedium|b.tech|technicalsupport|
Support Engineer,Pinnacle HRM,Bengaluru/Bangalore,1-5years,300000 - 600000 INR,"Looking for Tech Support, Product Support,Application Support with expertise in Banking Domain.",ProductSupport|Productionsupport|ApplicationSupport|TechnicalSupport|
Desktop Support Engineer (Freshers) Job In Kolkata,Magna India Services,Kolkata,0-2years,150000 - 250000 INR,Desktop Support Engineer,DesktopSupportEngineer|DesktopEngineer|TechnicalSupportEngineer|CustomerSupportEngineer|ItHelpDesk|ItServiceDesk|
Spot Offer BPO Jobs / Sat - Sun OFF / ( CALL Cheryl - 9322997981 ),Equations Placements,Mumbai|MumbaiCity|NaviMumbai|Thane,0-5years,Not Specified,Highest Paying BPO / Call Center Job Across Mumbai,CallCenter|CallCenterExecutive|CustomerCareExecutive|BPOExecutive|Chat|TechicalSupportExecutive|VoiceProcess|InternationalBpo|
Digital Marketing Executive,Scope Telecom Private Limited,Ambala|Chandigarh,0-1years,Not Specified,"The objective of digital marketing is to develop strong and innovative strategies to promote the business brand, products, and services. A digital marketing professional is expected to effectively use all marketing tools and techniques like PPC, SEO,",Smm|Ppc|SEO|Smo|
"International Techinecal Sales Call Center, Salary 18k to 45k, No Fees, Do Quik AMAZON Call Center S",M/s Best Placement Service,Chandigarh,0-5years,Not Specified,"Call me, after reading the below information if you are satisfied |  Call   7508062612    9988353971  9988350971    |  Jobs in Chandigarh and Mohali cab facility. |  We do not take any Fees, RRRRRRRRRRRequest, Please do not give any fees or any registration c",TechnicalSale|Internationalvoiceprocess|USprocessInboundCalls|InternationalCallCenter|Escalation|Feedback|InternationalBpo|InternationalKPO|Freshers|Experienced|CallCenter|Flipkart|TechSupport|TechnicalSupport|Quality|
Windows L3 Support,Labridge Consulting,Bengaluru/Bangalore,6-8years,Not Specified,Designation: Windows L3 Support |    Experience : 6-8 Years |    Location: Bangalore |    Mode: CTH(On Payrolls of Labriedge Technologies Pvt Ltd) |     |,AD|Windows|L3|Support|Azure|Sql|Backup|ServerHardware|
System Administrative,POSIDEX TECHNOLOGIES PVT LTD,Hyderabad/Secunderabad,2-4years,Not Specified,"Member of the IT Operations Team with responsibilities covering a wide range of |    technologies including, but not limited to, systems administration, helpdesk, telephony administration, |    laptop/desktop computer build-up/replacement among other items. |",SystemAdministrator|
Desktop Support Engineer For Freshers,Biz Industries,Bengaluru/Bangalore,0-2years,150000 - 250000 INR,Desktop Support Engineer,DesktopSupportEngineer|HardwareEngineer|DesktopEngineer|TechnicalSupportEngineer|CustomerSupportEngineer|
Hiring For Top MNC For Service Desk Profile Salary upto - 7.5 LPA Call 8368350108/  8826608219,Job World,Bengaluru/Bangalore,3-6years,Not Specified,Skill : L1 Tech Support with International Voice (Voice and Accent Round is included) |   Experience : 3 years to 6 years |   Location : Bangalore |   Shift : Fixed US Shift |   Notice Period : Immediate to 1 month only |   Education : Any Graduate,ServiceDesk|Itservicedesk|DesktopSupportEngineer|DesktopEnginee|TechnicalSupport|TechSupport|TechnicalSupportExecutive|TechnicalSupportEngineer|DesktopSupport|ItHelpdesk|Servicedeskanalyst|TechnicalHelpdesk|ItServiceDesk|ItHelpDesk|
Technical Support Engineer for software product and application,Kovair Software Pvt. Ltd.,Kolkata,3-6years,Not Specified,"Technical Support Engineer, with 3-6 years’ of work experience in technical support for software product/applications, having good knowledge in Windows and Linux, SQL query and MS-SQL server and IIS, with good communication skill in English.",Iis|SQLserver|Linux|InstallShield|TechnicalSupport|
IMMEDIATE OPENING FOR A VOICE PROCESS FOR A MNC IN HYDERABAD!!!,2COMS Consulting Private Limited,Hyderabad/Secunderabad,1-4years,Not Specified,Hi |   |  Greetings from 2COMS Consulting |  No Registration Charges |   |  Job Title: IMMEDIATE OPENING FOR A VOICE PROCESS FOR A MNC IN HYDERABAD!!! |  Qualification: Under graduate/ Any graduate/ Any post graduate |,"""icse""|""isc""|""cbse""|""convent""|""anglo""|""christian""|""catholic""|""st""|"
Technical Support / Software Specialist,My Corporate Jobs,Mumbai|MumbaiCity,0-5years,Not Specified,Technical Support Role |  Location: Mumbai |  Salary: 4Lpa |  Experience: 0-5 Yrs |  Good knowledge on SQL and Networking query handling.,DataValidation|SoftwareSupportEngineer|USShift|Networking|ApplicationSupport|SqlQueries|Sql|
R U Tired of Call Center Job Search ? Call  Us We Are Conducting Interview For Chandigarh / Mohali,Connecting the Dots,Mohali|Chandigarh,0-5years,200000 - 300000 INR,"If you are new to industry or established, contact us now for a chat, we will be happy to talk to you about us and more importantly how we might be able to help you achieve a higher level  |      |",Bpo|Callcenter|InternationalCallCenter|VoiceProcess|FresherBPO|Freshers|CSR|DomesticBPO|InternationalBpo|Inbound|Trainer|Mis|Backend|Chat|Email|Non-Voice|Helpdesk|Kpo|TeamLeader|QualityAnalyst|Kpo|TechnicalSupport|DesktopSupport|
"Fresher, Customer Care, Customer Support, Technical Support, CCE,CSR,TSE,TSA",Ritu Placements,Jaipur|Mohali,0-5years,250000 - 320000 INR,We are hiring for fresher Voice/Non voice/ Email /Chat Domestic and international process for BPO/customer support and Seller support executive/ Fresher for Mohali/ Panchkula/ Chandīgarh/ Punjab/,VoiceProcess|CustomerCareExecutive|CustomerSupport|Voicesupport|TSR|TSE|Voice|Domestic|International|TechnicalSupport|TechSupport|TechnicalSupportExecutive|
"Technical Support Jobs In Pune (Please call: 8766285530, 8860618858)",Jobs Expert Private Limited,Pune,1-10years,Not Specified,"Technical Support Jobs In Pune (Please call: 8766285530, 8860618858)",Activedirectory|AD|Ads|CustomerSupportExecutive|Dns|Tcp/ip|GroupPolicy|TechnicalSupportExecutive|TechnicalSupportOfficer|TechnicalSupportEngineer|TechnicalSupportRepresentative|TechSupport|
Job for IT Support Engineer,Primecare Medical Services and Multispeciality Clinics (I) Private Limited,Bengaluru/Bangalore,0-2years,Not Specified,"Dear Candidates, |   |  We have an job for IT Support Engineer Freshers & Experience candidates. |   |  Please find JD and Criteria is mentioned below |   |",TroubleShooting|Troubleshoot|TechnicalSupport|ItHelpdesk|
Technical Support Specialist,Banctec Tps India Private Limited,Pune,2-5years,Not Specified,Technical Support Specialist,SupportEngineer|Supportanalyst|Applicationsupportengineer|TechnicalSupport|ApplicationSupport|Appsupport|
Huge requirements with Top MNC's / Fresher's / Exp / Voice Process / Sal upto 4LPA,Black And White Business Solutions Private Limited,Bengaluru/Bangalore,0-5years,Not Specified,International Call Center / BPO /Banking /Healthcare/Customer Support / Technical Support,Voice|ChatSupport|Email|SupportCustomerSupport|CustomerService|CustomerSupportExecutive|CustomerCare|CustomerCareExecutive|TechnicalSupport|TechnicalSupport|TechSupport|TechnicalSupportExecutive|
Hardware and Networking maintenance,Vishvas Gopal Navare ( Proprietor of Vishvas Management Consultants ),NaviMumbai,0-1years,120000 - 180000 INR,"1.deal with hardware components (chips, computer systems, motherboard, processor, RAM, circuit boards, modems, external hard disks, printers, keyboard), servers,laptops. |   2.Install antivirus, take daily backup, coordinate with users & outside expert",Juniorsystemadministrator|panvel|newpanvel|kamothe|kalamboliarea.|HardwareAndNetworking|NetworkAdministrator|SystemAdministrator|
immediate  job opening for IT testing & developing,Diraa HR Services,Chennai|Coimbatore,0-5years,Not Specified,we are hiring for it company's immediate opening apply for fresher's & experiences,TestingEngineer|Developing|
Openings for IT Software & Hardware (0-2 Yrs),Apache Footwear India Private Limited,Nellore,0-2years,Not Specified,Greetings from Apache Footwear India Pvt Ltd. |   |  we have openings in our  IT Department (Software & Hardware) |  Interested candidates share your CV's to us.,Servicedesk|Software|Hardware|IT|ITSupport|Technicalsupport|Softwaredeveloperer|Programmer|SoftwareEngineer|
SERVICE DESK US VOICE FOR PUNE & GURGAON,Jobs Expert Private Limited,Delhi|Pune,1-11years,300000 - 600000 INR,SERVICE DESK US VOICE FOR PUNE & GURGAON,Helpdesk|ServiCeDesk|HelpDesk|HelpdeskExecutive|TechnicalSupport|TechnicalSupportExecutive|TechnicalSupportEngineer|TechSupport|ItHelpdesk|
Customer Service Representative,White Horse Manpower Private Limited,Hyderabad/Secunderabad,3-7years,Not Specified,Customer Service Executive,CSR|CustomerService|Bpo|InternationalVoiceProcess|TechnicalSupport|
FRESHER or EXPERIENCED IN INTERNATIONAL CALLCENTER BPO,Black And White Business Solutions Private Limited,Bengaluru/Bangalore,0-5years,150000 - 420000 INR,Candidate should possess excellent oral and written communication skills•         Candidate with good customer service skills would be preferred•         Candidate should have 0-5 year of experience in Customer Support Voice Process.,CustomerServiceExecutive|Inbound|Outbound|Bpo|CallCenter|CSR|TSR|InternationalCallCenter|customerservice|CustomerCare|CustomerSupport|TechnicalSupport|
Opening's for US healthcare / Voice Process / Physicioan billing / Sal upto 4LPA,Izee Manpower Consultancy Private Limited,Bengaluru/Bangalore,0-5years,Not Specified,International Call Center / BPO /Banking /Healthcare/Customer Support / Technical Support,Voice|ChatSupport|Email|SupportCustomerSupport|CustomerService|CustomerSupportExecutive|CustomerCare|CustomerCareExecutive|TechnicalSupport|TechnicalSupport|TechSupport|TechnicalSupportExecutive|
"Hiring for Customer Service executive, sal upto 4.5lpa Call HR@8951184876",Cybersoft And Software Solutions Private Limited,Bengaluru/Bangalore,0-5years,150000 - 450000 INR,"Hurry up! Immediate requirements for International Voice Process, Sal upto 4.5lpa, Fixed Shifts. If Interested Call HR @8951184876",CustomerSupportExecutive|CustomerServiceExecutive|Customercareexecutive|Customersupportrepresentative|CustomerServiceRepresentative|CustomerSupportOfficer|CSE|TechnicalSupportExecutive|
Technical Support Engineer,I Growth Services,Remote,2-6years,Not Specified,"A Technical Support Engineer serves as an expert for our product, VWO, and associated web technologies. The Support Engineer is the technical interface between our customers and VWO’s Development/QA and Product management teams.",HTML|CSS|Javascript|JQuery|
Network Engineer,Icon Facilities,Jaipur|Bharatpur,1-2years,90000 - 100000 INR,"We are looking for male candidates for network engineer post in different locations in Rajasthan- Jaipur, Ranthambore, Kota,Jawaibandh-Sumerpur/Pali with minimum 6 months and maximum 2 years of experience.",Hardwarenetworkingmale|NetworkEngineer|ComputerNetworking|
Urgent Opening for Back end Developer with Node Js,Black And White Business Solutions Private Limited,Thane,3-9years,Not Specified,candidate should have good experience in developing high profile back end development with Node JS. Interested candidates email us or directly call us on 8104727774,BackendDeveloper|
Technical Support Engineer,Ikya Human Capital Solutions Private Limited,Pune,0-2years,Not Specified,Post : Technical Support  |  Exp : 0 to 2 Years |  Salary : 15000 to 28000 |  Good Communication Skills,DesktopSupportEngineer|TSR|ProblemSolving|TechnicalSupportEngineer|CustomerSupportEngineer|TechnicalSupportExecutive|Techsupport|DesktopEngineer|TechnicalSupportRepresentative|
One day interview process / International Voice Process / Sal upto 4LPA,Izee Manpower Consultancy Private Limited,Bengaluru/Bangalore,0-5years,Not Specified,International Call Center / BPO /Banking /Healthcare/Customer Support / Technical Support,Voice|ChatSupport|Email|SupportCustomerSupport|CustomerService|CustomerSupportExecutive|CustomerCare|CustomerCareExecutive|TechnicalSupport|TechnicalSupport|TechSupport|TechnicalSupportExecutive|
"Golden Opportunities for "" Technical Support Associate """,Coral Bling Services Private Limited,Bengaluru/Bangalore,1-3years,200000 - 450000 INR,Golden Opportunities for ' Technical Support Associate ',ActiveDirectory|Troubleshooting|WindowsOperatingSystem|TechnicalSupportAssociate|TechnicalSupportRepresentative|TechnicalSupportExecutive|TechnicalSupportOfficer|ItServiceDesk|ItHelpDesk|Wan|Lan|Vpn|RoutingProtocol|MicrosoftOutlook|
"Hiring for Customer Service executive, sal upto 4.5lpa Call @9035059315",White Horse Manpower Consultancy Private Limited,Bengaluru/Bangalore,0-5years,150000 - 450000 INR,"Hurry up! Immediate requirements for International Voice Process, Sal upto 4.5lpa, Fixed Shifts. If Interested Call HR @9035059315",CustomerSupportExecutive|CustomerServiceExecutive|Customercareexecutive|Customersupportrepresentative|CustomerServiceRepresentative|CustomerSupportOfficer|CSE|TechnicalSupportExecutive|
Customer Care Associate,Labridge Consulting,Mohali|Chandigarh,0-1years,160000 - 200000 INR,WORK FROM OFFICE  |  Hiring For Customer Care Service |  Qualification :- Graduates or Under Graduates |  Freshers Can Also Apply |  Location :- Mohali |  Salary :- 17k with CTC  |  Rotational Shift |  Rotating Week Off |  Contact no :- HR Tanzeem 8956137033,DomesticVoiceSupport|Inbound|CallCenter|DomesticBPO|Fresher|VoiceProcess|TechnicalSupport|
BPO,Millennium Ims Private Limited,Bengaluru/Bangalore,1-5years,160000 - 420000 INR,BPO,CustomerServiceExecutive|Inbound|Outbound|Bpo|CallCenter|CallCentre|CSR|TSR|Kpo|TechnicalSupport|
Vmware Admin,White Horse Manpower Private Limited,Bengaluru/Bangalore,6-8years,Not Specified,Designation: Vmware Admin |   Experience : 6-8 Years |   Location: Bangalore |   Mode: CTH(On Payrolls of Labriedge Technologies Pvt Ltd) |,AD|Windows|Vmware|Sql|Exchange|Azure|Iis|
Openstack Ansible support,Black And White Business Solutions Private Limited,Remote,8-16years,Not Specified,Openstack Ansible support needed IMMEDIATE |  location- Remote |  Lvel-L3 |  Full time,cinder|gnochi|trove|octavia|Proxy|Openstack|Ansible|
Urgent Openings For Bpo  CSR Bangalore CAll Nisha 9886188040,Biz Industries,Bengaluru/Bangalore,0-4years,150000 - 480000 INR,"Calling, customer service, voice, support·         Candidate should possess excellent oral and written communication skills·         Candidate with good customer service skills would be preferred·         Candidate should have 0-5 year",CustomerServiceExecutive|Inbound|Outbound|Bpo|CallCenter|CallCentre|CSR|TSR|Kpo|TechnicalSupport|
