jobTitles,Company,jobLocations,requiredExperiance,Salary,JobDescription,Skills"Technical Support - Technical Sales, International US,UK,Australain Process Salary 15k to 51k, High",CSS Corp Private Limited,Chandigarh,0-5years,Not Specified,"Call me, after reading the below information if you are satisfied |  Call   7508062612    9988353971  9988350971    |  Jobs in Chandigarh and Mohali cab facility. |  We do not take any Fees, RRRRRRRRRRRequest, Please do not give any fees or any registration c",TechnicalSale|Internationalvoiceprocess|USprocessInboundCalls|InternationalCallCenter|Escalation|Feedback|InternationalBpo|InternationalKPO|Freshers|Experienced|CallCenter|Flipkart|TechSupport|TechnicalSupport|Quality|
Urgent Requirement For Technical Staff(Desktop Support) In International Bpo,Serviam Consultancy Services,Kolkata,1-2years,Not Specified,Looking For Technical Staff In Our International BPO (US process Night Shift),Virushandling|DialerManagement|HardwareTroubleshooting|HardwareAndNetworking|OsInstallation|
Hiring For Technical Assistance Center Representative for Corporate Company,Diraa HR Services,Mumbai|MumbaiCity|NaviMumbai|Thane,2-6years,Not Specified,Age Limit : 21 - 35 |  Amazing Salary Packages |  Rotational Shifts |  Experience - Min 2 years and Max 6 years. |  Corporate MNC Company |,TechnicalSupport|TechnicalSupportExecutive|
System Admin & Network Engineer,Aurumdata Solutions India Private Limited,Chennai,0-7years,Not Specified,To work as a hardware & network engineer to troubleshoot in real time desktop. Walk in immediately to attend the interview to the below mentioned address.,"Hardware|""systemadmin""|O/S|Tcp/ipProtocol|WindowsOperatingSystem|""technicalsupport""|NetworkingEngineer|"
Senior Technical Specialist - Database,Serviam Consultancy Services,Mumbai,4-6years,Not Specified,Experienced in defining & realizing end-to-end Oracle Database Architecture for large scale enterprise systems.,SeniorTechnicalSpecialist|Database|ORACLE|MSSQL|MySql|Servers|Storage|LanWan|
Technical Support,Hucon Solutions India Private Limited,Bengaluru/Bangalore,1-9years,Not Specified,HUCON SOLUTIONS |  IS RECRUTING CANIDATES LEADING SOFTWARE PRODUCT DEVELOPMENT  ; |  1. TECHNICAL SUPPORT -JR & SR ROLES |  2. CUSTOMER SUPPORT - VOICE SUPPORT |  3. ENTERPRISE DEVELOPMENT EXECUTIVE- SAAS / CLOUD SALES |  4. PPC / PPL SPECIALIST |  5. SEO MANAGER |    |,*Payrollexecutive|*Voicesupport|*PPC|*PPL|*payperclick|*PayperLead|*|TechnicalSupport|
Technical Support Engineer,Renstas,Bengaluru/Bangalore,1-3years,Not Specified,To be a part of a world class TAC team in US based MNC with global presence.,loadbalance|Ccna|CCIE|Ccnp|Tcp/ip|ospf|bgp|Firewall|TechnicalSupportEngineer|
WALK-IN BE/BTech Freshers / Technical Support & Customer Support BPO,White Horse Manpower Consultancy Private Limited,Bengaluru/Bangalore,0-4years,150000 - 420000 INR,Candidate should possess excellent oral and written communication skills•         Candidate with good customer service skills would be preferred•         Candidate should have 0-5 year of experience in Customer Support Voice Process.•         Prio,CustomerServiceExecutive|Inbound|Outbound|Bpo|CallCenter|CallCentre|CSR|TSR|Kpo|TechnicalSupport|
Technical Support/Networking Hardware/Customer Care/International BPO/Call Centre,Transformcx,Gurgaon/Gurugram,1-6years,250000 - 310000 INR,We have an urgent hiring for Technical support Executives for international BPO in Gurgaon- |   -Excellent comms required |   -Btech/BE Graduate with Tech Support Experience |   -Salary upto 25K CTC as per skillset/5 days working |   -Please call us 8595728636,Hardware|CustomerSupport|Voicesupport|NonVoiceBpo|CallCenterExecutive|TechnicalSupport|Networking|
Urgent Hiring For SERVICE DESK PROFILE/Bangalore location/SALRAY:-4.8LPA/Call/What's app/8076881359,Job World,Bengaluru/Bangalore,1-5years,100000 - 400000 INR,Hiring for Service desk  |  L1 Support voice process |   |  Salary:-4.80lpa |  Experience:-1-5yr  |  Location:-Bangalore |  ANY Graduate |  Interested candidates can share there Resume at  |  [HIDDEN TEXT] |   |  Thanks & Regards |  Prachi |  8076881359 |,servicedesk|Helpdesk|VoiceProcess|InternationalCallCenter|ItHelpdesk|ItServiceDesk|Servicedeskanalyst|TechSupport|
Fresher BPO Agents,Silaris Informations Private Limited,Noida,0-5years,Not Specified,"We are looking for a Call Center Representative that will be the liaison between our company and its current and potential customers. The successful candidate will be able to accept ownership for effectively solving customer issues, complaints.",CorporateCommunication|EnglishLanguage|Agents|CustomerSupport|CustomerSupportExecutive|CustomerService|CustomerCareExecutive|CustomerCare|TechnicalSupport|
APPLY FOR THE POST OF TECHNICAL SUPPORT HEAD CAN APPLY,Career Mantra Management Services,Mumbai|Pune,2-4years,229999 - 560000 INR,"As a technical support, you will be monitoring & maintaining the Printer, Scanner, RFID, Barcode, systems and networks within an organisation in a technical support role.If there are any issuses or changes required, such as forgetten passwords",OperationalOptimization|Installation&CommissioningEngineer|ProblemSolving|calling|Customercare|Telecalling|HardwareEngineer|CustomerSupportEngineer|RemoteAccess|Networking|
BPOs in Bangalore & Pune,White Horse Manpower Consultancy Private Limited,Bengaluru/Bangalore,0-3years,150000 - 370000 INR,•         Candidate should possess excellent oral and written communication skills•         Candidate with good customer service skills would be preferred•         Candidate should have 0-5 year of experience in Customer Support Voice Process.•,CustomerService|CustomerServiceExecutive|CustomerSupport|CustomerSupportExecutive|CustomerCare|CSR|TSR|TechnicalSupportExecutive|TechnicalSupport|
Technical Support Voice Process- Customer Support Engineer- Immediate Joiners,Jobs Expert Private Limited,Gurgaon/Gurugram|Pune,1-9years,300000 - 560000 INR,Technical Support Voice Process- Customer Support Engineer- Immediate Joiners  |   |  Must have experience in International Technical Support Voice process |   |  CTC upto 5.6 lpa + huge incentives |   |  Sam-9999300435,Bpo|Enterprisesupport|ActiveDirectory|AD|MsOutlook|TechnicalSolutionengineer|Servicedesk|TSE|Tsa|TSR|CustomerSupportEngineer|TechnicalSupportvoice|TechnicalHelpdesk|Dns|DHCP|Office365|TechnicalHelpdesk|Fsmo|Servicenow|
Just 2rounds of Interview for CSr /TSr,White Horse Manpower Consultancy Private Limited,Bengaluru/Bangalore,0-5years,Not Specified,Responsibility of handling any inquiries and resolving customer complaints on the service call. Seize opportunities to upsell products when they arise,CustomerComplaints|CSR|Bpo|CallCentre|TSR|customerenquiries|CustomerSupportRepresentative|TechnicalSupportRepresentative|Technicalsupport|
ENGINEERS TECHNICAL SUPPORT,Star Tech,Gurgaon/Gurugram|Noida,0-2years,300000 - 500000 INR,"RoleFresher |   Industry TypeIT-Software, Software Services |   Functional AreaIT Hardware, Technical Support, Telecom Engineering |   Employment TypeFull Time, Permanent |   Role CategoryOther",TechnicalSupport|TechSupport|TechnicalSupportExecutive|TechnicalSupportEngineer|ItHelpdesk|
Requirement For IT Manager In Canada And Australia,I2canz Outsourcing Private Limited,Australia|Canada,2-12years,3529999 - 4560000 INR,"Computer and information systems managers plan, organize, direct, control and evaluate the activities of organizations that analyze, design, develop, implement, operate and administer computer and telecommunications software, networks and information",Administration|technicalengineer|ItManagement|ItInfrastructureNetworking|Network|networkengineer|systemadministrator|TechnicalSupportEngineer|
Hiring for Technical Support,Vibrantzz Management Services,Mumbai|Thane,0-3years,Not Specified,Windows 10,Bpo|VoiceProcess|InternationalCallCenter|
Technical Voice Process - Microsoft Server - Enterprise Support,Jobs Expert Private Limited,Delhi|Gurgaon/Gurugram,2-9years,300000 - 500000 INR,Technical Voice Process - Microsoft Server - Enterprise Support |   |  Salary up to 5lpa + incentives |  Telephonic interviews |   |  Call@ Sam-9999300435,Activedirectory|AD|Microsoftprocess|Enterprisesupport|EPS|Technicalassociate|CustomerSupport|VoiceProcess|Tsa|TSR|TSE|Technicalsupport|ServerSupport|MicrosoftServer|MsExchangeServer|Fsmo|GroupPolicy|TechnicalHelpdesk|Tso|
Technical Support Voice,2COMS Consulting Private Limited,Chennai,2-12years,Not Specified,We are hiring for Technical Support  - we would love to connect with you. |  Work Location: Chennai |  Level and Salary : PA : 2 to 3 years Experience –Salary up to 6 LPA |  A – 3 to 5 years Experience – Salary up to 9.5 LPA |  SA – 6 to 10 years Experience – Sa,"""ServiceDesk""|""TechnicalSupportvoice""|""InternationalBPO""|""ITSupport""|""ITHelpDesk""|""TechnicalHelpdesk""|"
TECHNICAL VOICE CONSULTANT FOR DELHI,Jobs Expert Private Limited,Hyderabad/Secunderabad|Kolkata,1-11years,300000 - 600000 INR,TECHNICAL VOICE CONSULTANT FOR DELHI,Helpdesk|TechnicalSupport|TechSupport|TechnicalSupportExecutive|ItHelpdesk|TechnicalSupportEngineer|
Hiring for Top BPO,Winx Consulting Services,Hyderabad/Secunderabad,1-7years,Not Specified,|                                  |,
Technical Support Executive - Technical Voice Process,Jobs Expert Private Limited,Gurgaon/Gurugram|Pune,1-9years,300000 - 580000 INR,Technical Support Executive - Technical Voice Process |   |  International technical Voice experience is mandatory |  CTC up to 5.8 Lpa + incentives |   |  Sam- 9999300435,ActiveDIrectory|AD|TechnicalSolutionengineer|TechnicalVoiceProcess|technicalvcieprocess|TechnicalSupport|WindowsServerAdministration|Dns|DHCP|Azure|Citrix|ExchangeServer|TechnicalHelpdesk|TechnicalSupportAssociate|
Hiring for International Voice Process - Senior Associates,Waterleaf Consultants Private Limited,Hyderabad/Secunderabad,1-5years,300000 - 550000 INR,Immediate Openings for International Voice - (US) |,InternationalBpo|InternationalVoiceProcess|VoiceProcess|CustomerSupport|CustomerCareExecutive|TechnicalSupport|TechnicalSupportExecutive|TechSupport|
"Technical Support Executive ,Customer Support Executive ,BPO, Freshers, Jaipur.",Ritu Placements,Jaipur|Mohali,0-5years,250000 - 320000 INR,"We are Hiring for Voice/ non voice, Email, Chat support, Customer Support Executive, Customer Care Executive ,Technical Support associate, Freshers, BPO, BPO Executive, Jaipur Rajasthan.",CustomerSupportExecutive|CustomerServiceRepresentative|Customersupportrepresentative|CustomerCareExecutive|CSE|FresherBPO.|TechnicalSupportExecutive|
Service Desk Analyst US Voice For Pune / Gurgaon (CALL  Ankita 9999636969 ),Jobs Expert Private Limited,Delhi|Pune,1-11years,300000 - 600000 INR,Service Desk Analyst US Voice For Pune / Gurgaon (CALL  Ankita 9999636969 ),Helpdesk|Servicedesk|ActiveDirectory|AD|Ads|Troubleshooting|Installation|Hardware|ITSupport|RemoteSupport|Technicalsupport|ItHelpdesk|Dns|DhcpServer|DHCP|Ccna|CiscoCertifiedNetworkAssociate|HardwareNetworking|Configuration|ApplicationSupp|
Technical Support Voice,2COMS Consulting Private Limited,Pune,1-5years,270000 - 420000 INR,"Greetings from 2COMS Consulting Pvt Ltd, |   |    |   |  We are hiring for Technical Support Voice - we would love to connect with you. |  ​ |   |  As of now work from home, as per situation it will be work from the office |   |    |   |  Work Location: Pune |",CustomerSupport|Helpdesk|Tsa|TechnicalSupport|TechSupport|DesktopSupport|TechnicalSupportEngineer|TechnicalSupportExecutive|
Desktop Support Engineer,Excel It Services Private Limited,Pune,1-3years,120000 - 220000 INR,Urgently Looking For Desktop Support Engineer,DesktopSupportEngineer|SystemAdministrator|SystemEngineer|
IT HELPDESK VOICE FOR PUNE OR DELHI CALL- ANKITA 9999636969,Jobs Expert Private Limited,Chennai|Hyderabad/Secunderabad,1-11years,300000 - 500000 INR,IT HELPDESK VOICE FOR PUNE OR DELHI CALL- ANKITA 9999636969,ServiCeDesk|ActiveDirectory|SystemAdministration|ItHelpdesk|TechnicalSupport|Dns|DHCP|TechnicalSupportExecutive|TechnicalSupportOfficer|TechSupport|TechnicalSupportEngineer|ApplicationSupport|L2Support|
Technical Support voice process,2COMS Consulting Private Limited,Mumbai,1-4years,110000 - 240000 INR,looking for technical support voice process for  mumbai vikhroli. |  call 7001076297,Helpdesk|technicalsupport|TechnicalSupportExecutive|DesktopSupport|L1Support|
Technical Product Development - Manager/Senior Manager,Ritu Placements,Ahmedabad|Chennai,3-7years,450000 - 840000 INR,Looking for short notice joiners,TeamLead|TechnicalLeader|
"We are hiring for BPO for Domestic & International process, voice/non-voice/chat/email/Customer Supp",Jobs Expert Private Limited,Jaipur,0-5years,170000 - 370000 INR,"We are hiring for BPO for Domestic & International process, voice/non-voice/chat/email/Customer Support Associate, customer service representative, fresher Technical Support, seller support executive",BPOExecutive|CustomerSupport|TechnicalSupport|TechnicalSupportExecutive|TechnicalSupportEngineer|
TECH SUPPORT US VOICE GURGAON  / PUNE (CALL - ANKITA 9999636969 ),White Horse Manpower Consultancy Private Limited,Delhi|Hyderabad/Secunderabad,1-11years,300000 - 600000 INR,TECH SUPPORT US VOICE GURGAON  / PUNE (CALL - ANKITA 9999636969 ),ActiveDirectory|AD|Troubleshooting|Installation|HelpDesk|Helpdeskanalyst|Servicedesk|Exchange|CiscoCertifiedNetworkAssociate|Dns|DHCP|SystemAnalyst|SystemAdministrator|SystemEngineer|SystemAdmin|ItHelpDesk|Technicalsupport|L2Support|
All Rounds In The Same Place and Offer On Spot For INTL BPO Call Syed@9739738812,Excel It Services Private Limited,Bengaluru/Bangalore,0-3years,140000 - 420000 INR,•         Candidate should possess excellent oral and written communication skills•         Candidate with good customer service skills would be preferred•         Candidate should have 0-5 year of experience in Customer Support Voice Process.•,CustomerService|CustomerCare|CustomerSupport|CustomerServiceExecutive|VoiceProcess|CallCenter|Bpo|Voicesupport|TechSupport|TechnicalSupport|TechnicalSupportExecutive|
Desktop Support Engineer,Jobs Expert Private Limited,Ahmedabad|Mehsana,1-3years,120000 - 200000 INR,Urgently Looking For Desktop Support Engineer,DesktopSupportEngineer|SystemAdministrator|SystemEngineer|
Network Engineer  Network Administrator System Administrator Desktop Support Engineer,One Degree North Human Resource,Delhi|Mumbai,0-5years,350000 - 650000 INR,Network Engineer  |           Network Administrator |           System Administrator |           Desktop Support Engineer,DesktopSupportEngineer|NetworkEngineer|NetworkAdministrator|SystemAdministrator|Networking|
Technical Support Voice,Enormous IT Services Private Limited,Delhi|Pune,1-11years,300000 - 2000000 INR,|  Technical Support Voice  |,Helpdesk|AD|Ads|Activedirectory|TechnicalSupport|TechnicalSupportExecutive|TechnicalSupportEngineer|ItHelpdesk|Dns|GroupPolicy|
"CSR Voice technical support  International Sales international voice, coustomer support executive ,",Prosperspective Hr Solutions LLP,Bengaluru/Bangalore,0-5years,Not Specified,GREETING FROM SINDHU  FROM ONE DEGREE NORTH  |   BEST PAY MAX 5LAC.. ON SPOT OFFER….BEST COMPANIES HIRING WITH AN ATTRACTIVE SALARYPACKAGE!!!! CALL |  Madhu @ 9343733547 |   	 |   	 |   Huge job opportunities under one roof!!Spot offers!!Make the best,Bpo|CallCenter|VoiceProcess|InternationalCallCenter|ICC|InternationalBpo|BPOCallCentre|CustomerCareExecutive|CallCenterExecutive|BPOFresher|CSR|CSE|CustomerSupport|CRE|CCA|Csa|Cso|Customercare|TSR|Technical|TechnicalSupport|TechSupport|
customer service representative,Infyjob Technology Services,Delhi|Gurgaon/Gurugram,0-2years,200000 - 270000 INR,We are hiring for fresher |     |    Position: Customer Care Representative |     |    Location: Bangalore |     |    Shifts: Rotational Shifts & Weekoffs.  |     |    Working Days: 6  |     |    Benefits: one-way cab facility  |     |    Salary 18k per month. |,Bpo|FresherBPO|VoiceProcess|CustomerCareExecutive|CustomerSupport|Voicesupport|CallCenter|TechnicalSupport|
Technical Associate,CSS Corp Private Limited,Bengaluru/Bangalore|Hyderabad/Secunderabad,6-11years,Not Specified,Technical Associate with 6+years for Bangalore & Hyderabad,databses|Oem|Nagios|RedhatLinux|Scripting|NetworkMonitoring|Plsql|Elasticsearch|Kibana|SNMP|
Technical Support Specialist / Technical Manager / Technical Leader - IOT,Black And White Business Solutions Private Limited,Chennai,3-8years,Not Specified,"This individual will be responsible for the basic to advanced technical support on IoT device, remote server management and networking.",networkingarchitecture|OTAupdates|open-source|dataanalyticstoolsets|suchasR|SqlDatabase|RemoteDesktop|Vpn|Python|Iot|
"Job for Opening for Voice Process (Customer Service, Telecaller,)fresher can apply now",Ritu Placements,Ahmedabad,0-5years,Not Specified,"Job for Opening for Voice Process (Customer Service, Telecaller,)fresher can apply now",VoiceProcess|CallCenter|Bpo|Voicesupport|Inbound|Outbound|CustomerCareExecutive|CustomerSupport|TechnicalSupport|
International Voice Support,Next Career Point,Chennai,1-6years,200000 - 220000 INR,Hiring for international voice support for work from home,CustomerSupport|CommunicationSkills|Voicesupport|VoiceProcess|Bpo|InternationalCallCenter|CallCenter|Technicalsupport|
"Tech support, Ambattur",Cynosure Corporate Solutions,Chennai,0-3years,Not Specified,"Need candidates with call centre Exp or good knowledge in technical domain(Networking, Routers)",Bpo|CallCenter|VoiceProcess|Techsupport|technicalsupport|
HR Recruiter / Only FEMALE's / Sal upto 1.5LPA / Day shift,Jobs Expert Private Limited,Bengaluru/Bangalore,0-5years,Not Specified,International Call Center / BPO /Banking /Healthcare/Customer Support / Technical Support,Voice|CustomerSupport|CustomerService|CustomerSupportExecutive|CustomerCare|CustomerCareExecutive|TechnicalSupport|TechnicalSupport|TechSupport|TechnicalSupportExecutive|
"Fresher, Jaipur, Technical Support Executive ,Customer Support Executive ,BPO, Freshers, Jaipur.",Black And White Business Solutions Private Limited,Jaipur,0-5years,Not Specified,"We are Hiring for Voice/ non voice, Email, Chat support, Customer Support Executive, Customer Care Executive ,Technical Support associate, Freshers, BPO, BPO Executive, Jaipur Rajasthan.",CustomerSupportExecutive|CustomerServiceRepresentative|Customersupportrepresentative|CustomerCareExecutive|CSE|FresherBPO.|Jaipur|TechnicalSupportExecutive|
Urgent Hiring for Ground staff and Back office,Career Smart Technologies,Chennai|Goa,1-5years,350000 - 740000 INR,"This is to inform you that we do have the job openings for fresher and experience Candidates for the profiles Back-office, Customer service Executive, Ground Staff, HR faculties, and Engineering Departments.",GroundStaff|HrExecutive|BackOfficeOperations|CustomerSupport|Managers|FinanceManagement|ElectricalEngineer|TelecomSupport|NetworkEngineering|MaintenanceEngineer|TechnicalSupport|
Technical Support Engineer,Jobs Expert Private Limited,Chennai,0-2years,100000 - 150000 INR,"We are looking for a Desktop Support Engineer to provide technical assistance to our clients. You will help install, upgrade and troubleshoot hardware and software systems. |   |   |",Hardwarenetworkingmale|TechnicalSupport|DesktopSupport|NetworkEngineer|Networksupport|Networksecurity|ServerSupport|
Tech Support Openings in Ggn/ Pune || Salary Upto 35K||(CALL-8766285530),Black And White Business Solutions Private Limited,Gurgaon/Gurugram|Pune,1-10years,300000 - 500000 INR,TECHNICAL SUPPORT US VOICE CALL LIPIKA- 8766285530 |,TechSupportVoice|ActiveDirectory|ServiceDesk|ItHelpdesk|Dns|SystemAdministration|WindowsAdministration|GroupPolicy|Windows|Fsmo|DHCP|OperatingSystems|TechnicalHelpdesk|TechnicalSupportVoice|ExchangeAdministration|ServiceDeskAnalyst|
International Voice Process / Customer Support / Technical Support / Sal upto 3LPA,Black And White Business Solutions Private Limited,Bengaluru/Bangalore,0-5years,Not Specified,International Call Center / BPO /Banking /Healthcare/Customer Support / Technical Support,Voice|ChatSupport|Email|SupportCustomerSupport|CustomerService|CustomerSupportExecutive|CustomerCare|CustomerCareExecutive|TechnicalSupport|TechnicalSupport|TechSupport|TechnicalSupportExecutive|
Application Support-OMNESYS _Mumbai,3i Infotech Limited,Mumbai,2-10years,Not Specified,Application Support-OMNESYS |    EXP : 2+,OMNESYS|
Openings for day shift / HR Recruiter / ONLY FEMALE'S,Black And White Business Solutions Private Limited,Bengaluru/Bangalore,0-5years,Not Specified,International Call Center / BPO /Banking /Healthcare/Customer Support / Technical Support,Voice|CustomerSupport|CustomerService|CustomerSupportExecutive|CustomerCare|CustomerCareExecutive|TechnicalSupport|TechnicalSupport|TechSupport|TechnicalSupportExecutive|
Urgent Hiring In KPO,Hiringhub,NaviMumbai,0-3years,Not Specified,"* We Are Hiring For KPO  |    |   * EASY SELECTIONS |    |   * Telephonic Interview |    |   * US Customer Service |    |   * Great Opportunity For HSC, Graduate Freshers |    |   * WORK FROM OFFICE |",Bpo|customerservice|CustomerServiceExecutive|CustomerSupport|VoiceProcess|Kpo|technicalsupport|TechnicalProcess|
International Voice Process / Customer Support / Technical Support / Sal upto 4LPA,Black And White Business Solutions Private Limited,Bengaluru/Bangalore,0-5years,Not Specified,International Call Center / BPO /Banking /Healthcare/Customer Support / Technical Support,Voice|ChatSupport|Email|SupportCustomerSupport|CustomerService|CustomerSupportExecutive|CustomerCare|CustomerCareExecutive|TechnicalSupport|TechnicalSupport|TechSupport|TechnicalSupportExecutive|
Computer Engineer,Riju Karan (Proprietor Of Toyota Climax India),Chennai,1-5years,220000 - 420000 INR,Required Computer Engineers.,ComputerEngineer|Hardware|TechnicalSupport|Networking|
Urgent hiring for ground Staff.,UKB IT Solutions Private Limited,Delhi|Hyderabad/Secunderabad,0-2years,Not Specified,We are hiring for ground staff job at airport...,CommunicationSkills|PeopleSkills|Criticalthinkingskills|PositiveAttitude|Teamwork|Honesty|
EMT Functional/Server L1 Immediate Requirement,Proteus Technologies Private Limited,Noida,1-5years,Not Specified,We at UKB IT Solutions looking for Immediate Requirement for EMT Functional/Server L1 Position.  |  Work Location - Noida |  Work feasibility - Work from Noida office only |  Joining Date : April 1st 2021 |  Status of Employment - full time,EmcAvamar|Emc|MsWindows|Cisco|
Support/ Implementation consultant,UKB IT Solutions Private Limited,Mumbai|MumbaiCity|NaviMumbai|Thane,1-3years,Not Specified,"Interacting with client, Provide Client Support on Daily Basis ,requirement |  gathering, Documentation of requirement & explaining it to technical team.  |",ErpImplementation|Implementation|Implementor|SCMFunctionalConsultant|ImplementationExecutive|SupportExecutive|Support|Sql|CrmTechnical|FunctionalConsultant|ErpSupport|
VDI L1 Immediate Requirement,Proteus Technologies Private Limited,Noida,1-5years,Not Specified,We at UKB IT Solutions looking for Immediate Requirement for VDI L1 Position.  |  Work Location - Noida |  Work feasibility - Work from Noida office only |  Joining Date : April 1st 2021 |  Status of Employment - full time,Activedirectory|Citrix|CitrixAdmin|Vmware|Dns|DhcpServer|Vdi|
Support & Implementation Consultant,White Horse Manpower Consultancy Private Limited,Mumbai|MumbaiCity|Thane,1-3years,Not Specified,* Interacting with clients |  * Provide support to client on daily basic |  * Coordinating with development team |  * Knowledge of SQL |  * Experience from CRM OR SCM is mandatory,Scm|CRM|InventoryManagement|manufacturing|ERPCRMmodule|ERPSCMModule|ERPSoftwaresupport|Implementation|Sql|ApplicationSupport|Implementer|ErpSupport|
Technical Support for Desktops and Laptops Call Rina,UKB IT Solutions Private Limited,Bengaluru/Bangalore,0-4years,Not Specified,"Diagnose hardware and software problems, and replace defective",Troubleshooting|CallCenter|TechnicianActivities|databackups|disasterrecoveryoperations|Bpo|TechnicalSupport|DesktopSupport|
System Admin( Confluence L1) Immediate Requirement,Anejas Training & placement services,Noida,1-5years,Not Specified,We at UKB IT Solutions looking for Immediate Requirement for System Admin( Confluence L1) Position.  |  Work Location - Noida |  Work feasibility - Work from Noida office only |  Joining Date : April 1st 2021 |  Status of Employment - full time,confluencesetup|reportingmetrics|terminationsupport|TroubleShooting|ServerMonitoring|
Technical Support Executive Hyderabad,Black And White Business Solutions Private Limited,Hyderabad/Secunderabad,0-2years,Not Specified,"Need Technical Support Executive, Hyderabad |    MNC  |    Only Graduates |    WFH till further notice |    Rotational Shift |    Cab Available when WFO |    Salary - upto 2.40 Max Per Annum |    Should know HINDI and ENGLISH Fluent |     |    Call - 9988658591",DomesticBPO|DomesticVoiceSupport|Inbound|Fresher|InboundProcess|Domain|TechnicalSupport|
Hiring freshers for International Technical support / US Healthcare / Telecom /sal upto 3L PA.,Anejas Training & placement services,Bengaluru/Bangalore,0-5years,Not Specified,International Call Center / BPO /Banking /Healthcare/Customer Support / Technical Support,Voice|CustomerSupport|CustomerService|CustomerSupportExecutive|CustomerCare|CustomerCareExecutive|TechnicalSupport|TechnicalSupport|TechSupport|TechnicalSupportExecutive|
