jobTitles,Company,jobLocations,requiredExperiance,Salary,JobDescription,SkillsTechnical Support Engineer,Unicca Emporis Private Limited,Delhi|Mumbai,0-5years,350000 - 1250000 INR,Excellent verbal and written communication skills. |  24*7 operations and most of the times shift will be in est hours. |  Technical bent of mind to isolate a problem quickly. |  Basic troubleshooting of desktop/laptop and gadgets. |,Troubleshooting|Hardware|Installation|Laptop|Desktop|Configuration|Networking|linux|computerhardware|Windows|Ccna|SystemAdministration|desktopsupport|technicalsupport|LaptopSupport|SystemAdmin|
One Day interview process / International Voice Process / Sal upto 3LPA,Black And White Business Solutions Private Limited,Bengaluru/Bangalore,0-5years,Not Specified,International Call Center / BPO /Banking / Ecommerce / Healthcare/Customer Support / Technical Support,Voice|ChatSupport|Email|SupportCustomerSupport|CustomerService|CustomerSupportExecutive|CustomerCare|CustomerCareExecutive|TechnicalSupport|TechnicalSupport|TechSupport|TechnicalSupportExecutive|
SAP MM Functional Consultant,Startech Placement Services,Nagpur,1-2years,Not Specified,SAP MM Functional Consultant,SapMmFunctionalConsultant|
Technical Support Tech Support Service Desk,Job World,Gurgaon/Gurugram|Pune,2-6years,Not Specified,Hiring for TOP MNC for the profile of Service Desk |   |  Job Location: Pune/ Gurgaon |  Salary: Upto 7lpa |  Education Qualification: B.tech/B.E & MCA |  Experience: Minimum 2 years to 6 Years,ServiceDesk|TechnicalSuport|ItServiceDesk|ItHelpdesk|TechnicalHelpdesk|TechnicalSupportExecutive|
Technical Support Tech Support Service Desk,Job World,Gurgaon/Gurugram|Pune,2-6years,Not Specified,Hiring for TOP MNC for the profile of Service Desk |   |  Job Location: Pune/ Gurgaon |  Salary: Upto 7lpa |  Education Qualification: B.tech/B.E & MCA |  Experience: Minimum 2 years to 6 Years,ServiceDesk|TechnicalSuport|ItServiceDesk|ItHelpdesk|TechnicalHelpdesk|TechnicalSupportExecutive|
Customer International  Voice UK Shift BPO Call 9342431048,White Horse Manpower Private Limited,Bengaluru/Bangalore,0-2years,150000 - 420000 INR,•         Candidate should possess excellent oral and written communication skills•         Candidate with good customer service skills would be preferred•         Candidate should have 0-5 year of experience in Customer Support Voice Process.•,CustomerServiceExecutive|Inbound|Outbound|Bpo|CallCenter|CallCentre|CSR|TSR|Kpo|TechnicalSupport|
inbound process For Medical Billing,White Horse Manpower Private Limited,Bengaluru/Bangalore,0-4years,140000 - 420000 INR,Candidate should possess excellent oral and written communication skillsCandidate with good customer service skills would be preferredCandidate should have 0-5 year of experience in Customer Support Voice Process. Prior experience in Customer,CustomerServiceExecutive|Inbound|Outbound|Bpo|CallCenter|CallCentre|CSR|TSR|Kpo|TechnicalSupport|
QA Engineer,NKV Enterprises,Hyderabad/Secunderabad,4-8years,Not Specified,QA Automation Engineer,Selenium|Testng|Cucumber|Testng|JavaEE|
Home based work urgent hiring,Jobs Expert Private Limited,Delhi|Noida,0-2years,Not Specified,|                                  |,
Technical Support Executive,Ritu Placements,Delhi|Hyderabad/Secunderabad,1-11years,300000 - 600000 INR,Technical Support Executive,ServiceDesk|Helpdesk|Servicedeskanalyst|TechnicalHelpdesk|ItServiceDesk|ItHelpdesk|SystemAdministrator|SystemEngineer|
"Customer Support Executive customer service representative Technical Support, fresher,Seller support",Black And White Business Solutions Private Limited,Mohali,0-5years,250000 - 340000 INR,"We are hiring for work from home Voice/Non voice/ Email /Chat Domestic and international process for BPO / customer support/ Seller support executive/ Fresher/ Chandigarh, Punjab, Mohali , Jaipur.",CustomerSupportExecutive|CustomerCareExecutive|FresherBPO|TechnicalSupportExecutive|
Hiring for top MNC's / Excellent communication / Sal upto 28K,Atos Global It Solutions And Services Private Limited,Bengaluru/Bangalore,0-5years,Not Specified,International Call Center / BPO /Banking / Ecommerce / Healthcare/Customer Support / Technical Support,Voice|ChatSupport|Email|SupportCustomerSupport|CustomerService|CustomerSupportExecutive|CustomerCare|CustomerCareExecutive|TechnicalSupport|TechnicalSupport|TechSupport|TechnicalSupportExecutive|
Urgent hiring for Cyber Ark Support in Atos- Bangalore.,Black And White Business Solutions Private Limited,Bengaluru/Bangalore,5-8years,Not Specified,Atos is hiring for Cyber Ark Support in Atos- Bangalore.,CyberArk|
Hiring Freshers & Experience for International BPO - Customer support Associate.,One Degree North Human Resource,Bengaluru/Bangalore,0-5years,Not Specified,International Call Center / BPO /Banking / Ecommerce / Healthcare/Customer Support / Technical Support,Voice|ChatSupport|Email|SupportCustomerSupport|CustomerService|CustomerSupportExecutive|CustomerCare|CustomerCareExecutive|TechnicalSupport|TechnicalSupport|TechSupport|TechnicalSupportExecutive|
Hiring  for Technical voice process,Jobs Expert Private Limited,Bengaluru/Bangalore,0-2years,Not Specified,Hiring  for Technical voice process,VoiceProcess|CustomerSupport|VoiceProcess|Voicesupport|InternationalCallCenter|Bpo|CallCenter|InternationalBpo|Outbound|CustomerCareExecutive|Inbound|TechnicalSupport|TechSupport|
IT SUPPORT US VOICE FOR PUNE OR DELHI,Vibrantzz Management Services,Delhi|Pune,1-11years,300000 - 600000 INR,IT SUPPORT US VOICE FOR PUNE OR DELHI,Supportanalyst|SupportEngineer|Servicedesk|Helpdesk|Activedirectory|ActiveDirectory|ApplicationSupport|L2Support|Technicalsupport|ITSupport|ItHelpdesk|InformationTechnology|RemoteSupport|Dns|GroupPolicy|Exchange|
Job openings for Tech support / Day shift at Thane,Adal Immigrations LLP,Mumbai|MumbaiCity|NaviMumbai|Thane,0-5years,180000 - 290000 INR,Candidate needs to handle the calls of the customer and solve their basic customer service issues regarding windows 10 troubleshooting,Genpact|Sitel|Wipro|TechnicalSupport|TechSupport|TechnicalSupportExecutive|Dell|Hp|Ibm|Microsoft|Windows|
VMWARE ADMINISTRATOR/Hiring for Abroad,Riju Karan (Proprietor Of Toyota Climax India),Australia|Canada,2-7years,2000000 - 4500000 INR,Providing R D for released products by addressing product issues in customer environments by analyzing complex customer and or internal reported problems.,Activedirectory|Intel|TroubleShooting|Maintenance|Installation|Vmware|Windows|Vmwareadmin|Virtualization|Esx|Citrix|Antivirus|TechnicalSupport|Configuration|
Desktop Support Engineers,Greywindow Hitech Private Limited,Tiruppur,0-5years,200000 - 450000 INR,Required Desktop Support Engineers.,DesktopSupportEngineers|DesktopEngineers|LaptopSupport|CustomerSupportEngineer|TechnicalSupportEngineer|
Telecom / Fresher/ Customer services/ Telesales,Black And White Business Solutions Private Limited,Ahmedabad|Chennai,0-2years,220000 - 440000 INR,to provide our clients services and receive commission,CustomerSupport|CustomerServiceRepresentative|Freshers|TechnicalSupport|
International BPO - Customer support / E- Commerce / US Healthcare / sal upto 4L PA,White Horse Manpower Private Limited,Bengaluru/Bangalore,0-5years,Not Specified,International Call Center / BPO /Banking /Healthcare/Customer Support / Technical Support,Voice|ChatSupport|Email|SupportCustomerSupport|CustomerService|CustomerSupportExecutive|CustomerCare|CustomerCareExecutive|TechnicalSupport|TechnicalSupport|TechSupport|TechnicalSupportExecutive|
Excellent Opportunity For L1 Technical Support Engineer - Fresher/ Exp,Sapna Manish Sharma (Proprietor Of JBM India),Bengaluru/Bangalore|Hyderabad/Secunderabad,0-2years,280000 - 360000 INR,Greetings from us,Installation|Freshers|HardwareEngineer|USShift|Troubleshooting|IT|CommunicationSkills|CustomerSupport|CustomerService|CustomerCare|CustomerSupportExecutive|HardwareNetworking|NetworkEngineer|NetworkAdministrator|Windows|TechnicalSupport|
Bpo Call Centre,SnapHunt Pte Ltd,Bengaluru/Bangalore,0-4years,160000 - 400000 INR,Candidate should possess excellent oral and written communication skills•         Candidate with good customer service skills would be preferred•         Candidate should have 0-5 year of experience in Customer Support Voice Process,"CustomerService|Customerserviceexecutive|CustomerSupport|customersupportexecutive|""csr""|cso|tsr|scsr|stsr|tso|technicalsupportexecutive|seniorcustomersuppor|"
Customer Support Executive,2COMS Consulting Private Limited,Ahmedabad,1-6years,240000 - 350000 INR,Requirement for Customer Support Executive.,CustomerSupport|Inbound|Outbound|Graduate|GraduateFresherFreshers|InternationalBpo|DayShifts|VoiceProcessNightShift|TechnicalSupport|
Data Engineer,2COMS Consulting Private Limited,Delhi,2-5years,Not Specified,"Working on maintenance, improvement, cleaning, and manipulation of data in the business databases. Tracking data points to identify customer base. |",ComputerScience|AppliedMathematics|AnalyticalAbility|Python|Scala|BigData|Java|Programming|
IMMEDIATE OPENING FOR A VOICE PROCESS FOR A MNC IN HYDERABAD!!!,Black And White Business Solutions Private Limited,Hyderabad/Secunderabad,1-4years,Not Specified,Hi |   |  Greetings from 2COMS Consulting |  No Registration Charges |   |  Job Title: IMMEDIATE OPENING FOR A VOICE PROCESS FOR A MNC IN HYDERABAD!!! |  Qualification: Under graduate/ Any graduate/ Any post graduate |,"""icse""|""isc""|""cbse""|""convent""|""anglo""|""christian""|""catholic""|""st""|"
IMMEDIATE OPENING FOR A VOICE PROCESS FOR A MNC IN HYDERABAD!!!,White Horse Manpower Private Limited,Hyderabad/Secunderabad,1-4years,Not Specified,Hi |   |  Greetings from 2COMS Consulting |  No Registration Charges |   |  Job Title: IMMEDIATE OPENING FOR A VOICE PROCESS FOR A MNC IN HYDERABAD!!! |  Qualification: Under graduate/ Any graduate/ Any post graduate |,"""icse""|""isc""|""cbse""|""convent""|""anglo""|""christian""|""catholic""|""st""|"
IMMEDIATE OPENING FOR A VOICE PROCESS FOR A MNC IN HYDERABAD!!!,2COMS Consulting Private Limited,Hyderabad/Secunderabad,1-4years,Not Specified,Hi |   |  Greetings from 2COMS Consulting |  No Registration Charges |   |  Job Title: IMMEDIATE OPENING FOR A VOICE PROCESS FOR A MNC IN HYDERABAD!!! |  Qualification: Under graduate/ Any graduate/ Any post graduate |,"""icse""|""isc""|""cbse""|""convent""|""anglo""|""christian""|""catholic""|""st""|"
IMMEDIATE OPENING FOR A VOICE PROCESS FOR A MNC IN HYDERABAD!!!,2COMS Consulting Private Limited,Hyderabad/Secunderabad,1-4years,Not Specified,Hi |   |  Greetings from 2COMS Consulting |  No Registration Charges |   |  Job Title: IMMEDIATE OPENING FOR A VOICE PROCESS FOR A MNC IN HYDERABAD!!! |  Qualification: Under graduate/ Any graduate/ Any post graduate |,"""icse""|""isc""|""cbse""|""convent""|""anglo""|""christian""|""catholic""|""st""|"
IMMEDIATE OPENING FOR A VOICE PROCESS FOR A MNC IN HYDERABAD!!!,2COMS Consulting Private Limited,Hyderabad/Secunderabad,1-4years,Not Specified,Hi |   |  Greetings from 2COMS Consulting |  No Registration Charges |   |  Job Title: IMMEDIATE OPENING FOR A VOICE PROCESS FOR A MNC IN HYDERABAD!!! |  Qualification: Under graduate/ Any graduate/ Any post graduate |,"""icse""|""isc""|""cbse""|""convent""|""anglo""|""christian""|""catholic""|""st""|"
Job opportunity | End client: wipro pvt limited,Outworks Solutions Private Limited,Bengaluru/Bangalore,2-5years,Not Specified,Greetings from the OutworX !!! |  This is a permanent opening with us i.e.  OutworX Solutions Pvt. Ltd. and we are urgently hiring contractual position for our client side- wipro pvt ltd. |   |,WindowsAdministrator|WindowsAdmin|WindowsSystemAdmin|SystemAdministrator|WindowsSystemAdministrator|WindowsServerAdmin|Vmware|Windows|Vmwareadmin|
Data Engineer,SnapHunt Pte Ltd,Delhi,2-5years,Not Specified,"Working on maintenance, improvement, cleaning, and manipulation of data in the business databases. Tracking data points to identify customer base. |",ComputerScience|AppliedMathematics|AnalyticalAbility|Python|Scala|BigData|Java|Programming|
Call Center Bpo,White Horse Manpower Private Limited,Bengaluru/Bangalore,0-4years,140000 - 400000 INR,•         Candidate should possess excellent oral and written communication skills•         Candidate with good customer service skills would be preferred•         Candidate should have 0-5 year of experience in Customer Support Voice Process.•,"CustomerService|Customerserviceexecutive|CustomerSupport|customersupportexecutive|""csr""|cso|tsr|scsr|stsr|tso|technicalsupportexecutive|seniorcustomersuppor|"
Medical billing process Bpo,White Horse Manpower Private Limited,Bengaluru/Bangalore,0-4years,140000 - 400000 INR,Spot offer Medical billing process Bpo Call Ruby@9342431049,"CustomerService|Customerserviceexecutive|CustomerSupport|customersupportexecutive|""csr""|cso|tsr|scsr|stsr|tso|technicalsupportexecutive|seniorcustomersuppor|"
Storage Engineer,ALLEGIS SERVICES (INDIA) PRIVATE LIMITED (RPO),Pune,10-12years,Not Specified,"We are looking for unity with VNX storage analyst who is having 10+ Years of exeperience. |   |  Title: Principal engineer Unity |  24/7 shift(rotational shift)  |  Location – Pune Dell Office, Hinjewadi. |  Employment type:Contractual |  Duration: long term",StorageEngineer|StorageAreaNetworks|PrincipalEngineer|vnxSANStorage|StorageAdministrator|StorageDomain|
Microsoft Lync Support,Betamonks Technology Factory Private Limited,Bengaluru/Bangalore,1-2years,Not Specified,"L1 support on Business Skype - Supporting.Troubleshooting skills - user access, conf call etc.",MicrosoftLyncSupport|Mpls|TechSupport|Technicalsupport|Qos|Vpn|Desktopsupport|
Junior Executive – SQL / Tech Support,Vibrantzz Management Services,Chennai|NaviMumbai,Fresher,Not Specified,We are looking for Freshers having SQL knowledge,BankingOperations|BackOfficeOperations|Sql|TechnicalSupport|SqlQueries|Support|
Hiring for Technical support,Continuum Managed Solutions LLP,MumbaiCity|NaviMumbai|Thane,0-3years,210000 - 520000 INR,Windows 10 - Troubleshooting,TroubleShooting|Installation|TechnicalSupport|TechSupport|Windows10|
Security Analyst L1 Tech,Continuum Managed Solutions LLP,Pune,1-3years,Not Specified,Security Analyst L1 Tech-Graduate and above,ThreatResearchAnalyst|Windows|Firewalls|
Security Analyst L2 Tech,Millennium Ims Private Limited,Mumbai|Pune|MumbaiCity|NaviMumbai|Thane,2-6years,Not Specified,Security Analyst L2 Tech-Graduate and above,ThreatResearchAnalyst|Windows|Firewalls|
Splunk,2COMS Consulting Private Limited,Remote,13-16years,Not Specified,Experience - 13+ years |  Job type - Part-time. |  Location - Remote  |  *This opportunity is for freelancing.,TimeLine|Teamstructure|Resourceleading|Migration|
HIRING FOR INTERNATIONAL  VOICE PROCESS IN KOLKATA,Jobs Expert Private Limited,Kolkata,0-1years,Not Specified,INTERNATIONAL VOICE PROCESS |  SALARY UPTO 20000 |  IN HAND 16000 |  US PROCESS |  FIXED SHIFT |  FIXED WEEKOFF SUNDAY SATURDAY |  FRESHER+EXPERIENCE CAN APPLY,EnglishLanguage|BPOExecutive|VoiceProcess|InternationalBpo|CallCenter|Bpo|InternationalCallCenter|Voicesupport|Inbound|Outbound|CustomerCareExecutive|HealthCareServices|CustomerSupport|TechnicalSupport|
Technical Support Associate For Pune/Gurgaon,SnapHunt Pte Ltd,Chennai|Hyderabad/Secunderabad,1-11years,300000 - 600000 INR,Technical Support Associate For Pune/Gurgaon,Sutherland|Infosys|TCS|Accenture|HCL|Wipro|Convergys|Genpact|capgemini|HewlettPackard|DXC|Ibm|Dell|Hp|
Backend Engineer,White Horse Manpower Consultancy Private Limited,Bengaluru/Bangalore,1-6years,1000000 - 1500000 INR,"Developing and maintaining features and products, including communication with frontend, DevOps and test teams. |",Sql|Python|Scalability|Nosql|Ruby|Devops|Programming|SoftwareEngineer|
Excellent Openings In A MNC BPO For Technical Support Voice,Sun HR Consultancy,Bengaluru/Bangalore,0-3years,150000 - 420000 INR,Candidate should possess excellent oral and written communication skills•         Candidate with good customer service skills would be preferred•         Candidate should have 0-5 year of experience in Customer Support Voice Process.•         Prio,CustomerServiceExecutive|Inbound|Outbound|Bpo|CallCenter|CallCentre|CSR|TSR|Kpo|TechnicalSupport|
"Wanted Executives for Voice and Non- Voice Process for MNC in Chennai(Salary-Rs.15,000 to Rs.25,000)",White Horse Manpower Private Limited,Chennai,0-1years,200000 - 300000 INR,Voice and Non- Voice Process,BpoNonVoice|VoiceProcess|InternationalBpo|CustomerSupport|InternationalCallCenter|TechnicalSupport|
CUSTOMER SUPPORT- UK Shift - BPO,White Horse Manpower Consultancy Private Limited.,Bengaluru/Bangalore,0-5years,150000 - 420000 INR,•         Candidate should possess excellent oral and written communication skills•         Candidate with good customer service skills would be preferred•         Candidate should have 0-5 year of experience in Customer Support Voice Process.•,CustomerServiceExecutive|Inbound|Outbound|Bpo|CallCenter|CSR|TSR|Kpo|TechnicalSupport|
Customer Care Voice Process BPO,Jobs Expert Private Limited,Bengaluru/Bangalore,0-4years,150000 - 420000 INR,For Customer Care Voice Process BPO Call Nisha@8553283338,CustomerServiceExecutive|Inbound|Outbound|Bpo|CallCenter|CSR|TSR|Kpo|TechnicalSupport|
Deputy Manager – SAP SD,Jobs Expert Private Limited,Bengaluru/Bangalore,8-10years,Not Specified,Looking to hire a SAP - SD with GST subject matter expert who will be responsible for understanding business / functional requirements; perform gap-fit analysis between SAP functionality and business requirements.,"""SAPImplementation""|""ERPImplementation""|""SAPSD""|Salesforce|SDProcess|SolmanShareJobLinkonSocialMedia|SalesCloud|"
IT HELPDESK US VOICE FOR DELHI,M/s Best Placement Service,Mumbai|Pune,1-11years,300000 - 600000 INR,IT HELPDESK US VOICE FOR DELHI,ServiceDesk|Activedirectory|SystemAdministrator|SystemEngineer|ApplicationSupport|ItServiceDesk|TechnicalSupport|Dns|DhcpServer|Server|Exchange|TechnicalSupport|TechSupport|TechnicalSupportExecutive|
Hiring For Voice process/ chat process call @9582538811,Wsne Consulting Private Limited,Delhi|Gurgaon/Gurugram,0-4years,Not Specified,"FRESHERS/EXPERIENCE/GRADUATE/UG |  Salary - 15K upto 27500 inhand |  Incentive upto 15K |  Location - Gurgaon |  Excellent Comms Required |  *WFH / WFO* |   |  Call/Whatsapp Mehak 9582538811, Nidhi-9717672370",Cce|Customercareexecutive|Csa|Customercare|Ccr|CSE|Bpo|CCA|TSE|Tso|TechnicalSupportExecutive|Technicalsupport|TechnicalSupportRepresentative|
IT SUPPORT US VOICE FOR GURGAON / PUNE CALL - ANKITA 9999636969,Jobs Expert Private Limited,Bengaluru/Bangalore|Hyderabad/Secunderabad,1-11years,300000 - 600000 INR,IT SUPPORT US VOICE FOR GURGAON / PUNE CALL - ANKITA 9999636969,ServiceDesk|ActiveDirectory|Supportanalyst|SupportEngineer|AD|ItHelpdesk|ItServiceDesk|Servicedeskanalyst|TechnicalHelpdesk|TechnicalSupport|TechnicalSupportExecutive|ApplicationSupport|ITSupport|L2|L2Support|Dns|GroupPolicy|
Network Engineer  Network Administrator System Administrator Desktop Support Engineer,Esther Jeevitha (Proprietor of Morgan Techno India),Bengaluru/Bangalore|Pune,0-5years,350000 - 650000 INR,Network Engineer  |           Network Administrator |           System Administrator |           Desktop Support Engineer,DesktopSupportEngineer|NetworkEngineer|NetworkAdministrator|SystemAdministrator|ItServiceDesk|LaptopSupport|ItHelpDesk|
Desktop Support Engineers,Team Computers Private Limited,Hyderabad/Secunderabad,1-6years,250000 - 450000 INR,Requirement for the post of Desktop Support Engineer.,DesktopSupportEngineers|DesktopSupportEngineer|ServiCeDesk|HardwareEngineer|DesktopSupport|DesktopEngineer|LaptopSupport|Technicalsupport|SystemAdmin|CustomerSupportEngineer|ItHelpdesk|
Desktop Support Engineer,2COMS Consulting Private Limited,Delhi|Noida,1-6years,Not Specified,Desktop Support Engineer L1 & L2 Level @ Noida Sec-16 (Film City),DesktopSupportEngineer|DesktopSupportEngineers|ActiveDirectory|HardwareNe|TechnicalSupportEngineer|DhcpServer|Dns|Tcp/ip|
IMMEDIATE OPENING FOR VOICE AND WEB CHAT PROCESS IN KOLKATA!!!,2COMS Consulting Private Limited,Kolkata,1-4years,Not Specified,Hi |   |  Greetings from 2COMS Consulting |  No Registration Charges |   |  Job Title: IMMEDIATE OPENING FOR VOICE AND WEB CHAT PROCESS IN KOLKATA!!! |  Qualification: Under graduate/ Any graduate/ Any post graduate |  Salary up to 3.5 LPA |  Work Location: Kolkata |   |,"""icse""|""isc""|""cbse""|""convent""|""anglo""|""christian""|""catholic""|""st""|"
IMMEDIATE OPENING FOR VOICE AND WEB CHAT PROCESS IN KOLKATA!!!,2COMS Consulting Private Limited,Kolkata,0-2years,Not Specified,Hi |   |  Greetings from 2COMS Consulting |  No Registration Charges |   |  Job Title: IMMEDIATE OPENING FOR VOICE AND WEB CHAT PROCESS IN KOLKATA!!! |  Qualification: Under graduate/ Any graduate/ Any post graduate |  Salary up to 3.5 LPA |  Work Location: Kolkata |   |,"""icse""|""isc""|""cbse""|""convent""|""anglo""|""christian""|""catholic""|""st""|"
IMMEDIATE OPENING FOR VOICE AND WEB CHAT PROCESS IN KOLKATA!!!,Ritu Placements,Kolkata,0-2years,Not Specified,Hi |   |  Greetings from 2COMS Consulting |  No Registration Charges |   |  Job Title: IMMEDIATE OPENING FOR VOICE AND WEB CHAT PROCESS IN KOLKATA!!! |  Qualification: Under graduate/ Any graduate/ Any post graduate |  Salary up to 3.5 LPA |  Work Location: Kolkata,"""icse""|""isc""|""cbse""|""convent""|""anglo""|""christian""|""catholic""|""st""|"
Technical Support associate/Customer care executive/ Freshers/customer service representative.,Inlinked management and Training Institute,Jaipur|Mohali,0-5years,250000 - 320000 INR,We are Hiring for BPO Technical support associate/Voice/Non voice/ Email /Chat Domestic and international process for BPO/customer support/ Seller support executive/ Fresher/Jaipur/ Mohali.,CustomerSupportExecutive|CustomerCareExecutive|Fresher|BPOExecutive|TechnicalSupportExecutive|
International Call Center International Sales International Voice International Voice International Voice Support,Job Shop,Delhi|Noida,0-2years,90000 - 190000 INR,"Excellent written/oral communication skills with a genuine concern for the customer, |  Demonstrates flexibility and adaptability |  Candidates should be flexible in working US shift |  Rotational week off on week days |   |   |",InternationalBpo|Bpo|CallCenter|Inbound|Outbound|Fresher|DomesticBPO|Support|Technicalsupport|Kpo|
Opportunity To Work From Home For Technical support -BPO SAL 30K  - Call JOBSHOP 9964080000,Jobs Expert Private Limited,Bengaluru/Bangalore,1-6years,150000 - 500000 INR,Opportunity To Work From Home For Technical support -BPO SAL 30K  - Call JOBSHOP 9964080000,CustomerServiceExecutive|Non-Voice|InternationalBpo|INTERNATIONALVOICEProcess|Voice|
MEGA OPENING FOR TECHNICAL SUPPORT FOR PUNE OR DELHI,TalentPro India HR Private Limited,Delhi|Gurgaon/Gurugram,1-11years,300000 - 600000 INR,MEGA OPENING FOR TECHNICAL SUPPORT FOR PUNE OR DELHI,Troubleshooting|ServiceDesk|Ads|AD|Activedirectory|TechnicalSupport|ItHelpdesk|ItServiceDesk|TechnicalSupportEngineer|Dns|DHCP|Ccna|
Openings for L3 IT Support Engineer,Infosys BPM Limited,Chennai,5-15years,500000 - 750000 INR,"Technologies and Skills requires |   Primary - Windows Server 2019 and older, Hyper-V, EXCHANGE, AD, DNS, DHCP, RDP, IIS, FILE Server, Print Server, WSUS, 0365, Azure, LAN/WAN/VLAN, TCP/IP, UDP, Linux, RAID, PowerShell.   |   Optional – Vmware, AWS , SQL and","""L3SupportEngineer""|""WindowsServer2019""|""Hyper-V""|""EXCHANGE""|AD|0365|LAN/WAN/VLAN|PowerShell.|Dns|DHCP|Rdp|Iis|FileServer|PrintServer|Wsus|Azure|Tcp/ip|UDP|Linux|Raid|"
Service Desk Agent,Tech Mahindra Business Services Limited,Bengaluru/Bangalore,1-5years,Not Specified,"Provide 1st level technical support, service restoration, fulfillment of service request and advice to users ensuring the maximum availability, performance and utilization of knowledge and information systems.",TSR|TSE|Helpdesk|ItServedesk|TechnicalSupport|TechSupport|ItHelpdesk|DesktopSupport|ServiceDeskManagement|
Service Desk Analyst,M/s Best Placement Service,MumbaiCity,1-8years,Not Specified,"Tech Mahindra Business Services is hiring for Service Desk Analyst , Immediate joiners required.",ServiceDesk|ITHelpdeskExecutive|ServiceDeskAnalyst|ItHelpdesk|TechnicalHelpdesk|IncidentManagement|L1Support|TicketingTools|Itsm|OSS|TechnicalSupport|
Urgent Hiring Call……...for Hindi Punjabi English Call Center/BPO/KPO/Voice/Non Voice/ Flipkart / Sna,M/s Best Placement Service,Chandigarh,0-5years,Not Specified,"Call me, after reading the below information if you are satisfied |  Call   7508062612    9988353971  9988350971    |  Jobs in Chandigarh and Mohali cab facility. |  We do not take any Fees, RRRRRRRRRRRequest, Please do not give any fees or any registration c",TechnicalSale|Internationalvoiceprocess|USprocessInboundCalls|InternationalCallCenter|Escalation|Feedback|InternationalBpo|InternationalKPO|Freshers|Experienced|CallCenter|Flipkart|TechSupport|TechnicalSupport|Quality|
UUUUUnlimited Jobs in Chandigarh Mohali for BPO/KPO/Voice/Non Voice/ Flipkart / Snapdeal /Amazon / A,White Horse Manpower Consultancy Private Limited,Chandigarh,0-5years,Not Specified,"Call me, after reading the below information if you are satisfied |  Call   7508062612    9988353971  9988350971    |  Jobs in Chandigarh and Mohali cab facility. |  We do not take any Fees, RRRRRRRRRRRequest, Please do not give any fees or any registration c",TechnicalSale|Internationalvoiceprocess|USprocessInboundCalls|InternationalCallCenter|Escalation|Feedback|InternationalBpo|InternationalKPO|Freshers|Experienced|CallCenter|Flipkart|TechSupport|TechnicalSupport|Quality|
