jobTitles,Company,jobLocations,requiredExperiance,Salary,JobDescription,Skills
Technical Support,Hiringhub,NaviMumbai,0-2years,90000 - 240000 INR,Hiring for Hsc and Graduate Fresher!!,CustomerSupport|USShift|TechnicalSupport|
Technical Support Engineer / Tech Support / Technical Support Executive / TSE,Parahit Technologies Limited,Kozhikode/Calicut,2-5years,Not Specified,Looking for Technical Support Engineer,Linux|Centos|Windows|TechnicalSupport|
Technical Support Engineer,Quess IT Staffing (Formerly known as Magna Infotech),Bengaluru/Bangalore|Hyderabad/Secunderabad,2-4years,Not Specified,L2 Technical Support,CustomerSupportExecutive|TechnicalSupportExecutive|TechnicalSupportEngineer|TechnicalSupportOfficer|TechSupport|TechnicalSupportRepresentative|
Technical Support Representative,Cappricos Technology Solutions Private Limited,Bengaluru/Bangalore,0-2years,100000 - 210000 INR,L1 technical support process: |   if interested Kindly call or Forward your Updated Resume to  |   Saima - 9731172224 |   Email:- [HIDDEN TEXT],TechSupportRepresentative|TechnicalSupport|TechSupport|TechnicalSupportExecutive|
Technical Support / Customer Support / Enterprise Support,Jobs Expert Private Limited,Gurgaon/Gurugram|Pune,1-9years,300000 - 560000 INR,Technical Support voice process jobs  |   |  CTC-5.6 lpa |  Skype interviews |   |  Sam-9999300435,Helpdesk|CustomerSupport|TSE|TSR|Activedirectory|Technicalsupport|ServiceDeskAnalyst|TechSupport|Fsmo|Dns|DHCP|ExchangeServer|Office365|O365|microsoftonlineservices|windowsintune|
Technical Support/Customer Support - Chandigarh,2COMS Consulting Private Limited,Mohali|Panchkula|Chandigarh,1-5years,Not Specified,"Technical support opening in MNC ITES/BPO for one of the leading Laptop/Desktop Brand.Location: Chandigarh, DLF IT ParkRoles & Responsibilities:  * Providing inbound voice support to customers for Laptop/Desktop,  * Hardware, Printers,scanner",TechnicalSupport/CustomerSupport-Chandigarh|
Technical Support Engineer / Tech Support Engineer / Technical Support,Parahit Technologies Limited,Delhi,2-5years,320000 - 440000 INR,We are looking for high performing and independent Technical Support Engineer.,Dialer|Linux|Windows|Networking|
Technical Support  Voice - Gurgaon,2COMS Consulting Private Limited,Gurgaon/Gurugram,1-7years,200000 - 370000 INR,Exciting Opportunity for Experienced Technical Support Executive In A Leading MNCDesignation: Technical SupportJob role  *  Have to solve Candidate Technical Quires through incoming calls.  *  Educating the customer about the technical issue,Troubleshooting|TechnicalKnowledge|CustomerSupport|TechncialSupport|
Technical Support,Hiringhub,NaviMumbai,0-4years,120000 - 220000 INR,Opening for us tech support,UsProcess|International|VoiceProcess|TechnicalSupport|
Software tech support  Technical Support,Busipex Services Private Limited,Chennai,0-4years,Not Specified,2 Female candidates for Software Tech Support,softwaretechsuppport|SoftwareSupportExecutive|TechnicalSupport|TechSupport|TechnicalSupportExecutive|TechnicalSupportEngineer|SoftwareSupport|TechnicalSupportEngineer|TechnicalSupportRepresentative|ITSupport|
Application Support Engineer (Technical Support),ThinkApps Solutions Private Limited,Ahmedabad|Mumbai,1-4years,Not Specified,|  Application Support Engineer (Technical Support) -  Mumbai/Ahmedabad /Gangtok/Lucknow/Guwahati/Thiruvananthapuram/Shimla/Jammu/Chandigarh/Bhopal,ApplicationSupport|
Technical Support Engineer / Technical voice process jobs,Jobs Expert Private Limited,Gurgaon/Gurugram|Pune,1-9years,300000 - 560000 INR,Openings for Technical Support voice process |   |  Skype interviews |  CTC - 5.6 lpa + incentives |   |  Sam-9999300435,TSR|Helpdesk|CustomerSupport|Activedirectory|AD|RemoteSupport|Desktopsupport|TechnicalSupport|SystemAdmin|SystemAdmin|Dns|DHCP|Fsmo|Imap|Pop3|IpConfiguration|Exchange|Citrix|ExchangeServer|
Technical Support Representative  (Sam-9999300435),Jobs Expert Private Limited,Gurgaon/Gurugram|Pune,1-6years,300000 - 560000 INR,Technical Support Representative  (Sam-9999300435) |   |  Min 1yr+ technical support voice experience is required. |  Skype interviews |   |  Call@ Sam - 9999300435,Activedirectory|TechnicalSupportRepresentative|Technicalsupportvoice|Fsmo|ExchangeServer|Dns|DHCP|TechnicalProcess|
Technical Support voice process -  Server Support,Jobs Expert Private Limited,Gurgaon/Gurugram|Pune,1-8years,300000 - 560000 INR,Technical Support voice process -  Server Support |   |  CTC upto 5.6 Lpa |  Telephonic interviews |   |  Sam-9999300435,CustomerSupport|Activedirectory|ipcofiguration|Voicesupport|remotesuport|technicalsupport|TechnicalHelpdesk|TechnicalSupportExecutive|Dns|dhcp|ExchangeServer|TechnicalSupportRepresentative|techsupport|Ipv6|ServerSupport|
Customer Support Executive / Technical Support Associate,Black And White Business Solutions Private Limited,Bengaluru/Bangalore,0-5years,Not Specified,International Call Center / BPO /Banking / E commerce / Healthcare/Customer Support / Technical Support,Voice|ChatSupport|Email|SupportCustomerSupport|CustomerService|CustomerSupportExecutive|CustomerCare|CustomerCareExecutive|TechnicalSupport|TechnicalSupport|TechSupport|TechnicalSupportExecutive|
Associate Technical Support- International Voice Process(CALL- 8766285530),Jobs Expert Private Limited,Gurgaon/Gurugram|Pune,1-11years,300000 - 500000 INR,Associate Technical Support-International Voice |  Location: Gurgaon/ Pune |  Qual- Gards/ UG/ Drops outs can apply |  Skills- 1 yr tech support exp in International Voice Process |  Shifts- 24/7 |  CTC- 5LPA + Incentives |  CALL LIPIKA |  8766285530/ 8467054123,TechSupportVoice|Troubleshooting|ActiveDirectory|ServiceDesk|ItHelpdesk|PrinterSupport|SystemAdministration|NetworkSupport|Ccna|ServerSupport|AzureActiveDirectory|ExchangeServer|RemoteSupport|TechnicalHelpdesk|TechnicalSupport|
Technical Support Engineer,Riju Karan (Proprietor Of Toyota Climax India),Surat,1-5years,250000 - 450000 INR,Requirement for the post of Technical Support Engineer.,DesktopSupportEngineer|TSR|TechnicalSupportEngineer|CustomerSupportEngineer|TechnicalSupportExecutive|Techsupport|DesktopEngineer|TechnicalSupportRepresentative|
Openings for technical Support Voice Process / Enterprise Support,Jobs Expert Private Limited,Gurgaon/Gurugram|Pune,2-9years,300000 - 560000 INR,Openings for technical Support Voice Process / Enterprise Support |   |  Skype Interviews |  CTC- 5lpa + incentives |   |  Sam-9999300435,technicalnalayst|CustomerSupport|Activedirectory|MsOutlook|TSE|TSR|Technicalsupport|TechnicalHelpdesk|Dns|DHCP|Fsmo|ExchangeServer|O365|Ipv4|Ipv6|
Technical Support Engineer,Whitehr Consultancy Services,Pune,0-3years,180000 - 350000 INR,urgent required technical support freshers and experience candidates. |           |      MNC company on roll  |,HardwareNetworkingMale|HardwareAndNetworking|NetworkEngineer|SystemAdministrator|NetworkAdministrator|
Technical Support Engineer,Subrata Mondal (Proprietor Of Cafe Industry),Bhopal,1-5years,240000 - 420000 INR,Role: Technical Support Engineer,CustomerSupport|Emai|lPhone|Hindi|Troubleshooting|NetworkConfiguration|TechnicalSupport|
Technical Support Engineer Desktop Support,Roundworld Immigration Private Limited,Delhi,1-4years,150000 - 200000 INR,"The Support Analyst is responsible for providing support to server infrastructure, LAN WAN networks and VMWare by answering questions or resolving problems in person, via telephone or from a remote location.",Fmsengineer|DesktopSupportEngineer|Hardwareengineer|Hardwarenetworkingmale|DesktopEngineer|Desktopsupport|CustomerSupportEngineer|NetworkEngineer|ITSupport|
Technical Support,White Horse Manpower Consultancy Private Limited,Bengaluru/Bangalore,2-4years,Not Specified,Technical Leadership experience required,CustomerSupportExecutive|TechnicalSupportExecutive|TechnicalSupportOfficer|TechSupport|TechnicalSupportEngineer|TechnicalSupportRepresentative|
BE & BTech Freshers / Technical Support & Customer Support/ Spot Offer,White Horse Manpower Consultancy Private Limited,Bengaluru/Bangalore,0-4years,Not Specified,•         Candidate should possess excellent oral and written communication skills•         Candidate with good customer service skills would be preferred•         Candidate should have 0-5 year of experience in Customer Support Voice Process.•,CustomerServiceExecutive|Inbound|Outbound|Bpo|CallCenter|CallCentre|CSR|TSR|Kpo|TechnicalSupport|
AR- Sr. Technical Support Executive,Insigma Technologies Private Limited,Nagercoil,1-7years,Not Specified,Maxerience highly believes on Artificial Intelligence & Internet-of-Things based systems for the digital world. |  We are seeking for a reliable and organized person to join us as a Support Function Executive. We are a group of driven and hard-working i,GoodCommunication|ExperienceinITIndustry|Excel|Sql|
Technical Support Officer Required in CANADA & AUSTRALIA,Pear Visa Immigration Services Private Limited,Australia|Canada,3-8years,3750000 - 7000000 INR,Troubleshooting technical issues. |  Diagnosing and repairing faults. |  Resolving network issues. |  Installing & configuring hardware & software. |  Following up with clients to ensure the problem is resolved.,TechnicalSupportExecutiveTechSupport|technicalsupport|TechSupportOfficer|SoftwareSolutions|TechnicalHelpdesk|TechnicalSupportEngineer|TechnicalSupportRepresentative|
Technical Support / Tech Support / Technical Support Executive / Technical Support Engineer,Adam Information Technologies India Private Limited,Hyderabad/Secunderabad,2-5years,Not Specified,"Looking for Technical Support, Tech Support, Technical Support Executive, Technical Support Engineer for Hyderabad location with Experience into Application Integration, Web Services and Messaging Queue",TSR|TSE|CustomerSupport|Helpdesk|TechnicalSupport|TechSupport|TechnicalSupportExecutive|TechnicalSupportEngineer|ApplicationIntegration|MessageQueue|WebServices|
Customer Support Associate / Technical Support Associate,Black And White Business Solutions Private Limited,Bengaluru/Bangalore,0-5years,Not Specified,International Call Center / BPO /Banking / Ecommerce / Healthcare/Customer Support / Technical Support,Voice|ChatSupport|Email|SupportCustomerSupport|CustomerService|CustomerSupportExecutive|CustomerCare|CustomerCareExecutive|TechnicalSupport|TechnicalSupport|TechSupport|TechnicalSupportExecutive|
Fresher / Customer Support / Technical Support / call center / BPO,Black And White Business Solutions Private Limited,Bengaluru/Bangalore,0-5years,Not Specified,International Call Center / BPO /Banking / E commerce / Healthcare/Customer Support / Technical Support,Voice|ChatSupport|Email|SupportCustomerSupport|CustomerService|CustomerSupportExecutive|CustomerCare|CustomerCareExecutive|TechnicalSupport|TechnicalSupport|TechSupport|TechnicalSupportExecutive|
Banking / Telecom / Health Care / Customer Support / Technical Support,Black And White Business Solutions Private Limited,Bengaluru/Bangalore,0-5years,Not Specified,International Call Center / BPO /Banking / E commerce / Healthcare/Customer Support / Technical Support,Voice|ChatSupport|Email|SupportCustomerSupport|CustomerService|CustomerSupportExecutive|CustomerCare|CustomerCareExecutive|TechnicalSupport|TechnicalSupport|TechSupport|TechnicalSupportExecutive|
Technical Support -International exp 4-7 yrs,Waterleaf Consultants Private Limited,Delhi|Mumbai,4-7years,550000 - 1250000 INR,WE ARE HIRING,ServoMotors|PLCprogramme|Troubleshooting|ServoDrives|Filedbus|systemCommissioning|TechnicalSupport|
HIRING FOR INTERNATIONAL CS / TS VOICE  PROCESS,Insigma Technologies Private Limited,Hyderabad/Secunderabad,1-8years,200000 - 520000 INR,HIRING FOR INTERNATIONAL CS / TS VOICE  PROCESS,CustomerSupport|TechnicalSupport|ItHelpdesk|TechnicalSupportExecutive|
AR- Team Lead - Technical Support Executive,Insigma Technologies Private Limited,Nagercoil,2-7years,Not Specified,Maxerience highly believes on Artificial Intelligence & Internet-of-Things based systems for the digital world. |  We are seeking for a reliable and organized person to join us as a Support Function Executive. We are a group of driven and hard-working i,TeamLead|GoodCommunication|ITIndustryExperience|Excel|Sql|
Project Panel - Sr. Technical Support Executive,Insigma Technologies Private Limited,Nagercoil,1-7years,Not Specified,Maxerience highly believes on Artificial Intelligence & Internet-of-Things based systems for the digital world. |  We are seeking for a reliable and organized person to join us as a Support Function Executive. We are a group of driven and hard-working i,GoodCommunication|ITIndustryExperience|Excel|Sql|
IOT- Team Lead - Technical Support Executive,Vibrantzz Management Services,Nagercoil,2-7years,Not Specified,Maxerience highly believes on Artificial Intelligence & Internet-of-Things based systems for the digital world. |  We are seeking for a reliable and organized person to join us as a Support Function Executive.,TeamHandling|GoodCommunication|WorkExperienceinITIndustry|Excel|Sql|
Technical Support Executive,Arccaa Analytics And IT Solutions LLP,Mumbai|MumbaiCity,2-6years,450000 - 2000000 INR,Hiring for Technical Assistance - Center Representative for US Based Corporate Company with Excellent salary packages. |    Candidates who have recently worked in a Technical voice process for min 2years and max 6years into BPO/IT sector can apply ASAP,TechnicalSupport|TechnicalSupportExecutive|
Technical Support Executive,CSS Corp Private Limited,Hyderabad/Secunderabad,3-7years,Not Specified,Candidates should provide support to customers by clearly communicating technical solutions in a user-friendly and professional manner. Candidates are mainly responsible for taking charge of the queries (via email or phone),InternationalVoiceSupport|InboundCalls|TechnicalSupport|
Technical Support Engineer,Izee Manpower Consultancy Private Limited,Chennai,0-5years,Not Specified,Looking for Hindi speaking candidate with technical knowledge in Networking and troubleshooting . |  willing to work in both day and Night shift. Immediate joiner are required . |  work from Home till Jan 2021. |  candidate should be good in Hindi .,TechnicalSupportEngineer|TechnicalSupportExecutive|
Technical Support Specialist,Black And White Business Solutions Private Limited,Bengaluru/Bangalore,1-8years,Not Specified,Industry: |  ITES/BPO  |  Location:  |  Bengaluru / Bangalore  |  Years of Experience: |  1 - 8 years |  Function: |  Customer Service/Call Centre/BPO,TSR|TSE|Tsa|ServiceDesk|TechnicalSupport|TechnicalSupportEngineer|TechSupport|TechnicalSupportExecutive|ItHelpdesk|ITsupport|ItServiceDesk|
BPO - Customer support / Technical support Associate / sal 4L PA.,Java R&d Private Limited,Bengaluru/Bangalore,0-5years,Not Specified,International Call Center / BPO /Banking / E commerce / Healthcare/Customer Support / Technical Support,Voice|ChatSupport|Email|SupportCustomerSupport|CustomerService|CustomerSupportExecutive|CustomerCare|CustomerCareExecutive|TechnicalSupport|TechnicalSupport|TechSupport|TechnicalSupportExecutive|
Position: Process Lead/Business analyst ( Female )_Bhopal_Madhya Pradesh,Skylark Hr Solutions Private Limited,Bhopal,2-4years,Not Specified,We are hiring for the Role of Process Analyst /Business Analyst for Bhopal Location.,BusinessAnalyst|ProcessExecutive|TechnicalSupport|TechnicalSupportExecutive|ItHelpdesk|TechnicalSupportEngineer|
Technical Support Executive,US Tech Solutions Private Limited,Chennai,0-1years,Not Specified,|                                  |,
Technical Support Engineer,Black And White Business Solutions Private Limited,Hyderabad/Secunderabad|Noida,2-7years,Not Specified,General Details |   |  • Title – Technical Support Engineer |  • Timings – Rotational Shift per business requirement. |  • Cab & Meals – Provided for night shift,ActiveDirectory|Window|DnsServer|DhcpServer|RemoteAccess|Windowsadmin|Citrix|Vmware|
International Technical Support / Rotational Shifts / Sal upto 3lpa,Sky Scrapper Consulting,Bengaluru/Bangalore,0-5years,Not Specified,International Call Center / BPO /Banking / E commerce / Healthcare/Customer Support / Technical Support,Voice|ChatSupport|Email|SupportCustomerSupport|CustomerService|CustomerSupportExecutive|CustomerCare|CustomerCareExecutive|TechnicalSupport|TechnicalSupport|TechSupport|TechnicalSupportExecutive|
BPO-Technical support voice process @ Kharadi - Magarpatta | 8237076800,One Degree North Human Resource,Pune,0-5years,Not Specified,Technical Support VOICE process,Virginmedia|concentrix|Wipro|Troubleshooting|Voice|internationalvoiceprocess|Technicalsupport|techsupport|desktopsupport|ApplicationSupport|
Hiring for Technical Support Voice Call Shruti 8777584221,Insigma Technologies Private Limited,Bengaluru/Bangalore,0-3years,Not Specified,iring for Technical Support Voice Call Shruti 8777584221,Undergraduate|CallCenter|Bpo|ExcellentCommunication|International|
AR- Sr. Technical Support Executive,Whitehr Consultancy Services,Nagercoil,1-6years,Not Specified,"Looking for candidates with good experience in Support Executive, sql, excel and good communication",SupportExecutive|Sql|Excel|
Technical Support Engineer,Vibrantzz Management Services,Pune,0-3years,180000 - 350000 INR,urgent required technical support freshers and experience candidates. |          |     MNC company on roll  |,HardwareNetworkingMale|HardwareAndNetworking|NetworkEngineer|SystemAdministrator|NetworkAdministrator|
Global Technical Support Assistance Representative,White Horse Manpower Consultancy Private Limited,Mumbai,3-8years,Not Specified,Vibrantzz Management Services Offering Job for Technical Support Assistance Representative at Corporate MNC  |     |    Openings for International Stock Broking firm at Andheri Location  |     |    Candidate with Good Technical Knowledge and Experience Can apply,TechnicalAssistance|
Technical Support / Email Chat Support / Web Chat Support / IT Help Desk / BPO,Black And White Business Solutions Private Limited,Bengaluru/Bangalore,0-5years,Not Specified,International Call Center / BPO /Banking / E commerce / Healthcare/Customer Support / Technical Support,Voice|ChatSupport|Email|SupportCustomerSupport|CustomerService|CustomerSupportExecutive|CustomerCare|CustomerCareExecutive|TechnicalSupport|TechnicalSupport|TechSupport|TechnicalSupportExecutive|
Technical Support Engineer - Voice Process,Weone Business Solutions Private Limited,Chennai,0-4years,Not Specified,"Roles and Responsibilities : Handling calls & resolving enterprise level customer tickets, forensic work based on virus related issues, handling escalation calls, resolving tickets based on SLA, following internal process & keeping self-updated",Printer|Activedirectory|Networking|Os|Windows|Desktop|Laptop|Dns|DHCP|
Hiring for technical support executive,Vibrantzz Management Services,Mumbai|MumbaiCity|NaviMumbai|Thane,1-11years,Not Specified,Applicant would be handling calls of the customer and solve their technical Issues by troubleshooting. They should have good knowledge of windows 10,Helpdesk|TSE|TroubleShooting|TechnicalSupport|TechSupport|TechnicalSupportExecutive|ItHelpdesk|DesktopSupport|TechnicalSupportEngineer|Troubleshoot|
Technical Support Engineer,Riju Karan (Proprietor Of Toyota Climax India),Gurgaon/Gurugram,1-5years,220000 - 440000 INR,Hiring For Technical Support Engineers.,DesktopSupportEngineer|TechnicalSupportEngineer|CustomerSupportEngineer|Techsupport|TechnicalSupportRepresentative|TechnicalSupportExecutive|
Technical Support Engineer,Weone Business Solutions Private Limited,Chennai,1-4years,Not Specified,•	Any graduate or under graduate  |  •	Immediate joiners  or 15 days notice  |  •	Excellent communication skills required  |  •	Min 6 months experience in any Tech support . |,Voice|TechnicalSupport|
Technical Support Engineer,CSS Corp Private Limited,Chennai,0-5years,190000 - 350000 INR,*The person would be responsible for handling customer calls and troubleshooting technical issues related to operating systems / Routers / Modems & ISP related issues. |    |   *A Good Team Player |    |   *Prior Experience in Technical Support Process,CustomerSupport|TechnicalSupport|TechnicalSupportEngineer|
Technical Account Manager/Support Engineer Storage/ Implementation,Black And White Business Solutions Private Limited,Mumbai|MumbaiCity|NaviMumbai|Thane,5-15years,310000 - 1010000 INR,We are sourcing candidates for the below mentioned requirement. For IT company job location is in Mumbai. With various locations as required by client.,SDDC|NSX-T|Netabackup|HitachiVantara|SQL-DB|Vmware|Netapp|Vsan|Vrops|Commvault|Veeam|Networker|Backup|Storage|NetappStorage|Emc|Database|Virtualization|Nutanix|
Hiring Freshers & Experience for International BPO/ Healthcare / Telecom/ Voice/ sal 4L PA.,Black And White Business Solutions Private Limited,Bengaluru/Bangalore,0-5years,Not Specified,International Call Center / BPO /Banking / E commerce / Healthcare/Customer Support / Technical Support,Voice|ChatSupport|Email|SupportCustomerSupport|CustomerService|CustomerSupportExecutive|CustomerCare|CustomerCareExecutive|TechnicalSupport|TechnicalSupport|TechSupport|TechnicalSupportExecutive|
Immediate Requirement For Call Center / Customer Support / Bpo!!!,Black And White Business Solutions Private Limited,Bengaluru/Bangalore,0-5years,Not Specified,International Call Center / BPO /Banking / E commerce / Healthcare/Customer Support / Technical Support,Voice|ChatSupport|Email|SupportCustomerSupport|CustomerService|CustomerSupportExecutive|CustomerCare|CustomerCareExecutive|TechnicalSupport|TechnicalSupport|TechSupport|TechnicalSupportExecutive|
Hiring Graduate & UG Fresher / EXP / International BPO / Technical support Associate.,Riju Karan (Proprietor Of Toyota Climax India),Bengaluru/Bangalore,0-5years,Not Specified,International Call Center / BPO /Banking / E commerce / Healthcare/Customer Support / Technical Support,Voice|ChatSupport|Email|SupportCustomerSupport|CustomerService|CustomerSupportExecutive|CustomerCare|CustomerCareExecutive|TechnicalSupport|TechnicalSupport|TechSupport|TechnicalSupportExecutive|
Technical Support Executive,Insigma Technologies Private Limited,Mysore,0-3years,150000 - 300000 INR,Required Technical Support Executives.,Email|Phone|Hardware|Maintenance|Troubleshooting|NetworkConfiguration|Networking|TechnicalSupport|
Project Panel- Team Lead - Technical Support Executive,DXC Technology India,Nagercoil,2-7years,Not Specified,Maxerience highly believes on Artificial Intelligence & Internet-of-Things based systems for the digital world. |  We are seeking for a reliable and organized person to join us as a Support Function Executive. We are a group of driven and hard-working,GoodCommunication|TeamHandling|ITIndustryWorkingExperience|Excel|Sql|
Technical Voice Support,Sky Scrapper Consulting,Bengaluru/Bangalore,0-5years,Not Specified,1.	Person is required to provide 24X7 support on Service Desk responsibilities |  2.	Resource is required to have good communication skills – both verbal and written |  3.	Any Graduates and undergraduates |  4.     Fresher can also apply  |,TroubleshootingHardware/Networking/OSrelatedqueries/TrackingSLAperformance|
BPO-Technical support voice process @ HINJEWADI | 8237076800,Black And White Business Solutions Private Limited,Pune,0-5years,Not Specified,Technical Support VOICE process,Virginmedia|concentrix|Wipro|Troubleshooting|Voice|internationalvoiceprocess|Technicalsupport|techsupport|desktopsupport|ApplicationSupport|
BPO / Voice Process / Rotational Shifts / Sal upto 3lpa,Black And White Business Solutions Private Limited,Bengaluru/Bangalore,0-5years,Not Specified,International Call Center / BPO /Banking / E commerce / Healthcare/Customer Support / Technical Support,Voice|ChatSupport|Email|SupportCustomerSupport|CustomerService|CustomerSupportExecutive|CustomerCare|CustomerCareExecutive|TechnicalSupport|TechnicalSupport|TechSupport|TechnicalSupportExecutive|
International Voice Process / Rotational Shifts / Sal upto 4lpa,Black And White Business Solutions Private Limited,Bengaluru/Bangalore,0-5years,Not Specified,International Call Center / BPO /Banking / E commerce / Healthcare/Customer Support / Technical Support,Voice|ChatSupport|Email|SupportCustomerSupport|CustomerService|CustomerSupportExecutive|CustomerCare|CustomerCareExecutive|TechnicalSupport|TechnicalSupport|TechSupport|TechnicalSupportExecutive|
Immediate Requirement For Call Center / Customer Support / Bpo!!!,Black And White Business Solutions Private Limited,Bengaluru/Bangalore,0-5years,Not Specified,International Call Center / BPO /Banking / E commerce / Healthcare/Customer Support / Technical Support,Voice|ChatSupport|Email|SupportCustomerSupport|CustomerService|CustomerSupportExecutive|CustomerCare|CustomerCareExecutive|TechnicalSupport|TechnicalSupport|TechSupport|TechnicalSupportExecutive|
Custumer support voice/Technical voice/International voice/sal upto 4Lpa,Black And White Business Solutions Private Limited,Bengaluru/Bangalore,0-5years,Not Specified,International Call Center / BPO /Banking / E commerce / Healthcare/Customer Support / Technical Support,Voice|ChatSupport|Email|SupportCustomerSupport|CustomerService|CustomerSupportExecutive|CustomerCare|CustomerCareExecutive|TechnicalSupport|TechnicalSupport|TechSupport|TechnicalSupportExecutive|
Immediate Requirement For Call Center / Customer Support / Bpo!!!,Black And White Business Solutions Private Limited,Bengaluru/Bangalore,0-5years,Not Specified,International Call Center / BPO /Banking / E commerce / Healthcare/Customer Support / Technical Support,Voice|ChatSupport|Email|SupportCustomerSupport|CustomerService|CustomerSupportExecutive|CustomerCare|CustomerCareExecutive|TechnicalSupport|TechnicalSupport|TechSupport|TechnicalSupportExecutive|
