jobTitles,Company,jobLocations,requiredExperiance,Salary,JobDescription,Skills
SAP ABAP Consultant,TransAltus Management consulting Private Limited,Bengaluru/Bangalore|Chennai,5-10years,Not Specified,Position : SAP ABAP  |  Experience : 5 to 10 Years  |  Location : Bangalore (Remote Support) |   |,CDSVIEWS|SapAbap|Odata|Ooabap|Amdp|
SAP ABAP,Ideslabs Private Limited,Bengaluru/Bangalore|Hyderabad/Secunderabad,3-8years,Not Specified,SAP ABAP |   |  JOB TYPE- CONTRACT  |   |  COMPANY- NTT DATA |   |  PAYROLL-  IDESLABS (P) LTD |   |  LOCATION- HYDERABAD/BANGALORE,SapAbap|SapAbapConsultant|AbapConsultant|
SAP ABAP Consultant,TransAltus Management consulting Private Limited,Bengaluru/Bangalore,5-10years,Not Specified,"#Hiring Alerts |  Very immediate opportunity of SAP ABAP for remote project. |  Looking only for immediate joiners. |  Experience required: 5-10 years |  JD: |  ABAP with OData and HANA, CDS Views, AMDP. |   |  Interested candidates can apply to [HIDDEN TEXT]",Abap|Odata|Ooabap|Hana|
SAP ABAP Consultant,Siera IT Services Private Limited,Hyderabad/Secunderabad,5-10years,Not Specified,Immediate Requirement for SAP ABAP Consultant @ Client Location.,Ale|Hana|Idoc|
SAP ABAP Consultant,BOP Consultants Private Limited,Bengaluru/Bangalore|Chennai,5-8years,Not Specified,"Experience in SAP Abap with ODATA |  Interactive ALV reports |  Object Oriented Programming |  Enhancements (BAdi, User exits, Implicit / Explicit enhancements) |  HANA developments with ABAP Managed Database Procedures (AMDP) and CDS |  Conversions (BAPIs, BDCs, A",SapAbap|Odata|Alv|Bapis|
SAP ABAP,Ideslabs Private Limited,Hyderabad/Secunderabad,3-8years,Not Specified,New open role at [NTT DATA]: [SAP ABAP],SapAbap|
ABAP FIORI CONSULTANT,Siera IT Services Private Limited,Hyderabad/Secunderabad,5-10years,Not Specified,Immediate Requirement for ABAP Consultant @ Client Location.,Implementation|Hana|Fiori|
ABAP Developer ERP,Brain Management Consultants India Private Limited,Chennai,5-7years,450000 - 850000 INR,"Job Description  |   .	Technical analysis, designing, reviews, testing an implementation of SAP developments, ranging from small enhancements to large projects |   .	Ensure compliance to existing and development of required data and reporting standards |   .",ABAPDeveloper|Erp|
SAP ABAP,Millennium Ims Private Limited,Hyderabad/Secunderabad|OtherIndia,7-12years,Not Specified,Immediate Requirement |  Experience- 7 to 9 years |  Location : Offshore – Preferred Hyderabad,SAP|Abap|
Senior SAP ABAP Consultant,Tech Tiera Incorporation,Hyderabad/Secunderabad,8-15years,Not Specified,"We are looking for the SAP ABAP Consultant with 7+ years of experience . Experience with RICEFW, HANA, Workflow, Fiori",OO-ABAP|CDS|FIORI.|SapAbap|AbapOnHana|Workflows|
SAP ABAP HR Consultant,We Search INC,Chennai,3-6years,Not Specified,SAP Consultant who has expertise in SAP on ABAP-HR. He/she should be having hands on experience in core HR modules.,SAPABAPHrConsultant|
SAP ABAP Hr Consultant,Keen Bright Solutions Llp,Hyderabad/Secunderabad,3-8years,Not Specified,SAP ABAP HR,SAPABAPHrConsultant|
SAP ABAP SAP ABAP Hr Consultant  Fico  BPC Consultant Fiori,Keen Bright Solutions Llp,Hyderabad/Secunderabad,3-8years,Not Specified,Looking for SAP ABAP SAP ABAP Hr Consultant  Fico  BPC Consultant Fiori,Fico|SapAbap|Fiori|
SAP ABAP Fresher,Dwaith Infotech Private Limited,Bengaluru/Bangalore|Hyderabad/Secunderabad,Fresher,Not Specified,"|  Aptitude: |  Analytical Reasoning, Data Interpretation, Data Sufficiency, Logical Reasoning, Quantitative Reasoning, Geometry. |    |  ABAP: |  DDIC, Basics, ABAP Reports, Interfaces, Dialog Programming, Enhancements and Forms.",SapAbap|
SAP ABAP Trainee,Dwaith Infotech Private Limited,Hyderabad/Secunderabad,Fresher,Not Specified,"Eligibility Criteria:  |    |   |  1) Qualification: B.E/B.Tech(CSE/ECE) or MCA/MTech(CSE/ECE) with minimum 65% Marks (Those who passed out after 2017 are eligible) |   |  2) Those who have completed the ABAP training on Dictionary, Reports, In",Abap|
SAP ABAP Consultant,Balkan HR Services Private Limited,Mumbai|MumbaiCity|NaviMumbai|Thane,4-8years,Not Specified,"Engineer with 4 - 8 years of experience in SAP ABAP. Proficient on Module pool programming, BDCs, BAPI, RFC, idocs","""SAPABAPConsultant""|""SAPABAP""|""Modulepoolprogramming""|Bdcs|Bapi|Rfc|Idocs|"
SAP ABAP developers - 1-2 years,Phoenix Business Consulting India Private Limited,Hyderabad/Secunderabad,1-3years,220000 - 350000 INR,Hiring for ABAP consultants with 1-2 years of experience.,SAPABAPdevelopers|SAPABAPprogrammingRICEF|(Reports|Forms)|Interface|Conversions|Enhancements|
hiring SAP ABAP Consultants,Aequor Information Technologies Priivate Limited,Bengaluru/Bangalore|Hyderabad/Secunderabad,4-9years,Not Specified,"SAP ABAP Consultants with MM, SD, PS, FI Modules Plus SAP HR ABAP",OoAbap|SapAbap|SapHrAbap|
Jobs for sap ABAP Workflow,Ideslabs Private Limited,Bengaluru/Bangalore|Mumbai,5-10years,Not Specified,Jobs| for SAP ABAP Workflow,ABAPWorkflow|RICEFWobjects|BADI’s|Webdynpro|
Sr. Product Engineer,Best infosystems Ltd,Hyderabad/Secunderabad,3-13years,Not Specified,Looking for Product Engineer,SAP-ABAPCore|ABAPCore|Abap|
SAP ABAP Developer  [Fresher ],Dwaith Infotech Private Limited,OtherIndia,0-3years,100000 - 420000 INR,"1) Qualification: B.E/B.Tech(CSE/ECE) or MCA/MTech(CSE/ECE) with minimum 65% Marks (Those who passed out after 2009 are eligible) |   |  2) Those who have completed the ABAP training on Dictionary, Reports, Interfaces, Dialog programming, Enhancements and",ABAPDeveloper|AbapHumanResourcesConsultant|Abap|SapAbap|Basis|SAP|
Sr. Software Engineer,Best infosystems Ltd,Bengaluru/Bangalore,3-10years,Not Specified,We are looking for Strong SAP Technical consultant with hands on OO ABAP.,SAP-ABAP|Abap|SapAbap|TechnicalConsultant|
SAP ABAP,Quess IT Staffing (Formerly known as Magna Infotech),Hyderabad/Secunderabad,4-6years,Not Specified,"Please  find the Below Job Description :- |  Job Description for SAP ABAP Consultant |  Role:-SAP ABAP Consultant |  Skills Required:- SAP RAR,Experience of working in SAP Implementation/Development and S |  Experience:- 4-6Yrs |  Location:- Hyd |  NP:Immediate-15days",SAPRAR|ExperienceofworkinginSAPImplementation/Development|
SAP ABAP Technical Consultant,Labridge Consulting,Bengaluru/Bangalore|Chennai,8-12years,Not Specified,Designation: SAP ABAP Technical Consultant |  Experience : 8 - 12 Years |  Location: Hyderabad/Chennai/Bangalore |  Mode; Full Time |,Technical|ProductionPlanning|SAP|Abap|Pp|
