jobTitles,Company,jobLocations,requiredExperiance,Salary,JobDescription,Skills
Php developer,Sales Moguls Private Limited,Delhi,1-3years,Not Specified,We are looking for talented Php developer capable of developing highly demanding e-commerce applications.  |    |   For more pls call Hema @ 8800847556,Smarty|Phpdeveloper|PhpMysqlAjax|PHPprogrammer|Wordpress|WordpressDeveloper|Drupal|Magento|Php|CakePHP|Joomla|jQuery|Javascript|AJAX|Json|CSS|
Sales Officer,HDFC Sales Pvt Ltd,Mumbai,0-3years,Not Specified,Looking for  Sales Officer,Sales|SalesOfficer|Freshers|RelationshipManagement|BankingSales|BankingProductsales|BusinessDevelopment|
Social Media Marketing Executive/Manager,Sales Moguls Private Limited,Delhi,3-6years,Not Specified,Looking for a Social Media Marketing Manager with minimum 3 years of experience.,SMOExecutive|SocialMedia|SocialMediaExecutive|OnlineMarketing|Advertising|SocialNetworking|SocialMediaManager|InternetMarketing|facebook|instagrammanager|ContentWriter|ContentManager|ContentEditor|SocialMediaMarketingManager|SEO|
Relationship Manager/Executive,Sales Moguls Private Limited,Delhi,1-3years,Not Specified,Looking for a Relationship Manager/Executive with good communication skills. |   Freshers can apply too.,Telesales|CRM|Recruiter|NonITrecruiter|Bde|Bdm|Relationshipmanager|Sales|Selling|Marketing|DirectSales|AccountManager|BD|CrmSales|
UI/UX Developer,Sales Moguls Private Limited,Delhi,2-3years,240000 - 340000 INR,"Requirement of UI/UX Developer for Technology team for a permanent position, a person who has about 2-3 years of experience in UI/UX Development for web and software development. |",Photoshop|WebDeveloper|UserInterfaceDevelopment|Html5|Css3|Javascript|Bootstrap|jQuery|UiDevelopment|UserInterface|graphicaluserinterface|UXDeveloper|Programming|UiDesign|UX/UIDesign|
Corporate Sales Executive,Bright IT Global Solutions Private Limited,Gurgaon/Gurugram,2-5years,Not Specified,Urgent requirement for Sales executive for gurgaon location,B2bSales|
"Telesales , Business Development , B2B Sales",Hire Zone Solution,Delhi,0-3years,100000 - 150000 INR,"Identifying Clients, Introducing the Company and Self, Presenting the Concept, Convincing Its Values and Its Benefits and Executing Orders and other Corporate Services, Adhering to Target Limits. |   |  This Job Does Want You to Collect Data, Sort anylzise",OutboundSales|Telesales|BusinessAnalyst|FinancialAnalyst|b2bsales|
Corporate Sales Supervisor,Bright IT Global Solutions Private Limited,Gurgaon/Gurugram,5-10years,Not Specified,Urgent requirement for Sales supervisor for gurgaon location,InternationalSales|B2bSales|
"Hiring for Key Account Manager(B2B sales) in Tradebulls Securities for Bangalore,Chennai & Hyderabad",TradeBulls Securities Private Limited,Bengaluru/Bangalore|Chennai,1-6years,Not Specified,"Looking for 1year +Experience in Broking in B2B sales(Sub Broker sales)for Bangalore,Chennai & Hyderabad Location |   Work form Home is available  |     Acquisition of New Sub broker to the company |",Broking|SubBroker|B2bSales|franchiseacquisition|
Senior Executive - Sales/ Assistant Manager- Sales ||Corporate Sales/B2B Sales| Bangalore,Monster.com - India,Bengaluru/Bangalore,1-8years,Not Specified,Reporting to the Sales Manager/Branch Manager the incumbent will be responsible for acquisition of new business and sales management for the assigned territory / accounts. The job involves planning and execution of sales plans,SeniorExecutive-Sales|AssistantManager-Sales|CorporateSales|B2bSales|ClientRetention|Acquistion|Businessdevelopment|RevenueGeneration|Reportsgeneration|
Senior Executive - Sales/ Assistant Manager- Sales ||Corporate Sales/B2B Sales| Mumbai,Monster.com - India,Mumbai,1-8years,Not Specified,Reporting to the Sales Manager/Branch Manager the incumbent will be responsible for acquisition of new business and sales management for the assigned territory / accounts. The job involves planning and execution of sales plans,SeniorExecutive-Sales|AssistantManager-Sales|CorporateSales|B2bSales|ClientRetention|Acquistion|Businessdevelopment|RevenueGeneration|Reportsgeneration|
Executive-Sales/Senior Executive- Sales/Assistant Manager-Sales ||Corporate/B2B Sales| Hyderabad,Monster.com - India,Hyderabad/Secunderabad,1-7years,Not Specified,Reporting to the Sales Manager/Branch Manager the incumbent will be responsible for acquisition of new business and sales management for the assigned territory / accounts. The job involves planning and execution of sales plans,"""corporatesales""|""SMBsales""|""SMEsales""|""clientAcquisition""|""B2Bsales""|""spaceselling""|""conceptselling""|""adsales""|""directsales""|"
Sales Executive - B2B Sales - Industrial Sales,Aspire Group of Services,Lucknow,0-1years,Not Specified,REQUIREMENTS |  *Proven experience as a Sales Executive or relevant role in B2B Sales. |  *Excellent knowledge of MS Office. |  *Should have Competency and skills required for Sales. |  *Fast learner and passion for sales. |,INDUSTRIALENGINEER|LeadGeneration|B2bSales|IndustrialSales|businesstobusiness|Marketing|B2bMarketing|
Branch Sales Manager  Relationship Manager  B2B sales Sales Manager  Sales Officer,I Tech Solutions,Ahmedabad|Mumbai,1-8years,Not Specified,Hiring for one of the renowned company forMumbai/ Ahmedabad/Pune,BranchSalesManager|RelationshipManager|B2bSales|businesstobusiness|corporatesales|B2bMarketing|DirectSales|salesmarketing|SalesManager|
Opening for BDO(Field Work) in top Rating MNC Co. at Hyderabad,PARC Kalite Consultant,Hyderabad/Secunderabad,1-3years,100000 - 300000 INR,Job Designation : BDO |    Job Location : Hyderabad  |    Experience : MBA fresher or 2 Years |    Salary : 3.5lpa |    Qualification : MBA  |   Age Preferred : 21 to 28,"""B2bsales""|""businesstobusiness""|""sales""|""salesofficer""|""BDO""|""BDE""|""businessdevelopmentoffcier""|""Businessdevelopmentexecutive""|"
Sales Officer (B2B),Spirient Staffing Solutions Private Limited,Delhi|Gurgaon/Gurugram,1-4years,Not Specified,We're looking for sales officer for Gurgaon location with Excellent Communication skills.,BroadbandSales|Telecommunication|Telecom|Broadband|
Business Development - IT Sales,MP Dominic & Co,Cochin/Kochi/Ernakulam,2-7years,Not Specified,Excellent experience in IT Sales,"""ITSales""|""BusinessDevelopmentITSales""|""InternationalITSales""|B2b|B2C|"
Sales Associate - Urban Company,Urbanclap Technologies India Private Limited,Hyderabad/Secunderabad|Mumbai,1-6years,300000 - 600000 INR,Visit prospective customers homes for their Home Painting Requirement Do a home survey and pitch to Customers about the UCs Painting Services and consult them to make the right choices. Win the customer & get UC hired for the Customers Painting work.,FieldSales|DirectSales|b2bsaSalesExecutive|ChannelSales|CorporateSales|DirectSelling|
Opening for BDO(Field Work) in top Rating MNCs  Co. at Bangalore,PARC Kalite Consultant,Bengaluru/Bangalore,1-5years,150000 - 350000 INR,Job designation : BDO(Field Work) |  Job Location : Bangalore |  Experience :MBA Fresher |  Qualification : MBA Marketing |  Note : Candidate will on 3rd party & its a one year Contract base job.,"""BDO""|""BusinessDevelopmentOfficer""|""BusinessDevelopmentExecutive""|""sales""|""salesexecutive""|""salesofficer""|""BDE""|""b2bsales""|""businesstobusiness""|""BD""|"
Assistant Manager - Sales/Deputy Manager- Sales (Corporate Sales) |Chennai,Monster.com - India,Chennai,1-7years,Not Specified,"We are looking for candidate who shall be responsible for Acquisition of new business, growing potential accounts from existing value to it’s potential and to turnaround existing accounts to it’s full potential.","""corporateSales""|""b2bsales""|""conceptselling""|""businesstoBusiness""|""keyaccounts'|""majoraccounts""|"
Opening for BDO in top MNC Co. at Indore,PARC Kalite Consultant,Indore,1-3years,150000 - 350000 INR,"Job Designation : BDO (B2B sales) |    Job Location : Indore |    Salary : 3.5lpa |    Experience : 1 to 3 years |    Note : Candidate will on 3rd party payroll & One year contract base job, Contract will be  renewable depend on performance |","""B2bsales""|""businesstobusiness""|""salesofficer""|""businessdevelopmentofficer""|""businessdevelopment""|""businessdevelopmentexecutive""|""businessdevelopmentmanager""|""sales""|""coperatesales""|"
Lead Generation Executive,Strategic Initiatives,Kozhikode/Calicut,1-3years,180000 - 280000 INR,"We are looking for an experienced Lead Generation Executive to work with our Sales and Marketing team to develop and execute a healthy lead generation program, driving qualified leads into the sales pipeline.",LeadGeneration|LeadGenerationSales|B2bSales|B2bMarketing|
"Area Sales Manager (Courier,Transportation,Freight,Logistics industry)",I Tech Solutions,Ahmedabad|Chennai,4-6years,520000 - 720000 INR,Position: Area Sales Manager |   |    Area Sales Manager report to RSM/ ARSM.,CommunicationSkills|B2CSalesMarket|SurveyArea|SalesManagement|FieldSales|CustomerRetention|B2bSales|SalesManagement|CorporateSales|EnterpriseSales|Salesmarketing|Corporatemarketing|CorporateSelling|
"National relationship Manager , b2b sales",Selligence Solutions Private Limited,Mumbai|MumbaiCity|NaviMumbai|Thane,2-6years,Not Specified,Urgent hiring for NRM,NationalSalesManager|SalesManager|
