jobTitles,Company,jobLocations,requiredExperiance,Salary,JobDescription,Skills
Lead Consultant_ 9 To 12 Years_ BFSI _ Business Analysis_ Chennai,Novac Technology Solutions Private Limited,Chennai,9-12years,Not Specified,JOB DETAILS |   |  Qualification: Any Graduate |  Experience: 9 to 12 Years |  Place of Posting: Chennai |  Industry: BFSI |,GeneralInsurance|Businessprocessanalyst|BusinessAnalyst|GeneralInsuranceCompany|BusinessRequirementsGathering|NonMotorInurance|MotorInsurance|BusinessRequirementsDocument|BusinessAnalyst|Brd|Frd|FunctionalRequirementDocument|
ANALYST - MBA,Comfyi Solution,Chennai,0-1years,Not Specified,"Responsible for the  Analysis and research either inBusiness domain or Financial domain.Sound aptitude, outstanding logical reasoning and analytical skills.Walkin for an interview:-",businessintelligence|businessanalytics|Financialanalysis|BusinessAnalysis|Marketting|
Business Analyst,Esther Jeevitha (Proprietor of Morgan Techno India),Chennai,1-5years,250000 - 450000 INR,Requirement for the post of Business Analyst.,BusinessAnalyst|BusinessAnalysis|MarketAnalysis|BusinessPlanning|BusinessResearch|
Business Analyst - Canada,A V Immigration And Careers Consultancy Private Limited,Australia|Canada,3-8years,1600000 - 3200000 INR,"ICT BUSINESS AND SYSTEMS ANALYSTS work with users to formulate system requirements, develop system plans and documentation, review and evaluate existing systems, and design and modify systems to meet users business needs",BusinessAnalyst|BusinessAnalysis|BusinessPlanning|BA|BusinessProcesses|businesspractices|projectplans|projectmanagementmethodologies|
Business Analyst - Canada,A V Immigration And Careers Consultancy Private Limited,Australia|Canada,9-14years,1600000 - 3200000 INR,"ICT BUSINESS AND SYSTEMS ANALYSTS work with users to formulate system requirements, develop system plans and documentation, review and evaluate existing systems, and design and modify systems to meet users business needs",BusinessAnalyst|BusinessAnalysis|BusinessPlanning|BA|BusinessProcesses|businesspractices|projectplans|projectmanagementmethodologies|
Business Analyst required in CANADA & AUSTRALIA,Pear Visa Immigration Services Private Limited,Australia|Canada,3-8years,4050000 - 9000000 INR,"Creating a detailed business analysis, outlining problems, opportunities & solutions for a business |  Budgeting and forecasting |  Planning and monitoring |  Financial modelling |  Variance Analysis |  Pricing Reporting |  Defining business requirements and reporting",Pricing|Finance|techanalysis|FinancialModelling|TechnicalAnalysis|techplanning|Budgeting|VarianceAnalysis|BusinessAnalyst|Forecasting|associatebusinessanalyst|BusinessAnalyst|SeniorBusinessAnalyst|
Business Analyst required in CANADA & AUSTRALIA,Q Visas Immigration,Australia|Canada,2-7years,Not Specified,Identify and resolve project issues.,Finance|TechAnalysis|BusinessAnalyst|BusinessConsultant|SeniorBusinessAnalyst|SystemAnalyst|ResearchAnalyst|
BA - IT/ Business Analyst - IT / Technology Asst Manager,Axs Solutions And Consulting Private Limited,Mumbai,2-3years,350000 - 450000 INR,"We are looking A Assistant Manager with experience in Project Management, Team Management, Stake holders management, Preparing business documentations, presentation, demonstration of product to the clients, client Management etc.",BA/BusinessAnalysis/ProductPlaning/ProjectManagement/RiskAnalysis/StakeholdersManagement/Customerrelationship/Demonstration/Presentation/|
Lead Business Analyst/Business Analyst,CGI Information Systems and Management Private Limited,Bengaluru/Bangalore,5-13years,Not Specified,Looking for Lead Business Analyst/Business Analyst,SecuritiesBrokerage|BusinessAnalysis|SecuritiesOperations|AssetManagement|ResearchAnalyst|TestPlan|
ICT Business Analyst - Australia,A V Immigration And Careers Consultancy Private Limited,Australia|Canada,9-14years,1600000 - 3200000 INR,"ICT BUSINESS AND SYSTEMS ANALYSTS work with users to formulate system requirements, develop system plans and documentation, review and evaluate existing systems, and design and modify systems to meet users business needs",ICTBusinessAnalyst|BusinessAnalysis|BA|systemtestplans|
Business Analyst,Proximity Immigration Private Limited,Canada|Germany,1-6years,780000 - 1030000 INR,Minimum 1+ years of relevant experience  - MUST |   Must have good knowledge of English  - MUST |   Age: Must be below 40.,BusinessAnalyst|BusinessDevelopmentManager|BusinessConsultant|BusinessAnalysis|FunctionalConsultant|BusinessPlanning|MarketAnalysis|BA|Financialanalysis|SystemAnalysis|BusinessResearch|
ICT Business Analyst - Australia,A V Immigration And Careers Consultancy Private Limited,Australia|Canada,3-8years,1600000 - 3200000 INR,"ICT BUSINESS AND SYSTEMS ANALYSTS work with users to formulate system requirements, develop system plans and documentation, review and evaluate existing systems, and design and modify systems to meet users business needs",ICTBusinessAnalyst|BusinessAnalysis|BA|systemtestplans|
"Data Analyst Required For Canada, Singapore & Gulf",Shalitin Immigrations LLP,Canada|Singapore,2-5years,3000000 - 5400000 INR,"We are looking for a passionate certified Data Analyst. The successful candidate will turn data into information, information into insight and insight into business decisions.",DataAnalyst|PL/SQLDeveloper|datafusion|BusinessAnalysis|Financialanalysis|ResearchAnalyst|DataMining|SqlDatabase|Oracle|DatabaseDeveloper|AlgorithmDevelopment|algorithmanalysis|OptimizationAlgorithms|
Area Sales Manager,Global Placement,Nagpur,3-7years,850000 - 1250000 INR,experience in Liquor sales preferably in Beer or country Spirits. Developing & Executing Clear Sales strategies. Expanding distribution & availability of the brand .,NegotiatingSkill|OrganizationalSkills|CommunicationSkills|Budgeting|SalesForecasting|BusinessAnalysis|
Business Analyst-Tech Logistics Solution Provider-Bangalore-2yrs+-8-12lakhs,Angel And Genie,Bengaluru/Bangalore,2-5years,Not Specified,Business Analyst-Tech Logistics Solution Provider-Bangalore-2yrs+-8-12lakhs,BusinessAnalyst|BA|BusinessAnalytics|BusinessAnalysis|
Business Analyst-D365 Finance & operations-Manufacturing company-Bangalore-3-5yrs-11-12lakhs,Angel And Genie,Bengaluru/Bangalore,3-5years,Not Specified,Business Analyst-D365 Finance & operations-Manufacturing company-Bangalore-3-5yrs-11-12lakhs,BusinessAnalyst|BA|BusinessAnalysis|BusinessAnalytics|
"Job Opportunity with Ondemand agility Software,Mumbai",On Demand Agility Software Private Limited,Mumbai,3-10years,Not Specified,"Hi everyone, |  We have an excellent job opening for the role of Business analyst into capital market domain. |  Exp-2 to 10 yrs  |  Interested candidates can apply on the same or can send their resumes to [HIDDEN TEXT]",BusinessAnalyst|BusinessAnalysis|CapitalMarket|InvestmentbankingEquities|FixedIncome|Securities|Derivatives|Brd|Frd|GapAnalysis|RequirementGathering|
"Lead Business Analyst, US PAyroll, HRIS, Saas, Noida,6-8 yrs of exp, upto 20 LPA",Angel And Genie,Noida,6-8years,Not Specified,"Lead Business Analyst, US PAyroll, HRIS, Saas, Noida,6-8 yrs of exp, upto 20 LPA",LeadBusinessAnalyst|Hris|BusinessAnalyst|BusinessAnalysis|Saas|
Business Analyst - IT,Axs Solutions And Consulting Private Limited,Mumbai,2-5years,Not Specified,Managing the entire product line life cycle from strategic planning to tactical activities. |  Specifying market requirements for current and future products by conducting market research supported by on-going visits to customers and non-customers. |,BusinessAnalyst/ProjectMonitoring/DeliveryManagement/stakeholdermanagement/ProductManagement/BusinessAnalysis/BusinessAnalystManager/QualityAnalyst/QualityAssurance/QualityAnalystengineer|
BUSINESS ANALYST FOR A HOUSING FINANCE COMPANY AT MUMBAI,Visishta Consulting,MumbaiCity,8-15years,800000 - 1500000 INR,"Business analyst |  Company   Housing finance company |  Location  Mumbai  |  skills |  Experience  Business Analyst in Banking / NBFCs or HFCs. |   |  Should be having expertise in defining business requirements, writing BRD, FSDs, developing mock screens |  exp 8-15 yr",businessanalystrequirementgatheringimpactanalysisNBFCexperience|
"Financial Analyst Required Under PR Visa,Hiring for Abroad",Adal Immigrations LLP,Australia|Canada,2-7years,2000000 - 5000000 INR,This role involves preparing of financial plans and reports for financial advisors by including the strategic advice provided.,FinancialPlanning|RiskAnalysis|PortfolioAnalysis|FinancialReporting|VarianceAnalysis|ForecastingMIS|FinancialAnalysis|BusinessPlanning|
Lead Analyst,Angel And Genie,Bengaluru/Bangalore,5-8years,Not Specified,We are looking for a Lead Analyst to create deep understanding and insights for Life Sciences & Healthcare customers,BusinessAnalyst|DataAnalysis|Lifescience|Healthcare|UsHealthcare|AdvanceExcel|PatientAnalysis|DataModelling|Python|Sql|Tableau|StatisticalModelling|
Qualitative Research Analyst /Associate with a KPO,Angel And Genie,Chennai|Mumbai,3-7years,550000 - 1060000 INR,we are hiring....................,Business|CompetitiveIntelligence|FinancialResearch|MarketIntelligence|IndustryResearch|r&d|MarketResearch|IndustryAnalysis|PrimaryResearch|GlobalSales|BusinessResearch|SecondaryResearch|CompanyProfiling|
