jobTitles,Company,jobLocations,requiredExperiance,Salary,JobDescription,Skills
Data Entry,Jobs Rider,Shimoga|Shirdi,1-5years,150000 - 450000 INR,"SUPERVISORS STORE IN CHARGE REQUIRED |  Urgent Required Helper, Store keeper, |  Supervisors ,100% JOB HERE |  Company required local candidates, joining district wise |  Payment monthly Base: - |  For more information plz contact to miss pooja -7838405493 |  Company",DatabaseAdministrator|DataBaseAdministration|
Data Entry Operator,Qdegrees Services Private Limited,Thane,1-2years,Not Specified,|  We are looking for a Data Entry operator for Thane Location  |  Experience Required - 6 Months to 2 years |  Qualification - Any Graduates |  Salary - 12k CTC |,DataEntry|DataEntryOperator|BackOfficeExecutive|BackOffice|CustomerCareExecutive|Telecaller|
Data Entry Operator,Zarbex Solutions,Gurgaon/Gurugram|Pune,0-5years,150000 - 480000 INR,(On-the-spot offer letter.)Immediately Joining! |                     Concern Person Regarding That Mr. -HR Soniya |                     Contact No.-8447612779,BackOffice|Backend|BackOfficeExecutive|Backofficeoperations|DataEntryExecutive|Computeroperator|
Data Entry Operator,Aaryan Technology,Pune|Sangli,0-5years,210000 - 350000 INR,Urgent Hiring for Fresher/Online Data Entry/Data Entry Operator/Data Base Administrator/Data Entry Officer/Form Filling and AD Posting kind of Data Entry jobs with 0-5 Yrs Exp-Candidate can work from any locations-for more info- Contact @ 7499592230,OnlineDataEntry|DataEntryOperator|DatabaseAdministrator|BackOffice|BackOfficeExecutive|DataEntry|Dba|DatabaseAdmin|ComputerOperator|
Data Entry Executive/Back Office Executive/ Data Entry,Zarbex Solutions,Ahmedabad|Lucknow,0-5years,150000 - 480000 INR,(On-the-spot offer letter.)Immediately Joining! |                      Concern Person Regarding That Mr. -HR  Soniya |                      Contact No.-8447612779,DataEntryExecutive|BackOfficeExecutive|DataEntry|Computer|Laptop|Android|
Data Entry,Smart Solution,Pune|Agartala,0-5years,Not Specified,data entry job hr mina 9311024990,Bpo|SelfEmployed|homebasedjobs|Cce|ComputerOperating|HRAdmin|Executive|12thpass|DataEntry|PartTime|Recruitment|Sales|homebasedworkhomebased|BackOffice|CustomerCare|Fresher|WorkFromHome|Operations|Data|computeroperator|
back office/ data entry,Zarbex Solutions,Gulbarga|Hubli,0-5years,Not Specified,(On-the-spot offer letter.)Immediately Joining! |                        Concern Person Regarding That Mr. -HR Soniya |                        Contact No.-8447612779,BACKOFFICEBACKENEDDATAENTRYOPERATOR|
data entry work @home,Zarbex Solutions,Ahmedabad|Lucknow,0-5years,150000 - 480000 INR,(On-the-spot offer letter.)Immediately Joining! |                     Concern Person Regarding That Mr. -HR Soniya |                     Contact No.- 8447612779,CallCentre|CustomerCare|CustomerServiceExecutive|CustomerSupport|
"Online Data Entry, Work From Home Jobs, Part Time Jobs, Data Entry, Typing Jobs, Data Entry Jobs",Future Solution,Chennai|Mumbai|MumbaiCity|NaviMumbai|Thane,0-5years,Not Specified,"Online Data Entry, Work From Home Jobs, Part Time Jobs, Data Entry, Typing Jobs, Data Entry Jobs",DataEntry|BackOffice|Nonvoice|Backend|BackOfficeExecutive|OfficeAssistant|Typist|Typing|DataEntryOperator|Typist&ComputerOperator|DEO|OnlineJob|PartTimeJob|Fresher|Bpo|PartTimeWorkFromHomePartTimeJob|Freelance|ComputerOperator|
"online data entry work from home, data entry, online job from home, data entry job vacancy available",Future Solution,Mandi|Solan,0-5years,Not Specified,"online data entry work from home, data entry, online job from home, data entry job vacancy available",weoffer:OnlineWorkFromHomeDataEntryOnlineJobsPartTimeJobsWorkFromHomeJobsDataEntryJobs|DataEntryOperator|DataEntry|BackOffice|Deo|PartTimeWorkFromHomePartTimeJob|Typing|OnlineJobs|Freelance|WorkFrom|ComputerOperator|
"Online Data Entry Jobs, Part Time Jobs, Work From Home, Typing Jobs, Data Entry Jobs, Data Entry",Future Solution,Bengaluru/Bangalore|Chennai,0-5years,Not Specified,"Online Data Entry Jobs, Part Time Jobs, Work From Home, Typing Jobs, Data Entry Jobs, Data Entry",DataEntryJobs|WorkFromHome|OnlineDataEntryJobs|TypingJobs|PartTimeWorkFromHomePartTimeJob|WorkatHomeJobs|OnlineJobs|SimpleTypingJobs|FresherJobs|FreelancerJobs|DataEntryOperator|JobsNearMe|BackOffice|Deo|ComputerOperator|
