jobTitles,Company,jobLocations,requiredExperiance,Salary,JobDescription,Skills
Dentist Settle in Canada under PR visa@8448490104,World Overseas Immigration,Australia|Canada,3-10years,2380000 - 4660000 INR,"Dentist required with 6.5 bands each in IELTs,",Dentistry|Bds|MDS|canada|australia|Pr|PermanentResident|PNP|PNP|DentalSurgeon|DentalHygienist|DentalConsultant|BachelorofDentalSurgery(B.D.S)|BachelorofScience(B.Sc)|Dentist|
Dentist  Required  In Canada | Gulf,Cloud Visa Immigration LLP,Canada|Gulf,2-7years,4000000 - 6000000 INR,"Dentists diagnose and treat dental issues and help patients develop better oral hygiene regimens They clean teeth, correct bite issues, perform surgeries and extractions and perform other duties to ensure that the teeth and mouth are healthy.",DentalSurgeon|DentalMedicine|DentalHygienist|Dentist|
Dentist Required in Canada / Germany,Proximity Immigration Private Limited,Australia|Canada,1-6years,180000 - 760000 INR,Minimum 1+ years of relevant experience  - MUST |   Must have good knowledge of English  - MUST |   Age: Must be below 40.,Bds|MDSi|Dentistry|DesignIdentity|MDS|Bpt|MedicalOfficer|Media|Medical|MedicalRepresentative|Dentist|
Microbiologist Great Chance Settle in Canada under PR visa,World Overseas Immigration Consultancy Private Limited,Australia|Canada,3-12years,3860000 - 5270000 INR,Microbiologist Great Chance Settle in Canada,Microbiologist|MicrobiologistTrainee|LaboratoryAnalysis|microbialcultures|samples|newdrugs|CanadaPR|Canada|ExpressEntry|
Dentist,Proximity Immigration Private Limited,Singapore|Philippines,1-6years,670000 - 819999 INR,Minimum 1+ years of relevant experience  - MUST |   Must have good knowledge of English  - MUST |   Age: Must be below 40.,Dentistry|Bds|MDSi|MDS|Bpt|Surgeons|operationtheatre|Dentist|
"Endodontist, General Dentist, Pedodontist, Prosthodontist, Restorative Dentist, Receptionist",Balaji dental care center,Delhi,2-12years,Not Specified,Doctors would handle dental cases independently based on their specialization. Receptionist will perform administrative responsibilities including handling of front desk services.,Bds|MDS|Endodontist|Pedodontist|Prosthodontist|RestorativeDentist|Dentist|Receptionist|
Staff Nurse Required Under PR Visa/Canada/Australia/Hongkong,Adal Immigrations LLP,Australia|Canada,2-7years,2500000 - 5000000 INR,"Responsible for patient assessment, as well as planning of care and subsequent recovery.",StaffNurses|PatientCareCoordinator|PatientCare|Dressing|Hospitals|
Dentist / BDS,Space Consultancy,Mumbai,0-5years,Not Specified,Associate Dentist Product |   |  Associate Dentist Planning |   |  Customer Support |   |  Customer Care. |  Handle about 50-60 calls of customers on-boarded by sales team(Smile correction/ |  Smile straightening) |,Bds|Dentist|
job for packing masal dry fruit chocolate  box packing work for home call now 7400246726,Dev Group of Institutions,Bengaluru/Bangalore|Chennai,0-1years,Not Specified,job for packing masal dry fruit chocolate  box packing work for home call now 7400246726,jobforpackingmasaldryfruitchocolateboxpackingworkforhomecallnow7400246726|
MDS Orthodontist freshers and Experienced,Adal Immigrations LLP,Mumbai|MumbaiCity|NaviMumbai,0-5years,Not Specified,We are hiring MDS Orthodontist freshers and Experienced candidates  |  Offered Salary for fresher - 35k - 45k In Hand monthly  |  Offered Salary for Experienced - above 7 yrs experience 1 lacs to 1.2 lacs in hand Monthly  |  Location - Mumbai,Orthodontist|
Doctors Required in Canada|Australia,Flight To Sucess Immigration Services Llp,Australia|Canada,2-7years,2000000 - 5000000 INR,Formulate differential diagnosis*,Doctors|MedicalOfficer|M.B.B.S|RMO|MCH|Bds|Md|
Microbiologist Settle in Canada /Germany/Hongkong with Family Now,Space Consultancy,Canada|Germany,3-12years,4010000 - 6010000 INR,"Microbiologists undertake laboratory analysis and monitoring of microbial cultures, samples and new drugs using specialist computer software and a range of identification methods and clinical trials. Responsibilities include: planning and carrying ou",Microbiologist|MicrobiologistTrainee|LaboratoryAnalysis|microbialcultures|samples|newdrugs|
Dentist,World Overseas Immigration,MumbaiCity|NaviMumbai,0-3years,240000 - 530000 INR,URGENT REQUIREMENT OF DENTIST !!,"""Dentist""|""Dentistry""|""Dental""|"
Assistant Dentist required in Canada under PR visa@8448490104,Achievers Spot,Australia|Canada,3-13years,2380000 - 4660000 INR,"In Canada, dentistry is a regulated profession. To become a licensed dentist in Canada you must have a BDS/DDS/DMD degree and be certified by the NDEB. There are different pathways to licensure depending on where you obtain your dental degree.",Dentistry|Bds|MDS|canada|australia|Pr|PermanentResident|PNP|PNP|Dentist|
"Medical Coding Jobs - Pharmacist, Physiotherapist, Microbiologist, Dentist Freshers/Experienced",Cloud Visa Immigration LLP,Chennai|Kanchipuram,0-4years,350000 - 400000 INR,Medical Coding is the process of conversion of text information related to healthcare services into numeric Diagnosis (Medical Problems) and Procedure (Treatments)Codes using ICD-10 CM and CPT code books. Healthcare including Medical Coding and Billi,MedicalCoding|Pharmacy|Physiotherapy|Nursing|Zoology|Chemistry|OrganicNutrition&dietetics|Bhms|LifeScience|paramedical|medicalcoder|StaffNurse|Biotechnology|Biomedical|Bioinformatics|Biochemistry|Microbiology|Biology|Ch|Physiotherapist|Dentist|
"Dentist,Urgently Required In Canada",Foresee Immigration Consultancy Services Private Limited,Canada,2-7years,4000000 - 5000000 INR,"The Dentist will meet with patients, assess their dental health, perform scheduled cleanings, handle complex procedures, such as root canals, extractions, and oral surgery, and work with other staff members, such as dental hygienists and assistants",DentalSurgeon|DentalHygienist|DentalConsultant|Dentist|
Dentists Required in Hong Kong Call 9999293186,Basics of Immigration Consultant Services LLP,Canada|HongKong,2-7years,Not Specified,"Meeting with patients to discuss and treat dental concerns, performing regular cleanings and other preventative procedures, and establish a plan for better dental hygiene. |  Performing dental procedures, such as extractions, root canal.",Dentistry|DentalSurgeon|DentalConsultant|DentalMedicine|Dentist|
Orthodontist HIRING IN CANADA,Space Consultancy,Canada,8-18years,2600000 - 3400000 INR,Design and fabricate appliances to realign teeth and jaws to produce and maintain normal function and to improve appearance.,Orthodontist|
Radiology Doctor,Achievers Spot,Kanpur|Bijnor,1-11years,420000 - 4550000 INR,"Required Radiologist Doctors in all over India (Kanpur, Bijnor, Faridabad, Rudrapur, Meerut, Rudrapur )",USG/MRI/CT|
"Medical Coding Jobs -Pharmacist, Physiotherapist, Microbiologist, Dentist Freshers/Experience Wanted",Space Consultancy,Bengaluru/Bangalore|Chennai,0-4years,350000 - 400000 INR,Medical Coding is the process of conversion of text information related to healthcare services into numeric Diagnosis (Medical Problems) and Procedure (Treatments)Codes using ICD-10 CM and CPT code books. Healthcare including Medical Coding and Billi,MedicalCoding|Pharmacy|Physiotherapy|Nursing|StaffNurse|Biotechnology|Biomedical|Bioinformatics|Biochemistry|Microbiology|Biology|Botany|Pharmacist|Zoology|Nutrition&dietetics|Bhms|LifeScience|paramedical|medicalcoder|Physiotherapist|Dentist|
Radiology,Space Consultancy,Faridabad|Kanpur,1-11years,520000 - 5010000 INR,Required Radiology all over India,USG/MRI/CT|
Radiologist Required (ANA),Achievers Spot,Faridabad|Kanpur,1-11years,819999 - 4550000 INR,"W are requirement for Radiologist in all over India.  |  Qualification - MBBS / MD / DMRD / DMRT |  Salary - Best in the industry, No limit for deserving candidate |  Modalities - USG / MRI / CT |  Gender - Any |  Accommodation can be arranged |",USG/MRI/CT|
Pharmacist (Pharmacy)  retail pharmacist/ Hospital PHARMACIST FRESHER/INTERNSHIP 7208456718,Ameuro Migration Private Limited,Mumbai|MumbaiCity|NaviMumbai|Thane,0-1years,Not Specified,Pharmacist (Pharmacy) For Mumbai/ retail pharmacist/ Hospital PHARMACIST FRESHER/INTERNSHIP 7208456718,PharmacistRetail/hospital|Pharmacist|RetailPharmacist|Chemist|FresherTrainee|explabtechanicainnursegnamanm|
