jobTitles,Company,jobLocations,requiredExperiance,Salary,JobDescription,Skills
Fashion Designing - Merchandising,STT Solution,Delhi|Noida,0-3years,200000 - 390000 INR,Fashion Designing - Merchandising,FashionDesigner|Merchandiser|merchant|Buyer|VisualMerchandiser|Kids|Wear|Retailplanner|Apparels|Assistantmerchandiser|
Web Designing and Development,Scope Telecom Private Limited,Ambala|Panchkula,0-1years,Not Specified,"Write well designed, testable, efficient code by using best software development practices |  Create website layout/user interface by using standard HTML/CSS practices |  Integrate data from various back-end services and databases |  Gather",Photoshop|Photoshop|HTML|Dreamweaver|CSS|WebDesigner|Js|Javascript|Flash|Xml|
Garment Designer Freshers,Hire Zone Solution,Chennai,0-1years,420000 - 470000 INR,"Adapt existing designs for mass production. Develop pattern that is cut and sewn into sample garments and supervise making these including fitting, detailing and adaptations.",GarmentDesigning|
Garment Designers,Hire Zone Solution,Noida,0-1years,350000 - 420000 INR,"Adapt existing designs for mass production. Develop pattern that is cut and sewn into sample garments and supervise making these including fitting, detailing and adaptations.",GarmentDesigning|
Architect (Interior Designing),Radial HR Solutions,Bengaluru/Bangalore,4-7years,360000 - 600000 INR,Looking for the position of Architect (Interior Designing): Require Candidates with 4-6yrs of experience in designing of commercial interiors,Architect(InteriorDesigning)|InteriorDesign|3D|2d|Architect|
"Web Designer Web Developers PHP developer,  Graphic Designer",Pinnacle HRM,Bengaluru/Bangalore|Delhi,0-5years,350000 - 650000 INR,"Web Designer Web Developers PHP developer,  Graphic Designer",WebDevelopers|GraphicDesigner|WebDesigner|PHPdeveloper|WebDesigning|GraphiCDesigning|
Lead Designer- UI/UX,Career Mantra Management Services,Bengaluru/Bangalore|Chennai,8-17years,Not Specified,A Lead designer with 8+ years of proven experience delivering projects at the |  intersection of design and technology .,Sketch|Figma|Appdesigning|UxDesigner|WebDesigning|
Openings For Electrical Project Engineer  Fresher,DRPU Software Pvt. Ltd.,Pune|Nagpur,0-1years,140000 - 200000 INR,"The Project Engineer Electronics Division is responsible for Project Production and Testing for Electronics & |  Elertricals Peripherals products. |  Work Order & Purchase Documentation. |  knowledge In : Operation Standards, Process sequencing,Troubleshoot. |",knowledgeofKiCadorotherPCB|DesigningSoftware|
Fresher Graphic Designer Adobe Photoshop Graphics Designing Freshers Job Delhi NCR,Star Tech,Delhi|Noida,0-1years,150000 - 480000 INR,"Hiring Freshers! We are Looking for creative Graphic Designers having good knowledge of Adobe Photoshop Designing for Websites & web portals, Designing Apps GUI & icons etc, Designing Banners Promos & Ads etc for Social Media, Print Media & website.",Freshers|GraphicDesigner|GraphicsDesigning|AdobePhotoshop|AdobeIllustrator|AdobeIndesign|
URGENT HIRING  FOR CIVIL & STRUCTURAL DESIGN ENGINEER,TRANSCENDIX PARTNERS LLP,Gurgaon/Gurugram|Noida,0-1years,580000 - 860000 INR,CIVIL & STRUCTURAL DESIGN ENGINEER POST IS VACANT FOR THE REPUTED CONSTRUCTION GROUP.,StructuralDesignEngineer|CivilEngineers|StructuralDesign|CivilDesign|StructuralEngineer|
Game Artist,Monali Prashant Yeole (proprietor of A Plus Consultants),Bengaluru/Bangalore|Pune,0-3years,Not Specified,"Skills Café is looking for a game artist to make us beautiful. If you enjoy creating artwork for online games, comics, and graphic novels and are able to bring a story to life with your original designs, this may be the role for you.",GameDesigning|Illustrator|Articulate|ArticulateStoryline|
Graphic Designer,Mind Circus Innovations,Pune,0-2years,Not Specified,"Job location: Nigdi, Pune |  Experience' 0-2 yrs |  Immediate joining |  No Work from Home |   |",GraphicDesigner|Graphics|WebDesigner|GraphicDesigning|
Storyboard Illustration Jobs | Designing Job | Adobe Illustrator | Kochi,Mind Circus Innovations,Cochin/Kochi/Ernakulam|Thiruvananthapuram/Trivandrum,0-5years,200000 - 500000 INR,We are looking for a motivated and talented individual with good knowledge of Digital Designing and Adobe Illustrator  who can build captivating design that conveys emotive stories through animations and videos that will grab attention.,Illustrator|Illustration|Indesign|DigitalDesign|Designing|Storyboarding|CharacterDesigning|2DArtist|2DAnimation|3DAnimation|3DArtist|Artist|BackgroundArtist|Photoshop|Creative&Design|CreativeArtist|FineArts|Storyboards|AdobeIllustrator|
Storyboard Illustration Jobs | Designing Job | Adobe Illustrator | Visakhapatnam,A V Immigration And Careers Consultancy Private Limited,Vijayawada|Visakhapatnam,0-5years,200000 - 500000 INR,We are looking for a motivated and talented individual with good knowledge of Digital Designing and Adobe Illustrator  who can build captivating design that conveys emotive stories through animations and videos that will grab attention.,Illustrator|Illustration|Indesign|DigitalDesign|Designing|Storyboarding|CharacterDesigning|2DArtist|2DAnimation|3DAnimation|3DArtist|Artist|BackgroundArtist|Photoshop|Creative&Design|CreativeArtist|FineArts|Storyboards|AdobeIllustrator|
Aerospace Engineer Canada,Riju Karan (Proprietor Of Toyota Climax India),Canada,9-14years,Not Specified,"Aerospace Engineers design spacecraft, aircraft, missiles and weapons systems. In addition, they are also responsible for assembling, maintaining and ensuring they function properly at all times.",AerospaceEngineer|Designing|Assembling|Aerodynamics|
Fashion Designer,Mind Circus Innovations,Mumbai,1-5years,250000 - 470000 INR,Requirement for the post of Fashion Designer.,FashionDesigning|
Storyboard Illustration Jobs | Designing Job | Adobe Illustrator | Pondicherry,Sumedha Management Consultancy,Pondicherry|Vellore,0-5years,200000 - 500000 INR,We are looking for a motivated and talented individual with good knowledge of Digital Designing and Adobe Illustrator  who can build captivating design that conveys emotive stories through animations and videos that will grab attention.,Illustrator|Illustration|Indesign|DigitalDesign|Designing|Storyboarding|CharacterDesigning|2DArtist|2DAnimation|3DAnimation|3DArtist|Artist|BackgroundArtist|Photoshop|Creative&Design|CreativeArtist|FineArts|Storyboards|AdobeIllustrator|
Graphic Designer / Graphic Designing / Web Designer / Web Developer,A V Immigration And Careers Consultancy Private Limited,Faridabad,2-4years,160000 - 320000 INR,"•	JOB DESCRIPTION- |    •	GRAPHIC DESIGNER-(FARIDABAD-location)- |    •	Skills require- |    •	 |    o	Sound knowledge of Logo Design, packaging designing, banner and print media. |    •	 |    o	Good color combination knowledge. |    •	 |    o	Thinking Creatively Developing, designing, or",GraphicDesigner|CorelDraw|Photoshop|Illustrator|Creative&Design|WebDesigner|Dreamweaver|
Aerospace Engineer Canada,Mind Circus Innovations,Canada,3-8years,Not Specified,"Aerospace Engineers design spacecraft, aircraft, missiles and weapons systems. In addition, they are also responsible for assembling, maintaining and ensuring they function properly at all times.",AerospaceEngineer|Designing|Assembling|Aerodynamics|
Storyboard Illustration Jobs | Designing Job | Adobe Illustrator | Delhi,Mind Circus Innovations,Delhi|Chandigarh,0-5years,200000 - 500000 INR,We are looking for a motivated and talented individual with good knowledge of Digital Designing and Adobe Illustrator  who can build captivating design that conveys emotive stories through animations and videos that will grab attention.,Illustrator|Illustration|Indesign|DigitalDesign|Designing|Storyboarding|CharacterDesigning|2DArtist|2DAnimation|3DAnimation|3DArtist|Artist|BackgroundArtist|Photoshop|Creative&Design|CreativeArtist|FineArts|Storyboards|AdobeIllustrator|
Storyboard Artist Jobs | Digital Designing Job | Adobe Illustrator | Hyderabad,Mind Circus Innovations,Hyderabad/Secunderabad|Warangal,0-5years,200000 - 500000 INR,We are looking for a motivated and talented individual with good knowledge of Digital Designing and Adobe Illustrator  who can build captivating design that conveys emotive stories through animations and videos that will grab attention.,Illustrator|Illustration|Indesign|DigitalDesign|Designing|Storyboarding|CharacterDesigning|2DArtist|2DAnimation|3DAnimation|3DArtist|Artist|BackgroundArtist|Photoshop|Creative&Design|CreativeArtist|FineArts|Storyboards|AdobeIllustrator|
Storyboard Artist Jobs | Digital Designing Job | Adobe Illustrator | Raipur,Mind Circus Innovations,Bilaspur|Raipur,0-5years,200000 - 500000 INR,We are looking for a motivated and talented individual with good knowledge of Digital Designing and Adobe Illustrator  who can build captivating design that conveys emotive stories through animations and videos that will grab attention.,Illustrator|Illustration|Indesign|DigitalDesign|Designing|Storyboarding|CharacterDesigning|2DArtist|2DAnimation|3DAnimation|3DArtist|Artist|BackgroundArtist|Photoshop|Creative&Design|CreativeArtist|FineArts|Storyboards|AdobeIllustrator|
Storyboard Artist Jobs | Digital Designing Job | Adobe Illustrator | Goa,Mind Circus Innovations,Goa|Panjim/Panaji,0-5years,200000 - 500000 INR,We are looking for a motivated and talented individual with good knowledge of Digital Designing and Adobe Illustrator  who can build captivating design that conveys emotive stories through animations and videos that will grab attention.,Illustrator|Illustration|Indesign|DigitalDesign|Designing|Storyboarding|CharacterDesigning|2DArtist|2DAnimation|3DAnimation|3DArtist|Artist|BackgroundArtist|Photoshop|Creative&Design|CreativeArtist|FineArts|Storyboards|AdobeIllustrator|
