jobTitles,Company,jobLocations,requiredExperiance,Salary,JobDescription,Skills
job opportunity | End client: IBM,Outworks Solutions Private Limited,Pune,2-7years,Not Specified,An  Exchange Administrator is responsible for responding to the customer’s queries for services. The position of an MS Exchange Administrator is very dynamic and they need to look out for solutions to any problems they are assigned with. |,MsExchange|MicrosoftExchange|ExchangeServer|ExchangeServerAdmin|ExchangeAdmin|Office365|
Windows Exchange Server Technician Or Storage Tech Spotoffer,White Horse Manpower Consultancy Private Limited,Bengaluru/Bangalore,2-7years,Not Specified,Windows Exchange Server Technician,Hyper-V|TechnicianActivities|AnalyticalSkills|Dns|DHCP|FileServer|ExchangeServer|Antivirus|Vmware|Windows10|Storage|
Windows 10 Exchange Server Technician Call Ruby 8553281886,White Horse Manpower Consultancy Private Limited,Bengaluru/Bangalore,3-8years,300000 - 500000 INR,"1, Engineering graduate, Good communication, Analytical skills, knowledge on windows architecture, 2, Knowledge on Server Technologies, Hands-on on AD, DNS, DHCP, File Server, Hyper-V, VMWare, Antivirus Infrastructure",Technician|AD|Hyper-V|AntivirusInfrastructure|WindowsArchitecture|Sql|Dns|DHCP|FileServer|Vmware|Server|ExchangeServer|
Technical Support Representative  (Sam-9999300435),Jobs Expert Private Limited,Gurgaon/Gurugram|Pune,1-6years,300000 - 560000 INR,Technical Support Representative  (Sam-9999300435) |   |  Min 1yr+ technical support voice experience is required. |  Skype interviews |   |  Call@ Sam - 9999300435,Activedirectory|TechnicalSupportRepresentative|Technicalsupportvoice|Fsmo|ExchangeServer|Dns|DHCP|TechnicalProcess|
Openings for technical Support Voice Process / Enterprise Support,Jobs Expert Private Limited,Gurgaon/Gurugram|Pune,2-9years,300000 - 560000 INR,Openings for technical Support Voice Process / Enterprise Support |   |  Skype Interviews |  CTC- 5lpa + incentives |   |  Sam-9999300435,technicalnalayst|CustomerSupport|Activedirectory|MsOutlook|TSE|TSR|Technicalsupport|TechnicalHelpdesk|Dns|DHCP|Fsmo|ExchangeServer|O365|Ipv4|Ipv6|
Associate Technical Support- International Voice Process(CALL- 8766285530),Jobs Expert Private Limited,Gurgaon/Gurugram|Pune,1-11years,300000 - 500000 INR,Associate Technical Support-International Voice |  Location: Gurgaon/ Pune |  Qual- Gards/ UG/ Drops outs can apply |  Skills- 1 yr tech support exp in International Voice Process |  Shifts- 24/7 |  CTC- 5LPA + Incentives |  CALL LIPIKA |  8766285530/ 8467054123,TechSupportVoice|Troubleshooting|ActiveDirectory|ServiceDesk|ItHelpdesk|PrinterSupport|SystemAdministration|NetworkSupport|Ccna|ServerSupport|AzureActiveDirectory|ExchangeServer|RemoteSupport|TechnicalHelpdesk|TechnicalSupport|
Technical Support Engineer / Technical voice process jobs,Jobs Expert Private Limited,Gurgaon/Gurugram|Pune,1-9years,300000 - 560000 INR,Openings for Technical Support voice process |   |  Skype interviews |  CTC - 5.6 lpa + incentives |   |  Sam-9999300435,TSR|Helpdesk|CustomerSupport|Activedirectory|AD|RemoteSupport|Desktopsupport|TechnicalSupport|SystemAdmin|SystemAdmin|Dns|DHCP|Fsmo|Imap|Pop3|IpConfiguration|Exchange|Citrix|ExchangeServer|
Technical Support Engineer- International Voice Process(CALL-8766285530),Jobs Expert Private Limited,Gurgaon/Gurugram|Pune,1-10years,300000 - 500000 INR,Desg- Technical Support Engineer |  Comp- TOP BPO |  Loc- Gurgaon/ Pune |  Skills- 1yr exp in Technical Support in International Voice Process |  Must have good Knowledge on Servers/ Windows/ AD/ DNS/ DHCP/ Troubleshooting |  CTC Upto: 5LPA |  24/7 Shifts |   |  8766285530,ApplicationSoftware|Installation|Troubleshooting|Networking|Configuration|MsExchange|Windows|TechSupport|Fsmo|OperatingSystems|ExchangeServer|TechnicalSupport|TechnicalSupportVoice|SystemInstallation|Bootstrap|Ccnp|
Technical Support voice process -  Server Support,Jobs Expert Private Limited,Gurgaon/Gurugram|Pune,1-8years,300000 - 560000 INR,Technical Support voice process -  Server Support |   |  CTC upto 5.6 Lpa |  Telephonic interviews |   |  Sam-9999300435,CustomerSupport|Activedirectory|ipcofiguration|Voicesupport|remotesuport|technicalsupport|TechnicalHelpdesk|TechnicalSupportExecutive|Dns|dhcp|ExchangeServer|TechnicalSupportRepresentative|techsupport|Ipv6|ServerSupport|
Technical Support / Customer Support / Enterprise Support,Jobs Expert Private Limited,Gurgaon/Gurugram|Pune,1-9years,300000 - 560000 INR,Technical Support voice process jobs  |   |  CTC-5.6 lpa |  Skype interviews |   |  Sam-9999300435,Helpdesk|CustomerSupport|TSE|TSR|Activedirectory|Technicalsupport|ServiceDeskAnalyst|TechSupport|Fsmo|Dns|DHCP|ExchangeServer|Office365|O365|microsoftonlineservices|windowsintune|
Systems Engineer,CoreIT Services Private Limited,Mumbai|MumbaiCity|NaviMumbai|Thane,4-6years,400000 - 500000 INR,"The System Engineer will be responsible for effective provisioning, installation / configuration, operation, and maintenance of system hardware and software and related infrastructure.",ActiveDirectory|ExchangeServer|Office365|ServerAdministrator|GroupPolicy|Dns|DHCP|Virtualization|CloudServices|FsmoRoles|
Exchange Server Openings In Bangalore | CTC - 6.50 LPA,Jobs Expert Private Limited,Bengaluru/Bangalore,1-6years,Not Specified,Exchange Server Openings In Bangalore | CTC - 6.50 LPA,ActiveDirectory|AD|ExchangeServer|MsExchange|ExchangeAdmin|Exchange2003|MicrosoftExchange|WindowsServer|Dns|
Enterprise Vault Operations,Millennium Ims Private Limited,Mumbai|MumbaiCity|NaviMumbai,5-10years,Not Specified,Enterprise Vault needed  |  We are looking consultant for EV Operations |  Navi Mumbai |  Rotational Shift |  IMMEDIATE JOINERS ONLY-immediate or 10 days,emailarchival|Sql|EnterpriseArchitecture|EnterpriseVault|ExchangeServer|ExchangeAdmin|
Technical Voice process / Remote support / Voice Support,Jobs Expert Private Limited,Delhi|Gurgaon/Gurugram,1-8years,270000 - 500000 INR,Technical Voice process / Remote support / Voice Support |   |  Salary - 5lpa + incentives upto 20k |  Gurgaon location |   |  Sam- 9999300435,CustomerSupport|Voicesupport|Activedirectory|Ads|RemoteSupport|ServerSupport|Technicalsupport|Windowsserver|MicrosoftServer|Office365|ExchangeServer|Dns|DHCP|Fsmo|GroupPolicy|ApplicationSupport|HardwareSupport|TechnicalHelpdesk|
"Windows Server Administration, Technical Helpdesk - Microsoft server",Jobs Expert Private Limited,Delhi|Gurgaon/Gurugram,1-9years,300000 - 500000 INR,"Windows Server Administration, Technical Helpdesk - Microsoft server |   |  Salary upto 5lpa + incentives |  Cabs |   |  Sam-9999300435",Activedirectory|AD|Enterprisesupport|TechnicalVoiceProcess|CustomerSupport|Ads|Technicalsupport|WindowsServerAdministration|Dns|DHCP|ExchangeServer|MicrosoftOffice365|Windowsserver|MicrosoftServer|GroupPolicy|Fsmo|RemoteSupport|
Windows server administration / Technical Helpdesk / Technical voice process / Microsoft server,Jobs Expert Private Limited,Pune,2-9years,270000 - 560000 INR,Windows server administration / Technical Helpdesk / Technical voice process |   |  Salary upto 5.6Lpa + incentives |  Telephonic interviews |   |  Sam-9999300435,Helpdesk|Activedirectory|MsOutlook|Bpo|TSE|ItHelpdesk|TechnicalHelpdesk|WindowsServerAdministration|Technicalsupport|ServerSupport|RemoteSupport|WindowsTroubleshooting|Fsmo|Dns|DHCP|MsExchange|Office365|MicrosoftServer|
Active Directory Engineer,Aryan Solutions Pte Ltd,Pune,4-14years,700000 - 1000000 INR,"We are looking for an Active Directory Engineer for an ongoing long term project with a billion dollar Infra SI based in Pune, India. The role will be a long term contract with Aryan Solutions, India.",ActiveDirectory|Office365|ExchangeServer|Azure|
Technical Voice Process - Microsoft Server - Enterprise Support,Jobs Expert Private Limited,Delhi|Gurgaon/Gurugram,2-9years,300000 - 500000 INR,Technical Voice Process - Microsoft Server - Enterprise Support |   |  Salary up to 5lpa + incentives |  Telephonic interviews |   |  Call@ Sam-9999300435,Activedirectory|AD|Microsoftprocess|Enterprisesupport|EPS|Technicalassociate|CustomerSupport|VoiceProcess|Tsa|TSR|TSE|Technicalsupport|ServerSupport|MicrosoftServer|MsExchangeServer|Fsmo|GroupPolicy|TechnicalHelpdesk|Tso|
Technical Support Executive / Technical voice process/ Customer Support,Jobs Expert Private Limited,Delhi|Gurgaon/Gurugram,1-6years,300000 - 500000 INR,Technical Support Executive / Technical voice process/ Customer Support |   |  Require Immediate joiners only. |  CTC upto 5 Lpa |  Telephonic interviews |   |  Sam-9999300435,TechnicalVoiceProcess|Activedirectory|Ads|Servicedesk|TechnicalSupportExecutive|ServerSupport|ExchangeServer|Dns|DHCP|Fsmo|CustomerSupportEngineer|Servicenow|RemoteSupport|WindowsTroubleshooting|HardwareSupport|
MSP\Cloud  Senior Systems Administrator,NewCloud Networks,Bengaluru/Bangalore,10-20years,Not Specified,"Senior Systems Administrator for our Cloud Services and Managed Service Team focusing on support for our services in implementations, maintenance and troubleshooting of primarily windows and vmware systems.",Server2019|Server2016|Hyper-V|ActiveDirectory|mimecast|connectwise|MCSE|Mcsa|Server2012|Clustering|RDS|Exchange|Sql|Powershell|O365|Vmware|Vcenter|Virtualization|Automation|
Technical Support/ Technical Voice Process|| CTC-5.5LPA,Jobs Expert Private Limited,Gurgaon/Gurugram|Pune,1-10years,270000 - 500000 INR,Desg-Technical Support/ Technical Voice Process |  Comp- TOP BPO |  Skills- 1yr exp into Tech Support in International Voice |  Good knowledge into Servers/ Active Directory/ DNS/ DHCP/ Troubleshooting |  Qual- Grads/ UG |  CTC:5.5L |  24*7 SHIFTS |  CALL-8766285530,ExchangeSupport|Troubleshooting|EnterpriseSupport|TechnicalVoiceProcess|Tcp|Networking|MsExchange|Dns|WindowsTroubleshooting|GroupPolicy|MCSE|Ccna|TechSupport|DHCP|Fsmo|ServerSupport|ActiveDirectorySupport|ExchangeServer|ItServiceDesk|
IT SUPPORT US VOICE FOR DELHI OR PUNE ( CALL - ANKITA 9999636969 ),Jobs Expert Private Limited,Bengaluru/Bangalore|Chennai,1-11years,300000 - 600000 INR,IT SUPPORT US VOICE FOR DELHI OR PUNE ( CALL - ANKITA 9999636969 ),Servicedesk|Troubleshooting|VoiceProcess|ActiveDirectory|Helpdesk|TSR|SystemEngineer|SystemAdministration|ITSupport|ItHelpdesk|Server|Exchange|TechSupport|TechnicalSupport|TechnicalSupportExecutive|TechnicalSupportEngineer|
Active Directory AND Exchange Server- Bangalore,Jobs Expert Private Limited,Bengaluru/Bangalore,1-10years,300000 - 600000 INR,TOP MNC- Bangalore |  Technical Support Associate |  Hands on exp on Active Directory/ Exchange Server/ DNS/ DHCP/ Troubleshooting |  Req 1+yr exp into Technical Support in International Voice |  Only Grads |  CTC Upto: 6L |  24*7SHIFTS |   |  8766285530/ 8467054123,ActiveDirectory|loopbackaddress|Cas|autodiscoveryprocess|technicalvoice|Ldap|Dns|WindowsTroubleshooting|GroupPolicy|Windows|Fsmo|DHCP|DomainController|IpAddressing|ActiveDirectorySupport|ExchangeServer|ServerSupport|TechnicalSupport|
Server management Engineer for Bahrain,Vinirma Consulting Private Limited,Bahrain,4-9years,Not Specified,Urgent hiring for Server management Engineer.Administration support for Microsoft Windows Servers. |  Administration support for Microsoft Exchange. |  Administration support for Microsoft Active Directory.,ServermanagementEngineer|Activedirectory.|Windows|Exchange|
