jobTitles,Company,jobLocations,requiredExperiance,Salary,JobDescription,Skills
Front Office,Orissa Doot Private Limited,Bhubaneswar,0-2years,Not Specified,Opening for Front office in Bhubaneswar Location,FrontOffice|FrontOfficeExecutive|FrontDeskExecutive|Receptionist|
Front Office Duty Manager,Adal Immigrations LLP,Australia|Canada,2-7years,2000000 - 4500000 INR,Maintaining Guest Services and Front Desk Goals.,Hospitality|FrontDeskManager|Resorts|HotelManagement|Hotel|Restaurants|
URGENT OPENING FOR ASSISTANT MANAGER IN KUWAIT,I Square Consultancy,Kuwait,3-5years,Not Specified,Looking for Assistant Manager for kuwait |  Salary 170KD,AssistantManagerEXPERIENCEMUSTHAVE|
Telecaller Cum Front Office Admin,EDrishyaa IT India Private Limited,Bengaluru/Bangalore,1-6years,120000 - 180000 INR,eDrishyaa SAP Academy is hiring Telecaller cum Front office Admin for their Authorized Academy at Bangalore,FrontOfficeExecutive|Telecaller|Telemarketing|Telemarketingexecutive|Telesalestelemarketing|Telesalesexecutive|Receptionist|
Front Office Executive,Orissa Doot Private Limited,Bhubaneswar,0-2years,Not Specified,Opening for Front Office Executive in Bhubaneswar location,FrontOfficeExecutive|Telecaller|Counsellor|Telemarketingexecutive|Telesalesexecutive|Receptionist|
Front Office Executive,Orissa Doot Private Limited,Bhubaneswar,0-2years,Not Specified,Opening for Front Office Executive in Bhubaneswar location,FrontOffice|FrontDeskExecutive|Frontdeskofficer|Frontofficeassistant|Receptionist|
Front Office - Female - Chennai - immediate joiner,Exsellant Services,Chennai,0-2years,100000 - 300000 INR,"Hi All, |    |    |   Jobszonenow  |    |   We have job opening for fresher |    |  For Front office exe |    |    |   NO BE/BTECH |    |   10th, 12th, BA, BCOM, BBA, BSC,MCOM, MSC Any qualification people can apply |    |    |   if you are interested call Sampurana = 7824884400 (Morning 11A",FrontOffice|Administration|AdminExecutive|Facilities|Adminstrator|Admin|Hr|OfficeAssistant|
Front Office,Orissa Doot Private Limited,OtherIndia,0-2years,Not Specified,Opening for Front office in Bhubaneswar Location,FrontOffice|OfficeAssistant|FrontOfficeExecutive|FrontDesk|Telephoneoperator|FrontDeskExecutive|Reception|Receptionist|
Front Office Executive (Receptionist)/ Female,Aspire Group of Services,Lucknow,0-1years,120000 - 150000 INR,Location - Lucknow |   Age - 18 yr to 30yr |   Only female can apply. |   Freshers can also apply. |  Priti Singh | HR Executive | |  Call/ Whatsapp - 8400203031 |,FrontOfficeExecutive|OfficeAssistant|
Front Office Executive & Computer Operator,Global Transcripts,Pune,2-5years,250000 - 480000 INR,"We are looking for a full time front office executive, for one of a busy client.",FrontDeskExecutive|Frontdeskofficer|
Hotel Front Desk Agent,Freelancer - Purushottam Munjajirao Dhutraj,Kolkata|Mumbai,3-13years,3050000 - 5090000 INR,A Hotel Front Desk Agent must have the ability to complete diverse tasks in order to maintain an efficient front desk area of any hotel.,FrontOfficeExecutive|AdminExecutive|Administration|Facilities|Adminstrator|Frontoffice|Hr|OfficeAssistant|Receptionist|
Apply Now ! Front office manager for hotel/Restaurant for Singapore and Canada,PI Overseas Private Limited,Canada|Singapore,3-13years,3000000 - 6000000 INR,"Hotel Front Desk Agent responsibilities include registering guests, managing reservations and providing information about rooms,  amenities. |    |   Selected candidate will get 2 Yrs sponsored work permit visa with extra perks of accommodation and meal.",FrontDeskManager|FrontDeskExecutive|FrontDeskManagement|Frontoffice|Frontdeskofficer|FrontOfficeExecutive|Frontofficeassistant|Reception|
Receptionist / Front Office Executive / Front Desk Executive,Aspire Group of Services,Lucknow,0-1years,150000 - 260000 INR,"|  Hi, |   |   |  We have an opportunity for front desk manager - Female & Male both are preferred. |   |   |  Work location - Various locations. |   |   |  Degree in hospitality Industry courses in mandatory",FrontOfficeExecutive|Administration|AdminExecutive|Facilities|Adminstrator|Frontoffice|Hr|OfficeAssistant|Receptionist|
Culinary / F&B Service / Front Office,New Edu Vision Consultancy,US,0-5years,1330000 - 1860000 INR,USA J1 INTERN & TRAINEE PROGRAM!!,Culinary|F&BService|FrontOffice|
"Reception,Front office,Front desk,Front office executive,Receptionist front office,Receptionist",Aspire Group of Services,Mumbai|MumbaiCity|NaviMumbai|Thane,0-2years,Not Specified,"Opening for Reception,Front office,Front desk,Front office executive,Receptionist front office,Receptionist:8097093326",Reception|Frontoffice|FrontDesk|FrontOfficeExecutive|Receptionistfrontoffice|Receptionist|
front office,Proximity Immigration Private Limited,Lucknow,0-1years,110000 - 180000 INR,"Check, sort and forward emails. |    |   Monitor office supplies and place orders when necessary |",Fruntdesk|Email|ComputerOperator|
Front Office Executive Required in European Country,Orissa Doot Private Limited,Singapore|UK,1-6years,Not Specified,Minimum 1+ years of relevant experience  - MUST |   Must have good knowledge of English - MUST |   Age: Must be below 40.,FrontOffice|FrontOfficeExecutive|FrontDeskExecutive|FrontOfficeAssistant|FrontDeskManagement|FrontOfficeAssistant|Reception|Frontdeskofficer|FrontEndDevelopment|Receptionist|
Front Office Executive,Orissa Doot Private Limited,Bhubaneswar,0-2years,Not Specified,Opening for Front Office Executive in Bhubaneswar location,FrontOfficeExecutive|Frontoffice|OfficeAssistant|Receptionist|
Front Office Executive,Empire Group of Academy,Cuttack|Bhubaneswar,0-2years,Not Specified,Opening For Front Office  Executive in Bhubaneswar Location,FrontOfficeExecutive|FrontDeskExecutive|Frontoffice|FrontDesk|Reception|FrontOfficeManagement|Receptionist|
BDE CRM  Back Office Executive Front Office,Beechi Vidya Kendra Trust,Bhubaneswar,0-3years,Not Specified,Should have Excellence communuication in english and hindi...purely official work..we are looking highly skilled candidate with good communication and interpersonal skill...,BackOffice|Backend|BackOfficeExecutive|OfficeAssistant|Backofficeoperations|Operations|Nonvoice|Computeroperator|
Front Office Executive & Computer Operator,Sankalp Placements India LLP,Bengaluru/Bangalore,1-8years,100000 - 180000 INR,Looking for female Front Office Executive for Kodigehalli Location -Female,FrontOfficeExecutive|Administration|AdminExecutive|Adminstrator|Frontoffice|FrontDeskExecutive|Reception|Frontdeskofficer|Frontofficeassistant|Receptionist|
Front Office  Front Office Executive Front Desk Executive,I way solutions,NaviMumbai|Thane,1-3years,180000 - 200000 INR,A reputed company in Shipping Industry offers positions for Front Desk for their Company. |   |,FrontDeskManager|FrontOffice|FrontOfficeExecutive|FrontDeskExecutive|Frontofficeassistant|
