jobTitles,Company,jobLocations,requiredExperiance,Salary,JobDescription,Skills
Full Stack Developer,Briq,Remote,0-5years,Not Specified,Looking for some one who has experience with Full stack development - Back end - Python and Front end - React.js or Vue.JS. Freshers are welcome to apply given you have done side projects and have understanding of Python and react/vue,vue.JS|Python|react.js|
Full Stack Developer,MVK Staffing Services Private Limited,Hyderabad/Secunderabad|Mumbai,5-8years,700000 - 1000000 INR,"We are looking for Full Stack Developer, who can work for 100% Remote",C#.net|Angular|Html5|Sql|Android|Github|Ci|
.Net full stack developer,C P Careers Private Limited,Chennai|Noida,2-5years,600000 - 1300000 INR,"Job description |   |  We are hiring .Net full stack developers @ Noida office |  Job Type: Permanent |  Notice Period : Immediate to 30 days only |  Shift: 12 Pm - 9 Pm |  Work from home until further notice |  Mandatory skills : Asp.net , C# , SQL , Angular OR React OR",ASP.NETCORE|C#+anyfront-endtechnologieslikereact|KnowledgeofAgileandworkingknowledgeofcloud|ExperiencedinSQL|Postgres/MySQLdb|JavaScript.|CSSKnowledgeonCloud|Net|Angular|Oops|Asp.net|C#|Sql|Angular|React|HTML|
Full Stack Developer,Provance Business Consulting Private Limited,Bengaluru/Bangalore,3-5years,Not Specified,"HAPPIEST MINDS IS A DIGITAL TRANSFORMATION, INFRASTRUCTURE,SECURITY AND PRODUCT ENGINEERING SERVICE COMPANY .",.netCoreSQLServer.|Angular|Typescript|jQuery|C#|Entityframework|asp.netwebapi|
Full Stack Developer,Conifer Live,Chennai|Hyderabad/Secunderabad,3-7years,Not Specified,The responsibility of the full stack engineer is to be able to operate comfortably with both the backend & frontend of the web product to deliver features & resolve bugs in a timely manner. Developers are expected to conform to code quality standards,DotNet|Javascript|C#|Asp.netMvc|AngularJs|react.js|
Full stack Developer,Deputize Consultancy Private limited,Mumbai,4-5years,Not Specified,"Please share copy of your updated resume if you are available and interested to learn more about this opportunity;   |   |  Full stack Developer |  Andheri, Mumbai  |   |   |  Roles and Responsibilities |  • Displaying sound knowledge of software engineering |  process, you",Java|J2EE|Javascript|Angular|Bootstrap|
Full Stack Developer,Provance Business Consulting Private Limited,Bengaluru/Bangalore,3-6years,Not Specified,"( HAPPSTMNDS), a Mindful IT Company, enables digital transformation for enterprises and technology providers by delivering seamless customer experiences, business efficiency and actionable insights.",.netcore|Angular|jquery|asp.net|C#|sqlserver|
Full Stack Developer,PayGate India Private Limited,Thane,2-6years,Not Specified,"React JS, My SQL, Java  Java, J2EE, Spring MVC, Spring Boot, Hibernate, MySql/ Oracle, Angular JS, Jquery,  |  Javascript, HTML  Java, J2EE, Spring MVC, Spring Boot, Hibernate, MySql/ Oracle, Angular JS, Jquery,  |  Javascript, HTML",ReactJs|MySQL|Java|
Sr.Net full stack developer,C P Careers Private Limited,Chennai|Noida,5-10years,1100000 - 2000000 INR,Job description |   |  We are hiring .Net full stack developer for Noida office |  Total Exp :5 + yrs to 10 yrs |  Notice Period : Immediate to 30 days only |  Domain experience: Logistic (Added advantage),SQLServer&Angular4/5/6|atabaseschema(SPs/triggers)design|developmentandoptimizationwithRDBMSdatabase|strongdesign|codinganddebugging|icrosoftdesignpatterns|developmentbestpractices|applicationblocks|Tools|ASP.NET|Mvc|C#|
Full Stack Developer,Complete HR Services,MumbaiCity|NaviMumbai,3-5years,Not Specified,"ROLE and RESPONSIBILITIES OF APP AND WEB DEVELOPER:-) |  ⚫ Know HTML, CSS, JavaScript, PHP, and other relevant web design coding languages |  ⚫ Create and test applications for websites |  ⚫ Collaborate |  ⚫ Present design specs |  ⚫ Work with graphics and other de",Language-Python|WebDevelopment|HTML|CSS|Javascript|Php|Java|
Full Stack Developer,Teejay Global Infotech Services LLP,Bengaluru/Bangalore|Gurgaon/Gurugram,4-8years,Not Specified,Position: Full Stack Developer |  Duration:6 Months |  Location :Remote |,HTML|CSS|Javascript|Xml|Node.js|WebServices|Soap|ASP.NET|Jms|RESTful|
Full Stack Developer  Full Stack Web Developer  Node.js,CosyTech,Bengaluru/Bangalore|Noida,2-6years,Not Specified,We are looking for Full-Stack Engineer (Angular & Node) Hiring Test  / SF Full-Stack Engineer (React & Node ) Pan India - Fully Remote). |   |   |  Job Location - Pan India( Anywhere in India),FullStackDeveloper|FullStackWebDeveloper|NodeJS|AngularJs|react.js|
React Full Stack Developer,2COMS Consulting Private Limited,Hyderabad/Secunderabad,3-6years,Not Specified,"Skills Requirement:3-6 years of experience working as a Senior Full stack Engineer developing web and mobileapplications.3+ years of experience with the MERN full stack technologies including: React.js, Next.js, Redux,Node.js, MySQL/ MongoDB, Exp","""reactjs""|"
Full Stack Developer / Lead,LogicalHiring,Noida,1-8years,Not Specified,"Opening in Noida for Full stack developer, Sr. Developer and Lead role",FullStackDeveloper|FullStackWebDeveloper|FullStack|AngularJs|Node.js|react.js|
Java Full Stack Developer,Larsen & Toubro Infotech Limited,Pune,5-10years,Not Specified,Java Full Stack,J2EEScripts|CoreJAVAScripts|Java|CoreJava|Spring|Angular|react.js|Microservices|
AEM Full Stack Developer,Deputize Consultancy Private limited,Bengaluru/Bangalore|Mysore,4-7years,1000000 - 1500000 INR,Hiring for AEM Full Stack Developer |     |    |   Package: 12to 15 lac (PA) |    |   Quick Joining: 15 days  (Depends on Knowledge) |    |   Experience: 4-7 YEARS |,AEM(version6.4plus)|HTML|CSS|Javascript|AngularJs|react.js|
Full Stack Developer,Lakshya,Mohali|Chandigarh,1-3years,280000 - 480000 INR,We are looking for Full Stack developer. Fresher and experience both can apply.,FullStackDeveloper|asp.net|Ado.net|ajax|AJAX|CSS|Asp.Net|.NET|Css3|
Full Stack Developer,SmartDocs Business Solutions Private Limited,Hyderabad/Secunderabad,2-5years,Not Specified,We are seeking for a Full Stack Developer to join the SmartDocs innovative team.,FullStackDeveloper|HibernateEe|Java|SpringFramework|SpringBoot|CoreJava|JavaJ2ee|
Full Stack Developer,Planet One,UK,3-13years,Not Specified,Hiring for Fullstack developers for Europe location- Apply Now!!,FullStackDeveloper|FullStackWebDeveloper|
Full Stack Developer,PurpleHirez,Hyderabad/Secunderabad,7-12years,Not Specified,"Looking for Full Stack Developer,",FullStackDeveloper|FastAPI|Angular|Integration|Apis|
Full Stack Developer,Anupama (Proprietor of Making IT Simplest),Chennai|Hyderabad/Secunderabad,2-10years,Not Specified,Hiring for one of the top most Insurance Sector based in India (Hyderabad - Hitech City),react.js|Angular|Node.js|MongoDB|HTML|CSS|Angular|react.js|Java|Python|
Full Stack Developer,Deputize Consultancy Private limited,MumbaiCity,4-5years,Not Specified,"Overview |  Atom Technologies began its operations in 2005, with the sole aim of |  providing secured and seamless digital payment solutions to all. |  Throughout the years, Atom has been successfully developing |  innovative and award-winning digital payment so",Java|Javascript|SpringBoot|Html5|
Full Stack Developer,Hiremount Solutions Private Limited,Hyderabad/Secunderabad,3-8years,Not Specified,We are looking for a highly skilled computer programmer who is comfortable with both front and back end programming.,"FullStackDeveloper""|""FullStackWebDeveloper""|"
AWS Full Stack Developer,Redefined Corp,Remote,4-10years,Not Specified,AWS LEX l AWS Skills Training l AWS Certifications l S3 l rest integration l  CI/CD pipelines l WAF l Cloudfront l Angular l JSON l Lambda l Lex l Cognito l Dynamo DB l QuickSight,AWSLEXlAWSSkillsTraininglAWSCertificationslS3lrestintegrationlCI/CDpipelineslWAFlCloudfrontlAngularlJSONlLambdalLexlCognitolDynamoDBlQuickSight|
