jobTitles,Company,jobLocations,requiredExperiance,Salary,JobDescription,Skills
International Voice Process,Hucon Solutions India Private Limited,Hyderabad/Secunderabad,1-7years,Not Specified,Looking for someone who has the below. |   |   |  Process- International Voice |   |  Qualification - Any graduate |   |  Experience - 1 to 7 years |   |  Joining - Immediate |   |  Work location -  Hyderabad |   |,InternationalVoice|calling|VoiceProcess|InternationalBpo|
BPO-FRESHERS-INTERNATIONAL VOICE,Fazo Software,Chennai|Madurai,0-1years,210000 - 450000 INR,"Fazo software |   |  Wanted freshers for international voice!! |  - immediate joining is available |  - Salary will be around Rs. 10,000- 15,000 |  - Working days ( Monday - Saturday) |  - Work location will be in Chennai |  - Hike will be there once in every year |   |",InternationalCallCenter|BPOCallCentre|CustomerCareExecutive|VoiceProcess|Bpo|BPOFresher|CallCenterExecutive|TeleCaller|VoiceProcessExecutive|CallCenterRepresentative|
Process Associate (International Voice),Infyjob Technology Services,Hyderabad/Secunderabad,0-5years,200000 - 500000 INR,"Hiring for top MNCs in Hyderabad, for BPO (Business Process Outsourcing)services, Which offers a professional work environment, outstanding challenges, industry competitive compensation, accelerated career growth and overseas opportunities.","""Internationalvoiceprocess""|""Internationalprocess""|""InternationalSales""|Customersupport""|""Voiceprocess""|""Customerservice""|""VoiceSales""|""ADP""|""Amazon""|""HSBC""|""Dell""|""Deloitte""|""Regalix""|""C3I""|""Accenture""|""Cognizant""|"
International Voice Support,Inlinked management and Training Institute,Chennai,1-6years,200000 - 220000 INR,Hiring for international voice support for work from home,CustomerSupport|CommunicationSkills|Voicesupport|VoiceProcess|Bpo|InternationalCallCenter|CallCenter|Technicalsupport|
International Call Center International Sales International Voice International Voice International Voice Support,Infyjob Technology Services,Delhi|Noida,0-2years,90000 - 190000 INR,"Excellent written/oral communication skills with a genuine concern for the customer, |  Demonstrates flexibility and adaptability |  Candidates should be flexible in working US shift |  Rotational week off on week days |   |   |",InternationalBpo|Bpo|CallCenter|Inbound|Outbound|Fresher|DomesticBPO|Support|Technicalsupport|Kpo|
International Voice / Non-Voice Process,2COMS Consulting Private Limited,Chennai,1-5years,100000 - 350000 INR,Customer Service Representative || Immediate joiner || MNC || Work From Home,InternationalVoiceSupport|internationalnon-voice|Upselling|
International Voice Process - Kolkata,Jobs Expert Private Limited,Kolkata,1-5years,Not Specified,Job Title: Customer Support VoiceWork Location: KolkataShift: Rotational ShiftWeek Off: 2 Days rotational Week OffQualification: Undergraduate/ Graduate/ Post GraduateGraduate Candidate should have minimum 9 months Experience in BPO,
Associate Technical Support- International Voice Process(CALL- 8766285530),Black And White Business Solutions Private Limited,Gurgaon/Gurugram|Pune,1-11years,300000 - 500000 INR,Associate Technical Support-International Voice |  Location: Gurgaon/ Pune |  Qual- Gards/ UG/ Drops outs can apply |  Skills- 1 yr tech support exp in International Voice Process |  Shifts- 24/7 |  CTC- 5LPA + Incentives |  CALL LIPIKA |  8766285530/ 8467054123,TechSupportVoice|Troubleshooting|ActiveDirectory|ServiceDesk|ItHelpdesk|PrinterSupport|SystemAdministration|NetworkSupport|Ccna|ServerSupport|AzureActiveDirectory|ExchangeServer|RemoteSupport|TechnicalHelpdesk|TechnicalSupport|
Custumer support voice/Technical voice/International voice/sal upto 4Lpa,2COMS Consulting Private Limited,Bengaluru/Bangalore,0-5years,Not Specified,International Call Center / BPO /Banking / E commerce / Healthcare/Customer Support / Technical Support,Voice|ChatSupport|Email|SupportCustomerSupport|CustomerService|CustomerSupportExecutive|CustomerCare|CustomerCareExecutive|TechnicalSupport|TechnicalSupport|TechSupport|TechnicalSupportExecutive|
International Voice Support,Waterleaf Consultants Private Limited,Chennai,0-2years,Not Specified,Excellent Opportunity for Freshers and Experienced.,"""internationalvoicesupport""|""domesticvoicesupport""|""domesticchatprocess""|""internationalchatprocess""|""excellentcommunication""|""extraordinarycommunication""|""excellentverbal""|""technicalsupport""|""technicalvoicesupport""|""ethiraj""|"
POSITION OPENING FOR INTERNATIONAL VOICE BPO,Infyjob Technology Services,Kolkata,0-1years,Not Specified,Hi |   |  Greetings from 2COMS Consulting |  No Registration Charges |   |  Job Title: Hiring for Voice Process in MNC |  Qualification: Undergraduate/Graduate/ Post Graduate |  Salary: 15000 |  Work Location: KOLKATA |   |  Contact Person: POOJA  |  Contact No. : 8777090106,InternationalVoiceSupportCustomerSupport|CorporateCommunication|Cbse|Englishmedium|
Immediate Openings For International Voice  Process.,Waterleaf Consultants Private Limited,Hyderabad/Secunderabad,1-8years,Not Specified,International Process,InternationalSalesProcess|InternationalVoice|Telesales|CallCenter|Bpo|Telecalling|
"International Voice Support, MNC, Chennai",Fazo Software,Chennai,0-5years,Not Specified,Relationship Manager,InternationalVoiceSupport|VoiceProcess|CustomerSupport|CustomerCareExecutive|CustomerCare|CustomerService|
Hiring for International Voice,Arise Solution,Hyderabad/Secunderabad,1-8years,200000 - 590000 INR,"|  10+2/10+3/Any Graduate/Any PG |  1 year to Max 8 years of International Voice Experience Only |  Voice Process. |  U.K PROCESS , U.S |  HR, Value Assessment, OPS1 & Ops2. |  Max  5.50  LPA |  Immediate Joiners Only |  U.K Night Rotational Shift and Rotational Week-Off |",VoiceProcess|InternationalBpo|
International Voice Process / International Voice Support / International BPO / Voice Process,Winx Consulting Services,Chennai,Fresher,220000 - 450000 INR,Fresher |   Excellent communication |   Salary : 15000 |   Immediate joining. |,VoiceProcess|CallCenter|InternationalBpo|Bpo|InternationalCallCenter|Voicesupport|Inbound|CustomerSupport|CustomerCareExecutive|Outbound|Freshers|Graduates|GraduateFresher|Undergraduates|HighSchoolPass|FresherBPO|TechnicalSupport|
Night Shift/International Voice/US Calling /Ahmedabad,Aerolith Business Private Limited,Ahmedabad,0-4years,150000 - 300000 INR,Excellent written/Oral communication skills in English   |    Minimum 6 month of relevant experience inMedical Sector can Apply |     Salary upto :-20k too 25k   |     contact:- Sonali  9687676597 |    share cv :- [HIDDEN TEXT],InternationalBpo|VoiceProcess|RevenueCycleManagement|Denialprocess|UsHealthcare|HealthInsuranceExchanges|
Hiring  for international voice,2COMS Consulting Private Limited,Hyderabad/Secunderabad,0-5years,200000 - 500000 INR,Greetings of the day..!  |   Openings in a Top MNC  |   International Voice  |   Calling  |   Work from Home  |   Max Ctc is 4.5LPA |   Immediate Joinng ( 10 days Notice period) |,HiringforinternationalVoice|
International Voice,Tech Mahindra Business Services Limited,Noida,0-3years,90000 - 250000 INR,"Greetings from Aerolith Business Pvt. Ltd. |    We are hiring for International Voice Process in Night Shift. |    Interview Venue: Aerolith Business Pvt. Ltd.,B-113, Ground Floor, Sector- 64, Noida, UP (Nearest Metro Station 59) |    •	Interview Time: 11AM to 6 PM",LeadGeneration|Coldcalling|Businessdevelopment|Leads|SalesRepresentative|OutboundCalling|OutboundSales|OutboundProcess|Bpo|InternationalBpo|Fresher|CSR|Bde|CSE|CustomerSupport|ITES/BPO|salesCustomerService|CustomerSupportExecutive|Custome|
HIRING FOR INTERNATIONAL  VOICE PROCESS IN KOLKATA,Durus Consulting Private Limited,Kolkata,0-1years,Not Specified,INTERNATIONAL VOICE PROCESS |  SALARY UPTO 20000 |  IN HAND 16000 |  US PROCESS |  FIXED SHIFT |  FIXED WEEKOFF SUNDAY SATURDAY |  FRESHER+EXPERIENCE CAN APPLY,EnglishLanguage|BPOExecutive|VoiceProcess|InternationalBpo|CallCenter|Bpo|InternationalCallCenter|Voicesupport|Inbound|Outbound|CustomerCareExecutive|HealthCareServices|CustomerSupport|TechnicalSupport|
Hiring For International Voice and chat Process In TechMahindra-Mumbai,Izee Manpower Consultancy Private Limited,Mumbai|MumbaiCity|NaviMumbai,1-5years,Not Specified,WE ARE NOT HIRING FOR BACKOFFICE & FRESHERS. |,CustomerService|CustomerServiceExecutive|CustomerCareExecutive|CustomerCare|VoiceProcess|InternationalBpo|Bpo|InternationalCallCenter|Voicesupport|Inbound|CallCenter|Outbound|Ites|customerrepresentative|Kpo|
International Non voice Process_Chennai,Fazo Software,Chennai,0-5years,Not Specified,Openings for International Non voice Process-Chennai( Velacherry)-Immediate Joiners,Nonvoice|Bpo|
Opening  for International voice Customer care  voice and semi voice Salary upto 40k,Black And White Business Solutions Private Limited,Bengaluru/Bangalore,1-5years,110000 - 590000 INR,opening for Customer care all round will be done over thecall |  Call |  Apoorva  |  7022226234,InternationalVoice|CustomerSupportExecutive|CustomerServiceExecutive|Customercareexecutive|BPOCallCentre|DayShifts|USShift|Voice|Inbound|InternationalBpo|CallCenter|Outbound|Bpo|Accent|
International Voice Process,Zap Tech Private Limited,Chennai,Fresher,170000 - 280000 INR,Good Communication |   Salary 12000 - 15000 / month |   Incentives up to 8000. |   Immediate Joining. |   Night Shift.,BPOCallCentre|InternationalCallCenter|VoiceProcess|Bpo|InternationalBpo|CustomerCareExecutive|CallCenterExecutive|BPOFresher|VoiceSupportExecutive|Voicesupport|VoiceBasedProcess|USRecruiter|USShift|UKShift|DayShift|UsItRecruiter|
