jobTitles,Company,jobLocations,requiredExperiance,Salary,JobDescription,Skills
Relationship Manager for reputed share broking company,Morgan Eries,Delhi|Lucknow,1-4years,250000 - 509999 INR,"Company :Motilal Oswal Financial services Ltd. |    |   Responible and Advising clients for for Opening trading and demat account for Equity,Commodity , currnecy Segments ,Insurence,Mutualfunds,Investments,Assets and trading Products |    |",SalesSkill|Communication|Interpersonalrelatioship|
Sales Coordinator EL Overseas - (Mumbai),Morgan Eries,Mumbai,4-5years,400000 - 450000 INR,"|   |  Ensuring the deliverables is met through effective planning and execution. Facilitate Disbursement, PDD and Collection activities. Endeavour to make Avanse a brand of first choice within our customer segment.",InterpersonalSkills|communication|Negotiation|DecisionMaking|Flexibility|
Sales Coordinator EL Overseas - (Pune),Travel Food Services Pvt. Ltd,Pune,4-5years,400000 - 450000 INR,"Ensuring the deliverables is met through effective planning and execution. Facilitate Disbursement, PDD and Collection activities. Endeavour to make Avanse a brand of first choice within our customer segment.",InterpersonalSkills|communication|Negotiation|DecisionMaking|Flexibility|
Sales Coordinator EL Overseas - (Hyderabad),MP Dominic & Co,Hyderabad/Secunderabad,4-5years,400000 - 450000 INR,"|  Ensuring the deliverables is met through effective planning and execution. Facilitate Disbursement, PDD and Collection activities. Endeavour to make Avanse a brand of first choice within our customer segment.",InterpersonalSkills|communication|Negotiation|DecisionMaking|Flexibility|
Relationship Manager for reputed  Financial services Company,HR Factor,Delhi|Mumbai,1-4years,210000 - 409999 INR,"Company :Motilal Oswal Financial services Ltd. |   |  Responible and Advising clients for for Opening trading and demat account for Equity,Commodity , currnecy Segments ,Insurence,Mutualfunds,Investments,Assets and trading Products |   |",SalesSkill|Communication|Interpersonalrelatioship|
Restaurant Manager,C P Careers Private Limited,Bengaluru/Bangalore,8-15years,450000 - 550000 INR,Candidate with 8+years experience in Restaurant domain (preferred Indian/Multi-Cuisine Exposure),InterpersonalCommunicationSkills|
"Urgent Hiring for Ground Staff, Air ticketing and Cabin Crew in Airline.",C P Careers Private Limited,Chennai|Kolkata,0-2years,Not Specified,"We are hiring staff for 3 job profile - Ground Staff, Air ticketing and Cabin crew...",CommunicationskillsPlanning|OrganizingResponsibility|Teamwork|Problem-solvingskills|Interpersonal|abilitiesFlexibility|SoftSkills|ManagementSkills|Professional|
MALE NURSE,Team Management Services,UnitedArabEmirates,1-5years,Not Specified,Hiring MALE NURSE,EffectiveCommunicationSkills|Empathy|InterpersonalSkill|
Business Development Manager,C P Careers Private Limited,Indore,4-8years,400000 - 850000 INR,Industry-IT Software |   |  Experience - 4 - 8 Years |   |  Notice Period - 30 Days |   |  Salary - 400000 - 850000 PA |   |  Vacancies - 1 |   |  No of Interviews - 2 |   |  Job Type - Permanent Full Time |   |  Consider Relocation - yes,GoodCommunication|GoodInterpersonal|GoodNegotiation|
Sales Manager - Online Education Work From Home,PayGate India Private Limited,Bengaluru/Bangalore|Chennai,5-9years,800000 - 1200000 INR,"Proven B2C Sales track record of exceeding targets, 2 years of Sales experience |   Excellent communication, interpersonal, problem-solving, presentation, and organizational skills. |   Working knowledge of Salesforce, spreadsheets, and PowerPoint.",SalesManagement|Sales|Target|CommunicationSkills|Interpersonal|SkillsProblem|SolvingPresentation|OrganizationalSkills|Powerpoint|Spreadsheets|
Sales Manager - Day Shift,GITA Power & Infrastructure Private Limited,Bengaluru/Bangalore,5-9years,800000 - 1200000 INR,"Proven B2C Sales track record of exceeding targets, 2 years of Sales experience |   Excellent communication, interpersonal, problem-solving, presentation, and organizational skills. |   Working knowledge of Salesforce, spreadsheets, and PowerPoint.",SalesManagement|Sales|Target|CommunicationSkills|InterpersonalSkills|ProblemSolving|Presentation|OrganizationalSkills|Powerpoint|Spreadsheets|
"Sales Head , Sr. Sales Manager – Railway OHE/ Transmission line",Aspire Group of Services,Jabalpur,9-16years,650000 - 800000 INR,"Licensing with different Government Departments and HODs to generate Business opportunities in OHE, Transmission line, Electrical Substation, EPC/Electrical contracts and other MEP contracts.",•Confident&Quickresponse|Pro-activeinnature•Goodcommunication|interpersonalskills&presentationskills.|
Sales Manager - US Shift,Altus Learning Private Limited,Bengaluru/Bangalore|Chennai,4-8years,800000 - 1200000 INR,"Proven B2C Sales track record of exceeding targets, 2 years of Sales experience |   Excellent communication, interpersonal, problem-solving, presentation, and organizational skills. |   Working knowledge of Salesforce, spreadsheet, and PowerPoint",Powerpoint|Spreadsheets|Salesforce|Organizational|ExcellentCommunication|InterpersonalSkills|ProblemSolving|Presentation|Target|Sales|BusinessDevelopment|CommunicationSkills|
Product Manager,Hi Tides Consulting,Thane,10-20years,Not Specified,"Drive the entire vision and delivery of new products, features to keep the business  |   relevant and competitive. |   Conduct market and Product research to identify potential features or releases. |   Manage the roadmap, prioritize product opportunities.",Payments|DigitalBanking|OpenbankingandAPIbanking|FintechInnovations|Goodcommunicationandinterpersonalskills.Teamhandlingskills|
Sustainability/Green Job,Cyphware Infotech Private Limited,Chennai|Kolkata,4-8years,Not Specified,Green Initiative Projects,StrongInterpersonal|CriticalThinking|abilitytocollaborateandprojectmanagementabilities.|
Admission Counselor,Khutwad Devkar And Co,Lucknow,0-5years,Not Specified,Key Responsibility: |   |  *Responsible for the counselling of candidates for abroad admissions. |  *Meet the set targets. |  *Effective utilization of leads and Maintain a positive and healthy conversion rate |  *Exceptional communication skills |,CommunicationSkills|InterpersonalSkills|Open-mindedness.|
Executive - Human Resources,S K B Engineering Systems,Chennai,1-2years,Not Specified,|  Coordinate for Initial screening of candidates |  Support in onboarding of employees |  Organizing & coordinating Training for employees |  Coordinating for employee engagement activities |  Creation and maintenance of employee personal records |  Support in exit,GoodCommunicationSkills|InterpersonalSkills|presentationskillsShareJobLinkonSocialMedia|
