jobTitles,Company,jobLocations,requiredExperiance,Salary,JobDescription,Skills
Mean Stack developer,Aarav Consultancy,Hyderabad/Secunderabad,2-6years,Not Specified,Urgent requirement of Mean Stack developer for Hyderabad Location.,MeanStackDeveloper|MeanStack|
Mean Stack Developer,Hi Tides Consulting,Amritsar,1-2years,300000 - 450000 INR,"Experience in web development of Single Page Applications (Angular) |   Experience in performing SQL queries on a RDMS especially in MySQL. |   RDBMS (Relational Database Management System) |   Good at API integration, debugging and fixing the issues with API |   Go",MeanStackDeveloper|MongoDB|Mysql|NodeJS|Node.js|AngularJs|Angular|
MEAN Stack Developer,Radial HR Solutions,Bengaluru/Bangalore,3-6years,500000 - 1200000 INR,"Looking for the position of MEAN Stack Developer: Require Candidates with 3+yrs of experience in Angular, Node.js, JavaScript, MongoDB, Express.js",MEANStackDeveloper|Express.js|Angular|Node.js|Javascript|MongoDB|
Java Mean Stack,A3edge Services Private Limited,Pune,5-15years,800000 - 2400000 INR,Looking to hire Java with Mean stack Developers and Architects,MeanStack|MongoDB|react.js|AngularJs|Angularjs|Node.js|Nodejs|JavaScript|CSS|Jscript|HTML|
React Developer (Mean Stack Developer),E-Friend Solutions India,Ahmedabad|Indore,2-5years,300000 - 600000 INR,"React.Js,Node.js,express.js,mern,Mean Stack Developer,React Native,",express.js|mern|MeanStackDeveloper|react.js|Node.js|ReactNative|
Senior Developer,The Skillions,Kolkata,5-15years,Not Specified,We are looking for a 'Senior Developer/ Architect'  for our reputed   Client in the IT domain   |   Job Title/Designation : Sr Developer/Architect  |   Annual CTC : No Restriction for deserving candidate |   Location : KOLKATA(Work from Home,MeanStackDeveloper|MeanStack|AngularJs|angular.js|Node.js|
Mean Stack Developer,Vedic Systems Private Limited,Hyderabad/Secunderabad,2-3years,Not Specified,"•	Must have minimum 2  Years of  experience on  Mongodb, Express JS, Angular and NodeJS |   •	Must have been working on mobile and web applications |",Backend|MeanStack|Nodejs|Angularjs|mongodb|
Mean Stack Developer,Gulam Mustafa Tabeerali Chaudhary (Proprietor Of Maxdigi Solutions),Nasik|Nashik,2-5years,Not Specified,We are looking for a MEAN STACK Developer responsible for managing the interchange of data between the server and the users.,Angular4+|Node.js|PostgreSQL|Mysql|AngularJs|jQuery|CSS|Bootstrap|RestApi|JIRA|NodeJS|MeanStack|ExpressJs|
UI developer,Freelancer Srividya Palaniandi,Bengaluru/Bangalore|Hyderabad/Secunderabad,8-15years,Not Specified,UI developer,UI|MeanStack|RestApi|
Immediate requirement for MERN Stack Developer,InfoPro Solutions Pvt Ltd,Bengaluru/Bangalore,4-6years,Not Specified,Immediate requirement for MERN Stack Developer with one of our client in Bangalore location (Product based company),FullStackDeveloper|Mernstackdeveloper|MeanStackDeveloper|
Full Stack Developer / Frontend Developer /Backend Developer / Fullstack / Software Engineer,Freelancer Kosana Anupama,Hyderabad/Secunderabad,4-10years,Not Specified,We are looking for a Fullstack frontend and backend developer (MEAN stack required) with experience in leveraging cloud platform technologies.,AngularJs|Angularjs|Node.js|NodeJS|MeanStack|
MEAN Stack Lead,Gridh Technologies India Private Limited,Chennai,7-9years,1050000 - 1689999 INR,"1.6+ years of extensive experience in developing the Single Page Application with Web responsive design for mobile  |        and web using React JS, HTML 5, CSS 3 and Bootstrap. |   2. Must have enterprise platform experience using React JS / Angular 2+",mern|Angular|AWS|CSS|Dynamodb|Html5|JavaScript|Lambda|MeanStack|NODEJS|ReactJs|Mysql|Bootstrap|
Mean Stack Developer,Deputize Consultancy Private limited,Mumbai|Thane,2-5years,Not Specified,"Having strong knowledge of .net mvc sql server |  MEAN. Mongo express angular node |   |  Previous working experience as a MEAN Stack Developer for   2-5 years |  BSc degree in Computer Science or similar relevant field |  In depth knowledge of NodeJS, ExpressJS or",MeanStackDeveloper|.NET|Mvc|AngularJs|NodeJS|
Full Stack Developer/Mean/Mern Developer,Bright IT Global Solutions Private Limited,Chandigarh,1-6years,Not Specified,Multiple openings for Mern Developer for Chandigarh location,Node.js|JavaScript|CSS|Jscript|NodeJS|MeanStack|ExpressJs|MongoDB|react.js|AngularJs|angular.js|Gruntjs|
Mean Stack Developer,SwissTech Unicorn Corp LLP,Vadodara,3-8years,350000 - 850000 INR,We are currently looking for an experienced and detail-oriented individual to join our team at SwissTech Unicorn as a MEAN stack developer with an emphasis in AngularJS and NodeJS.,Javascript|Mogodb|Jquery|Node.js|AngularJs|
Senior Frontend/Meanstack Developer,Varaisys Private Limited,Noida,5-12years,Not Specified,"We are looking for a Mean Stack Developer to produce scalable software solutions. You’ll be part of a cross-functional team that’s responsible for the full software development life cycle, from conception to deployment.",MeanStack|FrontEndDevelopment|Node.js|Javascript|Jquery|AngularJs|
Full Stack Developer,Softobiz Technologies Private Limited,Chennai|Chandigarh,3-8years,600000 - 1500000 INR,We are looking for 1 - 3 years of experienced full stack software engineer to develop high-quality software that is aligned with user needs and business goals. You will work with Tech Leadership to implement complex solutions with Modern architecture,FullStackDeveloper|Ddd|Node.js|MongoDB|AngularJs|MeanStack|
MEAN Stack Developer,SnapHunt Pte Ltd,Remote,2-4years,240000 - 420000 INR,Supporting continuous improvement by investigating alternatives and new technologies and presenting these for architectural review. Troubleshooting and debugging to optimise performance. |,MeanStackDeveloper|SoftwareEngineer|Mvc|WebApi|Javascript|Html5|Node.js|MongoDB|MeanStack|
Mean Stack Developer,2COMS Consulting Private Limited,Bengaluru/Bangalore,3-8years,Not Specified,"Amazing Opportunity for Mean Stack Developers, Bangalore",MeanStackDeveloper|MeanStack|AngularJs|NodeJS|
Immediate C2H OPENING FOR MERN STACK(MONGO/EXPRESS/REACT/ NODE JS)DEVELOPER AT CHENNAI,BR Raysoft Global Private Limited,Chennai,3-10years,Not Specified,Immediate C2H OPENING FOR MERN STACK(MONGO/EXPRESS/REACT/ NODE JS)DEVELOPER AT CHENNAI,MeanStack|Mongo|React|NODEJS|
Mean Stack Developer - Node.js & Angular,Sevenstar Websolution,Noida,1-4years,229999 - 620000 INR,"We are looking for a Node.js Developer responsible for managing the interchange of data between the server and the users. You will also be responsible for integrating the front-end (Angular,react,html5,css3).",MeanStackDeveloper|FullStackDeveloper|Node.js|AngularJs|MongoDB|DatabaseDeveloper|Html5|Css3|react.js|MysqlDatabase|
Mean Stack Developer,Hiremount Solutions Private Limited,Hyderabad/Secunderabad|Mumbai,3-6years,310000 - 730000 INR,Urgent Requirement,MeanStackDeveloper|MeanStack|Xml|Xsl|AJAX|Soap|Javascript|Xsd|WebServices|Dhtml|
Mean Stack Developer,MVK Staffing Services Private Limited,OtherIndia,2-7years,Not Specified,"Angular, Node.js,mongoDB,express framework (MEAN stack) ll HTML 5 ll RDBMS (MySQL)  ll Linux (Ubuntu Servers)",expressframework(MEANstack)llHTML5llRDBMS(MySQL)llLinux(UbuntuServers)|Angular|Node.js|mongoDB|
Full Stack Developer  - Hyderabad,Populus Flyers Private Limited,Hyderabad/Secunderabad,3-8years,Not Specified,We are hiring Full stack developers at HYD location.,MongoDB|Angular|NodeJS|MeanStack|
