jobTitles,Company,jobLocations,requiredExperiance,Salary,JobDescription,Skills
inbound process For Medical Billing,White Horse Manpower Private Limited,Bengaluru/Bangalore,0-4years,140000 - 420000 INR,Candidate should possess excellent oral and written communication skillsCandidate with good customer service skills would be preferredCandidate should have 0-5 year of experience in Customer Support Voice Process. Prior experience in Customer,CustomerServiceExecutive|Inbound|Outbound|Bpo|CallCenter|CallCentre|CSR|TSR|Kpo|TechnicalSupport|
Medical billing process Bpo,White Horse Manpower Private Limited,Bengaluru/Bangalore,0-4years,140000 - 400000 INR,Spot offer Medical billing process Bpo Call Ruby@9342431049,"CustomerService|Customerserviceexecutive|CustomerSupport|customersupportexecutive|""csr""|cso|tsr|scsr|stsr|tso|technicalsupportexecutive|seniorcustomersuppor|"
Medical Billing Senior Executive Accounts Receivable,White Horse Manpower Consultancy Private Limited,Bengaluru/Bangalore,1-2years,Not Specified,Meet the productivity targets of clients within the stipulated time.,AccountsReceivable|Accounting|MedicalBilling|QualityStandards|Collections|statusreports|
Medical Billing,Arise Solution,Ahmedabad,0-2years,150000 - 200000 INR,Medical Billing Process,CustomerService|CustomerSupportExecutive|VoiceProcess|Voicesupport|InternationalBpo|
Medical Billing Process/International Voice/ US Calling - Ahmedabad,Arise Solution,Ahmedabad,0-3years,150000 - 300000 INR,"A/R FOLLOW-UP AND CLAIMS STATUSING - INSURANCE AND PATIENT COLLECTIONS |  CLAIMS ADJUDICATION AND RESUBMISSION |  CREDENTIALING, ENROLLMENT, AND RE-CREDENTIALING |  OUTBOUND / INBOUND CALLING |    If Someone interested Contact on 9687676593",MedicalBilling|UsHealthcare|MedicalCoding|cashposting|Healthcare|ArCaller|MedicalRepresentative|DenialManagement|Medicalrep|PharmaSales|Territorybusinessmanager|Fieldsalesofficer|USShift|
Medical Billing Senior Executive Accounts Receivable Call Rina,White Horse Manpower Consultancy Private Limited,Bengaluru/Bangalore,0-4years,Not Specified,Meet the productivity targets of clients within the stipulated time.,MedicalBilling|AccountsReceivable|CustomerService|CustomerSupport|qualitystandards|statusreports|
Medical Billing Process/Night Shift/ US Calling - Ahmedabad,Arise Solution,Ahmedabad,0-3years,150000 - 300000 INR,"A/R FOLLOW-UP AND CLAIMS STATUSING - INSURANCE AND PATIENT COLLECTIONS |       CLAIMS ADJUDICATION AND RESUBMISSION |       CREDENTIALING, ENROLLMENT, AND RE-CREDENTIALING |       OUTBOUND / INBOUND CALLING |         If Someone interested Contact on 9687676593",MedicalBilling|UsHealthcare|MedicalCoding|cashposting|Healthcare|ArCaller|MedicalRepresentative|DenialManagement|Medicalrep|PharmaSales|Territorybusinessmanager|Fieldsalesofficer|USShift|
Medical Billing Executive in Lucknow,Aspire Group of Services,Lucknow,0-1years,110000 - 180000 INR,Fresher male candidates can apply |   |  Age :- 18 to 45 |   |  Job Location Lucknow |   |,MedicalBillingMedicalCoding|Healthcare|
Medical Billing Voice Support Rotating Shift  BPO 9972020040,White Horse Manpower Private Limited,Bengaluru/Bangalore,0-3years,140000 - 420000 INR,Back Office Medical Billing Process |   Provide Customer service for Healthcare Domain |   End to end Transaction processing. |   Need to maintain Accuracy in Reports.,CustomerServiceExecutive|Inbound|Outbound|Bpo|CallCenter|CallCentre|CSR|TSR|Kpo|TechnicalSupport|
Medical Billing Executive Call 9643599774,Flight To Sucess Immigration Services Llp,Canada|Germany,2-12years,Not Specified,"Medical Billing executive are in huge demand for Germany / Canada / Hong Kong / Australia |   Obtaining referrals and pre-authorizations as required for procedures. |   Checking eligibility and benefits verification for treatments, hospitalizations, and proc",MedicalBillingExecutive|MedicalBilling|Healthcare|ArCaller|Compliance|
Medical Billing/ International Voice / US Shift/Night Shift /Ahmdabad,Arise Solution,Ahmedabad,0-4years,150000 - 300000 INR,Excellent written/Oral communication skills in English   |  Minimum 6 month of relevant experience inMedical Sector can Apply |   Salary upto :-20k too 25k   |   contact:- Sonali  9687676597 |  share cv :- [HIDDEN TEXT],InternationalBpo|VoiceProcess|RevenueCycleManagement|Denialprocess|UsHealthcare|HealthInsuranceExchanges|
International Voice Process / Fluent English / Medical Billing Process - Ahmedabad,Arise Solution,Ahmedabad,0-3years,150000 - 300000 INR,Good communication skills in English |   Experience in Medical Billing process has been Eligible. |   Should be able to work with Voice Process. |   For Ahemdabad Candidates only. |   If Someone interested Contact on 9687676593,MedicalBilling|UsHealthcare|MedicalCoding|cashposting|Healthcare|ArCaller|MedicalRepresentative|DenialManagement|Medicalrep|PharmaSales|Territorybusinessmanager|Fieldsalesofficer|USShift|
Medical Billing Process - Night Shift - Ahmedabad,Arise Solution,Ahmedabad,0-4years,120000 - 240000 INR,We are currently working for one of our leading MNC client in Ahmedabad for Medical billing process. Below I have mentioned the Job Description of this requirements.,CallCenterExecutive|BPOCallCentre|InternationalCallCenter|CustomerCareExecutive|CallCenterRepresentative|BPOFresher|BPOExecutive|TeleCaller|VoiceProcessExecutive|DomesticBPO|USShift|
Medical Billing Process - Night Shift - Ahmedabad,Arise Solution,Ahmedabad,0-4years,120000 - 240000 INR,We are currently working for one of our leading MNC client in Ahmedabad for Medical billing process. Below I have mentioned the Job Description of this requirements.,CallCenterExecutive|BPOCallCentre|InternationalCallCenter|CustomerCareExecutive|CallCenterRepresentative|BPOFresher|BPOExecutive|TeleCaller|VoiceProcessExecutive|DomesticBPO|USShift|
Medical Coding Analyst  required in Canada@8448490104,World Overseas Immigration Consultancy Private Limited,Canada,4-11years,2550000 - 6530000 INR,Medical Coding Analyst  required in Canada within 6 months,MedicalCoder|Healthcare|MedicalBilling|Medicalcoding|
inbound process For Medical Billing,White Horse Manpower Consultancy Private Limited,Bengaluru/Bangalore,0-4years,140000 - 420000 INR,Candidate should possess excellent oral and written communication skillsCandidate with good customer service skills would be preferredCandidate should have 0-5 year of experience in Customer Support Voice Process. Prior experience in Customer,CustomerServiceExecutive|Inbound|Outbound|Bpo|CallCenter|CallCentre|CSR|TSR|Kpo|TechnicalSupport|
Medical Billing Process - Fresher - Fluent English - Ahmedabad,Arise Solution,Ahmedabad|Gandhinagar,0-4years,120000 - 250000 INR,We are currently working for one of our leading MNC client in Ahmedabad for Medical billing process. Below I have mentioned the Job Description of this requirements.,CallCenterExecutive|BPOCallCentre|InternationalCallCenter|CustomerCareExecutive|CallCenterRepresentative|BPOFresher|BPOExecutive|TeleCaller|VoiceProcessExecutive|DomesticBPO|USShift|
Medical Billing Voice Support Rotating Shift  BPO,White Horse Manpower Private Limited,Bengaluru/Bangalore,0-5years,140000 - 420000 INR,•         Candidate should possess excellent oral and written communication skills•         Candidate with good customer service skills would be preferred•         Candidate should have 0-5 year of experience in Customer Support Voice Process.•,CustomerServiceExecutive|Inbound|Outbound|Bpo|CallCenter|CallCentre|CSR|TSR|MedicalTerminology|Proofreading|CustomerService|Kpo|TechnicalSupport|
Medical Coding Analyst Required in Germany/Canada Call 9643599774,Flight To Sucess Immigration Services Llp,Canada|Germany,0-5years,2530000 - 4410000 INR,Comply with all legal requirements regarding coding procedures and practices |   Conduct audits and coding reviews to ensure all documentation is accurate and precise |   Assign and sequence all codes for services rendered |   Collaborate with billing department,MedicalCoder|Healthcare|MedicalBilling|MedicalCoding|
Hiring For Retail Pharmacist/Assistant Pharmacist In Hyderabad Location-93470568l6,Tarare Consulting services Private Limited,Hyderabad/Secunderabad,0-3years,Not Specified,Hiring For Pharmacist/Assistant Pharmacist In Hyderabad Location,RetailPharmacist|HospitalSales|HospitalPharmacist|medicalsales|MedicalBilling|FrenchJobs|
Opening for Medical Billing Process - Fresher - Fluent English - Ahmedabad,Arise Solution,Ahmedabad|Gandhinagar,0-4years,120000 - 250000 INR,We are currently working for one of our leading MNC client in Ahmedabad for Medical billing process. Below I have mentioned the Job Description of this requirements.,CallCenterExecutive|BPOCallCentre|InternationalCallCenter|CustomerCareExecutive|CallCenterRepresentative|BPOFresher|BPOExecutive|TeleCaller|VoiceProcessExecutive|DomesticBPO|USShift|
Opening for Medical Billing Process - Fresher - Fluent English - Ahmedabad,Arise Solution,Ahmedabad|Gandhinagar,0-4years,120000 - 240000 INR,We are currently working for one of our leading MNC client in Ahmedabad for Medical billing process. Below I have mentioned the Job Description of this requirements.,CallCenterExecutive|BPOCallCentre|InternationalCallCenter|CustomerCareExecutive|CallCenterRepresentative|BPOFresher|BPOExecutive|TeleCaller|VoiceProcessExecutive|DomesticBPO|USShift|
Client Service  / Medical Billing/ US Process / US Shift - Ahemdabad,Arise Solution,Ahmedabad,0-3years,150000 - 300000 INR,Good communication skills in English |   Experience in BPO / Customer Service / International Process can also apply |   Should be able to work with Voice Process. |    For Ahemdabad Candidates only. |    If Someone interested Contact on 9687676593,CustomerSupport|CustomerSupportExecutive|Bpo|InternationalBpo|InboundProcess|FresherTrainee|
Hiring For Hospital Pharmacist/Retail Pharmacist In Hyderabad Location -93470568l6,Tarare Consulting services Private Limited,Hyderabad/Secunderabad,0-3years,Not Specified,Opening For AirPort Pharmacist/Hospital Pharmacist In Hyderabad Location,RetailSalesExecutive|HospitalSales|LocalShops|Freshers|MedicalBilling|medicalsales|
