jobTitles,Company,jobLocations,requiredExperiance,Salary,JobDescription,Skills
.NET Developer - Jaipur,Star Jobs Private Limited,Jaipur,4-14years,Not Specified,"Net Developer (MVC is a must) |   |  C#,.Net, Strong OOPS Concepts, Entity Framework with Code First Approach, MySQL, Web API & MVC.","""netDeveloper""|""dotnetdeveloper""|""dotnetdevelopment""|""MVC""|""CodeFirstApproach""|""React""|""Angularjs""|""Angular8""|"".NetMVC""|"
Dot net Developer,Aarav Consultancy,Ahmedabad|Mumbai,3-8years,Not Specified,Urgent opening for Dot net developer Location (Pan India).,MVC.|.NET|
FullStack Developer (C#/Angular6+) with Product MNC (Mumbai) Immediate Joiners,Mulya Consulting,Mumbai|Thane,5-15years,Not Specified,FullStack Developer (C#/MVC/WebAPI/Entity Framework/Angular6+) with Product MNC (Mumbai)  Short Joiners,C#|Mvc|EntityFramework|WebApi|Wcf|Angular|
Dot Net – Technical Consultant,Millennium Ims Private Limited,Bengaluru/Bangalore|OtherIndia,8-18years,Not Specified,Must have Skills |    •	Dot Net |    •	MVC |    •	Java Script |    •	Web API integration  |    •	API call |    •	Ajax |,.NET|C#|Asp.Net|Mvc|HTML|Javascript|CSS|
Sr Developer- full stack .net,Selligence Solutions Private Limited,Coimbatore,3-6years,Not Specified,"o	3+ concurrent years as a senior level C# ASP .NET developer |  o	Expert level skills in ASP .NET 3.5, 4.0 using C#, |  o	Strong skills in SQL database development. |  o	Deep knowledge of C#, ASP.NET,MVC,Angular,Unittesting,oopsJquery, JavaScript, Transact-S",.NET|Mvc|Api|
.net Sr. software Engineer,Procentris India Private Limited,Kolkata|Mumbai|MumbaiCity|NaviMumbai|Thane,3-8years,Not Specified,Looking for SSE .net profiles with 3-8 yrs of experience,ASP.net|C#|Sql|Mvc|
Dot Net Developer Required For CANADA & AUSTRALIA,Pear Visa Immigration Services Private Limited,Australia|Canada,2-7years,5000000 - 9500000 INR,"Plan and identifying areas for modification & improvement |  Prepare test based applications for various .Net applications |  Create technical specifications and test plans |  Upgrading, configuring & debugging existing systems",.netframwork|C#.netprogrammer|MVCdesign|CSharp.Net|netdeveloper|C#|MvcArchitecture|C#Developer|OracleDeveloper|Mvc|.NET|ASP.net|RDBMS|Sql|MVCframework|ASP.net|Oracle|C++|
Asp.Net Mvc Developer,Lakshya,Mohali|Chandigarh,0-3years,160000 - 340000 INR,We have urgent requirement. Fresher and experience both can apply.,Asp.Net|.NET|DotNet|Mvc|Mvc3/4|Mvc++|
Technical Leader / .net Lead / Dot Net Lead/ Dot Net developer/ Tech Lead,Jarus Technologies India Private Limited,Hyderabad/Secunderabad,8-15years,Not Specified,Enforce compliance with coding guidelines using code reviews etc.  |     Schedule work to meet completion dates & technical specifications.  |     Ensure that the requirements are adequately defined & designs are fully documented. |     To handle tasks independently.,Aps.Net|C#|Mvc|EntityFramework|MVCframework|SdlcProcess|OopsConcepts|DotNet|.NET|
Asp.Net Mvc Developer,Progment Software Technologies Pvt Ltd,Hyderabad/Secunderabad,2-5years,100000 - 450000 INR,"We are looking for an ASP.NET MVC developer that will be able to develop and support existing applications. You will create applications from scratch, configure existing systems and provide user support and training. Your goal will be to work with in",Silverlight|Asp.Net|C#|.NET|DotNet|SQLServer|Aspdotnet|Api|WebServices|Soap|Xml|Wcf|Mvc|Ado.net|C#.net|SqlServer2005|Sql|Wcf|Wpf|Linq|.NET3.5|
Java with JSP or Spring MVC,Nucleus Software Exports Limited,Chennai,4-6years,Not Specified,"Nucleus Software’s is urgently looking for Candidates with Java with JSP or Spring MVC skills, Exp – 4.5to 6, Loc – Chennai",Java|SpringMvc|Jsp|
.Net Lead --MVC/WebAPI,Sysmedac Technologies India Private Limited,Chennai,4-8years,Not Specified,Must to have - 6 to  10 Yrs of Strong Dot Net /MVC/WebAPI  project experience in implementing in various domain projects |,WebDeveloper|Asp.NetC#|MvcRazor|Mvc|WebApplication|WebApp|WebBased|
ASP.NET Developer,Cerentral Consultants Private Limited,Mumbai,3-4years,250000 - 550000 INR,Urgent!!! Hiring for '.Net Developer' for reputed company in Mumbai Location,Asp.Net|Asp.netMvc|Sql|Oracle|
Hot Vacancies for C#Dotnet Developer,Shell Info Technologies Private Limited,Hyderabad/Secunderabad,3-4years,Not Specified,"Requirement Summary (Mandatory skills) |   •	4-5 years of experience in C# development and implementation |   •	4 Plus Strong Experience in working on MVC |   •	Strong in HTML, JS and CSS |   •	Experience on REST API, JSON, XML |    |    |",DotnetDeveloper|Mvc|Asp.netMvc|EntityFramework|
Immediate Openings For .NetCore Developer_ Contract To Hire_ Hyderabad,TechEra IT Consulting Private Limited,Hyderabad/Secunderabad,3-5years,Not Specified,Greetings from TechEra IT Services!!! |   |   |  We have openings for .Net Core Developer for Hyderabad location on Contract to Hire roles. |   |   |  Exp: 3.5-4.5 Years |   |  NP: 0-15days,.Netcore|.NET|C#|WebApi|Mvc|
Sr. ASP .NET Developer,InSync Tech-Fin Solutions Ltd,Kolkata,1-5years,Not Specified,"We’re looking for: |     Proficiency in C# and Javascript |     Technical competence on working with .NET 4.5 framework |     Experience in developing ASP.NET MVC applications |     Understanding of HTML, JS, and CSS |     Familiarity with the client side framework like jQuery",FullStackDeveloperASP.NET|.NET|C#|Aspdotnet|VB.NET|DotNet|Mvc|
.Net Backend Developer,Deputize Consultancy Private limited,MumbaiCity,5-8years,Not Specified,".Net Backend Developer |  Minimum 5+ Years of exp     |  Technical Requirement |  - Must to Have |      o C# |      o SQL Server |  - Good to Have |      o MVC Knowledge |   |  Utilize established development tools, guidelines, and conventions including but. not limited to ASP",.NET|SQLServer|C#|Mvc|
Hot Vacancies for ASP.net with VB.net,Shell Info Technologies Private Limited,Hyderabad/Secunderabad,3-8years,Not Specified,"•	Technical Skills (Mandatory)  |   o	ASP.Net Webforms with VB.Net and C# |   o	ASP.Net WEB-API |   o	Ajax, JavaScript, JQuery |   o	HTML, XML |   o	Understanding of unit testing frameworks  |   o	SQL Server 2008 R2 and above |   o	Knowledge on SQL programming, writing stored",Asp.Net|VB.Net|Mvc|
Asp Dot Net Developer,Aarav Consultancy,Mumbai|MumbaiCity|NaviMumbai,4-7years,Not Specified,Urgent opening of Asp.net Developer(MVC) for Mumbai Location.,.NetDeveloper|ASP.NET|Mvc|
Senior Software Engineer-Dot Net,GA Staffing Solutions Private Limited,Cochin/Kochi/Ernakulam,4-9years,Not Specified,"We are seeking a .NET developer responsible for building .NET applications |  using C#, Asp. Net MVC & SQL server. Your primary responsibility will be to |  design and develop different layers of our applications.",C#.net|Mvc|
Dot Net Trainee,Miracle Software Systems India Private Limited,Visakhapatnam,Fresher,Not Specified,"The candidate may possess skills in C#,ASP.Net, MVC |  Trained candidates  or Hands-on experience in Dot Net can be preffered  |  Good communication skills and logical thinking capabilities. |",C#.net|Asp.Net|Mvc|Sql|DotNet|C#|
Sr. Software Engineer / Tech. Lead.,Jarus Technologies India Private Limited,Hyderabad/Secunderabad,7-12years,Not Specified,"Skills Specification: Experience in Data Warehouse, ETL and BI Tools is preferred |    |   Developer Skill Set: |    |   Web Application Development, SPA, Razor and Entity Frameworks |   .NET framework, C#.net, MVC Framework,  |   ASP.NET (earlier version of ASP is a plus),",Backend|MsSqlServer|C#|Mvc|Asp.Net|Xml|
Sr. Software Engineer-Dot Net,Jarus Technologies India Private Limited,Hyderabad/Secunderabad,4-8years,Not Specified,Enforce compliance with coding guidelines using code reviews etc.  |  Schedule work to meet completion dates & technical specifications.  |  Ensure that the requirements are adequately defined & designs are fully documented. |  To handle tasks independently.,"""DotNet""|""EntityFramework""|""MVCFramework""|""DotNetDeveloper""|.NetDeveloper|Asp.netDeveloper|""SDLCProcess""|""OOPsConcepts""|Asp.Net|.NET|Mvc|C#|"
ASP.Net,Nucleus Software Exports Limited,Chennai,4-6years,Not Specified,"Nucleus Software’s is urgently looking for Candidates with ASP.Net skills, Exp – 4.5to 6, Loc – Chennai",Mvc|MVVM|jQuery|JavaScript|Asp.Net|
