jobTitles,Company,jobLocations,requiredExperiance,Salary,JobDescription,Skills
Online Form Filling,Aaryan Technology,Pune|MumbaiCity,0-5years,210000 - 350000 INR,Online Form Filling,OnlineDataEntry|DataEntryOperator|DataEntryOfficer|FormFilling|DataEntryExecutive|DEO|DataEntry|DatabaseAdministrator|BackOffice|DataBaseAdministrator|ComputerOperator|Dba|DatabaseAdmin|DataBaseAdministration|
Online Data Entry Operator,Smart Solution,Erode|Gwalior,0-5years,Not Specified,"online Data Entry Operator, Computer Operator hr rahul 9971517616",Labour|Packaging|Packers|Packages|jobsalloverindia|JournalEntry|DataProcessing|DataEntry|DataConversion|DataManipilation|Typing|Voice|BackOffice|DataManagement|
Online Marketing  jobs,Smart Solution,Agra|NaviMumbai,0-5years,Not Specified,"online jobs freelancer job , data entry jobs hr rahul 9971517616",Bpo|SelfEmployed|homebasedjobs|Cce|ComputerOperating|HRAdmin|Executive|12thpass|DataEntry|PartTime|Recruitment|Sales|homebasedworkhomebased|BackOffice|CustomerCare|Fresher|WorkFromHome|Operations|Data|computeroperator|
Online Sales excecutive,Smart Solution,MumbaiCity|Bikaner,0-5years,Not Specified,online salaes executive / work from home also available all over India hr twinkle 8866783070,Bpo|SelfEmployed|homebasedjobs|Cce|ComputerOperating|HRAdmin|Executive|12thpass|DataEntry|PartTime|Recruitment|Sales|homebasedworkhomebased|BackOffice|CustomerCare|Fresher|WorkFromHome|Operations|Data|computeroperator|
TYPING WORK / ONLINE FREELANCER WORK,Zarbex Solutions,Coimbatore|Visakhapatnam,0-5years,Not Specified,"we are providing work from home jobs to every individuals , basic typing skills  and laptop/computer is mandatory for this work. this platform is available for serious job seekers. No registration fees for joining.",WorkFromHome|TypingWork|ContentWriter|ContentDeveloper|ContentEditor|parttimejobs|fulltimejob|jobsinVisakhapatnam|jobsinCoimbatore.|
online typing work/ freelance jobs,Desnor Destination Pvt Ltd,Indore|Jabalpur,0-5years,Not Specified,"we are providing work from home jobs to every individuals , basic typing skills  and laptop/computer is mandatory for this work. this platform is available for serious job seekers. No registration fees for joining.",WorkFromHome|TypingWork|ContentWriter|ContentDeveloper|ContentEditor|parttimejobs|fulltimejob|jobsinkerla|jobsinhyderabad.|
Home Based Online Job - Data Entry - Work From Home - Online Job,India Travel Group,Madurai|Mysore,0-5years,150000 - 480000 INR,(On-the-spot offer letter.)Immediately Joining! |                      Concern Person Regarding That Mr. -HR Soniya |                      Contact No.- 8447612779,Freshers|FresherBPO|FresherTrainee|Hr|HomeBasedJobs|Housewives|HomeBasedWork|WorkFromHome|HomeBased|PartTime|12thPass|Fresher|Hsc|Undergraduate|SelfEmployed|CallCenter|BPOFresher|Bpo|Graduate|Custome|SoftwareDeveloper|ComputerOperator|
Online Promotion,Aaryan Technology,Noida,0-3years,10000 - 120000 INR,"Desnor Destination Pvt. Ltd, one of the fast growing company in Travel & Tourism industry is providing online income opportunity. We need committed & result-oriented people who can join hands with us & contribute in the promotion. Earn huge benefits",Bde|Cce|Customercareexecutive|Customercare|AdvertisingExecutive|Hr|Recruiter|HrRecruitment|HrExecutive|Recruitment|RecruitmentExecutive|
Digital Marketing / Online Marketing/ Online Advertisement,Aaryan Technology,Bengaluru/Bangalore|Hyderabad/Secunderabad,0-5years,340000 - 800000 INR,"An opportunity to earn huge income up to 45,000 every month. Easy Internet Job.",PartTimeJob|WorkFromHome|Freelance|HomeBased|OnlineMarketing|InternetMarketing|WebMarketing|DigitalMarketing|Businessdevelopment|SearchEngine|EmailMarketing|Marketing|Branding|SearchEngineOptimization|
ONLINE TYPING WORK / CONTENT WRITING,Star Tech,Coimbatore|Mangalore,0-5years,Not Specified,"we are providing work from home jobs to every individuals , basic typing skills  and laptop/computer is mandatory for this work. this platform is available for serious job seekers. without any registration fees.",WorkFromHome|TypingWork|ContentWriter|ContentDeveloper|ContentEditor|parttimejobs|fulltimejob|jobsinMysore|jobsinMadurai.|
