jobTitles,Company,jobLocations,requiredExperiance,Salary,JobDescription,Skills
Need Delivery Boy,Incube Placements,Chennai|Hyderabad/Secunderabad,0-1years,Not Specified,We are looking to hire a reliable Delivery Boy to deliver packages to customers. The Delivery Boy's responsibilities include verifying the identities of recipients before handing over packages,HighschooldiplomaorGED.Validdriver'slicense.Cleandrivingrecord.|
CAD Customization / C++ Developer for Teamcenter Application,Progneur Technologies Private Limited,Pune,2-5years,Not Specified,"Responsibilities: |  •	Design, build, and maintain efficient, reusable, and reliable C++ code |  •	Implement performance and quality modules |  •	Identify bottlenecks and bugs, and devise solutions to these problems |  •	Help maintain code quality, organization,",CADCustomization|Proe|CAD|Catia|C++|Solidworks|
"Logistics Manager reqd. for Canada, Australia",Shalitin Immigrations LLP,Australia|Canada,2-8years,5530000 - 7050000 INR,We are looking for a reliable Logistics Manager to be responsible for the overall supply chain management. Logistics Manager responsibilities include organizing and monitoring storage and distribution of goods.,SupplyChainManagement|WarehouseManager|SupplyPlanning|ProcurementManager|DemandForecasting|PurchaseManager|Purchase|Sourcing|MaterialsManager|ProcurementHead|TransportManager|LogisticsManager|
Full-stack Web Developer,Progneur Technologies Private Limited,Bengaluru/Bangalore|Pune,3-7years,Not Specified,"•	Design, build, and maintain efficient, reusable, and reliable C# or .NET code. |  •	Implement distributed applications with N-tier architecture. |  •	Identify bottlenecks and bugs, and devise solutions to these problems.",Angular8|Javascript|Html5|Css3|.NET|C#|
Process Associate IR Operation,Insigma Technologies Private Limited,Nagercoil,0-5years,Not Specified,Maxerience highly believes on Artificial Intelligence & Internet-of-Things based systems for the digital world. We are seeking for a reliable and organized person to join us as a Process associate.,ComputerKnowledge|GoodCommunication|
Senior Software Engineer - progress 4GL/ open edge ABL/ Progress ABL,Sunquest Information Systems (India) Private Limited,Kolkata,5-10years,Not Specified,"Senior Software Developer takes ownership and responsibility for working towards delivering reliable software, writing immaculate code and delivering projects on time and budget.","""seniorsoftwaredeveloper""|""progress4GL""|"
Lab Technician Required in Abroad,Cloud Visa Immigration LLP,Canada|Kuwait,2-7years,4500000 - 5000000 INR,Lab Technician who will be responsible for supporting our laboratory staff with the primary goal of optimizing lab procedures and succeeding in producing reliable test results. |,LabTechnician|LabAssistant|LaboratoryTechnician|Laboratory|LabChemist|LabIncharge|Mlt|Dmlt|
Application Engineer required for One Of the Leading IT Company in Chennai,Fortumax Career International Private Limited,Chennai,4-8years,1200000 - 1500000 INR,"The Application Engineer ensures that all in-house and 3rd party applications conform to our configuration and deployment standards so that every application can be deployed, monitored and managed in a consistent and reliable fashion.",ApplicationDeveloper|Deployment|UNIX|Linux|Shellscripting|Perl|Python|IbmMqSeries|Configuration|ApacheTomcat|
Java Developer,C P Careers Private Limited,Bengaluru/Bangalore|Chennai,8-15years,1800000 - 2500000 INR,"Responsibilities |   |  • Design, build, and maintain efficient, reusable, and reliable Java code. • Translate |  application storyboards and use cases into functional applications. |  • Ensure the best possible performance, quality, and responsiveness of the |  ap",object-orientedprogramming|variousdesign|architecturalpatterns|JavaGUI|Java|Mvc|JDBC|RESTful|Frameworks|Jvm|
Delivery Field Boys,Kisaanputr Infotech Private Limited,Jaipur,1-5years,Not Specified,"We are looking to hire a reliable Delivery Boy to deliver packages to customers. The Delivery Boy's responsibilities include verifying the identities of recipients before handing over packages, updating the status.",DeliveryBoy|DeliveryFieldBoys|
IOT- Team Lead - Technical Support Executive,Insigma Technologies Private Limited,Nagercoil,2-7years,Not Specified,Maxerience highly believes on Artificial Intelligence & Internet-of-Things based systems for the digital world. |  We are seeking for a reliable and organized person to join us as a Support Function Executive.,TeamHandling|GoodCommunication|WorkExperienceinITIndustry|Excel|Sql|
Android Developer | Payment Gateway Project Experience,Disha Recruitment Services,Bengaluru/Bangalore,2-3years,300000 - 400000 INR,"MUST have done Payment Gateway project |  Translate designs and wireframes into high quality code |  Design, build, and maintain high performance, reusable and reliable Java code |  Strong knowledge of Android SDK, different versions of Android",AndroidUIdesignprinciples|AndroidDevelopment|AndroidApplicationDevelopment|Java|AndroidSDK|RestfulApis|DesignPatterns|Multithreading|
Software Engineer (Golang) - II,Continuum Managed Solutions LLP,Bhopal|Goa,2-12years,Not Specified,"Looking for strong candidates who will help develop the platform as a reliable, scalable, modern architecture that supports long term growth and reduces operational and support costs.",SeniorSoftwareEngineer|Java|Golang|RESTful|Scrum|Agile|
Software Engineer (Golang) - II,Continuum Managed Solutions LLP,Bhopal|Goa,2-6years,Not Specified,"looking for strong candidates who will help develop the platform as a reliable, scalable, modern architecture that supports long term growth and reduces operational and support costs.",SeniorSoftwareEngineer|Java|Golang|RESTful|Scrum|Agile|
Software Engineer (Golang) - II,Continuum Managed Solutions LLP,Bhopal|Goa,2-12years,Not Specified,"Looking for strong candidates who will help develop the platform as a reliable, scalable, modern architecture that supports long term growth and reduces operational and support costs.",SeniorSoftwareEngineer|Java|Golang|RESTful|Scrum|Agile|
Senior Software Engineer- I & II,Continuum Managed Solutions LLP,Bhopal|Goa,5-8years,Not Specified,"looking for strong candidates who will help develop the Platform as a reliable, scalable, modern architecture that supports long term growth and reduces operational and support costs.",SeniorSoftwareEngineer|Java|Golang|RESTful|MicroServices|AWS|Docker|Kubernetes|Iam|Scrum|Agile|
Finance Manager Hiring For CANADA,Shalitin Immigrations LLP,Canada,2-5years,2600000 - 4200000 INR,We are looking for a reliable Financial Manager that will analyze every day financial activities and subsequently provide advice and guidance to upper management on future financial plans.,FinanceManager|FinanceExecutive|FinancialController|AccountsManager|FinancialAnalyst|BusinessAnalyst|FinancialPlanning|ForecastingMIS|
Project Panel- Team Lead - Technical Support Executive,Insigma Technologies Private Limited,Nagercoil,2-7years,Not Specified,Maxerience highly believes on Artificial Intelligence & Internet-of-Things based systems for the digital world. |  We are seeking for a reliable and organized person to join us as a Support Function Executive. We are a group of driven and hard-working,GoodCommunication|TeamHandling|ITIndustryWorkingExperience|Excel|Sql|
Support Function MIS Executive,Insigma Technologies Private Limited,Nagercoil,1-7years,Not Specified,Maxerience highly believes on Artificial Intelligence & Internet-of-Things based systems for the digital world. |  We are seeking for a reliable and organized person to join us as a Support Function Executive. We are a group of driven and hard-working,Mis|ITIndustryWorkingExperience|GoodCommunication|Excel|Sql|
AR- Team Lead - Technical Support Executive,Insigma Technologies Private Limited,Nagercoil,2-7years,Not Specified,Maxerience highly believes on Artificial Intelligence & Internet-of-Things based systems for the digital world. |  We are seeking for a reliable and organized person to join us as a Support Function Executive. We are a group of driven and hard-working i,TeamLead|GoodCommunication|ITIndustryExperience|Excel|Sql|
AR- Sr. Technical Support Executive,Insigma Technologies Private Limited,Nagercoil,1-7years,Not Specified,Maxerience highly believes on Artificial Intelligence & Internet-of-Things based systems for the digital world. |  We are seeking for a reliable and organized person to join us as a Support Function Executive. We are a group of driven and hard-working i,GoodCommunication|ExperienceinITIndustry|Excel|Sql|
Project Panel - Sr. Technical Support Executive,Insigma Technologies Private Limited,Nagercoil,1-7years,Not Specified,Maxerience highly believes on Artificial Intelligence & Internet-of-Things based systems for the digital world. |  We are seeking for a reliable and organized person to join us as a Support Function Executive. We are a group of driven and hard-working i,GoodCommunication|ITIndustryExperience|Excel|Sql|
Shift Manager,Freelancer - Purushottam Munjajirao Dhutraj,Ahmedabad|Kolkata,1-11years,1970000 - 3729999 INR,"A shift manager’s duties will vary from restaurant to restaurant depending on its location, size, hours, and cost, but some central tasks are almost always part of the job.",ShiftManager|SiteManager|ShiftSupervisor|ShiftLead|ShiftIncharge|AssistantManager|FloorManager|RestaurantManager|
Network infrastructure - system Admin,Encora Innovation Labs India Private Limited,Bengaluru/Bangalore,4-9years,Not Specified,"Network and System Administrator with skills to build and run large scale, distributed, reliable and resilient 24/7 core network infrastructure services",NetworkInfrastructure|Networking|Tcp|IpRouting|
