jobTitles,Company,jobLocations,requiredExperiance,Salary,JobDescription,Skills
"Facility Manager Required In Canada , Australia",Cloud Visa Immigration LLP,Australia|Canada,3-5years,4010000 - 5520000 INR,"overseeing and agreeing contracts and providers for services including security, parking, cleaning, catering. |  supervising multi-disciplinary teams of staff including cleaning, maintenance and security. |  managing budgets and ensuring cost-effectivenes.",FacilityManagement|ManagedServices|FacilityServices|Facilities|Housekeeping|FMS|Amc|AdminIncharge|Administration|
Restaurant Manager Required In Dubai,Cloud Visa Immigration LLP,Gulf,4-9years,4000000 - 5000000 INR,Call & Whats App to Ms.Pooja-9311529770 |   We are looking for a Restaurant Manager to lead all aspects of our business. You will deliver a high-quality menu and motivate our staff to provide excellent customer service.,RestaurantManagerAssistantRestaurantManager|CafeManager|ShiftManager|Hotel|HotelManager|OutletManager|
"Restaurant General Manager To Be Based in Canada, Australia",Esther Jeevitha (Proprietor of Morgan Techno India),Australia|Canada,2-7years,4550000 - 5050000 INR,|  Call & what's to Pooja-9311529770 |  Restaurant Manager to lead all aspects of our business. You will deliver a high-quality menu and motivate our staff to provide excellent customer service.,AssistantRestaurantManager|CafeManager|ShiftManager|HotelManager|RestaurantManager|OutletManager|
Hotel Manager,Travel Food Services Pvt. Ltd,Chennai,1-6years,250000 - 450000 INR,Requirement for the post of Hotel Manager.,HotelManager|HotelManagement|Restaurant|Resort|Bhm|Hospitality|RestaurantManager|
Restaurant Manager,Travel Food Services Pvt. Ltd,Bengaluru/Bangalore,8-15years,450000 - 550000 INR,Candidate with 8+years experience in Restaurant domain (preferred Indian/Multi-Cuisine Exposure),InterpersonalCommunicationSkills|
Restaurant Manager,Flight To Sucess Immigration Services Llp,Chennai,4-6years,300000 - 500000 INR,Required Restaurant Manager for Chennai Outlet,AssistantRestaurantManager|Hotel|HotelManager|ShiftManager|TeamHandling|F&bManagement|RestaurantManager|OutletManager|
Restaurant Manager  settle in Germany or Hongkong no ielts  9643599936,Adal Immigrations LLP,Germany|HongKong,0-5years,Not Specified,"Restaurant Manager are responsible for leading and managing restaurants. They may be responsible for different tasks such as restaurant marketing strategies, recruiting and hiring restaurant staff, training, overseeing food quality, developing menus",AssistantRestaurantManager|CafeManager|ShiftManager|Hotel|HotelManager|RestaurantManager|OutletManager|
Restaurant Manager Required Under Work Permit Visa,A V Immigration And Careers Consultancy Private Limited,Australia|Canada,2-7years,1500000 - 5000000 INR,"Will have the overall responsibility for directing the daily operations of a restaurant in the absence of Restaurant General Manager's, ensuring compliance with company standards in all areas of operation, including product preparation and delivery.",FoodQuality|CustomerService|HotelManagement|Hospitality|Bhm|Restaurant|Resort|RestaurantManager|
Restaurant Manager - Australia,A V Immigration And Careers Consultancy Private Limited,Australia,9-14years,1700000 - 3200000 INR,"CAFE AND RESTAURANT MANAGERS organise and control the operations of cafes, restaurants and related establishments to provide dining and catering services.",RestaurantManagement|Reservations|greetguests|RestaurantManager|
Restaurant Manager - Australia,Flight To Sucess Immigration Services Llp,Australia,3-8years,1700000 - 3200000 INR,"CAFE AND RESTAURANT MANAGERS organise and control the operations of cafes, restaurants and related establishments to provide dining and catering services.",RestaurantManagement|Reservations|greetguests|RestaurantManager|
Restaurant Manager Settle in Canada /Europe/Hongkong,Shalitin Immigrations LLP,Canada|Germany,2-8years,4000000 - 6600000 INR,"Restaurant Manager are responsible for leading and managing restaurants. They may be responsible for different tasks such as restaurant marketing strategies, recruiting and hiring restaurant staff, training, overseeing food quality, developing menus",ManpowerHandling|ShiftManagement|BaristaFood|Safety|FoodPreparation|Audit&ordersupplyConflictManagementCustomerSupportManager|DailyProductionPlanning|RestaurantManager|OutletManager|
"Restaurant & Hotel Manager reqd. in Canada, Australia",Proximity Immigration Private Limited,Australia|Canada,2-8years,4000000 - 6500000 INR,"Restaurant Manager responsibilities include maintaining the restaurant’s revenue, profitability and quality goals. You will ensure efficient restaurant operation, as well as maintain high production, productivity, quality, customer-service standards.",ManpowerHandling|ShiftManagement|Barista|FoodSafety|FoodPreparation|Audit&ordersupply|ConflictManagement|CustomerSupportManager|DailyProductionPlanning|HotelManagement|HospitalityManager|RestaurantManager|OutletManager|
Restaurant Manager can Work In Cyprus / Austria,Travel Food Services Pvt. Ltd,Australia|Canada,1-6years,680000 - 810000 INR,Minimum 1+ years of relevant experience  - MUST |   Must have good knowledge of English  - MUST |   Age: Must be below 40.,Bhm|HospitalityManagement|HotelManagement|HotelBookings|HotelManagement|HotelAccounting|RestaurantCashiers|RestaurantIncharge|RestaurantGeneralManager|RestaurantManager|RestaurantManager|RestaurantSupervisor|
Restaurant Manager / Assistant Restaurant Manager,Adal Immigrations LLP,Mumbai,5-13years,380000 - 730000 INR,We have multiple Openings for Restaurant Manager / Assistant Restaurant Manager across Mumbai,Hospitality|Hotels|Restaurant|AssistantRestaurantManager|F&BService|TeamHandling|GuestService|finedinningrestaurant|
Restaurant General Manager/PR Visa/Canada/Australia/Hongkong,Adal Immigrations LLP,Australia|Canada,2-7years,2500000 - 5500000 INR,"WE CURRENTLY HAVE OPENING FOR RESTAURANT GENERAL MANAGER,achieve restaurant customer experience objectives by excelling at building and maintaining customer experience. Must be clear on Moment of Truth concepts and must be able to inspire and enable",ServiceManager|TrainingManager|CafeManagerHotelManager|ShiftManager|AssistantRestaurantManager|RestaurantManager|
Hotel Manager PR Visa/Canada/Australia/Hongkong,A V Immigration And Careers Consultancy Private Limited,Australia|Canada,2-7years,2000000 - 5000000 INR,The manager should know how to do marketing and promotion of hotel room and restaurant;. |   |  Know how to keep the hotel always in clean and hygiene condition.,CafeManager|ShiftManager|HotelManager|Hotel|AssistantRestaurantManager|RestaurantManager|OutletManager|
Restaurant Manager - Australia,A V Immigration And Careers Consultancy Private Limited,Australia,9-14years,1700000 - 3200000 INR,"CAFE AND RESTAURANT MANAGERS organise and control the operations of cafes, restaurants and related establishments to provide dining and catering services.",RestaurantManagement|Reservations|greetguests|RestaurantManager|
Restaurant Manager - Australia,Subrata Mondal (Proprietor Of Cafe Industry),Australia,3-8years,1700000 - 3200000 INR,"CAFE AND RESTAURANT MANAGERS organise and control the operations of cafes, restaurants and related establishments to provide dining and catering services.",RestaurantManagement|Reservations|greetguests|RestaurantManager|
Hotel Manager,Vinfinity Immigration LLP,Bhopal,1-5years,250000 - 450000 INR,Urgent hiring for Hotel Manager,HotelManager|
Food & Beverage Manager /Restaurant Manager Required in Canada / Singapore,I2canz Outsourcing Private Limited,Canada|Singapore,2-10years,3050000 - 6030000 INR,"Call/Whatsapp-8527524099(Ms.Chahat) |      Restaurant and food service managers plan, organize, direct, control and evaluate the operations of restaurants, bars, cafeterias and other food and beverage services. They are employed in food & beverage service",BeverageManager|ChefManagement|FoodManager|RestaurantManagement|Restaurant|BeverageManagement|FastfoodManagement|FoodandBeverageManager|HotelManagement|Bhm|Hospitality|Mall|Resort|Steward|RestaurantManager|
Food & Beverage Manager /Restaurant Manager Required  in Canada / Australia,Cloud Visa Immigration LLP,Australia|Canada,2-10years,4550000 - 5010000 INR,"Restaurant and food service managers plan, organize, direct, control and evaluate the operations of restaurants, bars, cafeterias and other food and beverage services. They are employed in food and beverage service establishments",BeverageManager|chefmanagenent|foodmanager|RestaurantManagement|Restaurant|beveragemanagement|fastfoodmanagement|Food&BeverageManager|HotelManagement|Bhm|Hospitality|Mall|Resort|Steward|RestaurantManager|
"Restaurant Manager ,Hiring for Abroad",Freelancer - Purushottam Munjajirao Dhutraj,Australia|Canada,2-7years,2000000 - 5000000 INR,"The Restaurant General Manager has the overall responsibility for directing the daily operations of a restaurant, ensuring compliance with company standards in all areas of operation, including product preparation and delivery, customer relations.",AssistantRestaurantManager|CafeManager|HotelManager|Hotel|ShiftManager|RestaurantManager|OutletManager|
Restaurant Manager,A V Immigration And Careers Consultancy Private Limited,Delhi|Mumbai,3-13years,1540000 - 3160000 INR,"This Restaurant Manager job description template will help you save time, optimize your job ads for SEO and attract qualified candidates.",AssistantRestaurantManager|HotelManager|ShiftManager|CafeManager|RestaurantandBanquets|RestaurantManager|OutletManager|
Restaurant Manager - Australia,Shaikh Azharuddin Mheboob (Proprietor of Staff India Consultancy),Australia,3-8years,1700000 - 3200000 INR,"CAFE AND RESTAURANT MANAGERS organise and control the operations of cafes, restaurants and related establishments to provide dining and catering services.",RestaurantManagement|Reservations|greetguests|RestaurantManager|
