jobTitles,Company,jobLocations,requiredExperiance,Salary,JobDescription,Skills
DevOps Engineer - Ahmedabad,RM Job Junction,Ahmedabad,3-8years,Not Specified,"Our client is looking for a DevOps Engineer, who will be working with cross-functional teams to define, design, |   and deliver DevOps infrastructure and adopt best practices of IAC to guarantee a robust and stable CI/CD |   process to increase efficiency.",Devops|DevopsEngineer|AWS|
BI Developer,RM Job Junction,Ahmedabad,3-8years,Not Specified,"Looking for smart and passionate BI Developer, who will build and maintain a data warehousing |  design to generate reports on financial and market intelligence to aid in business performance monitoring |  and business decision making.",BiDeveloper|
Test Automation Engineer and Test Automation Lead/QA lead,RM Job Junction,Ahmedabad,2-10years,Not Specified,Our client is looking for Test Automation Engineer and Test Automation Lead/QA lead for their company based in Ahmedabad,LeadtesterQATesting|AutomationTestEngineer|Qa|AutomationTesting|SoftwareTesting|
HTML Developer - Remote permanent (night shift),RM Job Junction,Remote,2-8years,Not Specified,Looking for HTML developer. It will be a permanent remote position,HTMLDeveloper|remoteopening|html|
Scrum Master - Ahmedabad,RM Job Junction,Ahmedabad,4-8years,Not Specified,Our client is looking for Scrum Master for Ahmedabad location.,#scrum#scrummaster|
ETL Developer - Ahmedabad location,RM Job Junction,Ahmedabad,3-6years,Not Specified,Our client is looking for ETL developer for Ahmedabad location,ETLDeveloper|Etl|
Software Engineer – React.js Tech Lead -ReactJs and React Native,RM Job Junction,Ahmedabad,2-10years,Not Specified,"Our client is looking for ReactJS developer as well as Teach lead, ReactJS",react.js|TechLead|TechnicalLead|ReactNative|
Senior US IT Recruiter,Rm Technotree,Hyderabad/Secunderabad|OtherIndia,5-8years,Not Specified,Senior US IT Recruiter,recruiter|h1b|ead|c2c|1099|W2|greencard|citizen|Corp-Corp|UsItRecruiter|
Technical Project Manager (node/react/angular) Ahmedabad location,RM Job Junction,Remote,8-13years,Not Specified,"We are seeking a Technical Manager for our client, who will be leading a young team of software engineers designing and developing complex solutions.",Node.js|NodeJS|Nodejs|ProjectManager|
Sr. React JS and Sr. Node JS developers,RM Job Junction,Remote,2-10years,Not Specified,Our client is looking for Sr. ReactJs and NodeJs developers,remotework|react.js|Node.js|NodeJS|Nodejs|
"Senior Wordpress Developer (remote, full time)",RM Job Junction,Ahmedabad|Remote,4-10years,Not Specified,"Our esteemed client is looking for Sr. Wordpress developer for their company located at Ahmedabad, however this will be permanent remote position.",Wordpress|Woocommerce|
Senior Devops Architect,RM Job Junction,Ahmedabad,8-14years,Not Specified,Sr. Devops architect required for our client based at Ahmedabad,Devops|AWS|
Core PHP/LAMP developers (Laravel OR yii OR Codeigniter OR Symfony) (Experienced and Freshers),RM Job Junction,Ahmedabad,0-10years,Not Specified,Our client is looking for Core PHP developers (remote/WFH) Ahmedabad based company Experienced as well as Freshers,FresherPHP|Phpdeveloper|Php|Laravel|PhpProgrammer|CorePhp|Lamp|Drupal|
"Fullstack Engineer (Node & React) (WFH permanent, for a company based in Ahmedabad)",RM Job Junction,Ahmedabad,7-16years,Not Specified,Our client is looking for Full Stack Engineer (Node and React),fullstackdeveloper|ReactJs|NodeJs|
EEG Technician (female) for Saudi Arabia,White Horse Manpower Consultancy Private Limited.,SaudiArabia,2-5years,Not Specified,EEG Technician (female) Minimum Requirements:Must be Bachelor degree in nursing with 3 years experience of handling EEG machines also,EEGTechnician|EEGmachines|Nursing|HealthCare|
RM/GM Sales - {IMS Products and services },Aayam Consultants,Gurgaon/Gurugram,18-22years,3000000 - 4000000 INR,to take care of Sales for Government and PSU vertical,GovernmentSales|ITSalesManager|GMSales|ManagedServices|Ims|Datacenter|InfrastructureServices|ItInfrastructure|CloudSales|ItInfrastructureServices|
Relationship Manager (RM) - HDFC (Tele Channel) - Bangalore call me urgent 9619022384,first india hr solution,Bengaluru/Bangalore,1-2years,Not Specified,Relationship Manager (RM) - HDFC (Tele Channel) - Bangalore call me urgent 9619022384,TelesalesExecutive|Telemarketing|Undergrduate|Freshers|CustomerCareExecutives|Telecall|Outbound|Bpo|
RelationShip Manager - CASA : Leading Bank : Mumbai,Qc Acumen Private Limited,Mumbai|MumbaiCity|NaviMumbai,2-10years,500000 - 1200000 INR,Hi |   |  There is an urgent opening in a leading Bank |,"""CASA""|""CurrentAccount""|""SavingAccount""|""RelationshipManager""|""RM""|""wealth""|""mutualfund""|""portfoliomanagement""|""WealthManagement""|""HNIacquisition""|""HNISales""|""RM""|"
Hiring for Sales Profile in Goa/Panjim with Lead Support,Skycruze Services,Goa|Panjim/Panaji,1-6years,200000 - 350000 INR,Looking for Sales Executives and Sales Manager |    End to End Sales profile |    Leads support |    Job location Goa/Panjim |    No door to door sales |    Corporate Sales  |     |    For more details share resume on [HIDDEN TEXT] or Apply |     |,Sales|Marketing|bfsisales|Banking|Bank|B2C|B2b|businessdevelopment|Lic|lifeinsurance|financialproduct|AgencyManager|Advisors|BankingSales|FieldSales|relationshipmanager|Rm|BD|DirectSales|corporatesales|salesexecutive|SalesManager|Srm|
Hiring for Sales in Top Banks in Kolhapur with Lead Support,Skycruze Services,Kolhapur,1-6years,200000 - 350000 INR,Looking for Sales Executives and Sales Manager |   End to End Sales profile |   Leads support |   Job location all over Kolhapur |   No door to door sales |   Corporate Sales  |    |   For more details share resume on [HIDDEN TEXT] or Apply |    |,Sales|Marketing|bfsisales|Banking|Bank|B2C|B2b|businessdevelopment|Lic|lifeinsurance|financialproduct|AgencyManager|Advisors|BankingSales|FieldSales|relationshipmanager|Rm|BD|DirectSales|corporatesales|salesexecutive|SalesManager|Srm|
Hiring for Sales in Top Banks in Mumbai/Navi Mumbai and Goa/Panjim with Lead Support,Skycruze Services,Mumbai|Goa|MumbaiCity|NaviMumbai,1-6years,200000 - 350000 INR,Looking for Sales Executives and Sales Manager |  End to End Sales profile |  Leads support |  Job location all over Mumbai branches and Goa/Panjim |  No door to door sales |  Corporate Sales  |   |  For more details share resume on [HIDDEN TEXT] or Apply |   |,Sales|Marketing|bfsisales|Banking|Bank|B2C|B2b|businessdevelopment|Lic|lifeinsurance|financialproduct|AgencyManager|Advisors|BankingSales|FieldSales|relationshipmanager|Rm|BD|DirectSales|corporatesales|salesexecutive|SalesManager|Srm|
Relationship Officer (RO) / Senior Relationship Officer (SRO) / Relationship Manager (RM),AasaanJobs Private Limited,Bengaluru/Bangalore,0-2years,Not Specified,Candidate should be experienced from Loan Against Property 1. Prospecting new customers in line with BIZLOAN’s lending policies through direct calls and sourcing channels |,RelationshipManager|Sales|BD|BusinessDevelopment|ClientServicing|ClientAcquisition|LoanAgainstProperty|
