jobTitles,Company,jobLocations,requiredExperiance,Salary,JobDescription,Skills
"We are Looking passionate candidate for ""Java""",Spring Computing Technologies Private Limited,Pune,3-7years,Not Specified,"We are looking for candidates for 'Java', who can join Immediately or Max for 15 days. Exp Range : 3 to 7 Years |  The work location will be Kothrud, Pune once normal office operations resume.",Javadeveloper|restlet|Java|Struts|J2EE|Jsp|Spring|Hibernate|Jsf|Ejb|Servlets|SpringSecurity|SpringBoot|RESTful|WebServices|Soap|
Immediate Job opportunity for Senior Java Developer,InfoPro Solutions Pvt Ltd,Bengaluru/Bangalore,4-8years,Not Specified,5+ years of software development experience   |  Proficiency in Java  |  Experience building and scaling RESTful APIs and event driven platforms. |  Experience Spring Platform (E.g. Spring Boot | Spring| Spring Rest and Spring technologies). |,Java|RESTful|Spring|SpringBoot|
Software Developer,Socialangles Digital Solutions Private Limited,Pune,2-4years,250000 - 350000 INR,"BS degree in Computer Science, Engineering or a related subject |  Proven hands-on Software Development experience |  Proven working experience in Java development |  Hands on experience in designing and developing applications using Java EE platforms |  Object.",CoreJava|Spring|SpringBoot|SpringMvc|AWS|Mysql|Git|Github|Jpa|
Java Spring boot Developer,IPS Vantage Tech Services Private Limited,Mumbai,4-6years,Not Specified,urgent hiring for Java Spring boot Developer,JavaSpring|SpringBoot|Hibernate|Jsp|Java|
Java Spring boot Developer,IPS Vantage Tech Services Private Limited,MumbaiCity,4-8years,Not Specified,We are hiring for Java Spring Boot Developer in Mumbai location with 4+ Yrs of experience.,Java|CoreJava|SpringBoot|Spring|
Java with Spring,Parna Hr Consultants,Mumbai,3-6years,400000 - 600000 INR,Java with Spring,Java|Spring|
Opening for Java Professional @LTI_Mumbai/Chennai,Larsen & Toubro Infotech Limited,Chennai|Mumbai|MumbaiCity|NaviMumbai|Thane,5-10years,Not Specified,"PFB the JD :  |  • Strong Experience in Java8  |  • Rich Expertise in Java frameworks like Spring MVC, Springboot, Hibernate, RestAPI and Microservices  |  • Exposure to CI & CD tools  |  • Experience in working with global teams in Agile/Scrum methodology  |",Java|Spring|SpringBoot|WebServices|REST|Soap|Microservices|
Java + Springboot,Larsen & Toubro Infotech Limited,Mumbai,3-7years,Not Specified,3+ years of overall IT experience |  1+ years of experience with Springboot |,Java|SpringBoot|
Weekend Drive Event for Java - Spring Boot Professionals with L&T Infotech on 8th May 2021,HTC Global Services (India) Private Limited,Chennai|Pune,3-10years,Not Specified,"Interview Mode - Webex (Will share meeting request, once profile is shortlisted) |   |  Experience - 3+ Years |   |  Job Location - Chennai, Pune, Bangalore & Hyderabad |",Java|SpringBoot|
Excellent opening for Java Fullstack Professionals - Chennai,Career Foresight Hr Solutions Llp,Chennai,3-10years,Not Specified,HTC Global Services is hiring Java Full Stack Professionals with Angular / React experience for Chennai Location,Spring|Springboot|Angular|
Java Developer,Luminate It Solutions Private Limited,Cochin/Kochi/Ernakulam,2-7years,400000 - 900000 INR,Proficient in Java |  REST frameworks with focus on API development with Spring Boot |  Expertise in Java and related technologies |  Ability to prepare technical design and architecture |  Good Knowledge of Spring framework,Java|Spring|Hibernate|
Senior Java Developer,Quess IT Staffing (Formerly known as Magna Infotech),Bengaluru/Bangalore|Hyderabad/Secunderabad,5-15years,1500000 - 2500000 INR,"Skills: Java, spring boot, spring cloud, micro services |  Banking / Financial domain refereed |   |  Duration: Long Term Contract ( Work from Home option is available) |   |  Notice period: Immediate to 2 Weeks  |",microservices.|Java|SpringBoot|SpringCloud|
Java Developer,Apptad Technologies Private Limited,NaviMumbai,2-6years,Not Specified,"Strong programming expertise in Core Java, Multi-threading and SQL Server |  Experience in implementing solutions that handle high availability and concurrency with low latency requirements. |  Should have excellent debugging skills |  Undertake performance.",Java|Spring|Hibernate|Sql|
Java Developer Core Java,Team Ace HR LLP,Mumbai,8-10years,Not Specified,Urgently hiring for java developer with immediate joiners,SpringAop|SpringJdbc|SpringMVC|SpringRest|SpringFramework|OraclePlSql|
Job Opening for Java Springboot Professionals,C P Careers Private Limited,Pune|MumbaiCity,5-12years,Not Specified,Hiring for Java Springboot Professionals,JavaSpring|
Sr. Java developers,PARC Kalite Consultant,Chennai|Noida,6-10years,800000 - 1600000 INR,Sr. Java developers |   |  Skills: |  Core Java |  Spring |  Hibernate |  OOPS |  Collection |  Multithreading |  Database |   |  Exp: 6-10 Yrs |  Salary Range: maximum 16 Lac,Collection|Core|Java|Spring|Hibernate|Oops|Multithreading|Database|
Fullstack Developer at Mumbai & Hyderabad,LogicalHiring,Hyderabad/Secunderabad|Mumbai|MumbaiCity|NaviMumbai|Thane,2-12years,500000 - 1600000 INR,Designation : Fullstack Developer / Lead |   |  Location : Mumbai / Hyderabad  |   |  Experience : 3 to 9 years  |   |  Salary : depends on experience,"""angular6""|""angular8""|""springboot""|""springboot""|Java|"
Java Developer / Lead,Team Ace HR LLP,Noida,1-8years,Not Specified,"Opening in Noida for Java Developer, Sr. Developer & Lead role",Java|SpringBoot|Drools|
Job Opening for Java Springboot Professionals,Saksoft Limited,Chennai,5-12years,Not Specified,Hiring for Java Springboot Professionals,JavaSpring|
"Hiring for Java Developer"" - Pune (Immediate Joiner)",Mount Graph Technologies Private Limited,Pune,3-13years,Not Specified,"|  Greeting form Saksoft Limited. |   |   |  Hiring for Java Developer - Pune |  Exp : 3+ Years  |  NP : Immediate joiner or 15-20 days Max |   |  Skill set : Java7/Java 8, Spring boot, Web services  |   |  If interested please share your updated resume at [HIDDEN TEXT]","""Java""|""java8""|""Spring""|""Springboot""|""Webservices""|""Java""|"
Java Developer,PayGate India Private Limited,Chennai,4-8years,Not Specified,"Java, Microservices , Spring boot , Microservices",Java|SpringBoot|MicroServices|
Java Developer Fresher,Sun Technology Integrators Private Limited,Thane,0-2years,Not Specified,"Java, J2EE, Spring MVC, Spring Boot, Hibernate, MySql/ Oracle, Angular JS, Jquery,  |  Javascript, HTML .",MySql/Oracle|HTML.|Java|J2EE|SpringMVC|SpringBoot|Hibernate|AngularJs|Jquery|Javascript|
Senior Java Developer,PayGate India Private Limited,Bengaluru/Bangalore,5-13years,500000 - 1300000 INR,"Mandatory Skills:  Java, J2EE, Spring, Spring Boot, Hibernate |   |  Desired Skills:	React, Vue , HTML5, JavaScript, jQuery, CSS, Jboss, Bootstrap, Micro Services, Design Patterns, Spring boot, JPA, ORM, Lead role, Client interaction |",Java|Hibernate|Spring|SpringBoot|
Java Developer,Stryde Consulting Services,Thane,2-7years,Not Specified,"Technical Skills: Java, J2EE, Spring MVC, Spring Boot, Hibernate, MySql/ Oracle, Angular JS, Jquery,  |  Javascript, HTML .",MySql/Oracle|HTML.|Java|J2EE|SpringMVC|SpringBoot|Hibernate|AngularJs|Jquery|Javascript|
