jobTitles,Company,jobLocations,requiredExperiance,Salary,JobDescription,Skills
Senior Engineer / AWS / Amazon Web services / Microservices,Freelancer Deepika D Bidri,Pune,3-10years,Not Specified,"Mid Senior Engineer - Java, Microservices, AWS |",Java|Spring|REST|Microservices|AWS|AmazonWebService|
We are looking for Java Developer,Quess IT Staffing (Formerly known as Magna Infotech),Bengaluru/Bangalore,5-10years,Not Specified,"Mandatory skills - Java,Spring boot and micro services,Web services |",Java|SpringBoot|MicroServices|WebServices|
Salesforce Developer,Aroha Technologies,Bengaluru/Bangalore,6-14years,Not Specified,"Hi Everyone, |   |  Greetings from aroha technologies!!! |   |  Hope your all doing good.. |   |  We are currently hiring for Salesforce developer for Bangalore location. interested can contact or watsapp your resume to 8197245097. |   |",Salesforce|SalesforceCommercecloud|Salesforce.com|SFDC|Visualforce|Apex|WebServices|Javascript|
Node JS Developer / Sr. Node JS Developer,Hi Tides Consulting,Ahmedabad,2-7years,240000 - 1080000 INR,Looking for candidate with experience in NodeJS and Web Development,restlet|Javascript|CSS|HTML|Jscript|WebDevelopment|MongoDB|RESTful|WebServices|
Opening for Java Professional @LTI_Mumbai/Chennai,Larsen & Toubro Infotech Limited,Chennai|Mumbai|MumbaiCity|NaviMumbai|Thane,5-10years,Not Specified,"PFB the JD :  |  • Strong Experience in Java8  |  • Rich Expertise in Java frameworks like Spring MVC, Springboot, Hibernate, RestAPI and Microservices  |  • Exposure to CI & CD tools  |  • Experience in working with global teams in Agile/Scrum methodology  |",Java|Spring|SpringBoot|WebServices|REST|Soap|Microservices|
Java Full Stack Developer & Lead (Multiple Positions),Best infosystems Ltd,Chennai|Hyderabad/Secunderabad,2-12years,Not Specified,"We have a Multiple reqts for Java Full Stack Developers (Remote working) at Bangalore, Mysore, Chennai & Hyderabad. |   |  No. of resources reqd: Hyderabad : 25 | Chennai : 18 | Mysore : 15 | Bangalore : 4","""WebServices""|""Microservices""|""WebServices""|""Microservices""|""Springboot""|Java|SpringBoot|Hibernate|Springs|RESTful|"
Scala Developer (A/SA),Quess IT Staffing (Formerly known as Magna Infotech),Bengaluru/Bangalore,4-11years,Not Specified,Looking for Scala Developer (A/SA),Xml|WebServices|Api|Cassandra|Hbase|Nosql|
Java Developer,Saksoft Limited,Hyderabad/Secunderabad,4-10years,Not Specified,We are looking for Java Developer,Java|SpringBoot|WebServices|Angular|react.js|
"Hiring for Java Developer"" - Pune (Immediate Joiner)",Best infosystems Ltd,Pune,3-13years,Not Specified,"|  Greeting form Saksoft Limited. |   |   |  Hiring for Java Developer - Pune |  Exp : 3+ Years  |  NP : Immediate joiner or 15-20 days Max |   |  Skill set : Java7/Java 8, Spring boot, Web services  |   |  If interested please share your updated resume at [HIDDEN TEXT]","""Java""|""java8""|""Spring""|""Springboot""|""Webservices""|""Java""|"
Senior Software Engineer-Java,Jarus Technologies India Private Limited,Bengaluru/Bangalore,2-8years,300000 - 1000000 INR,"Should have strong and hands on knowledge of Java application development, Spring MVC, Spring Boot, Hibernate, Webservices, Gitlab and working in Agile. |",Java|SpringBoot|Hibernate|WebServices|
Sr.Software Engineer - Java,Navyah Immigration Services Private Limited,Hyderabad/Secunderabad,4-8years,Not Specified,"Technical Skills :  Strong in J2EE Development SDLC process, Java 7, Java script, AJAX, Hibernate, Spring 2.5,JSF 1.2,Web services, JBoss  6.x or above, Oracle 11 or 12 or above and SQL",Javadeveloper|Java|CoreJava|Spring|Hibernate|J2EE|Jboss|Javascript|AJAX|WebServices|
Web Designers and Developers for USA / Canada,Teejay Global Infotech Services LLP,Australia|Canada,2-5years,3540000 - 4550000 INR,"Web designers and developers in Canada research, design, develop and produce Internet sites...",WebProgrammer|WebDesigner|WebDevelopment|WebServices|
Full Stack Developer,Adept Recruiting,Bengaluru/Bangalore|Gurgaon/Gurugram,4-8years,Not Specified,Position: Full Stack Developer |  Duration:6 Months |  Location :Remote |,HTML|CSS|Javascript|Xml|Node.js|WebServices|Soap|ASP.NET|Jms|RESTful|
Project Manager,Best infosystems Ltd,Mumbai,5-10years,1000000 - 2000000 INR,Hiirng Project Manager for leading General Insurance Company.,ProjectManagement|ProjectExecution|ProjectPlanning|ProjectImplementation|ProjectScheduling|CoreInsuranceSystems|Portals|WebServices|Middleware|SQLServer|WebServices|Java|.NET|Mvc|
"Senior Software Engineer - Java, Spring boot, Hibernate, Web services",Applicantz Inc,Bengaluru/Bangalore,2-7years,Not Specified,"Should have strong and hands on knowledge of Java application development, Spring MVC, Spring Boot, Hibernate, Webservices, Gitlab and working in Agile. |  Bachelor degree, with minimum 3-4 years of experience in software development. |  Ability to work.. |",Java|SpringBoot|Hibernate|WebServices|Struts|Spring|
Big Data Engineer,Jarus Technologies India Private Limited,Remote,2-6years,1000000 - 1800000 INR,Work with one of the Fortune 1000 technology companies that work in cutting-edge technology. It has been listed as Forbes's best place to work,Sql|Spark|Scala|AWS|Python|AmazonWebServices|AmazonWebService|
Tech. Lead. - Java,Stryde Consulting Services,Hyderabad/Secunderabad,8-13years,Not Specified,"Strong in J2EE,SDLC process,Java 7,Java script, AJAX, Hibernate, Angular 2 or above,Spring 2.5 or above, JSF,Web Services, JBOSS,XML,XSL,Oracle11,SQL","""CoreJAVA""|""WebServices""|Javadeveloper|Java|J2EE|SpringMVC|Angular|Hibernate|Jboss|Xml|Spring|"
Excellent Opportunity for Java Full Stack Developer,Encora Innovation Labs India Private Limited,Bengaluru/Bangalore|Hyderabad/Secunderabad,3-10years,Not Specified,"Excellent Opportunity for Java Full Stack Developer |  Strong Exp in Java,Spring Or Spring Boot,Hibernate Webservices (Soap OR restful) |  Front End Technologies :-HTML,CSS,Angualr or React  |  Exp:-3.5Yrs to 10.0Yrs |  Location:- Hyderabad & Bangalore |   |   |",Java|J2ee|Spring|SpringBoot|Hibernate|Jpa|Hibernate|WebServices|Soap|Restful|Angular|Reactjs|
.Net developer,Mohideen Rahim (Proprietor of Braincert India),Chennai,3-10years,Not Specified,"Encora is looking for .Net developer with 3-10 years’ experience in ASP.Net, .Net Core, C#, MVC, Angular JS, Web API, Web Services, Java Script/ jQuery, Multi-tier Architecture, Entity Framework, SQL, Design Patterns and Agile",.NetCore|Asp.Net|Mvc|AngularJs|WebServices|WebApi|C#|Sql|AJAX|JQuery|Javascript|
Lead/Sr.PHP Developer,Dunn Solutions India Private Limited,Coimbatore,4-8years,Not Specified,"Comprehensive knowledge of Open Source CMS platforms including WordPress, Joomla, and the ability to implement complex sites and create custom components, modules, and plugins as necessary. |",PHPDeveloper|PhpLead|Bootstrap|Json|JQuery|Html5|WebServices|JOOMLA|Wordpress|Moodle|Laravel|
Java Fullstack Developer,Enroll N Pro,Bengaluru/Bangalore,3-5years,Not Specified,Dunn Solutions Group is looking for an Java fullstack Developer in our Bangalore office! |       |      Our Consultants work on projects that are truly innovative revolving around providing solutions in portal and ecommerce projects,Java|Spring|Hibernate|AngularJs|WebServices|Javascript|
Java Developer,2COMS Consulting Private Limited,Hyderabad/Secunderabad,3-5years,Not Specified,We are looking for candidates who are experienced in JAVA support in Hyderabad location.,L2support.|Java|WebServices|Spring|SpringBoot|
Java Developer,Inventeq Software Services,Bengaluru/Bangalore,1-6years,Not Specified,"Hello |   |   |   |  Greetings of the day! |   |  This is Supriya from 2Coms Consulting Pvt Ltd. |   |  Role: Java Developer |   |  Experience  : 2- 6 years |   |  Skills Required: |   |  Core Java with J2EE concepts |   |  Should have mandatory experience in JSP, Servlets,Web services,JSON/XML. |   |",Java|WebServices|Jsp|Servlets|
Java Fullstack Developer,Vedic Systems Private Limited,Bengaluru/Bangalore,3-8years,Not Specified,"Core Java, OOPs, Multi-threading, Generics, and design patterns |  Spring boot, spring integration & REST web services.",anddesignpatternsSpringboot|springintegration&RESTwebservices.|CoreJava|Oops|Multi-threading|Generics|
